2,2,1,0,1,0,,,,,,['Forced air'],True,,,,,,,True,False,,,1750.0,,,,,,,False,,,False,,False,,,,1,,,,,,['Other'],,,,,,,,,,,,False,0.31 acres,,,,False,230500050,False,False,,,,Single Family,,,['Concrete'],Asphalt,,,False,,,False,,,,,,,,,,,,,,,True,False,,Ranch,,,,,,,,,,False,Elko New Market,,,[],55020,9720 Oxford Ln,Elko New Market,MN,44.553211,-93.326922,419000.0,SOLD,0,55020_71,"Recently sold: $419,000. K Michael Homes quality built construction. Single level living at it's finest! Empty nest special. All of the finest in living spaces for you, the home owner. Large owner's suite includes a walk-in ceramic shower, walk-in closet and walk-thru laundry to the mudroom. A must see! Also on the main level there is a generously sized guest/2nd bedroom/office. Up to three more bedrooms finished in the basement. Walking and biking paths right out your front door. A pool within walking distance."
3,2,,,,,,,,Finished,,['Forced air'],True,,,,,,,,False,,,1300.0,,,,,,,False,,,False,,False,,,,1,,,,,,['Wood'],,,,,,,,,,,,False,10.09 acres,,,,False,089330030,False,False,,,,Single Family,,,,Asphalt,,,False,,,False,,,,,,,,,,,,,,,True,False,,Ranch,,,,,,,,,,False,Elko New Market,,,[],55020,27181 Dakota Ave,Elko New Market,MN,44.554957,-93.356908,309000.0,SOLD,0,55020_72,"Recently sold: $309,000. 27181 Dakota Ave, Elko New Market, MN is a single family home that contains 1,300 sq ft and was built in 1973. It contains 3 bedrooms and 1.75 bathrooms. This home last sold for $309,000 in June 2018. 
 
The Zestimate for this house is $340,258, which has increased by $4,035 in the last 30 days. The Rent Zestimate for this home is $1,950/mo, which has increased by $17/mo in the last 30 days. "
4,3,2,0,1,0,,,[],Unfinished,"['Carpet', 'Laminate', 'Tile']",['Forced air'],True,['Central'],True,"['Dishwasher', 'Dryer', 'Garbage disposal', 'Microwave', 'Range / Oven', 'Refrigerator', 'Washer']",,,,True,False,,,2356.0,,,,['Attached Garage'],3,,False,True,,False,,False,,,,2,,,False,False,,"['Brick', 'Vinyl']",,,,,False,,,,,,,False,9.65 acres,,,,False,809200100,False,False,,Residential-Single,,Single Family,,,,Asphalt,,,False,1999,,False,,,,['Private'],,,,,,,,,,,True,False,,Other,,,,,,,,,,False,Elko New Market,,,"[{'name': 'AmenitiesUnit', 'value': 'Kitchen Window'}, {'name': 'BathDesc', 'value': 'Private Master, Full Master, Main Floor 1/2 Bath, Upper Level Full Bath'}, {'name': 'Fuel', 'value': 'Natural Gas'}, {'name': 'GarageDescription', 'value': 'Driveway - Asphalt, Driveway - Concrete'}, {'name': 'SpecialSearch', 'value': '3 BR on One Level, Main Floor Laundry'}, {'name': 'FrontageFeet', 'value': 'Paved Streets, County'}, {'name': 'PresentUse', 'value': 'Yearly'}, {'name': 'Water', 'value': 'Well'}, {'name': 'OutBuildings', 'value': 'Storage Shed'}, {'name': 'Style', 'value': '(SF) Modified Two Story'}]",55020,6246 E 240th St,Elko New Market,MN,44.603815,-93.39459,430000.0,SOLD,0,55020_73,"Recently sold: $430,000. Enjoy country living at it's finest in this 4 bedroom, 3 bathroom home on nearly 10 acres located on paved road. Updated kitchen w/stainless appliances, modern backsplash &amp; countertops. Beautiful family room w/knotty pine &amp; gas fireplace w/stone surround creating a cozy up north feel. 4 bedrooms on one level. Master suite with private bath and walk in closet. Unfinished, walk out lower level offers huge potential for expansion. Large multi-level deck. Beautiful yard and scenery! Come see today!"
5,4,4,0,0,0,,,[],,,['Forced air'],True,['Refrigeration'],True,,,,,False,False,,,3039.0,,,,['Attached Garage'],3,,False,True,,False,,False,,,,0,,,False,False,,['Other'],,,,,False,,,,,,,False,10 acres,,,,False,893100360,False,False,,,,Single Family,,,,Asphalt,,,False,1999,,False,,,,,,,,,,,,,,,True,False,,Other,,,,,,,,,,False,Elko New Market,,,"[{'name': 'central_air_desc', 'value': 'Central A/C'}, {'name': 'architectural_style', 'value': 'Other'}, {'name': 'dining_rooms', 'value': '0'}, {'name': 'living_rooms', 'value': '0'}, {'name': 'fireplaces', 'value': '0'}, {'name': 'taxes_annual', 'value': '4120'}]",55020,27981 Jonquil Ave,Elko New Market,MN,44.54556,-93.399546,347500.0,SOLD,24,55020_74,"Recently sold: $347,500. Welcome home to this spacious 5 bedroom, 4 bath home located on 10 acres! Light and bright foyer leads to a formal living room, kitchen, informal dining and family room plus main floor bedroom and laundry room. 3 bedrooms on the upper level with private 3/4 master suite and huge walk-in closet! Walk-out lower level is fully finished with 5th bedroom, amusement room, and additional full bath. Check out virtual tour!"
4,4,4,0,0,0,,,,Finished,"['Carpet', 'Concrete', 'Hardwood', 'Laminate', 'Tile']",['Forced air'],True,['Central'],True,"['Dishwasher', 'Dryer', 'Freezer', 'Garbage disposal', 'Microwave', 'Range / Oven', 'Refrigerator', 'Washer']",,,,True,False,,,3608.0,,,,['Attached Garage'],3,,False,True,,False,,False,,,,3,,,False,False,,"['Brick', 'Other', 'Vinyl', 'Wood']",,,,,False,,,,,,,False,0.44 acres,,,,False,230410190,False,False,,,,Single Family,,,['Concrete'],Asphalt,,,False,2004,,False,,,,,,,,,,,,,,,True,False,,Other,,,Lakeville #194,,Lakeville #194,,Lakeville #194,,,False,Elko New Market,,,[],55020,9840 Blackpool Ct E,Elko New Market,MN,44.560271,-93.322776,359200.0,SOLD,0,55020_75,"Recently sold: $359,200. "
3,3,2,0,1,0,,,[],,,['Forced air'],True,['Refrigeration'],True,"['Exhaust Fan/Hood', 'Disposal', 'Water Softener - Owned']",,,,True,False,,,1680.0,,,,['Attached Garage'],2,,False,True,,False,,False,,,,2,,,,,,['Vinyl'],,,,,,,,,,,,False,0.47 acres,,,,False,230330390,False,False,,Residential-Single,,Single Family,,,['Concrete'],Asphalt,,,False,2000,,False,,,,['City Sewer/Connected'],,,,,,,,,,,True,False,,Other,,,,,,,,,,False,Elko,,,"[{'name': 'AmenitiesUnit', 'value': 'Natural Woodwork, Kitchen Window, Washer/Dryer Hookup'}, {'name': 'BathDesc', 'value': 'Private Master, Full Master, Upper Level Full Bath, Separate Tub & Shower, Rough In'}, {'name': 'Fuel', 'value': 'Natural Gas'}, {'name': 'GarageDescription', 'value': 'Garage Door Opener, Driveway - Asphalt'}, {'name': 'SpecialSearch', 'value': '3 BR on One Level, Main Floor Laundry'}, {'name': 'Style', 'value': '(SF) Two Stories'}, {'name': 'FrontageFeet', 'value': 'Paved Streets, City, Curbs, Cul De Sac'}, {'name': 'PresentUse', 'value': 'Yearly'}, {'name': 'Roof', 'value': 'Age Over 8 Years'}, {'name': 'Water', 'value': 'City Water/Connected'}, {'name': 'Fence', 'value': 'Invisible'}]",55020,10261 Oakhill Ct,Elko,MN,44.565202,-93.313532,275000.0,SOLD,24,55020_76,"Recently sold: $275,000. Move right in to this beautiful home situated on a nearly 1/2 acre, private, cul-de-sac lot! This home features gorgeous wooded views, patio for entertaining and an open floorplan. You will appreciate the stainless steel appliances, large kitchen island, gas fireplace and laminate floors thru-out the main level. The master suite has a huge walk-in closet &amp; a private bath with a dual vanity.  Other features that make this home a must see: 3 bedrooms on one level, nearby park &amp; Lakeville Schools!"
5,4,,,,,,,,Finished,,['Forced air'],True,,,,,,,,False,,,3598.0,,,,,,,False,,,False,,False,,,,,,,True,,,['Other'],,,,,,,,,,,,False,10 acres,,,,False,039360012,False,False,,,,Single Family,,,['Concrete Block'],Asphalt,,,False,,,False,,,,,,,,,,,,,,,True,False,,Ranch,,,,,,,,,,False,Elko New Market,,,[],55020,27140 Jonquil Ave,Elko New Market,MN,44.556021,-93.402568,807500.0,SOLD,0,55020_77,"Recently sold: $807,500. "
4,4,,,,,,,,Finished,,['Forced air'],True,,,,,,,,False,,,2296.0,,,,,,,False,,,False,,False,,,,1,,,,,,['Other'],,,,,,,,,,,,False,2.5 acres,,,,False,030380160,False,False,,,,Single Family,,,['Concrete Block'],Asphalt,,,False,,,False,,,,,,,,,,,,,,,True,False,,,,,,,,,,,,False,Elko New Market,,,[],55020,4201 Miller View Rd,Elko New Market,MN,44.591274,-93.435157,459900.0,SOLD,0,55020_78,"Recently sold: $459,900. "
3,1,1,0,0,0,,,[],Finished,['Tile'],['Forced air'],True,['Central'],True,"['Exhaust Fan/Hood', 'Disposal', 'Water Softener - Owned']",,,,,False,,,1348.0,,,,['Attached Garage'],2,,False,True,,False,,False,,,,1,,,,,,['Other'],,,,,,,,,,,,False,0.43 acres,,,,False,239260023,False,False,,Residential-Single,,Single Family,,,['Concrete Block'],Asphalt,,,False,1985,,False,,,,['City Sewer/Connected'],,,,,,,,,,,True,False,,Other,,,Lakeville - 194,,Lakeville - 194,,Lakeville - 194,,,False,Elko New Market,,,"[{'name': 'AmenitiesUnit', 'value': 'Kitchen Window, Washer/Dryer Hookup'}, {'name': 'Fuel', 'value': 'Natural Gas'}, {'name': 'GarageDescription', 'value': 'Insulated Garage, Garage Door Opener, Driveway - Asphalt'}, {'name': 'SpecialSearch', 'value': '3 BR on One Level'}, {'name': 'BathDesc', 'value': 'Main Floor Full Bath'}, {'name': 'Exterior', 'value': 'Fiber Board'}, {'name': 'PresentUse', 'value': 'Yearly'}, {'name': 'Roof', 'value': 'Pitched, Age Over 8 Years'}, {'name': 'OutBuildings', 'value': 'Storage Shed'}, {'name': 'FrontageFeet', 'value': 'City'}, {'name': 'Water', 'value': 'City Water/Connected'}]",55020,26525 Xerxes Trl,Elko New Market,MN,44.565716,-93.318252,224900.0,SOLD,0,55020_79,"Recently sold: $224,900. "
2,2,1,1,0,0,,,[],Partial Finished,"['Hardwood', 'Tile']",['Forced air'],True,['Refrigeration'],True,"['Water Softener - Owned', 'Air-To-Air Exchanger']",,,,True,False,,,1698.0,,,,['Attached Garage'],2,,False,True,,False,,False,,,,1,,,True,,,"['Stone', 'Vinyl']",,,,,,,,,,,,False,0.06 acres,,,,False,230520060,False,False,,Residential-Single,,Townhouse,,,['Concrete'],Asphalt,,,False,2008,,False,,,,['City Sewer/Connected'],,,,,,,,,,,True,False,,,,,,,,,,,,False,Elko New Market,,,"[{'name': 'AmenitiesUnit', 'value': 'Natural Woodwork, Balcony, Sun Room, Washer/Dryer Hookup, In-Ground Sprinkler'}, {'name': 'BathDesc', 'value': 'Main Floor 3/4 Bath, Private Master'}, {'name': 'Fuel', 'value': 'Natural Gas'}, {'name': 'GarageDescription', 'value': 'Insulated Garage, Garage Door Opener, Driveway - Asphalt'}, {'name': 'FrontageFeet', 'value': 'Paved Streets, Private'}, {'name': 'PresentUse', 'value': 'Yearly'}, {'name': 'Roof', 'value': 'Pitched, Age Over 8 Years'}, {'name': 'SpecialSearch', 'value': 'Main Floor Laundry, Main Floor Bedroom, All Living Facilities on One Level'}, {'name': 'Water', 'value': 'City Water/Connected'}]",55020,9760 Oxford Ln,Elko New Market,MN,44.555056,-93.325415,255000.0,SOLD,24,55020_80,"Recently sold: $255,000. Luxury main level living sets this executive townhome apart. This spectacular end unit backs up to wetlands as well as the 5th hole of Boulder Pointe golf course. Almost 1700 square feet of updates that include open kit with granite counters, gas marble fireplace, wide plank oak hardwood floors, custom built-ins, sunroom with deck access, spacious master suite with walk-in closet, surround sound throughout, 10 foot ceilings &amp; oversized 2 car garage. Walkout lower level allows for room to expand!"
5,4,3,0,1,0,,,[],"Full, Finished (Livable), Drain Tiled, Concrete Block, Walkout",['Hardwood'],['Forced air'],True,['Refrigeration'],True,"['Range', 'Microwave', 'Exhaust Fan/Hood', 'Dishwasher', 'Refrigerator', 'Washer', 'Dryer', 'Cooktop', 'Water Softener - Owned']",,,,,False,,,3035.0,,,,['Attached Garage'],3,,False,True,,False,,False,,,,2,,,,,,"['Brick', 'Stone', 'Vinyl']",,,,,,,,,,,,False,0.27 acres,,,,False,230390170,False,False,,Residential-Single Family,,Single Family,,,['Concrete'],Asphalt,,,False,2005,,False,,,,['City Sewer/Connected'],,,,,,,,,,,True,False,,Other,,,,,,,,,,False,Elko,5546629,,"[{'name': 'AmenitiesUnit', 'value': 'Deck, Natural Woodwork, Kitchen Window, Hardwood Floors, Washer/Dryer Hookup, Patio, Walk-In Closet, Ceiling Fan(s), Local Area Network, Master Bedroom Walk-In Closet'}, {'name': 'BathDesc', 'value': 'Private Master, Full Master, Upper Level Full Bath'}, {'name': 'Exterior', 'value': 'Brick/Stone, Vinyl'}, {'name': 'DiningRoomDescription', 'value': 'Kitchen/Dining Room, Eat In Kitchen, Separate/Formal Dining Room'}, {'name': 'Fuel', 'value': 'Natural Gas'}, {'name': 'GarageDescription', 'value': 'Attached Garage, Garage Door Opener, Driveway - Asphalt'}, {'name': 'HeatingDescription', 'value': 'Forced Air'}, {'name': 'FrontageFeet', 'value': 'Paved Streets, City, Curbs, Cul De Sac'}, {'name': 'PresentUse', 'value': 'Yearly'}, {'name': 'Roof', 'value': 'Asphalt Shingles, Pitched'}, {'name': 'Water', 'value': 'City Water/Connected'}, {'name': 'TaxYear', 'value': '2019.00'}, {'name': 'CONSTRUCTIONSTATUS', 'value': 'Previously Owned'}, {'name': 'Status', 'value': 'Active'}, {'name': 'PowerCompanyName', 'value': 'Xcel Energy'}]",55020,26645 Meadow Ridge Ct,Elko,MN,44.563986,-93.313093,349900.0,FOR_SALE,0,55020_81,"For sale: $349,900. Come and see this spacious home on a cquiet cul de sac in high demand Windrose developement. This home has it all! 5 bedrooms, 4 baths, 3 stall garage, huge deck overlooking a pond,  fully finished walkout basement, large kitchen with plenty of counter space,and cabinets, and natural woodwork throughout the home. The private owners suite uptairs has lots of closet space, plenty of natural light,  and an updated bathroom, Schedule a showing, today you won't regret it."
3,3,2,0,1,0,,,,,,,,,,,,,,,False,,,2900.0,,,,,,,False,,,False,,False,,,,,,,,,,,,,,,,,,,,,,False,,,,,False,,False,False,,,,Single Family,,,,,,,False,,,False,,,,,,,,,,,,,,,True,False,,,,,,,,,,,,False,Elko New Market,,,[],55020,4262 Edenvale Court,Elko New Market,MN,44.594716,-93.433487,590000.0,SOLD,0,55020_82,"Recently sold: $590,000. "
5,3,2,1,0,0,,,,Finished,"['Carpet', 'Tile']","['Baseboard', 'Forced air']",True,['Central'],True,"['Dryer', 'Freezer', 'Microwave', 'Refrigerator', 'Washer']",,,,True,False,,,3736.0,,,,['Attached Garage'],3,,False,True,,False,,False,,,,2,,,False,False,,"['Cement concrete', 'Vinyl']",,,,,False,,,,,,,False,4.1 acres,,,,False,811501200,False,False,,,,Single Family,,,,Asphalt,,,False,2005,,False,,,,,,,,,,,,,,,True,False,,Ranch,,,,,,,,,,False,Elko New Market,,,[],55020,26385 Jonquil Ave,Elko New Market,MN,44.565849,-93.397703,456000.0,SOLD,67,55020_83,"Recently sold: $456,000. Beautiful custom built JB Woodfitter rambler on 4+ acres in New Prague School District. Home boasts 3 bedrooms on main level, 2 bedrooms in lower level, fully finished LL in 2017. Gorgeous Hickory main level floors, SS, 2 gas burning fireplaces, tile, main floor laundry, master w/ soaker tub and separate shower. Gorgeous views of the mature trees and rolling hills. Large LL walk-out, oversized 3 car garage, room for a shop adjacent to the home, new Tuff shed in 2017 (12x16) for outdoor storage."
4,4,0,0,0,0,,,,Finished,['Hardwood'],['Forced air'],True,['Central'],True,,,,,True,False,,,2503.0,,,,['Attached Garage'],2,,False,True,,False,,False,,,,2,,,,,,['Vinyl'],,,,,,,,,,,,False,0.3 acres,,,,False,230390080,False,False,,,,Single Family,,,['Concrete'],Asphalt,,,False,2005,,False,,,,,,,,,,,,,,,True,False,,Other,,,Lakeville #194,,Lakeville #194,,Lakeville #194,,,False,Elko,,,[],55020,26698 Meadow Ridge Ct,Elko,MN,44.563232,-93.313936,320000.0,SOLD,0,55020_84,"Recently sold: $320,000. "
5,4,2,0,2,0,,,[],Finished,"['Carpet', 'Hardwood', 'Tile']",['Forced air'],True,['Central'],True,"['Exhaust Fan/Hood', 'Disposal', 'Water Softener - Owned', 'Furnace Humidifier', 'Air-To-Air Exchanger']",,,,True,False,,,4112.0,,,,['Attached Garage'],3,,False,True,,False,,False,,,,3,,,False,False,,"['Brick', 'Stone', 'Vinyl']",,,"['Territorial', 'Water']",True,False,,,,,,,False,0.42 acres,,,,False,230380120,False,False,,Residential-Single,,Single Family,,,['Concrete'],Asphalt,,,False,2003,,False,,,,['City Sewer/Connected'],,,,,,,,,,,True,False,,Other,,,,,,,,,,False,Elko,,,"[{'name': 'AmenitiesUnit', 'value': 'Sun Room, In-Ground Sprinkler'}, {'name': 'BathDesc', 'value': 'Private Master, Full Master, Main Floor 1/2 Bath, Whirlpool, Upper Level Full Bath, Separate Tub & Shower'}, {'name': 'Fuel', 'value': 'Natural Gas, Electric'}, {'name': 'GarageDescription', 'value': 'Garage Door Opener, Driveway - Asphalt'}, {'name': 'Style', 'value': '(SF) Two Stories'}, {'name': 'FrontageFeet', 'value': 'Paved Streets, City, Curbs'}, {'name': 'PresentUse', 'value': 'Yearly'}, {'name': 'Roof', 'value': 'Pitched, Age Over 8 Years'}, {'name': 'Fence', 'value': 'Partial, Invisible, Rail'}, {'name': 'Water', 'value': 'City Water/Connected'}, {'name': 'SpecialSearch', 'value': '2nd Floor Laundry, 4 BR on One Level'}]",55020,9246 Cambridge Ln,Elko,MN,44.561215,-93.333408,376000.0,SOLD,0,55020_85,"Recently sold: $376,000. Wonderful custom-built home with amazing golf course and pond views! Hardwood floors in foyer, kitchen, informal dining, and sun room. Formal dining with box bay window, kitchen with tile floor and backsplash. Informal dining area and living room share a 2-sided gas fireplace. Walkout lower level has 5th bedroom, 3/4 bath and space for a game table. A large deck, just off the sun room and informal dining, leads to the fabulous backyard with patio, large sport court and back garage door for golf cart access."
5,3,0,0,0,0,,,[],,"['Hardwood', 'Tile']",['Forced air'],True,,,"['Dishwasher', 'Dryer', 'Microwave', 'Range / Oven', 'Refrigerator']",,,,True,False,,,3600.0,,,,['Attached Garage'],3,,False,True,,False,,False,,,,1,,,,,,"['Brick', 'Stone', 'Vinyl']",,,,,,,,,,,,False,2.5 acres,,,,False,811500600,False,False,,,,Single Family,,,,Asphalt,,,False,2006,,False,,,,,,,,,,,,,,,True,False,,Ranch,,,New Prague Area Schools,,New Prague Area Schools,,New Prague Area Schools,,,False,Elko New Market,,,"[{'name': 'central_air_desc', 'value': 'Central A/C'}, {'name': 'architectural_style', 'value': 'Other'}, {'name': 'has_ceiling_fan_fl', 'value': 'Y'}, {'name': 'taxes_annual', 'value': '5584'}]",55020,26191 Jonquil Ave,Elko New Market,MN,44.569475,-93.398254,560000.0,SOLD,22,55020_86,"Recently sold: $560,000. All paved roads lead to this wonderful JB Woodfitter one story home. Kitchen boasts miles of birch cabinetry, granite center island &amp; hearty hickory flooring. Open floor concept with 3 BR's on one level &amp; two addt'l in walk-out lower level. Master offers, WIC, private bath and country views for miles. 2 stone gas fireplaces, main floor laundry plus mega mudroom. Super durable &amp; convenient mat flex garage flooring in both upper &amp; lower attached garages, Htd. 52x28 finished RV garage."
2,2,2,0,0,0,,,,,,,,,,,,,,,False,,,2026.0,,,,,,,False,,,False,,False,,,,,,,,,,,,,,,,,,,,,,False,,,,,False,,False,False,,,,Single Family,,,,,,,False,,,False,,,,,,,,,,,,,,,True,False,,,,,,,,,,,,False,Elko New Market,,,[],55020,8662 240th St E,Elko New Market,MN,44.569,-93.3544,443700.0,SOLD,0,55020_87,"Recently sold: $443,700. "
5,4,2,0,2,0,,,[],Finished,"['Hardwood', 'Tile']",['Forced air'],True,['Refrigeration'],True,"['Dishwasher', 'Dryer', 'Garbage disposal', 'Microwave', 'Range / Oven', 'Refrigerator', 'Washer']",,,,True,False,,,3608.0,,,,['Attached Garage'],3,,False,True,,False,,False,,,,2,,,False,False,,"['Brick', 'Stone', 'Vinyl']",,,,,False,,,,,,,False,0.3 acres,,,,False,230450060,False,False,,Residential-Single,,Single Family,,,['Concrete'],Shake/Shingle,,,False,2006,,False,,,,['City Sewer/Connected'],,,,,,,,,,,True,False,,Other,,,,,,,,,,False,Elko New Market,,,"[{'name': 'AmenitiesUnit', 'value': 'Natural Woodwork, Kitchen Window, Washer/Dryer Hookup, In-Ground Sprinkler, Local Area Network'}, {'name': 'BathDesc', 'value': 'Private Master, Full Master, Main Floor 1/2 Bath, Whirlpool, Upper Level Full Bath, Separate Tub & Shower, Bathroom Ensuite'}, {'name': 'Fuel', 'value': 'Natural Gas'}, {'name': 'Style', 'value': '(SF) Two Stories'}, {'name': 'PresentUse', 'value': 'Yearly'}, {'name': 'SpecialSearch', 'value': 'Main Floor Laundry, 4 BR on One Level'}, {'name': 'Roof', 'value': 'Age Over 8 Years'}, {'name': 'FrontageFeet', 'value': 'City'}, {'name': 'Water', 'value': 'City Water/Connected'}, {'name': 'Fence', 'value': 'Chain Link'}]",55020,26936 Meadow Ridge Dr,Elko New Market,MN,44.559577,-93.315607,339900.0,SOLD,0,55020_88,"Recently sold: $339,900. This 5bed/4bath home has a surprising amount of space! Oversized kitchen w/upgraded cabinets, pullout drawers along w/larger corner pantry. Open concept for easy entertaining! Formal dining/office in front of home.  Upper level: 4 beds, large Master BR w/ generously sized walk-in closet, master bath w/jetted tub and dual sinks. LL finished w/new carpet, roughed-in wet bar, family room and 5th bedroom. Large fenced backyard great for kids and dogs. This is where you come home."
4,3,,,,,,,,Finished,,['Forced air'],True,,,,,,,,False,,,1675.0,,,,,,,False,,,False,,False,,,,,,,,,,['Metal'],,,,,,,,,,,,False,2.6 acres,,,,False,030090040,False,False,,,,Single Family,,,['Concrete Block'],Asphalt,,,False,,,False,,,,,,,,,,,,,,,True,False,,Ranch,,,,,,,,,,False,Elko New Market,,,[],55020,3686 Miller View Rd,Elko New Market,MN,44.592383,-93.444962,385000.0,SOLD,0,55020_89,"Recently sold: $385,000. "
5,3,2,1,0,0,,,[],Finished,,['Forced air'],True,,,['Water Softener - Owned'],,,,True,False,,,2432.0,,,,['Attached Garage'],,,False,,,False,,False,,,,,,,False,False,,['Vinyl'],,,,,False,,,,,,,False,0.57 acres,,,,False,230310370,False,False,,Residential-Single,,Single Family,,,['Concrete'],Asphalt,,,False,,,False,,,,['City Sewer/Connected'],,,,,,,,,,,True,False,,,,,,,,,,,,False,Elko New Market,,,"[{'name': 'BathDesc', 'value': 'Private Master, Main Floor Full Bath'}, {'name': 'Fuel', 'value': 'Natural Gas, Electric'}, {'name': 'GarageDescription', 'value': 'Driveway - Asphalt'}, {'name': 'PresentUse', 'value': 'Yearly'}, {'name': 'Roof', 'value': 'Age 8 Years or Less'}, {'name': 'Water', 'value': 'City Water/Connected'}]",55020,10183 Ptarmigan Ct,Elko New Market,MN,44.566027,-93.315251,319900.0,SOLD,0,55020_90,"Recently sold: $319,900. Delightful newer custom-built split in cul de sac on over 1/2 acre. Lower level just finished! Features open floor plan, upgrades galore plus custom cabinets &amp; detailed millwork. 3 BRs on main level, huge family room, gourmet kitchen, 9-foot ceilings, fireplace &amp; lots of natural light. Insulated 3-car garage with an extra-long side drive for a camper/boat. Great private wooded backyard with plenty of grass space to entertain &amp; enjoy nature. Minutes from 35, shopping, parks &amp; Lakeville schools."
3,3,2,0,1,0,,,[],,['Hardwood'],['Forced air'],True,['Central'],True,"['Dishwasher', 'Garbage disposal', 'Microwave', 'Range / Oven', 'Refrigerator', 'Washer']",,,,,False,,,1950.0,,,,['Attached Garage'],2,,False,True,,False,,False,,,,,,,,,,['Other'],,,,,,,,,,,,False,0.06 acres,,,,False,230460210,False,False,,,,Townhouse,,,['Slab'],Asphalt,,,False,2006,,False,,,,,,,,,,,,,,,True,False,,,,,,,,,,,,False,Elko,,,"[{'name': None, 'value': 'Living room'}, {'name': None, 'value': 'Playground'}, {'name': None, 'value': 'Stainless steel appliances'}]",55020,26540 Pond Ct,Elko,MN,44.565087,-93.335974,211000.0,SOLD,15,55020_91,"Recently sold: $211,000. Lots of space in this open layout TH - 1900 fsf!  Fresh paint and new carpet throughout the entire home!!  Kitchen has stainless steel appliances, two tiered center Island and Walk-in Pantry - open layout to the family room!  Main floor powder room, three extremely spacious bedrooms, and a loft area that is both spacious and functional.  Amazing views from the backyard patio of the pond.  Enjoy the wildlife and privacy on the patio!  Fantastic opportunity - don't miss out!"
4,4,,,,,,,,Finished,,['Forced air'],True,,,,,,,,False,,,2813.0,,,,,,,False,,,False,,False,,,,2,,,,,,['Other'],,,,,,,,,,,,False,0.31 acres,,,,False,230370281,False,False,,,,Single Family,,,['Concrete'],Asphalt,,,False,,,False,,,,,,,,,,,,,,,True,False,,,,,,,,,,,,False,Elko New Market,,,[],55020,10375 Ponds Way,Elko New Market,MN,44.560655,-93.311238,335000.0,SOLD,0,55020_92,"Recently sold: $335,000. "
3,3,1,2,0,0,,,[],Finished,['Hardwood'],['Forced air'],True,['Central'],True,['Range / Oven'],,,,True,False,,,2980.0,,,,['Attached Garage'],2,,False,True,,False,,False,,,,,,,,,,"['Stone', 'Vinyl']",,,,,,,,,,,,False,0.06 acres,,,,False,230500140,False,False,,Residential-Single,,Townhouse,,,['Concrete'],Asphalt,,,False,2006,,False,,,,['City Sewer/Connected'],,,,,,,,,,,True,False,,,,,Lakeville,,Lakeville,,Lakeville,,,False,Elko,,,"[{'name': 'AmenitiesUnit', 'value': 'Natural Woodwork'}, {'name': 'BathDesc', 'value': 'Main Floor 3/4 Bath'}, {'name': 'Fuel', 'value': 'Natural Gas'}, {'name': 'FrontageFeet', 'value': 'Paved Streets, City'}, {'name': 'PresentUse', 'value': 'Yearly'}, {'name': 'SpecialSearch', 'value': 'Main Floor Laundry, Main Floor Bedroom, All Living Facilities on One Level'}, {'name': 'Water', 'value': 'City Water/Connected'}]",55020,9707 Oxford Ln,Elko,MN,44.552376,-93.326193,254900.0,SOLD,24,55020_93,"Recently sold: $254,900. Former model on Boulder  Point Golf Course with 10' ceilings and open floor plan. Fireplace in living room, pass through to breakfast nook overlooking golf course. Bright and sunny, super clean! Center island, hardwood floors, deck off the master bedroom. Room for a pool table in large entertainment center with bar and refrigerator. Electric fireplace in lower level family room. Assoc. fee covers trash."
3,2,,,,,,,,,,['Forced air'],True,,,,,,,,False,,,2068.0,,,,,,,False,,,False,,False,,,,,,,,,,['Other'],,,,,,,,,,,,False,3.84 acres,,,,False,030800110,False,False,,,,Single Family,,,['Concrete'],Asphalt,,,False,,,False,,,,,,,,,,,,,,,True,False,,Ranch,,,,,,,,,,False,Elko New Market,,,[],55020,4262 Edenvale Ct,Elko New Market,MN,44.594644,-93.434155,139900.0,SOLD,0,55020_94,"Recently sold: $139,900. "
