3,4,3,0,1,0,,,[],Finished,,['Forced air'],True,,,"['Dishwasher', 'Microwave', 'Range / Oven', 'Refrigerator']",,,,True,False,,,2201.0,,,,"['Attached Garage', 'Detached Garage']",,,False,,,False,,False,,,,1,,,False,False,,['Wood'],,,,,False,,,,,,,False,10 acres,,,,False,039230136,False,False,,,,Single Family,,,['Concrete Block'],Asphalt,,,False,,,False,,,,,,,,,,,,,,,True,False,,Ranch,,,,,,,,,,False,Elko New Market,,,"[{'name': 'PRESENTUSE', 'value': 'Yearly'}, {'name': 'STATUS', 'value': 'Pending'}, {'name': 'ZONING', 'value': 'Residential-Single Family'}, {'name': 'TOPOGRAPHY', 'value': 'Walkout, Other'}, {'name': 'FRONTAGEFEET', 'value': 'Private, No Outlet/Dead End, Unpaved Streets'}, {'name': 'BASEMENT', 'value': 'Full, Partial Finished, Unfinished, Walkout'}, {'name': 'CONSTRUCTIONSTATUS', 'value': 'Previously Owned'}, {'name': 'GARAGEDESCRIPTION', 'value': 'Attached Garage, Detached Garage, Heated Garage, Driveway - Gravel, Other'}, {'name': 'HEATINGDESCRIPTION', 'value': 'Forced Air, In-Floor Heating, Fireplace, Space Heater'}, {'name': 'WATER', 'value': 'Well'}, {'name': 'APPLIANCES', 'value': 'Range, Refrigerator, Washer, Dryer, Microwave, Dishwasher, Water Softener - Owned, Central Vacuum, Water Filtration System'}, {'name': 'FIREPLACELOC', 'value': 'Living Room, Gas Burning, Family Room'}, {'name': 'AMENITIESUNIT', 'value': 'Deck, Kitchen Window, Ceiling Fan(s), Porch, Vaulted Ceiling(s), Security System, Skylight, Main Floor Master Bedroom, Kitchen Center Island'}, {'name': 'BATHDESC', 'value': 'Main Floor 3/4 Bath, Main Floor 1/2 Bath, Main Floor Full Bath, Private Master, 3/4 Master, Walk-In Shower Stall, Jetted Tub, Full Basement'}, {'name': 'DININGROOMDESCRIPTION', 'value': 'Living/Dining Room, Informal Dining Room, Kitchen/Dining Room, Eat In Kitchen'}, {'name': 'ROOMFLOOR1', 'value': 'Main'}, {'name': 'ROOF', 'value': 'Asphalt Shingles'}, {'name': 'SPECIALSEARCH', 'value': 'Main Floor Laundry, Main Floor Bedroom, 3 BR on One Level, All Living Facilities on One Level'}, {'name': 'FUEL', 'value': 'Natural Gas'}, {'name': 'SEWER', 'value': 'City Sewer/Connected, Mound'}, {'name': 'EXTERIOR', 'value': 'Wood'}, {'name': 'OUTBUILDINGS', 'value': 'Other, Pole Building, Workshop, Chicken Coop/Barn'}, {'name': 'FARMTYPE', 'value': 'Hobby, Crop, Horse, Other'}, {'name': 'CROPTYPE', 'value': 'Corn, Beans, Other'}, {'name': 'TAXYEAR', 'value': '2019.00'}, {'name': 'DAYSONMARKET', 'value': '17'}, {'name': 'DAYSONMARKETCUMULATIVE', 'value': '17'}, {'name': 'OFFMARKETDATE', 'value': '2019-05-17T10:42:54'}]",55020,25960 Zachary Ave,Elko New Market,MN,44.573712,-93.42131,490000.0,RECENTLY_SOLD,60,55020_29,"Recently sold: $490,000. Welcome to this great 3 bedroom 3 bathroom home nestled on 10 beautiful acres in Elko New Market! This charming home features a spacious living room with gas-burning fireplace, a separate informal dining area and sliding glass door access to private deck! The kitchen offers tons of cabinet and counter space and stainless steel appliances.  You will love the large lower level family room with brand new carpet and beautiful french doors leading out to the expansive yard. This property includes a large pole barn, 2 pastures with electric fencing and a chicken coop. Located off 260th with convenient access to 35W and the southern Twin Cities."
4,3,1,1,1,0,,,[],Unfinished,"['Hardwood', 'Tile']",['Forced air'],True,['Central'],True,"['Dishwasher', 'Dryer', 'Garbage disposal', 'Microwave', 'Range / Oven', 'Refrigerator', 'Washer']",,,,True,False,,,2457.0,,,,['Attached Garage'],3,,False,True,,False,,False,,,,2,,,False,False,,"['Brick', 'Stone', 'Vinyl']",,,,,False,,,,,,,False,0.28 acres,,,,False,230480040,False,False,,,,Single Family,,,['Concrete'],Asphalt,,,False,,,False,,,,,,,,,,,,,,,True,False,,,,,194 - Lakeville,,194 - Lakeville,,194 - Lakeville,,,False,Elko New Market,,,"[{'name': 'PRESENTUSE', 'value': 'Yearly'}, {'name': 'STATUS', 'value': 'Pending'}, {'name': 'TAXYEAR', 'value': '2018.00'}, {'name': 'ZONING', 'value': 'Residential-Single Family'}, {'name': 'FRONTAGEFEET', 'value': 'Paved Streets, Curbs, City'}, {'name': 'BASEMENT', 'value': 'Full, Sump Pump, Daylight/Lookout Windows, Poured Concrete, Unfinished, Drain Tiled'}, {'name': 'CONSTRUCTIONSTATUS', 'value': 'Previously Owned'}, {'name': 'GARAGEDESCRIPTION', 'value': 'Attached Garage, Garage Door Opener, Driveway - Asphalt'}, {'name': 'HEATINGDESCRIPTION', 'value': 'Forced Air, Fireplace'}, {'name': 'APPLIANCES', 'value': 'Range, Refrigerator, Washer, Dryer, Microwave, Dishwasher, Disposal, Water Softener - Owned, Air-To-Air Exchanger, Furnace Humidifier, Water Filtration System'}, {'name': 'FIREPLACELOC', 'value': 'Gas Burning, Family Room, Stone'}, {'name': 'BATHDESC', 'value': 'Main Floor 1/2 Bath, Private Master, 3/4 Master, Upper Level Full Bath, Basement, Rough In'}, {'name': 'ROOMFLOOR1', 'value': 'Main'}, {'name': 'ROOF', 'value': 'Asphalt Shingles, Pitched, Age 8 Years or Less'}, {'name': 'EXTERIOR', 'value': 'Vinyl, Brick/Stone'}, {'name': 'FUEL', 'value': 'Natural Gas'}, {'name': 'SEWER', 'value': 'City Sewer/Connected'}, {'name': 'WATER', 'value': 'City Water/Connected'}, {'name': 'AMENITIESUNIT', 'value': 'Kitchen Window, Ceiling Fan(s), Hardwood Floors, Tiled Floors, Washer/Dryer Hookup, Natural Woodwork, Walk-In Closet, In-Ground Sprinkler, Local Area Network, Master Bedroom Walk-In Closet, Kitchen Center Island, Paneled Doors'}, {'name': 'DININGROOMDESCRIPTION', 'value': 'Informal Dining Room, Breakfast Area, Eat In Kitchen'}, {'name': 'ASSOCFEEINCLUDES', 'value': 'Sanitation, Professional Mgmt'}, {'name': 'SPECIALSEARCH', 'value': '3 BR on One Level, 2nd Floor Laundry, 4 BR on One Level'}]",55020,27037 Long Ridge Dr,Elko New Market,MN,44.558114,-93.331639,394900.0,RECENTLY_SOLD,47,55020_30,"Recently sold: $394,900. Why build when you can have a new home that is loaded with extra detail and all the finishing touches. Custom home by Craft Homes nestled on a premium lot with water views from the front and back. Gourmet kitchen, wide plank hand scraped american birch wood floors, stainless steel appliances, granite counters, upgraded enamel casing, 2 panel doors, stone fireplace, built-in bench in the foyer and mudroom, main floor office, knockdown ceiling, large 2nd floor loft plus 4 bedrooms on one level. Quartz counters in the owners bath with higher counters, tile floors, subway tile shower, ceiling with box up for a dramatic look. The lower level with lookout windows offers wonderful opportunity for storage or an open space to make it your own. Full irrigation, gutters and landscaping with beautiful curb appeal, 3 car garage. Enjoy this highly desired golf course community of Boulder Pointe. Close to clubhouse dining."
3,3,2,1,0,0,,,[],Finished,"['Hardwood', 'Tile']",['Forced air'],True,['Central'],True,['Water Softener - Rented'],,,,True,False,,,1675.0,,,,['Attached Garage'],2,,False,True,,False,,False,,,,,,,,,,"['Brick', 'Stone', 'Vinyl']",,,,,,,,,,,,False,0.04 acres,,,,False,230500300,False,False,,Residential-Single,,Condo,,,['Concrete'],Asphalt,,,False,2007,,False,,,,['City Sewer/Connected'],,,,,,,,,,,True,False,,,,,Lakeville,,Lakeville,,Lakeville,,,False,Elko New Market,,,"[{'name': 'BathDesc', 'value': 'Private Master, Upper Level Full Bath, 3/4 Master'}, {'name': 'Fuel', 'value': 'Natural Gas'}, {'name': 'GarageDescription', 'value': 'Driveway - Asphalt'}, {'name': 'PresentUse', 'value': 'Yearly'}, {'name': 'Water', 'value': 'City Water/Connected'}, {'name': 'SpecialSearch', 'value': '2nd Floor Laundry'}, {'name': 'TaxYear', 'value': '2017.00'}]",55020,9748 Saint Andrews Dr,Elko New Market,MN,44.554451,-93.325666,200000.0,RECENTLY_SOLD,31,55020_31,"Recently sold: $200,000. Welcome home! This Elko New Market townhome is an incredible property within the Boulder Pointe community. Featuring three bedrooms, three bathrooms, two car garage, wood flooring, tile flooring and many more updates. The attention to detail on this townhome is amazing. Located in the Lakeville school district. Easy access to 35W, shopping and entertainment. If you like to golf, this is the property for you! Buyer to assume special assessment."
3,3,0,0,0,0,,,[],Finished,['Hardwood'],['Forced air'],True,['Central'],True,"['Exhaust Fan/Hood', 'Cooktop', 'Disposal', 'Water Softener - Owned']",,,,False,False,,,1898.0,,,,['Attached Garage'],2,,False,True,,False,,False,,,,,,,False,False,,"['Brick', 'Stone', 'Vinyl']",,,,,False,,,,,,,False,0.04 acres,,,,False,230500370,False,False,,Residential-Multi-Family,,Townhouse,,,['Concrete'],Other,,,False,2006,,False,,,,['City Sewer/Connected'],,,,,,,,,,,True,False,,Other,,,Lakeville #194,,Lakeville #194,,Lakeville #194,,,False,Elko,,,"[{'name': 'AmenitiesUnit', 'value': 'Natural Woodwork, Kitchen Window, Washer/Dryer Hookup, In-Ground Sprinkler'}, {'name': 'BathDesc', 'value': 'Private Master, Upper Level Full Bath, 3/4 Master, Upper Level 3/4 Bath, Walk-In Shower Stall'}, {'name': 'Fuel', 'value': 'Natural Gas'}, {'name': 'GarageDescription', 'value': 'Insulated Garage, Garage Door Opener, Driveway - Asphalt'}, {'name': 'PresentUse', 'value': 'Yearly'}, {'name': 'Water', 'value': 'City Water/Connected'}, {'name': 'SpecialSearch', 'value': '2nd Floor Laundry'}]",55020,9735 Saint Andrews Dr,Elko,MN,44.553792,-93.325671,219900.0,RECENTLY_SOLD,29,55020_32,"Recently sold: $219,900. Stunning townhome. Surrounded by Boulder Pointe Gold Course. The upgrades are phenomenal. Hardwood maple foyer, transom windows, maple cabinetry, granite center island, engineered hardwood hickory kitchen dinette and living room. 6 panel doors, spectacular decor with custom window treatments and &quot;spa like&quot; ceramic baths. Beautifully cared for, one owner home."
4,3,,,,,,,,Finished,,['Forced air'],True,,,,,,,,False,,,1342.0,,,,,,,False,,,False,,False,,,,1,,,,,,['Wood'],,,,,,,,,,,,False,10 acres,,,,False,089290042,False,False,,,,Single Family,,,['Concrete Block'],Asphalt,,,False,,,False,,,,,,,,,,,,,,,True,False,,Ranch,,,,,,,,,,False,Elko New Market,,,[],55020,7837 E 260th St,Elko New Market,MN,44.571146,-93.362037,450000.0,RECENTLY_SOLD,0,55020_33,"Recently sold: $450,000. "
4,2,,,,,,,,Finished,,,,,,,,,,,False,,,1514.0,,,,,,,False,,,False,,False,,,,2,,,,,,['Other'],,,,,,,,,,,,False,13 acres,,,,False,081000010,False,False,,,,Single Family,,,,Asphalt,,,False,,,False,,,,,,,,,,,,,,,True,False,,,,,,,,,,,,False,Elko New Market,,,[],55020,10876 E 270th St,Elko New Market,MN,44.559819,-93.30206,370000.0,RECENTLY_SOLD,0,55020_34,"Recently sold: $370,000. 10876 E 270th St, Elko New Market, MN is a single family home that contains 1,514 sq ft and was built in 1900. It contains 4 bedrooms and 2.25 bathrooms. This home last sold for $370,000 in May 2019. 
 
The Zestimate for this house is $390,030, which has increased by $3,714 in the last 30 days. The Rent Zestimate for this home is $1,950/mo, which has increased by $17/mo in the last 30 days. "
4,3,1,1,1,0,,,[],Finished,['Hardwood'],['Forced air'],True,['Central'],True,"['Refrigerator', 'Washer']",,,,False,False,,,2879.0,,,,['Detached Garage'],3,,False,True,,False,,False,,,,2,,,False,False,,['Vinyl'],,,,,False,,,,,,,False,13 acres,,,,False,810000100,False,False,,,,Single Family,,,,Asphalt,,,False,2001,,False,,,,,,,,,,,,,,,True,False,,Other,,,,,,,,,,False,Elko New Market,,,"[{'name': 'PRESENTUSE', 'value': 'Yearly'}, {'name': 'STATUS', 'value': 'Pending'}, {'name': 'TAXYEAR', 'value': '2018.00'}, {'name': 'TOPOGRAPHY', 'value': 'Sloped'}, {'name': 'ZONING', 'value': 'Residential-Single Family'}, {'name': 'FRONTAGEFEET', 'value': 'County'}, {'name': 'BASEMENT', 'value': 'Full, Egress Windows, Sump Pump'}, {'name': 'CONSTRUCTIONSTATUS', 'value': 'Previously Owned'}, {'name': 'GARAGEDESCRIPTION', 'value': 'Detached Garage'}, {'name': 'HEATINGDESCRIPTION', 'value': 'Forced Air'}, {'name': 'SEWER', 'value': 'Private'}, {'name': 'WATER', 'value': 'Well'}, {'name': 'APPLIANCES', 'value': 'Range, Exhaust Fan/Hood, Refrigerator, Microwave, Dishwasher'}, {'name': 'AMENITIESUNIT', 'value': 'Deck, Kitchen Window, Ceiling Fan(s), Hardwood Floors, Washer/Dryer Hookup, Natural Woodwork'}, {'name': 'BATHDESC', 'value': 'Main Floor 1/2 Bath, 3/4 Basement, Upper Level Full Bath'}, {'name': 'ROOMFLOOR1', 'value': 'Main'}, {'name': 'ROOF', 'value': 'Asphalt Shingles'}, {'name': 'EXTERIOR', 'value': 'Vinyl'}, {'name': 'FUEL', 'value': 'Natural Gas'}, {'name': 'DININGROOMDESCRIPTION', 'value': 'Informal Dining Room, Breakfast Area, Separate/Formal Dining Room'}, {'name': 'FENCE', 'value': 'Wire, Electric'}, {'name': 'CROPTYPE', 'value': 'Hay/Alfalfa'}, {'name': 'FARMTYPE', 'value': 'Hobby, Horse, Beef'}]",55020,10876 E 270th St,Elko New Market,MN,44.559819,-93.30206,370000.0,RECENTLY_SOLD,0,55020_35,"Recently sold: $370,000. Your horses will love it here! Charming turn of the century hobby farm.  Ready for horses, goats and chickens, atv's dirt bikes. Goat pen attached to the Taj Mahal of chicken coops with attached storage building, corn crib/hay storage, large machine shed, pig barn and milk house. 3 electric fenced in pastures (one is a large paddock with automatic waterer and 12' x 24' shelter). Gardens galore. 4 acres can be fenced in for more horses or used as a hay field. Many updates including electrical, water softener, water heater, supplemental heating, sump pump."
5,3,,,,,,,,Finished,,['Forced air'],True,,,,,,,,False,,,2188.0,,,,,,,False,,,False,,False,,,,1,,,,,,['Other'],,,,,,,,,,,,False,10 acres,,,,False,080800020,False,False,,,,Single Family,,,['Concrete'],Asphalt,,,False,,,False,,,,,,,,,,,,,,,True,False,,,,,,,,,,,,False,Elko New Market,,,[],55020,7482 E 250th St,Elko New Market,MN,44.589665,-93.3695,535000.0,RECENTLY_SOLD,0,55020_36,"Recently sold: $535,000. "
4,3,2,0,1,0,,,[],Finished,"['Hardwood', 'Tile']",['Forced air'],True,['Refrigeration'],True,"['Dishwasher', 'Dryer', 'Microwave', 'Range / Oven', 'Refrigerator', 'Washer']",,,,,False,,,2075.0,,,,['Attached Garage'],2,,False,True,,False,,False,,,,2,,,,,,"['Brick', 'Metal', 'Stone', 'Vinyl']",,,,,,,,,,,,False,0.31 acres,,,,False,230330130,False,False,,,,Single Family,,,['Concrete Block'],Asphalt,,,False,2000,,False,,,,,,,,,,,,,,,True,False,,Other,,,194 - Lakeville,,194 - Lakeville,,194 - Lakeville,,,False,Elko New Market,,,"[{'name': 'PRESENTUSE', 'value': 'Yearly'}, {'name': 'STATUS', 'value': 'Pending'}, {'name': 'TAXYEAR', 'value': '2018.00'}, {'name': 'ZONING', 'value': 'Residential-Single Family'}, {'name': 'BASEMENT', 'value': 'Full, Partial Finished, Sump Pump, Daylight/Lookout Windows, Walkout, Drain Tiled'}, {'name': 'CONSTRUCTIONSTATUS', 'value': 'Previously Owned'}, {'name': 'EXTERIOR', 'value': 'Metal, Vinyl, Brick/Stone'}, {'name': 'GARAGEDESCRIPTION', 'value': 'Attached Garage'}, {'name': 'HEATINGDESCRIPTION', 'value': 'Forced Air'}, {'name': 'FRONTAGEFEET', 'value': 'City'}, {'name': 'APPLIANCES', 'value': 'Range, Refrigerator, Washer, Dryer, Microwave, Dishwasher, Water Softener - Rented'}, {'name': 'AMENITIESUNIT', 'value': 'Deck, Kitchen Window, Ceiling Fan(s), Hardwood Floors, Tiled Floors, Natural Woodwork, Walk-In Closet, Porch, Vaulted Ceiling(s), Master Bedroom Walk-In Closet, Kitchen Center Island'}, {'name': 'FIREPLACELOC', 'value': 'Gas Burning, Family Room'}, {'name': 'BATHDESC', 'value': 'Main Floor 1/2 Bath, Upper Level Full Bath, Full Master, Rough In'}, {'name': 'ROOMFLOOR1', 'value': 'Main'}, {'name': 'SPECIALSEARCH', 'value': 'Main Floor Laundry, 3 BR on One Level'}, {'name': 'FUEL', 'value': 'Natural Gas'}, {'name': 'SEWER', 'value': 'City Sewer/Connected'}, {'name': 'WATER', 'value': 'City Water/Connected'}, {'name': 'DININGROOMDESCRIPTION', 'value': 'Eat In Kitchen, Separate/Formal Dining Room'}, {'name': 'FENCE', 'value': 'Chain Link'}]",55020,26424 Woodcrest Ln,Elko New Market,MN,44.566955,-93.317394,303500.0,SOLD,0,55020_37,"Recently sold: $303,500. "
2,2,,,,,,,,,,['Forced air'],True,,,,,,,,False,,,1174.0,,,,,,,False,,,False,,False,,,,1,,,,,,['Other'],,,,,,,,,,,,False,10 acres,,,,False,080640020,False,False,,,,Single Family,,,['Concrete Block'],Asphalt,,,False,,,False,,,,,,,,,,,,,,,True,False,,Ranch,,,,,,,,,,False,Elko New Market,,,[],55020,27275 Jonquil Ave,Elko New Market,MN,44.555156,-93.397235,420000.0,SOLD,0,55020_38,"Recently sold: $420,000. "
3,2,0,0,0,0,,,[],Finished,,['Forced air'],True,['Refrigeration'],True,"['Dryer', 'Washer']",,,,,False,,,1758.0,,,,"['Attached Garage', 'Off street']",2,,False,True,,False,,False,,,,,,,,,,['Wood'],,,,,,,,,,,,False,0.36 acres,,,,False,230310410,False,False,,,,Single Family,,,['Concrete Block'],Asphalt,,,False,1990,,False,,,,,,,,,,,,,,,True,False,,,,,,,,,,,,False,Elko,,,"[{'name': None, 'value': 'Balcony'}, {'name': None, 'value': 'Dogs Allowed'}, {'name': None, 'value': 'Laundry: In Unit'}, {'name': None, 'value': 'Parking Type: Garage'}, {'name': None, 'value': 'Small Dogs Allowed'}]",55020,26616 Woodcrest Cir,Elko,MN,44.56438,-93.317111,180000.0,SOLD,7,55020_39,"Recently sold: $180,000. Located in the top rated ISD 194 Lakeville Schools! Large lot on corner across from park! Spacious upper floor with 3 bedrooms on main level! Large deck! NEW Carpet and flooring throughout! Walkout basement with lots of storage. Don't miss out!
New Refrigerator, Range, Microwave, Washer, and Dryer.  2 car garage. Small dogs ok with deposit at landlord's discretion. Showings available by appointment."
4,3,,,,,,,,Finished,,['Forced air'],True,,,,,,,,False,,,2172.0,,,,,,,False,,,False,,False,,,,2,,,,,,['Other'],,,,,,,,,,,,False,4.93 acres,,,,False,080950040,False,False,,,,Single Family,,,,Asphalt,,,False,,,False,,,,,,,,,,,,,,,True,False,,,,,,,,,,,,False,Elko New Market,,,[],55020,7375 E 250th St,Elko New Market,MN,44.585725,-93.37174,414900.0,SOLD,0,55020_40,"Recently sold: $414,900. "
5,4,2,1,1,0,,,[],Daylight/Lookout Windows,['Tile'],['Forced air'],True,"['Central', 'Refrigeration']",True,"['Furnace Humidifier', 'Air-To-Air Exchanger']",,,,True,False,,,3644.0,,,,['Attached Garage'],3,,False,True,,False,,False,,,,2,,,False,False,,['Wood products'],,,"['Park', 'Water']",True,False,,,,,,,False,0.29 acres,,,,False,230380630,False,False,,Residential-Single Family,,Single Family,,,['Concrete Block'],Other,,,False,2005,,False,,,,['City Sewer/Connected'],,,,,,,,,,,True,False,,Craftsman,,,Lakeville,,Lakeville,,Lakeville,,,False,Elko New Market,,,"[{'name': 'AmenitiesUnit', 'value': 'Natural Woodwork, Kitchen Window, In-Ground Sprinkler, Kitchen Center Island, French Doors, Master Bedroom Walk-In Closet, Paneled Doors, Wet Bar, Panoramic View'}, {'name': 'BathDesc', 'value': 'Private Master, Full Master, Main Floor 1/2 Bath, Upper Level Full Bath, Separate Tub & Shower, Upper Level 3/4 Bath, Walk-In Shower Stall, Bathroom Ensuite, Jetted Tub'}, {'name': 'Exterior', 'value': 'Shakes'}, {'name': 'Fuel', 'value': 'Natural Gas'}, {'name': 'GarageDescription', 'value': 'Insulated Garage, Garage Door Opener, Heated Garage, Driveway - Asphalt'}, {'name': 'SpecialSearch', 'value': '3 BR on One Level, Main Floor Laundry, 4 BR on One Level'}, {'name': 'Style', 'value': '(SF) Two Stories'}, {'name': 'PresentUse', 'value': 'Yearly'}, {'name': 'Roof', 'value': 'Age 8 Years or Less'}, {'name': 'Water', 'value': 'City Water/Connected'}, {'name': 'Fence', 'value': 'Invisible'}, {'name': 'TaxYear', 'value': '2018.00'}]",55020,9409 Glenborough Dr,Elko New Market,MN,44.559338,-93.333026,366500.0,SOLD,22,55020_41,"Recently sold: $366,500. Why build new when you can have the perfect custom built home, on the perfect lot, in the perfect neighborhood? Enjoy vista view in front and back w/upgrades over-sized windows. Upgrades galore: real hardwoods, upgraded cabinetry, wood built-ins, stacked stone fireplace in living and family rooms. 4 bedroom up w/vaulted master suite w/window bump-out. Heated over sized garage, maintenance free deck, invisible fence, &amp; patio w/ stone fire pit! Stainless steel appliances will be installed also!"
5,3,1,2,0,0,,,[],Partial Finished,['Hardwood'],['Forced air'],True,['Refrigeration'],True,"['Disposal', 'Water Softener - Owned', 'Air-To-Air Exchanger']",,,,,False,,,2280.0,,,,['Attached Garage'],,,False,,,False,,False,,,,2,,,,,,"['Brick', 'Metal', 'Stone', 'Vinyl']",,,,,,,,,,,,False,0.26 acres,,,,False,230440900,False,False,,Residential-Single,,Single Family,,,['Concrete'],Asphalt,,,False,2013,,False,,,,['City Sewer/Connected'],,,,,,,,,,,True,False,,,,,,,,,,,,False,Elko New Market,,,"[{'name': 'AmenitiesUnit', 'value': 'Washer/Dryer Hookup, In-Ground Sprinkler'}, {'name': 'Fuel', 'value': 'Natural Gas'}, {'name': 'GarageDescription', 'value': 'Garage Door Opener'}, {'name': 'SpecialSearch', 'value': '3 BR on One Level'}, {'name': 'BathDesc', 'value': 'Main Floor Full Bath, 3/4 Master'}, {'name': 'PresentUse', 'value': 'Yearly'}, {'name': 'Roof', 'value': 'Age 8 Years or Less'}, {'name': 'Water', 'value': 'City Water/Connected'}, {'name': 'TaxYear', 'value': '2018.00'}]",55020,9177 Fairway Hill Dr,Elko New Market,MN,44.562354,-93.335537,300000.0,SOLD,0,55020_42,"Recently sold: $300,000. "
4,3,0,0,0,0,,,,,,['Forced air'],True,['Refrigeration'],True,,,,,,False,,,2896.0,,,,['Attached Garage'],3,,False,True,,False,,False,,,,2,,,,,,['Other'],,,,,,,,,,,,False,0.29 acres,,,,False,230380680,False,False,,,,Single Family,,,['Concrete'],Asphalt,,,False,2005,,False,,,,,,,,,,,,,,,True,False,,Other,,,194 - Lakeville,,194 - Lakeville,,194 - Lakeville,,,False,Elko,,,[],55020,26963 Long Ridge Dr,Elko,MN,44.558812,-93.331667,250000.0,SOLD,17,55020_43,"Recently sold: $250,000. Stunning, custom home in high demand Boulder Pointe golf course community. Open and bright floor plan with custom cabinetry and wood floors. Walk in closets in all bedrooms and double sinks in owner's suite.  Brick exterior.  Custom finishes throughout! Attractive, neutral colors and landscaping.  Shows like a model."
4,3,,,,,,,,Finished,,['Forced air'],True,,,,,,,,False,,,1546.0,,,,,,,False,,,False,,False,,,,1,,,,,,['Other'],,,,,,,,,,,,False,4.01 acres,,,,False,081150200,False,False,,,,Single Family,,,['Concrete Block'],Asphalt,,,False,,,False,,,,,,,,,,,,,,,True,False,,Ranch,,,,,,,,,,False,Elko New Market,,,[],55020,26631 Jonquil Ave,Elko New Market,MN,44.561378,-93.397839,437500.0,SOLD,0,55020_44,"Recently sold: $437,500. "
4,4,1,1,2,0,,,[],Finished,"['Hardwood', 'Tile']",['Forced air'],True,['Central'],True,"['Disposal', 'Air-To-Air Exchanger']",,,,False,False,,,3493.0,,,,['Attached Garage'],3,,False,True,,False,,False,,,,1,,,False,False,,"['Metal', 'Stone', 'Stucco', 'Vinyl']",,,,,False,,,,,,,False,0.3 acres,,,,False,230380370,False,False,,Residential-Single,,Single Family,,,['Concrete'],Asphalt,,,False,2005,,False,,,,['City Sewer/Connected'],,,,,,,,,,,True,False,,Ranch,,,,,,,,,,False,Elko New Market,,,"[{'name': 'AmenitiesUnit', 'value': 'Natural Woodwork, Balcony, Kitchen Window, Washer/Dryer Hookup'}, {'name': 'BathDesc', 'value': 'Private Master, Full Master, Main Floor 1/2 Bath, Whirlpool, Walk-In Shower Stall'}, {'name': 'Fuel', 'value': 'Natural Gas'}, {'name': 'GarageDescription', 'value': 'Insulated Garage, Garage Door Opener, Driveway - Asphalt'}, {'name': 'FrontageFeet', 'value': 'Paved Streets, City, Curbs, Sidewalks'}, {'name': 'PresentUse', 'value': 'Yearly'}, {'name': 'Roof', 'value': 'Pitched, Age Over 8 Years'}, {'name': 'Style', 'value': '(SF) One Story'}, {'name': 'SpecialSearch', 'value': 'Main Floor Laundry, Main Floor Bedroom'}, {'name': 'Water', 'value': 'City Water/Connected'}, {'name': 'TaxYear', 'value': '2018.00'}]",55020,9556 Glenborough Dr,Elko New Market,MN,44.559339,-93.328471,379000.0,SOLD,27,55020_45,"Recently sold: $379,000. Come see the home before it's listed! For more details or to set up a private-pre-list showing, call us at 612-324-5026! WE HAVE MANY BUYERS LOOKING FOR HOMES IN YOUR AREA! CALL US TODAY TO FIND OUT WHAT YOUR HOME IS WORTH!!!

SEE OUR TEAM'S OTHER COMING SOON LISTINGS AT www.KCPrelistings.com!!!!"
5,4,,,,,,,,Finished,,['Forced air'],True,,,,,,,,False,,,2336.0,,,,,,,False,,,False,,False,,,,1,,,,,,['Other'],,,,,,,,,,,,False,5 acres,,,,False,080830040,False,False,,,,Single Family,,,['Concrete Block'],Asphalt,,,False,,,False,,,,,,,,,,,,,,,True,False,,Ranch,,,,,,,,,,False,Elko New Market,,,[],55020,27115 Clover Path,Elko New Market,MN,44.55726,-93.345553,565000.0,SOLD,0,55020_46,"Recently sold: $565,000. "
4,4,3,0,1,0,,,[],Finished,"['Carpet', 'Laminate']",['Forced air'],True,['Central'],True,"['Dishwasher', 'Dryer', 'Freezer', 'Microwave', 'Range / Oven', 'Refrigerator', 'Washer']",,,,False,False,,,2855.0,,,,['Attached Garage'],5,,False,True,,False,,False,,,,1,,,False,False,,"['Brick', 'Stone', 'Vinyl']",,,['Territorial'],True,False,,,,,,,False,10 acres,,,,False,392301130,False,False,,Residential-Single Family,,Single Family,,,,Asphalt,,,False,1995,,False,,,,['Private'],,,,,,,,,,,True,False,,Ranch,,,,,,,,,,False,Elko New Market,,,"[{'name': 'Fuel', 'value': 'Natural Gas'}, {'name': 'GarageDescription', 'value': 'Driveway - Gravel, Underground Garage'}, {'name': 'SpecialSearch', 'value': '3 BR on One Level, Main Floor Laundry, Main Floor Bedroom, All Living Facilities on One Level'}, {'name': 'PresentUse', 'value': 'Yearly'}, {'name': 'Roof', 'value': 'Pitched, Age Over 8 Years'}, {'name': 'Style', 'value': '(SF) One Story'}, {'name': 'Water', 'value': 'Well'}, {'name': 'OutBuildings', 'value': 'Hen House'}, {'name': 'TaxYear', 'value': '2018.00'}]",55020,4875 E 250th St,Elko New Market,MN,44.584115,-93.425216,450000.0,SOLD,16,55020_47,"Recently sold: $450,000. Ten acres of trees, creek, and a lovely rambler that looks out over all this beauty. 4 Bedrooms, 3 baths, 2nd kitchen, one in LL. Open floor plan, 2 car attached garage and a single heated garage below. Follow the path in the woods to see the back of the property. Hen house and hot tub stay."
