5,3,0,0,0,0,,,,,['Hardwood'],['Other'],True,['Wall'],True,,,,,True,False,,,3878.0,,,,,,,False,,,False,,False,,,,,,,,,,['Other'],,,,,,,,,,,,False,5.2 acres,,,,False,030044300,False,False,,,,Single Family,,,,Composition,,,False,1992,,False,,,,,,,,,,,,,,,True,False,,Ranch,,,Cambridge-Isanti #911,,Cambridge-Isanti #911,,Cambridge-Isanti #911,,,False,Harris,,,[],55032,395 Stark Rd,Harris,MN,45.579785,-93.103148,400000.0,RECENTLY_SOLD,0,55032_25,"Recently sold: $400,000. "
2,2,1,0,1,0,,,[],,"['Carpet', 'Linoleum / Vinyl']",['Forced air'],True,['Central'],True,"['Dishwasher', 'Dryer', 'Range / Oven', 'Refrigerator']",,,,,False,,,1936.0,,,,"['Attached Garage', 'Detached Garage']",,,False,,,False,,False,,,,0,,,,,,['Vinyl'],,,,,,,,,,,,False,5 acres,,,,False,090076007,False,False,,,,Single Family,,,,Composition,,,False,1999,,False,,,,,,,,,,,,,,,True,False,,Ranch,,,,,,,,,,False,Harris,,,"[{'name': 'PRESENTUSE', 'value': 'Yearly'}, {'name': 'STATUS', 'value': 'Pending'}, {'name': 'ZONING', 'value': 'Residential-Single Family'}, {'name': 'FRONTAGEFEET', 'value': 'Paved Streets, Township'}, {'name': 'CONSTRUCTIONSTATUS', 'value': 'Previously Owned'}, {'name': 'FUEL', 'value': 'Propane'}, {'name': 'GARAGEDESCRIPTION', 'value': 'Attached Garage, Detached Garage, Garage Door Opener, Driveway - Gravel'}, {'name': 'HEATINGDESCRIPTION', 'value': 'Forced Air'}, {'name': 'SEWER', 'value': 'Private'}, {'name': 'WATER', 'value': 'Well'}, {'name': 'APPLIANCES', 'value': 'Range, Refrigerator, Washer, Dryer, Dishwasher'}, {'name': 'AMENITIESUNIT', 'value': 'Deck, Kitchen Window, Ceiling Fan(s), Porch, Master Bedroom Walk-In Closet'}, {'name': 'BASEMENT', 'value': 'Egress Windows, Sump Pump, Concrete Block, Unfinished'}, {'name': 'BATHDESC', 'value': 'Main Floor 1/2 Bath, Upper Level Full Bath'}, {'name': 'SPECIALSEARCH', 'value': 'Main Floor Laundry'}, {'name': 'EXTERIOR', 'value': 'Vinyl'}, {'name': 'DININGROOMDESCRIPTION', 'value': 'Informal Dining Room, Breakfast Area, Kitchen/Dining Room, Eat In Kitchen'}, {'name': 'OUTBUILDINGS', 'value': 'Additional Garage'}, {'name': 'ROOMFLOOR1', 'value': 'Upper'}, {'name': 'TAXYEAR', 'value': '2019.00'}, {'name': 'DAYSONMARKET', 'value': '4'}, {'name': 'DAYSONMARKETCUMULATIVE', 'value': '4'}, {'name': 'OFFMARKETDATE', 'value': '2019-06-04T16:51:40'}]",55032,42205 Joywood Ave,Harris,MN,45.560561,-92.910179,234000.0,RECENTLY_SOLD,26,55032_26,"Recently sold: $234,000. If you are Iooking for privacy, room to roam, and quiet, you???ve found it! This one owner home is tucked away on a quiet, wooded 5 acre Iot, but still has easy access to I 35 to be in the cities in just minutes! This well maintained home features a large kitchen with an abundance of counter top space and cabinet storage, and a breakfast bar. The kitchen Ieads right into dining room with views of your Iarge deck overlooking the beautifully private property, a large living room, main floor Iaundry room/ mud room, a large walk-in master closet, and buiId instant equity in the Iower Ievel with adding a bedroom, and family room with just paint and flooring, and a 3rd bathroom. A brand new furnace was just installed Jan 2019. This serene property awaits your finishing touches!"
4,3,1,2,0,0,,,[],,['Tile'],['Forced air'],True,['Central'],True,"['Dryer', 'Microwave', 'Refrigerator', 'Washer']",,,,,False,,,2400.0,,,,['Attached Garage'],,,False,,,False,,False,,,,,,,,,,['Vinyl'],,,,,,,,,,,,False,9.3 acres,,,,False,030046400,False,False,,,,Single Family,,,,Asphalt,,,False,2007,,False,,,,,,,,,,,,,,,True,False,,,,,,,,,,,,False,Harris,,,"[{'name': 'PRESENTUSE', 'value': 'Yearly'}, {'name': 'STATUS', 'value': 'Pending'}, {'name': 'ZONING', 'value': 'Residential-Single Family'}, {'name': 'BASEMENT', 'value': 'Full, Finished (Livable), Sump Pump, Daylight/Lookout Windows, Concrete Block, Walkout, Drain Tiled'}, {'name': 'CONSTRUCTIONSTATUS', 'value': 'Previously Owned'}, {'name': 'FUEL', 'value': 'Propane'}, {'name': 'GARAGEDESCRIPTION', 'value': 'Attached Garage, Garage Door Opener, Driveway - Gravel, Insulated Garage'}, {'name': 'HEATINGDESCRIPTION', 'value': 'Forced Air'}, {'name': 'SEWER', 'value': 'Private'}, {'name': 'WATER', 'value': 'Well'}, {'name': 'APPLIANCES', 'value': 'Range, Refrigerator, Washer, Dryer, Microwave, Dishwasher, Water Softener - Owned, Air-To-Air Exchanger, Fuel Tank - Rented'}, {'name': 'AMENITIESUNIT', 'value': 'Deck, Kitchen Window, Ceiling Fan(s), Tiled Floors, Porch, Master Bedroom Walk-In Closet, Main Floor Master Bedroom, Kitchen Center Island, Cable, Broadband Available, Wet Bar'}, {'name': 'BATHDESC', 'value': 'Main Floor 3/4 Bath, 3/4 Basement, Private Master, Full Master, Walk-In Shower Stall'}, {'name': 'ROOMFLOOR1', 'value': 'Main'}, {'name': 'FRONTAGEFEET', 'value': 'Township, Unpaved Streets'}, {'name': 'ROOF', 'value': 'Asphalt Shingles, Age 8 Years or Less'}, {'name': 'EXTERIOR', 'value': 'Vinyl'}, {'name': 'DININGROOMDESCRIPTION', 'value': 'Kitchen/Dining Room'}, {'name': 'SPECIALSEARCH', 'value': 'Main Floor Bedroom'}, {'name': 'OUTBUILDINGS', 'value': 'Storage Shed'}, {'name': 'LAKEWATERFRONT', 'value': 'Pond'}, {'name': 'TAXYEAR', 'value': '2019.00'}, {'name': 'DAYSONMARKET', 'value': '7'}, {'name': 'DAYSONMARKETCUMULATIVE', 'value': '7'}, {'name': 'OFFMARKETDATE', 'value': '2019-04-19T13:35:58'}]",55032,43071 Amery Ave,Harris,MN,45.573164,-93.116117,260000.0,RECENTLY_SOLD,40,55032_27,"Recently sold: $260,000. You will love this comfortable rambler located on a private &amp; quiet setting in the Cambridge-Isanti School District. Updated home with a main floor master bedroom suite &amp; an updated master bathroom.  Laminate flooring and slate tile floors in the updated 3/4 bathrooms and updated flooring throughout within the last five years.  Fresh paint, neutral decor, granite counter tops in the kitchen and bathrooms.  Appliances replaced w/in the last seven years and the stove is a true convection oven with three fans.  Four bedrooms, three bathrooms &amp; a den that can be used for a variety of things.  Unique wet bar space with laundry.  Enjoy living on your own private oasis with a front porch, walk-out lower level that leads to a back patio and there is a back deck off the dining room.  Relax around the bonfire pit and enjoy the quiet country life with lots of wildlife including ducks, swans and other water fowl around the pretty pond, which is also great for canoeing &amp; kayaking.  Welcome Home!"
4,2,2,0,0,0,,,[],Daylight/Lookout Windows,"['Carpet', 'Linoleum / Vinyl']",['Baseboard'],True,['Other'],True,"['Dishwasher', 'Dryer', 'Range / Oven', 'Refrigerator', 'Washer']",,,,,False,,,1856.0,,,,['Detached Garage'],4,,False,True,,False,,False,,,,1,,,,,,['Other'],,,,,,,,,,,,False,4.84 acres,,,,False,140019200,False,False,,Residential-Single Family,,Single Family,,,,Asphalt,,,False,1986,,False,,,,['Private'],,,,,,,,,,,True,False,,Other,,,138 - North Branch,,138 - North Branch,,138 - North Branch,,,False,Harris,,,"[{'name': 'Fuel', 'value': 'Electric'}, {'name': 'GarageDescription', 'value': 'Garage Door Opener'}, {'name': 'HeatingDescription', 'value': 'Wood Stove, Gravity'}, {'name': 'PresentUse', 'value': 'Yearly'}, {'name': 'Water', 'value': 'Well'}, {'name': 'TaxYear', 'value': '2018.00'}, {'name': 'CONSTRUCTIONSTATUS', 'value': 'Previously Owned'}, {'name': 'Status', 'value': 'Active'}]",55032,43065 Forest Blvd,Harris,MN,45.572118,-92.974464,235000.0,RECENTLY_SOLD,0,55032_28,"Recently sold: $235,000. "
3,3,2,0,1,0,,,[],"Full, Finished (Livable), Drain Tiled, Sump Pump, Concrete Block","['Hardwood', 'Tile']",['Forced air'],True,['Central'],True,"['Range', 'Dishwasher', 'Refrigerator', 'Washer', 'Dryer', 'Water Softener - Owned', 'Air-To-Air Exchanger', 'Fuel Tank - Rented']",,,,True,False,,,3018.0,,,,['Attached Garage'],,,False,,,False,,False,,,,,,,,,,['Stone'],,,,,,,,,,,,False,10.2 acres,,,,False,140010520,False,False,,Residential-Single Family,,Single Family,,,,Asphalt,,,False,2002,,False,,,,['Private'],,,,,,,,,,,True,False,,Ranch,,,138 - North Branch,,138 - North Branch,,138 - North Branch,,,False,Harris,,,"[{'name': 'AmenitiesUnit', 'value': 'Deck, Natural Woodwork, Kitchen Window, Vaulted Ceiling(s), Hardwood Floors, Tiled Floors, Washer/Dryer Hookup, Patio, Walk-In Closet, Ceiling Fan(s), Kitchen Center Island, Master Bedroom Walk-In Closet, Main Floor Master Bedroom, Satelite Dish'}, {'name': 'BathDesc', 'value': 'Private Master, Full Master, Main Floor Full Bath, Main Floor 1/2 Bath, Full Basement, Separate Tub & Shower, Walk-In Shower Stall, Jetted Tub'}, {'name': 'Exterior', 'value': 'Brick/Stone, Aluminum Siding'}, {'name': 'DiningRoomDescription', 'value': 'Kitchen/Dining Room, Breakfast Area, Living/Dining Room, Eat In Kitchen'}, {'name': 'GarageDescription', 'value': 'Attached Garage, Insulated Garage, Garage Door Opener, Heated Garage, Driveway - Asphalt, Driveway - Concrete'}, {'name': 'FireplaceLoc', 'value': 'Living Room, Gas Burning, Master Bedroom'}, {'name': 'Fuel', 'value': 'Propane'}, {'name': 'HeatingDescription', 'value': 'Forced Air'}, {'name': 'OutBuildings', 'value': 'Additional Garage, Pole Building, Storage Shed, Workshop, Chicken Coop/Barn'}, {'name': 'PresentUse', 'value': 'Yearly'}, {'name': 'Roof', 'value': 'Asphalt Shingles, Age Over 8 Years'}, {'name': 'SpecialSearch', 'value': 'Main Floor Laundry, All Living Facilities on One Level'}, {'name': 'Water', 'value': 'Well'}, {'name': 'FrontageFeet', 'value': 'County, Unpaved Streets'}, {'name': 'CONSTRUCTIONSTATUS', 'value': 'Previously Owned'}, {'name': 'Status', 'value': 'Active'}, {'name': 'TaxYear', 'value': '2020.00'}]",55032,4506 455th St,Harris,MN,45.608854,-93.018369,360000.0,RECENTLY_SOLD,36,55032_29,"Recently sold: $360,000. Welcome home to this hard to find 10 acre private retreat. 3 bdrm 3 bthrm 3 car garage with additional 30x40 pole building is available only due to a job transfer. Tucked peacefully off the road, enter on the new asphalt driveway. (add'l asphalt millings back by the pole barn with add'l parking spaces). The gleaming hd wd flrs welcome you in to the open &amp; expansive rooms of this beautiful rambler.  Mn flr master bdrm w fireplace is a dream get away, along with the private full bath (jetted tub new in 2018 and sep walk in shower).  Continue right into the huge walk in closet w the convenience of laundry right there!!  Kitchen has custom mission cabinetry, brand new dbl dutch oven, walk in pantry, &amp; corner fireplace.  Whole house back up generator is included!  Pole barn has a 23x12 shop that is ready for finishing!"
3,2,,,,,,,,,"['Carpet', 'Linoleum / Vinyl']",['Forced air'],True,['Central'],True,,,,,,False,,,1882.0,,,,['Detached Garage'],,,False,,,False,,False,,,,3,,,,,,['Wood'],,,,,,,,,,,,False,,,,,False,140044310,False,False,,,,Single Family,,,,Composition,,,False,1996,,False,,,,,,,,,,,,,,,True,False,,,,,,,,,,,,False,Harris,,,[],55032,6740 439th St,Harris,MN,45.585824,-92.972013,145000.0,SOLD,0,55032_30,"Recently sold: $145,000. Ready for you to move right in, doesnt need any work at all!! Cute decorating and nice open layout. Room sizes are very spacious. Large deck and huge yard. Dont miss out on this fantastic place, why take the risk with a foreclosure!!!!"
2,1,,,,,,,,,"['Carpet', 'Linoleum / Vinyl']",['Forced air'],True,['Central'],True,,,,,,False,,,1204.0,,,,,,,False,,,False,,False,,,,,,,,,,['Other'],,,,,,,,,,,,False,,,,,False,140044200,False,False,,,,Single Family,,,,Composition,,,False,1965,,False,,,,,,,,,,,,,,,True,False,,,,,,,,,,,,False,Harris,,,[],55032,6771 Sunrise Rd,Harris,MN,45.585822,-92.971378,25900.0,SOLD,0,55032_31,"Recently sold: $25,900. "
3,2,1,1,0,0,,,[],,"['Carpet', 'Linoleum / Vinyl']",['Other'],True,['Central'],True,['Washer'],,,,False,False,,,1326.0,,,,"['Detached Garage', 'Off street']",2,,False,True,,False,,False,,,,2,,,False,False,,['Wood'],,,,,False,,,,,,,False,8.43 acres,,,,False,030025600,False,False,,Residential-Single Family,,Single Family,,,,Asphalt,,,False,1980,,False,,,,['Private'],,,,,,,,,,,True,False,,Ranch,,,,,,,,,,False,Harris,,,"[{'name': 'HeatingDescription', 'value': 'Hot Water'}, {'name': 'SpecialSearch', 'value': '3 BR on One Level'}, {'name': 'GarageDescription', 'value': 'Tuckunder Garage'}, {'name': 'Fuel', 'value': 'Oil'}, {'name': 'PresentUse', 'value': 'Yearly'}, {'name': 'Style', 'value': '(SF) One Story'}, {'name': 'Water', 'value': 'Well'}, {'name': 'FrontageFeet', 'value': 'City'}, {'name': 'BathDesc', 'value': 'Upper Level Full Bath, 3/4 Master'}, {'name': 'TaxYear', 'value': '2018.00'}]",55032,1850 Stark Rd W,Harris,MN,45.591255,-93.132277,210000.0,SOLD,14,55032_32,"Recently sold: $210,000. Contact co-listing agent, Kasandra Rinnet, at 612-845-9979 or Kasandra@KrisLindahl.com for questions and inquiries."
3,2,2,0,0,0,,,[],Partial,['Hardwood'],['Baseboard'],True,,,,,,,,False,,,1353.0,,,,,,,False,,,False,,False,,,,,,,,,,['Other'],,,,,,,,,"Level, Rolling, Low Land",,,False,20 acres,,,,False,090055900,False,False,,Residential-Single Family,,Single Family,,,,Asphalt,,,False,1970,,False,,,,"['Private', 'Mound']",,,,,,,,,,,True,False,,,,,,,,,,,,False,Harris,,,"[{'name': 'AmenitiesUnit', 'value': 'Natural Woodwork, Kitchen Window, Washer/Dryer Hookup'}, {'name': 'Fence', 'value': 'Wood, Wire, Partial'}, {'name': 'HeatingDescription', 'value': 'Hot Water'}, {'name': 'FrontageFeet', 'value': 'Township, Unpaved Streets'}, {'name': 'Fuel', 'value': 'Propane'}, {'name': 'BathDesc', 'value': 'Main Floor Full Bath, Upper Level Full Bath'}, {'name': 'PresentUse', 'value': 'Yearly'}, {'name': 'Roof', 'value': 'Age 8 Years or Less'}, {'name': 'OutBuildings', 'value': 'Pole Building, Storage Shed, Other, Stables, Grain Bin'}, {'name': 'Style', 'value': '(SF) One 1/2 Stories'}, {'name': 'Water', 'value': 'Well'}, {'name': 'TaxYear', 'value': '2018.00'}]",55032,7845 450th St,Harris,MN,45.598744,-92.948866,125000.0,SOLD,26,55032_33,"Recently sold: $125,000. Enjoy peace and quiet yet only 3 miles from freeway.  (2 bedrooms are non-conforming/no closets but great size)  



Neighborhood Description



About a mile to downtown Harris on well maintained dirt road.  Country setting."
2,1,,,,,,,,,"['Carpet', 'Linoleum / Vinyl']",['Forced air'],True,,,,,,,,False,,,983.0,,,,,,,False,,,False,,False,,,,,,,,,,,,,,,,,,,,,,False,80.41 acres,,,,False,030026700,False,False,,,,Single Family,,,,Composition,,,False,,,False,,,,,,,,,,,,,,,True,False,,,,,,,,,,,,False,Harris,,,[],55032,44320 Alpine Ave,Harris,MN,45.592602,-93.114922,80000.0,SOLD,0,55032_34,"Recently sold: $80,000. "
5,3,3,0,0,0,,,[],,['Tile'],['Forced air'],True,['Central'],True,"['Dryer', 'Microwave', 'Refrigerator', 'Washer']",,,,,False,,,2632.0,,,,['Attached Garage'],,,False,,,False,,False,,,,,,,,,,"['Stone', 'Vinyl']",,,,,,,,,Level,,,False,5 acres,,,,False,090051313,False,False,,Residential-Single,,Single Family,,,,Asphalt,,,False,2004,,False,,,,['Private'],,,,,,,,,,,True,False,,Ranch,,,Rush City,,Rush City,,Rush City,,,False,Harris,,,"[{'name': 'BathDesc', 'value': 'Private Master, Full Master, Main Floor Full Bath, Full Basement'}, {'name': 'SpecialSearch', 'value': '3 BR on One Level, Main Floor Laundry, Main Floor Bedroom, All Living Facilities on One Level'}, {'name': 'FrontageFeet', 'value': 'Township'}, {'name': 'Fuel', 'value': 'Electric, Propane'}, {'name': 'OutBuildings', 'value': 'Additional Garage, Shop, Pole Building, Storage Shed, Dog Kennel'}, {'name': 'PresentUse', 'value': 'Yearly'}, {'name': 'Style', 'value': '(SF) One Story'}, {'name': 'Water', 'value': 'Well'}, {'name': 'Roof', 'value': 'Age Over 8 Years'}, {'name': 'SoilType', 'value': 'Loam, Clay'}, {'name': 'Fence', 'value': 'Chain Link, Electric, Full'}, {'name': 'FarmType', 'value': 'Hobby'}]",55032,46885 James Ave,Harris,MN,45.627398,-92.923255,350000.0,SOLD,24,55032_35,"Recently sold: $350,000. This peaceful 5 bed/3 bath home sits on 5 acres with lots of wildlife to enjoy. Backyard set up perfectly for animals with electric fence. Two outbuildings to store the toys including a 42x30 shop with a car lift, in-floor heat &amp; air conditioning as well as a 40x30 pole building. Open concept, Master suite has heated bathroom title, 3 bedrooms on main floor &amp; laundry, zoned heating, screened in porch and lots of storage. Spacious lower level to entertain, this home will not disappoint!"
2,1,,,,,,,,,"['Carpet', 'Hardwood']",['Forced air'],True,,,,,,,,False,,,1406.0,,,,,,,False,,,False,,False,,,,,,,,,,['Wood'],,,,,,,,,,,,False,58.25 acres,,,,False,030018300,False,False,,,,Single Family,,,,Composition,,,False,,,False,,,,,,,,,,,,,,,True,False,,,,,,,,,,,,False,Harris,,,[],55032,45534 Cedarcrest Trl,Harris,MN,45.609845,-93.066132,340000.0,SOLD,0,55032_36,"Recently sold: $340,000. "
3,1,1,0,0,0,,,[],Partial,['Hardwood'],['Forced air'],True,['Central'],True,"['Range / Oven', 'Refrigerator']",,,,,False,,,1146.0,,,,,,,False,,,False,,False,,,,,,,,,,['Wood'],,,,,,,,,,,,False,22.3 acres,,,,False,030013500,False,False,,Residential-Single,,Single Family,,,,Asphalt,,,False,1986,,False,,,,['Private'],,,,,,,,,,,True,False,,,,,,,,,,,,False,Harris,,,"[{'name': 'Fuel', 'value': 'Propane'}, {'name': 'BathDesc', 'value': 'Main Floor Full Bath'}, {'name': 'PresentUse', 'value': 'Yearly'}, {'name': 'Roof', 'value': 'Pitched'}, {'name': 'Style', 'value': '(SF) One 1/2 Stories'}, {'name': 'Water', 'value': 'Well'}, {'name': 'FrontageFeet', 'value': 'County'}, {'name': 'GarageDescription', 'value': 'Other'}, {'name': 'TaxYear', 'value': '2018.00'}]",55032,46875 Cedarcrest Trl,Harris,MN,45.628443,-93.059795,90000.0,SOLD,0,55032_37,"Recently sold: $90,000. Amazing rolling and wooded acreage on the well known Hogsback.  It is absolutely beautiful lane, you feel like you are way up north but really only 15 minutes to the freeway.   this is a great opportunity to do some work and have  a wonderful place to call your own.  the land is gorgeous!!!!!!! Septic is in compliance."
4,4,2,1,1,0,,,[],,"['Carpet', 'Hardwood']","['Forced air', 'Other']",True,['Central'],True,['Water Softener - Owned'],,,,True,False,,,2820.0,,,,['Attached Garage'],,,False,,,False,,False,,,,,,,,,,"['Stone', 'Wood']",,,,,,,,,,,,False,5 acres,,,,False,030045980,False,False,,Residential-Single,,Single Family,,,,Asphalt,,,False,2001,,False,,,,"['Tank with Drainage Field', 'Private']",,,,,,,,,,,True,False,,,,,,,,,,,,False,Harris,,,"[{'name': 'AmenitiesUnit', 'value': 'Balcony, Kitchen Window'}, {'name': 'BathDesc', 'value': 'Private Master, Main Floor 1/2 Bath, Upper Level Full Bath, 3/4 Master'}, {'name': 'Exterior', 'value': 'Fiber Board'}, {'name': 'Fuel', 'value': 'Natural Gas'}, {'name': 'GarageDescription', 'value': 'Garage Door Opener, Driveway - Gravel, Driveway - Concrete'}, {'name': 'FrontageFeet', 'value': 'Township, Unpaved Streets'}, {'name': 'Style', 'value': '(SF) Two Stories'}, {'name': 'HeatingDescription', 'value': 'Other'}, {'name': 'PresentUse', 'value': 'Yearly'}, {'name': 'Roof', 'value': 'Age Over 8 Years'}, {'name': 'SpecialSearch', 'value': 'Main Floor Laundry'}, {'name': 'Water', 'value': 'Well'}, {'name': 'HandicapAccess', 'value': 'Stair Chair Lift, Roll&#45;In Shower, Doors 36&rdquo;&#43;, Grab Bars In Bathroom, Door Lever Handles'}, {'name': 'TaxYear', 'value': '2018.00'}]",55032,1191 Antler Rd,Harris,MN,45.582999,-93.124097,299900.0,SOLD,30,55032_38,"Recently sold: $299,900. Enjoy heavily wooded setting with plenty of Privacy located on a quiet cul-de-sac and convenient location.  5 acres just waiting for you to explore.  This 2 story home offers a great room, deck, 2 patios and a balcony, 4 bedrooms and a newly remodeled master bathroom.  Lots of storage in this home so that everything can have a place."
4,4,2,1,1,0,,,[],,"['Hardwood', 'Tile']",['Forced air'],True,['Central'],True,"['Exhaust Fan/Hood', 'Water Softener - Owned', 'Air-To-Air Exchanger']",,,,True,False,,,2692.0,,,,['Attached Garage'],,,False,,,False,,False,,,,,,,,,,['Vinyl'],,,['Water'],True,,,,,,,,False,0.85 acres,,,,False,030111200,False,False,,Residential-Single,,Single Family,,,,Asphalt,,,False,2009,,False,,,,['Private'],,,,,,,,,,,True,False,,,,,,,,,,,,False,Harris,,,"[{'name': 'AmenitiesUnit', 'value': 'Kitchen Window, In-Ground Sprinkler'}, {'name': 'BathDesc', 'value': 'Private Master, Full Master, Main Floor 1/2 Bath, Whirlpool, Upper Level Full Bath, Separate Tub & Shower'}, {'name': 'GarageDescription', 'value': 'Garage Door Opener'}, {'name': 'FrontageFeet', 'value': 'Township, Paved Streets'}, {'name': 'Fuel', 'value': 'Propane'}, {'name': 'PresentUse', 'value': 'Yearly'}, {'name': 'Roof', 'value': 'Age 8 Years or Less'}, {'name': 'Water', 'value': 'Well'}, {'name': 'OutBuildings', 'value': 'Storage Shed'}, {'name': 'LakeBottom', 'value': 'Soft'}, {'name': 'Style', 'value': '(SF) Four or More Level Split'}]",55032,1078 Anchor Ct,Harris,MN,45.600832,-93.088921,290000.0,SOLD,23,55032_39,"Recently sold: $290,000. Gorgeous lake access home on the Goose Lake chain w/ great curb appeal including stone front &amp; paver driveway &amp; sidewalks. Recently remodeled w/ fresh paint thru out &amp; recently completed lower levels. You will love the Hardwood floors, 6 panel doors, oil rubbed bronze fixtures, Anderson windows w/ tilt back, gas fireplace &amp; stainless steel appliances including a gas stove w/ double oven. Heated garage &amp; large storage shed. Beautiful views and abundant wildlife await you &amp; only 45 min to cities."
3,2,1,0,0,1,,,[],,"['Hardwood', 'Linoleum / Vinyl']","['Forced air', 'Other']",True,['Central'],True,"['Range / Oven', 'Refrigerator']",,,,True,False,,,1842.0,,,,['Attached Garage'],,,False,,,False,,False,,,,,,,,,,['Vinyl'],,,,,,,,,,,,False,5 acres,,,,False,030050400,False,False,,,,Single Family,,,,Asphalt,,,False,1992,,False,,,,,,,,,,,,,,,True,False,,,,,,,,,,,,False,Harris,,,"[{'name': 'Features', 'value': 'Views/Scenic, Road Type/City / Town Street, Area Description/Country Living, General/Smoke Detector, Garage Count/2 Car Garage, Flooring/Mixed, Water/Well, Kitchen Features/Eat-in Kitchen, Sewer/Private, Lot Description/Wooded, Age/41-50 Years Old, Lot Description/Access Type - Road, Property Description/Acreage, Road Type/County Street, Area Description/Privacy, Cooling/A/C, Other/Water Softener - Own, Garage Description/Garage, Lot Size/2-5 Acres, Exterior/Water Feature, Body of Water/Pond, Views/Pond'}]",55032,812 N Pine Lake Rd,Harris,MN,45.565916,-93.115166,218000.0,SOLD,0,55032_40,"Recently sold: $218,000. Private, beautiful acreage just minutes from Cambridge &amp; North Branch. Maintenance Free Siding on this Split Level home with a large sunny Living Room. Open the maintenance free Vinyl Windows &amp; smell the fresh country air! You will love the large Deck-perfect for viewing wildlife &amp; entertaining. Nice mix of Woods, Yard and also a pond. Call today for a showing make this wonderful home yours!"
2,2,,,,,,,,,"['Carpet', 'Linoleum / Vinyl']",['Forced air'],True,['Central'],True,,,,,,False,,,865.0,,,,,,,False,,,False,,False,,,,3,,,,,,['Other'],,,,,,,,,,,,False,1.5 acres,,,,False,140036710,False,False,,,,Single Family,,,,Composition,,,False,2004,,False,,,,,,,,,,,,,,,True,False,,,,,,,,,,,,False,Harris,,,[],55032,43857 Gates Ave,Harris,MN,45.585533,-92.976894,180000.0,SOLD,0,55032_41,"Recently sold: $180,000. "
4,4,2,1,1,0,,,,,,,,,,,,,,,False,,,3070.0,,,,,,,False,,,False,,False,,,,,,,,,,,,,,,,,,,,,,False,,,,,False,,False,False,,,,Single Family,,,,,,,False,,,False,,,,,,,,,,,,,,,True,False,,,,,,,,,,,,False,Fish Lake Township,,,[],55032,1015 Amery Lane,Fish Lake Township,MN,45.573508,-93.119645,355000.0,SOLD,0,55032_42,"Recently sold: $355,000. "
3,1,1,0,0,0,,,[],Partial Finished,"['Carpet', 'Linoleum / Vinyl']",['Forced air'],True,['Central'],True,"['Dishwasher', 'Dryer', 'Range / Oven', 'Refrigerator', 'Washer']",,,,,False,,,1148.0,,,,['Attached Garage'],,,False,,,False,,False,,,,,,,,,,['Vinyl'],,,,,,,,,,,,False,0.31 acres,,,,False,140041400,False,False,,Residential-Single,,Single Family,,,,Asphalt,,,False,2000,,False,,,,['City Sewer/Connected'],,,,,,,,,,,True,False,,Ranch,,,,,,,,,,False,Harris,,,"[{'name': 'Fuel', 'value': 'Natural Gas'}, {'name': 'SpecialSearch', 'value': '3 BR on One Level'}, {'name': 'BathDesc', 'value': 'Main Floor Full Bath'}, {'name': 'PresentUse', 'value': 'Yearly'}, {'name': 'Style', 'value': '(SF) One Story'}, {'name': 'FrontageFeet', 'value': 'City'}, {'name': 'Water', 'value': 'City Water/Connected'}, {'name': 'TaxYear', 'value': '2018.00'}]",55032,6345 437th St,Harris,MN,45.583243,-92.980001,146000.0,SOLD,0,55032_43,"Recently sold: $146,000. "
