2,1,1,0,0,0,,,[],,"['Carpet', 'Linoleum / Vinyl']",['Baseboard'],True,,,"['Dryer', 'Microwave', 'Range / Oven', 'Refrigerator', 'Washer']",,,,,False,,,1200.0,,,,['Detached Garage'],,,False,,,False,,False,,,,,,,,,,['Wood'],,,,,,,,,,,,False,119.5 acres,,,,False,080010500,False,False,,"Residential-Single, Agriculture",,Single Family,,,,Asphalt,,,False,,,False,,,,['Tank with Drainage Field'],,,,,,,,,,,True,False,,Ranch,,,,,,,,,,False,Taylors Falls,,,"[{'name': 'AmenitiesUnit', 'value': 'Kitchen Window'}, {'name': 'HeatingDescription', 'value': 'Hot Water, Boiler'}, {'name': 'FrontageFeet', 'value': 'Township'}, {'name': 'Fuel', 'value': 'Propane'}, {'name': 'BathDesc', 'value': 'Main Floor Full Bath'}, {'name': 'PresentUse', 'value': 'Yearly'}, {'name': 'Roof', 'value': 'Age Over 8 Years'}, {'name': 'OutBuildings', 'value': 'Pole Building'}, {'name': 'Style', 'value': '(SF) One Story'}, {'name': 'SpecialSearch', 'value': 'Main Floor Laundry'}, {'name': 'Water', 'value': 'Well'}, {'name': 'SoilType', 'value': 'Loam'}, {'name': 'FarmType', 'value': 'Crop'}, {'name': 'TaxYear', 'value': '2017.00'}]",55084,34785 Teal Ave,Taylors Falls,MN,45.453657,-92.706227,445000.0,SOLD,0,55084_30,"Recently sold: $445,000. "
3,2,2,0,0,0,,,[],,"['Carpet', 'Other']",['Forced air'],True,['Central'],True,"['Dishwasher', 'Dryer', 'Microwave', 'Range / Oven', 'Refrigerator']",,,,True,False,,,2652.0,,,,['Detached Garage'],,,False,,,False,,False,,,,1,,,,,,['Wood'],,,,,,,,,,,,False,5.45 acres,,,,False,200002910,False,False,,,,Single Family,,,,Asphalt,,,False,2004,,False,,,,,,,,,,,,,,,True,False,,,,,,,,,,,,False,Taylors Falls,,,"[{'name': 'central_air_desc', 'value': 'Central A/C'}, {'name': 'has_pond_fl', 'value': 'Y'}, {'name': 'architectural_style', 'value': 'Other'}, {'name': 'has_ceiling_fan_fl', 'value': 'Y'}, {'name': 'taxes_annual', 'value': '4202'}]",55084,836 Furuby Rd,Taylors Falls,MN,45.412974,-92.669102,324700.0,SOLD,24,55084_31,"Recently sold: $324,700. COUNTRY SERENITY! You'll love the privacy &amp; convenience of this meticulously maintained property at the edge of scenic Taylor Falls. Darling 3 BR/2BA home on 5.45 acres tucked off the road with gorgeous pond views. Wrap around deck, screen porch, heated, insulated garage with stairs to upper loft &amp; awesome 40x31 barn. Granite counters, fireplace, wide plank fir floors finished lower level &amp; more. See supplements for detail"
3,1,1,0,0,0,,,[],Finished,"['Carpet', 'Linoleum / Vinyl']",['Forced air'],True,['Central'],True,['Exhaust Fan/Hood'],,,,False,False,,,1526.0,,,,['Detached Garage'],,,False,,,False,,False,,,,2,,,False,False,,['Metal'],,,['Water'],True,True,,,,,,,False,0.3 acres,,,,False,200010000,False,False,,Residential-Single,,Single Family,,,,Asphalt,,,False,1983,,False,,,,['City Sewer/Connected'],,,,,,,,,,,True,False,,,,,,,,,,,,False,Taylors Falls,,,"[{'name': 'Fuel', 'value': 'Natural Gas'}, {'name': 'Fence', 'value': 'Wood, Chain Link'}, {'name': 'BathDesc', 'value': 'Main Floor Full Bath'}, {'name': 'OutBuildings', 'value': 'Shop'}, {'name': 'PresentUse', 'value': 'Yearly'}, {'name': 'Style', 'value': '(SF) One 1/2 Stories'}, {'name': 'FrontageFeet', 'value': 'City'}, {'name': 'Water', 'value': 'City Water/Connected'}]",55084,685 River St,Taylors Falls,MN,45.407995,-92.650764,190000.0,SOLD,38,55084_32,"Recently sold: $190,000. Gorgeous turn key property overlooking St. Croix river, huge corner lot, quiet street, alley entrance to oversized 2 car garage and shop, great deck in back yard for BBQ's, hardwood floors, 2 beds and bathroom on the main, new carpet in bedroom upstairs, beautifully finished lower level with plenty of storage and spacious family room. City owned land across the street with access to the river. Interior pics coming soon but do not wait to see this, it will not last!"
3,1,1,0,0,0,,,[],"Crawl Space, Partial Finished",['Tile'],['Forced air'],True,['Central'],True,"['Disposal', 'Water Softener - Owned']",,,,,False,,,1692.0,,,,['Attached Garage'],,,False,,,False,,False,,,,3,,,,,,"['Brick', 'Stone', 'Vinyl']",,,,,,,,,,,,False,0.99 acres,,,,False,200058100,False,False,,Residential-Single,,Single Family,,,,Asphalt,,,False,1996,,False,,,,['Private'],,,,,,,,,,,True,False,,,,,,,,,,,,False,Taylors Falls,,,"[{'name': 'AmenitiesUnit', 'value': 'Kitchen Window'}, {'name': 'Fuel', 'value': 'Natural Gas'}, {'name': 'GarageDescription', 'value': 'Driveway - Asphalt'}, {'name': 'Fence', 'value': 'Wood, Rail'}, {'name': 'FrontageFeet', 'value': 'Paved Streets, City'}, {'name': 'PresentUse', 'value': 'Yearly'}, {'name': 'BathDesc', 'value': 'Upper Level Full Bath'}, {'name': 'OutBuildings', 'value': 'Storage Shed'}, {'name': 'Water', 'value': 'City Water/Connected'}, {'name': 'Style', 'value': '(SF) Three Level Split'}]",55084,460 Locust Ln,Taylors Falls,MN,45.417211,-92.658643,222500.0,SOLD,24,55084_33,"Recently sold: $222,500. This home is a sweetheart! Maintained and cared for with LOVE! Cozy up around the gas FP, enjoy the nature that surrounds! Many improvements &amp; updates! Kitchen w/pantry,Stainless steel appliances,garage rocked &amp; painted. New furnace and THEN-the almost full acre of beauty in your back yard! Canopy covered deck for many relaxing days soaking up this sensational spot in lovely Taylors Falls. 45 min. to the Twin Cities. Close to Interstate parks, St Croix River,Skiing, Wineries, shops &amp; restaurants"
3,1,1,0,0,0,,,[],,"['Carpet', 'Linoleum / Vinyl']",['Baseboard'],True,['Central'],True,"['Dishwasher', 'Dryer', 'Microwave', 'Range / Oven', 'Refrigerator', 'Washer']",,,,,False,,,1920.0,,,,['Attached Garage'],,,False,,,False,,False,,,,,,,,,,['Vinyl'],,,,,,,,,,,,False,0.19 acres,,,,False,200038800,False,False,,Residential-Single,,Single Family,,,,Asphalt,,,False,1990,,False,,,,['City Sewer/Connected'],,,,,,,,,,,True,False,,Ranch,,,,,,,,,,False,Taylors Falls,,,"[{'name': 'AmenitiesUnit', 'value': 'Natural Woodwork, Kitchen Window'}, {'name': 'Fuel', 'value': 'Electric'}, {'name': 'BathDesc', 'value': 'Main Floor Full Bath'}, {'name': 'PresentUse', 'value': 'Yearly'}, {'name': 'Style', 'value': '(SF) One Story'}, {'name': 'SpecialSearch', 'value': 'Main Floor Bedroom'}, {'name': 'FrontageFeet', 'value': 'City'}, {'name': 'Water', 'value': 'City Water/Connected'}]",55084,743 West St,Taylors Falls,MN,45.408909,-92.657071,169000.0,SOLD,24,55084_34,"Recently sold: $169,000. Taylors Falls welcomes you! Clean and tidy 3 BR, 2 BA rambler with great deck and backyard in an established neighborhood in Historic Taylors Falls! Near schools. New siding in 2007. St Croix River and State parks, walking and bike trails, restaurants are just across the river from MORE shopping, theater, libraries, cinema theater and yet enjoy the peace and quiet of a wonderful little town. City water and sewer. Great Opportunity!"
4,3,0,0,0,0,,,,,['Hardwood'],['Other'],True,['Wall'],True,,,,,,False,,,1904.0,,,,,,,False,,,False,,False,,,,2,,,,,,['Vinyl'],,,,,True,,,,,,,False,0.52 acres,,,,False,200009900,False,False,,,,Single Family,,,,Composition,,,False,1978,,False,,,,,,,,,,,,,,,True,False,,,,,Chisago Lakes #2144,,Chisago Lakes #2144,,Chisago Lakes #2144,,,False,Taylors Falls,,,[],55084,661 River St,Taylors Falls,MN,45.407508,-92.65079,200000.0,SOLD,0,55084_35,"Recently sold: $200,000. "
2,1,1,0,0,0,,,[],Slab,,['Forced air'],True,,,['Air-To-Air Exchanger'],,,,,False,,,1415.0,,,,['Attached Garage'],,,False,,,False,,False,,,,,,,,,,"['Brick', 'Metal', 'Stone']",,,,,,,,,,,,False,0.21 acres,,,,False,200002877,False,False,,Residential-Single,,Single Family,,,,Asphalt,,,False,,,False,,,,['City Sewer/Connected'],,,,,,,,,,,True,False,,,,,,,,,,,,False,Taylors Falls,,,"[{'name': 'AmenitiesUnit', 'value': 'Kitchen Window, Sun Room, Washer/Dryer Hookup, In-Ground Sprinkler'}, {'name': 'Fuel', 'value': 'Natural Gas'}, {'name': 'BathDesc', 'value': 'Main Floor Full Bath, 3/4 Master'}, {'name': 'FrontageFeet', 'value': 'Paved Streets, City, Curbs'}, {'name': 'PresentUse', 'value': 'Yearly'}, {'name': 'SpecialSearch', 'value': 'All Living Facilities on One Level'}, {'name': 'Water', 'value': 'City Water/Connected'}, {'name': 'HandicapAccess', 'value': 'Doors 36&rdquo;&#43;'}]",55084,920 Gable St,Taylors Falls,MN,45.413237,-92.666269,225091.0,SOLD,0,55084_36,"Recently sold: $225,091. TO BE BUILT-MODEL TWIN HOME WILL BE COMPLETED JULY 2017- 25 TWIN HOME LOTS AVAILABLE 3 DETACHED LOTS AVAILABLE  ALL ONE LEVEL LIVING,BEAUTIFUL WOODED SETTING"
2,1,1,0,0,0,,,[],,"['Carpet', 'Laminate']",['Forced air'],True,['Central'],True,"['Exhaust Fan/Hood', 'Water Softener - Owned', 'Air-To-Air Exchanger']",,,,,False,,,1457.0,,,,['Attached Garage'],,,False,,,False,,False,,,,,,,,,,"['Brick', 'Metal', 'Stone']",,,,,,,,,,,,False,0.6 acres,,,,False,200003861,False,False,,Residential-Single,,Single Family,,,,Asphalt,,,False,2006,,False,,,,['City Sewer/Connected'],,,,,,,,,,,True,False,,Ranch,,,,,,,,,,False,Taylors Falls,,,"[{'name': 'AmenitiesUnit', 'value': 'Natural Woodwork, Kitchen Window, Washer/Dryer Hookup'}, {'name': 'BathDesc', 'value': 'Private Master, Main Floor Full Bath, 3/4 Master, Rough In'}, {'name': 'Fuel', 'value': 'Natural Gas'}, {'name': 'GarageDescription', 'value': 'Insulated Garage, Garage Door Opener'}, {'name': 'PresentUse', 'value': 'Yearly'}, {'name': 'Roof', 'value': 'Age 8 Years or Less'}, {'name': 'SpecialSearch', 'value': 'Main Floor Laundry, Main Floor Bedroom'}, {'name': 'FrontageFeet', 'value': 'Private'}, {'name': 'Water', 'value': 'City Water/Connected'}, {'name': 'SharedRooms', 'value': 'Club House'}]",55084,468 Cedar Ct,Taylors Falls,MN,45.416203,-92.659208,175000.0,SOLD,16,55084_37,"Recently sold: $175,000. Welcome to Cedar Grove Estates! The best of both worlds-1 level living with a FULL basement for expansion or storage! Master Suite has double closets-Private bath-2nd bedroom has a build in computer/desk that tucks away behind doors! Vaulted ceiling in the living room and dining area--Gas fireplace to cozy up to in the evenings-Sunroom and deck overlook a wooded area-watch the birds and wildlife in you own back yard! Garage is fully insulated and sheet rocked with a storage area."
4,2,1,1,0,0,,,[],,"['Carpet', 'Linoleum / Vinyl']","['Baseboard', 'Forced air']",True,,,['Exhaust Fan/Hood'],,,,,False,,,2000.0,,,,['Attached Garage'],,,False,,,False,,False,,,,,,,,,,"['Stone', 'Wood']",,,,,,,,,,,,False,1.55 acres,,,,False,080039300,False,False,,Residential-Single,,Single Family,,,,Asphalt,,,False,1983,,False,,,,"['Tank with Drainage Field', 'Private']",,,,,,,,,,,True,False,,,,,Chisago Lakes,,Chisago Lakes,,Chisago Lakes,,,False,Taylors Falls,,,"[{'name': 'AmenitiesUnit', 'value': 'Kitchen Window, Washer/Dryer Hookup'}, {'name': 'GarageDescription', 'value': 'Insulated Garage, Garage Door Opener'}, {'name': 'Fuel', 'value': 'Electric, Propane'}, {'name': 'PresentUse', 'value': 'Yearly'}, {'name': 'Roof', 'value': 'Age 8 Years or Less'}, {'name': 'Water', 'value': 'Well'}, {'name': 'BathDesc', 'value': 'Upper Level Full Bath'}, {'name': 'FrontageFeet', 'value': 'City'}]",55084,21244 Victory Ln,Taylors Falls,MN,45.413641,-92.673011,178500.0,SOLD,20,55084_38,"Recently sold: $178,500. Buyer had to back out so here is your chance. Peaceful lot...tucked away from traffic. Come hang out on the wrap around deck with a cup of coffee and no noise.! Great starter home with 1.55 acres and backing up to woods. 3 car garage with 3rd stall currently used as an office/workroom. Perfect opportunity for a little sweat equity here with basic cosmetic updates. At this price this won't last long..!! Well &amp; septic are both compliant."
2,1,1,0,0,0,,,[],Slab,,['Forced air'],True,,,['Air-To-Air Exchanger'],,,,,False,,,1415.0,,,,['Attached Garage'],,,False,,,False,,False,,,,,,,,,,"['Brick', 'Metal', 'Stone']",,,,,,,,,,,,False,0.18 acres,,,,False,200002874,False,False,,Residential-Single,,Single Family,,,,Asphalt,,,False,,,False,,,,['City Sewer/Connected'],,,,,,,,,,,True,False,,,,,,,,,,,,False,Taylors Falls,,,"[{'name': 'AmenitiesUnit', 'value': 'Kitchen Window, Sun Room, Washer/Dryer Hookup, In-Ground Sprinkler'}, {'name': 'Fuel', 'value': 'Natural Gas'}, {'name': 'BathDesc', 'value': 'Main Floor Full Bath, 3/4 Master'}, {'name': 'FrontageFeet', 'value': 'Paved Streets, City, Curbs'}, {'name': 'PresentUse', 'value': 'Yearly'}, {'name': 'SpecialSearch', 'value': 'All Living Facilities on One Level'}, {'name': 'Water', 'value': 'City Water/Connected'}, {'name': 'HandicapAccess', 'value': 'Doors 36&rdquo;&#43;'}]",55084,728 Hilltop Dr,Taylors Falls,MN,45.413678,-92.665706,224900.0,SOLD,0,55084_39,"Recently sold: $224,900. TO BE BUILT-MODEL TWIN HOME WILL BE COMPLETED JULY 2017- 25 TWIN HOME LOTS AVAILABLE 3 DETACHED LOTS AVAILABLE  ALL ONE LEVEL LIVING,BEAUTIFUL WOODED SETTING"
4,2,2,0,0,0,,,[],,,,,,,,,,,,False,,,2490.0,,,,,,,False,,,False,,False,,,,0,,,,,,['Wood'],,,,,,,,,,,,False,8.64 acres,,,,False,,False,False,,,,Single Family,,,,,,,False,,,False,,,,,,,,,,,,,,,True,False,,,,,2144,,2144,,2144,,,False,Taylors Falls,,,"[{'name': 'Features', 'value': 'Well'}, {'name': 'Features', 'value': 'Septic'}, {'name': 'Features', 'value': 'A/C'}, {'name': 'Features', 'value': '3 Car Garage'}]",55084,18683 Saint Croix Trl,Taylors Falls,MN,45.4473,-92.7218,290000.0,SOLD,0,55084_40,"Recently sold: $290,000. Great private 8+ acre setting with this remodeled 4 bedroom 2 bath home. Beautiful hardwood floors, 6 panel doors, gorgeous kitchen with stainless steel appliances. Huge chalet style great room with towering windows &amp;  knotty pine ceilings, large master bath with newly tiled shower and more! Brand new roof, furnace, CA, carpet, fixtures,  and the list goes on! Enjoy the wrap around deck, huge 30x40 insulated garage as well as the pole shed / horsebarn! A MUST SEE!"
3,2,1,0,1,0,,,[],,"['Carpet', 'Linoleum / Vinyl']",['Other'],True,,,"['Dishwasher', 'Microwave', 'Range / Oven', 'Refrigerator']",,,,,False,,,1581.0,,,,['Attached Garage'],1,,False,True,,False,,False,,,,,,,,,,['Other'],,,,,,,,,,,,False,0.77 acres,,,,False,200043610,False,False,,Residential-Single,,Single Family,,,,Asphalt,,,False,1978,,False,,,,['City Sewer/Connected'],,,,,,,,,,,True,False,,,,,,,,,,,,False,Taylors Falls,,,"[{'name': 'AmenitiesUnit', 'value': 'Natural Woodwork, Kitchen Window, Washer/Dryer Hookup, Exercise Room'}, {'name': 'HeatingDescription', 'value': 'Hot Water'}, {'name': 'Fuel', 'value': 'Electric'}, {'name': 'BathDesc', 'value': 'Main Floor Full Bath, Main Floor 1/2 Bath'}, {'name': 'FrontageFeet', 'value': 'Paved Streets, City'}, {'name': 'PresentUse', 'value': 'Yearly'}, {'name': 'Roof', 'value': 'Pitched'}, {'name': 'SpecialSearch', 'value': 'Main Floor Bedroom'}, {'name': 'Style', 'value': '(SF) One 1/2 Stories'}, {'name': 'Water', 'value': 'City Water/Connected'}, {'name': 'Fence', 'value': 'Chain Link'}]",55084,536 Pine St,Taylors Falls,MN,45.40686,-92.660641,210303.0,SOLD,0,55084_41,"Recently sold: $210,303. Fantastic 3 bedroom in wonderful Taylors Falls location! Open layout, nice rooms sizes, sliding doors to deck overlooking huge fenced yard, includes extra lot that could be split off. Close to many recreational activities, schools &amp; amenities! Very affordable! Purchase with 1.5 acre lot for 2+ acres close to town for under 220K!"
4,2,,,,,,,,,"['Carpet', 'Laminate']",['Forced air'],True,['Central'],True,,,,,,False,,,1081.0,,,,,,,False,,,False,,False,,,,,,,,,,['Other'],,,,,,,,,,,,False,,,,,False,200038900,False,False,,,,Single Family,,,,Metal,,,False,1986,,False,,,,,,,,,,,,,,,True,False,,,,,,,,,,,,False,Taylors Falls,,,[],55084,755 West St,Taylors Falls,MN,45.409161,-92.657064,175000.0,SOLD,0,55084_42,"Recently sold: $175,000. "
5,3,3,0,0,0,,,[],,"['Carpet', 'Hardwood']",['Forced air'],True,['Central'],True,,,,,,False,,,2884.0,,,,"['Attached Garage', 'Detached Garage']",,,False,,,False,,False,,,,0,,,True,,,['Brick'],,,,,,,,,,,,False,0.5 acres,,,,False,200057700,False,False,,,,Single Family,,,,Asphalt,,,False,1998,,False,,,,,,,,,,,,,,,True,False,,,,,2144 - Chisago Lakes,,2144 - Chisago Lakes,,2144 - Chisago Lakes,,,False,Taylors Falls,,,"[{'name': 'Features', 'value': 'City Water'}, {'name': 'Features', 'value': 'Septic'}, {'name': 'Features', 'value': 'A/C'}, {'name': 'Features', 'value': '3 Car Garage'}, {'name': 'Features', 'value': 'Workshop'}]",55084,357 Briar Ln,Taylors Falls,MN,45.416464,-92.655969,294848.0,SOLD,0,55084_43,"Recently sold: $294,848. A TAYLORS FALLS GEM! Beautifully updated 5 bedroom 3 bath home boasting beautiful views of the river valley on a quiet road. Prepare gourmet meals in this fully loaded kitchen or relax by the heated in-ground pool. This place has everything: granite, hardwood, double oven, pool, pool house and a 2nd garage. Do not miss out on this one!"
3,1,1,0,0,0,,,[],,"['Hardwood', 'Other']",['Forced air'],True,,,,,,,,False,,,1900.0,,,,,,,False,,,False,,False,,,,0,,,,,,['Wood'],,,,,,,,,,,,False,,,,,False,200040300,False,False,,,,Single Family,,,,Asphalt,,,False,1990,,False,,,,,,,,,,,,,,,True,False,,,,,,,,,,,,False,Taylors Falls,,,"[{'name': 'Features', 'value': '2 Car Garage'}, {'name': 'Features', 'value': 'City Water, City'}, {'name': 'Features', 'value': 'Window A/C'}]",55084,406 Maple St,Taylors Falls,MN,45.411286,-92.657015,160000.0,SOLD,0,55084_44,"Recently sold: $160,000. Great curb appeal in this tastefully updated 3BR home. Newer kitchen cabinets and countertops, newer windows, roof, furnace, master bedroom addition and newer 2 car garage with office bonus room above. Nice corner lot on a quiet street in beautiful Taylors Falls!"
2,2,1,1,0,0,,,[],"Full, Unfinished, Poured Concrete",,['Forced air'],True,,,"['Dishwasher', 'Microwave', 'Range / Oven', 'Refrigerator']",,,,True,False,,,1536.0,,,,['Attached Garage'],,,False,,,False,,False,,,,,,,,,,"['Brick', 'Stone', 'Vinyl']",,,,,,,,,,,,False,0.5 acres,,,,False,200002866,False,False,,Residential-Single Family,,Townhouse,,,,Asphalt,,,False,,,False,,,,['City Sewer/Connected'],,,,,,,,,,,True,False,,,,,,,,,,,,False,Taylors Falls,,,"[{'name': 'AmenitiesUnit', 'value': 'Kitchen Window, Vaulted Ceiling(s), Sun Room, Washer/Dryer Hookup, Patio, Walk-In Closet, Ceiling Fan(s), In-Ground Sprinkler, Kitchen Center Island, Master Bedroom Walk-In Closet, Main Floor Master Bedroom, Paneled Doors'}, {'name': 'BathDesc', 'value': 'Main Floor 3/4 Bath, Main Floor Full Bath, 3/4 Master'}, {'name': 'Exterior', 'value': 'Brick/Stone, Vinyl'}, {'name': 'DiningRoomDescription', 'value': 'Kitchen/Dining Room'}, {'name': 'Fuel', 'value': 'Natural Gas'}, {'name': 'GarageDescription', 'value': 'Attached Garage, Garage Door Opener, Driveway - Asphalt'}, {'name': 'FireplaceLoc', 'value': 'Living Room, Gas Burning'}, {'name': 'HeatingDescription', 'value': 'Forced Air'}, {'name': 'FrontageFeet', 'value': 'Paved Streets, Curbs, Sidewalks, Cul De Sac'}, {'name': 'PresentUse', 'value': 'Yearly'}, {'name': 'Roof', 'value': 'Asphalt Shingles'}, {'name': 'SpecialSearch', 'value': 'Main Floor Bedroom'}, {'name': 'Water', 'value': 'City Water/Connected'}, {'name': 'HandicapAccess', 'value': 'Partially Wheelchair'}, {'name': 'TaxYear', 'value': '2019.00'}, {'name': 'Status', 'value': 'Active'}, {'name': 'AssocFeeIncludes', 'value': 'Shared Amenities, Sanitation, Snow/Lawn Care, Outside Maintenance, Building Exterior, Hazard Insurance'}, {'name': 'CONSTRUCTIONSTATUS', 'value': 'To Be Built/Floor Plan'}]",55084,716 Hilltop Dr,Taylors Falls,MN,45.412462,-92.664982,150000.0,SOLD,0,55084_45,"Recently sold: $150,000. "
2,2,1,1,0,0,,,[],Slab,,['Forced air'],True,,,"['Dishwasher', 'Microwave', 'Range / Oven', 'Refrigerator']",,,,True,False,,,1476.0,,,,['Attached Garage'],2,,False,True,,False,,False,,,,,,,,,,"['Brick', 'Stone', 'Vinyl']",,,,,,,,,,,,False,0.13 acres,,,,False,200002876,False,False,,Residential-Single Family,,Townhouse,,,,Asphalt,,,False,,,False,,,,['City Sewer/Connected'],,,,,,,,,,,True,False,,,,,,,,,,,,False,Taylors Falls,5353095,,"[{'name': 'AmenitiesUnit', 'value': 'Kitchen Window, Vaulted Ceiling(s), Washer/Dryer Hookup, Patio, Walk-In Closet, Ceiling Fan(s), In-Ground Sprinkler, Kitchen Center Island, Master Bedroom Walk-In Closet, Main Floor Master Bedroom, Paneled Doors'}, {'name': 'BathDesc', 'value': 'Main Floor 3/4 Bath, Main Floor Full Bath, 3/4 Master'}, {'name': 'Exterior', 'value': 'Brick/Stone, Vinyl'}, {'name': 'DiningRoomDescription', 'value': 'Kitchen/Dining Room'}, {'name': 'Fuel', 'value': 'Natural Gas'}, {'name': 'GarageDescription', 'value': 'Attached Garage, Garage Door Opener, Driveway - Asphalt'}, {'name': 'FireplaceLoc', 'value': 'Living Room, Gas Burning'}, {'name': 'HeatingDescription', 'value': 'Forced Air'}, {'name': 'FrontageFeet', 'value': 'Paved Streets, Curbs, Sidewalks'}, {'name': 'PresentUse', 'value': 'Yearly'}, {'name': 'Roof', 'value': 'Asphalt Shingles'}, {'name': 'SpecialSearch', 'value': 'Main Floor Laundry, Main Floor Bedroom, All Living Facilities on One Level'}, {'name': 'Water', 'value': 'City Water/Connected'}, {'name': 'HandicapAccess', 'value': 'No Stairs External, No Stairs Internal'}, {'name': 'TaxYear', 'value': '2019.00'}, {'name': 'Status', 'value': 'Active'}, {'name': 'CONSTRUCTIONSTATUS', 'value': 'Model (for sale)'}, {'name': 'AssocFeeIncludes', 'value': 'Sanitation, Outside Maintenance, Building Exterior, Hazard Insurance, Snow Removal, Lawn Care'}]",55084,918 Gable St,Taylors Falls,MN,45.413059,-92.666278,239900.0,FOR_SALE,14,55084_46,"For sale: $239,900. One level living at its finest! Two beds, two baths, and no stairs inside or out. The homeowners association takes care of most of your worries, making this a perfect place to downsize. This listing is for the existing model, which is the last remaining slab on grade home available.  New builds have loads of options with quick build times possible. Small development with only 14 lots remaining."
2,1,1,0,0,0,,,[],Slab,,['Forced air'],True,,,['Air-To-Air Exchanger'],,,,,False,,,1415.0,,,,['Attached Garage'],,,False,,,False,,False,,,,,,,,,,"['Brick', 'Metal', 'Stone']",,,,,,,,,,,,False,0.14 acres,,,,False,200002858,False,False,,Residential-Single,,Single Family,,,,Asphalt,,,False,,,False,,,,['City Sewer/Connected'],,,,,,,,,,,True,False,,,,,,,,,,,,False,Taylors Falls,,,"[{'name': 'AmenitiesUnit', 'value': 'Kitchen Window, Sun Room, Washer/Dryer Hookup, In-Ground Sprinkler'}, {'name': 'Fuel', 'value': 'Natural Gas'}, {'name': 'BathDesc', 'value': 'Main Floor Full Bath, 3/4 Master'}, {'name': 'FrontageFeet', 'value': 'Paved Streets, City, Curbs'}, {'name': 'PresentUse', 'value': 'Yearly'}, {'name': 'SpecialSearch', 'value': 'All Living Facilities on One Level'}, {'name': 'Water', 'value': 'City Water/Connected'}, {'name': 'HandicapAccess', 'value': 'Doors 36&rdquo;&#43;'}]",55084,921 Gable St,Taylors Falls,MN,45.413326,-92.666972,150000.0,SOLD,0,55084_47,"Recently sold: $150,000. TO BE BUILT-MODEL TWIN HOME WILL BE COMPLETED JULY 2017- 25 TWIN HOME LOTS AVAILABLE 3 DETACHED LOTS AVAILABLE  ALL ONE LEVEL LIVING,BEAUTIFUL WOODED SETTING"
2,1,1,0,0,0,,,[],Slab,,['Forced air'],True,,,['Air-To-Air Exchanger'],,,,,False,,,1415.0,,,,['Attached Garage'],,,False,,,False,,False,,,,,,,,,,"['Brick', 'Metal', 'Stone']",,,,,,,,,,,,False,0.18 acres,,,,False,200002863,False,False,,Residential-Single,,Single Family,,,,Asphalt,,,False,,,False,,,,['City Sewer/Connected'],,,,,,,,,,,True,False,,,,,,,,,,,,False,Taylors Falls,,,"[{'name': 'AmenitiesUnit', 'value': 'Kitchen Window, Sun Room, Washer/Dryer Hookup, In-Ground Sprinkler'}, {'name': 'Fuel', 'value': 'Natural Gas'}, {'name': 'BathDesc', 'value': 'Main Floor Full Bath, 3/4 Master'}, {'name': 'FrontageFeet', 'value': 'Paved Streets, City, Curbs'}, {'name': 'PresentUse', 'value': 'Yearly'}, {'name': 'SpecialSearch', 'value': 'All Living Facilities on One Level'}, {'name': 'Water', 'value': 'City Water/Connected'}, {'name': 'HandicapAccess', 'value': 'Doors 36&rdquo;&#43;'}]",55084,710 Hilltop Dr,Taylors Falls,MN,45.412416,-92.6658,150000.0,SOLD,0,55084_48,"Recently sold: $150,000. TO BE BUILT-MODEL TWIN HOME WILL BE COMPLETED JULY 2017- 25 TWIN HOME LOTS AVAILABLE 3 DETACHED LOTS AVAILABLE  ALL ONE LEVEL LIVING,BEAUTIFUL WOODED SETTING"
2,2,1,1,0,0,,,[],Slab,['Hardwood'],['Forced air'],True,,,['Air-To-Air Exchanger'],,,,True,False,,,1415.0,,,,['Attached Garage'],,,False,,,False,,False,,,,,,,,,,"['Brick', 'Metal', 'Stone']",,,,,,,,,,,,False,0.2 acres,,,,False,200002851,False,False,,Residential-Single Family,,Townhouse,,,,Asphalt,,,False,,,False,,,,['City Sewer/Connected'],,,,,,,,,,,True,False,,,,,,,,,,,,False,Taylors Falls,,,"[{'name': 'AmenitiesUnit', 'value': 'Kitchen Window, Washer/Dryer Hookup, In-Ground Sprinkler'}, {'name': 'BathDesc', 'value': 'Main Floor 3/4 Bath, Private Master, 3/4 Master'}, {'name': 'Fuel', 'value': 'Natural Gas'}, {'name': 'GarageDescription', 'value': 'Garage Door Opener, Driveway - Asphalt'}, {'name': 'FrontageFeet', 'value': 'Paved Streets, City, Curbs, Sidewalks, No Outlet/Dead End'}, {'name': 'PresentUse', 'value': 'Yearly'}, {'name': 'Roof', 'value': 'Age 8 Years or Less'}, {'name': 'SpecialSearch', 'value': 'Main Floor Laundry, Main Floor Bedroom, All Living Facilities on One Level'}, {'name': 'Water', 'value': 'City Water/Connected'}, {'name': 'HandicapAccess', 'value': 'No Stairs External, Doors 36&rdquo;&#43;, No Stairs Internal'}, {'name': 'TaxYear', 'value': '2017.00'}]",55084,907 Gable St,Taylors Falls,MN,45.412331,-92.667044,150000.0,SOLD,0,55084_49,"Recently sold: $150,000. "
