2,2,1,1,0,0,,,[],,,['Forced air'],True,,,"['Dishwasher', 'Microwave', 'Range / Oven', 'Refrigerator']",,,,,False,,,1536.0,,,,['Attached Garage'],,,False,,,False,,False,,,,,,,,,,"['Brick', 'Metal', 'Stone']",,,,,,,,,,,,False,0.21 acres,,,,False,200002860,False,False,,,,Single Family,,,,Asphalt,,,False,,,False,,,,,,,,,,,,,,,True,False,,,,,,,,,,,,False,Taylors Falls,,,"[{'name': 'PRESENTUSE', 'value': 'Yearly'}, {'name': 'STATUS', 'value': 'Pending'}, {'name': 'TAXYEAR', 'value': '2018.00'}, {'name': 'ZONING', 'value': 'Residential-Single Family'}, {'name': 'GARAGEDESCRIPTION', 'value': 'Attached Garage'}, {'name': 'HEATINGDESCRIPTION', 'value': 'Forced Air'}, {'name': 'EXTERIOR', 'value': 'Vinyl'}, {'name': 'FUEL', 'value': 'Natural Gas'}, {'name': 'HANDICAPACCESS', 'value': 'No Stairs Internal, No Stairs External, Grab Bars In Bathroom, Partially Wheelchair'}, {'name': 'SEWER', 'value': 'City Sewer/Connected'}, {'name': 'WATER', 'value': 'City Water/Connected'}, {'name': 'ASSOCFEEINCLUDES', 'value': 'Sanitation, Snow/Lawn Care, Outside Maintenance, Hazard Insurance, Building Exterior, Shared Amenities'}, {'name': 'BASEMENT', 'value': 'Slab'}, {'name': 'STYLE', 'value': '(TH) Side x Side'}, {'name': 'CONSTRUCTIONSTATUS', 'value': 'To Be Built/Floor Plan'}, {'name': 'OFFMARKETDATE', 'value': '2019-04-02T14:32:41'}]",55084,704 Hilltop Dr,Taylors Falls,MN,45.41245,-92.666403,235624.0,RECENTLY_SOLD,0,55084_13,"Recently sold: $235,624. "
2,2,1,1,0,0,,,[],,['Hardwood'],['Forced air'],True,,,"['Dishwasher', 'Microwave', 'Range / Oven', 'Refrigerator']",,,,,False,,,1536.0,,,,['Attached Garage'],,,False,,,False,,False,,,,,,,,,,"['Brick', 'Stone', 'Vinyl']",,,,,,,,,,,,False,0.14 acres,,,,False,200002869,False,False,,,,Single Family,,,,Asphalt,,,False,,,False,,,,,,,,,,,,,,,True,False,,,,,,,,,,,,False,Taylors Falls,,,"[{'name': 'PRESENTUSE', 'value': 'Yearly'}, {'name': 'STATUS', 'value': 'Pending'}, {'name': 'TAXYEAR', 'value': '2018.00'}, {'name': 'ZONING', 'value': 'Residential-Single Family'}, {'name': 'GARAGEDESCRIPTION', 'value': 'Attached Garage, Garage Door Opener, Driveway - Asphalt, Insulated Garage'}, {'name': 'HEATINGDESCRIPTION', 'value': 'Forced Air'}, {'name': 'FIREPLACELOC', 'value': 'Living Room'}, {'name': 'ROOMFLOOR1', 'value': 'Main'}, {'name': 'ROOF', 'value': 'Asphalt Shingles, Age 8 Years or Less'}, {'name': 'SPECIALSEARCH', 'value': 'Main Floor Laundry, Main Floor Bedroom, All Living Facilities on One Level'}, {'name': 'EXTERIOR', 'value': 'Vinyl, Brick/Stone'}, {'name': 'FUEL', 'value': 'Natural Gas'}, {'name': 'HANDICAPACCESS', 'value': 'No Stairs Internal, No Stairs External'}, {'name': 'SEWER', 'value': 'City Sewer/Connected'}, {'name': 'WATER', 'value': 'City Water/Connected'}, {'name': 'AMENITIESUNIT', 'value': 'Patio, Kitchen Window, Ceiling Fan(s), In-Ground Sprinkler, Vaulted Ceiling(s), Sun Room, Master Bedroom Walk-In Closet, Main Floor Master Bedroom, Kitchen Center Island'}, {'name': 'BATHDESC', 'value': 'Main Floor Full Bath, 3/4 Master, Upper Level 3/4 Bath'}, {'name': 'ASSOCFEEINCLUDES', 'value': 'Sanitation, Snow/Lawn Care, Outside Maintenance, Hazard Insurance, Building Exterior, Shared Amenities'}, {'name': 'DININGROOMDESCRIPTION', 'value': 'Kitchen/Dining Room'}, {'name': 'FENCE', 'value': 'Privacy'}, {'name': 'BASEMENT', 'value': 'Slab'}, {'name': 'STYLE', 'value': '(TH) Side x Side'}, {'name': 'CONSTRUCTIONSTATUS', 'value': 'Completed New Construction'}, {'name': 'DAYSONMARKETCUMULATIVE', 'value': '50'}, {'name': 'DAYSONMARKET', 'value': '50'}, {'name': 'OFFMARKETDATE', 'value': '2019-06-25T10:54:13'}]",55084,722 Hilltop Dr,Taylors Falls,MN,45.413098,-92.664949,229000.0,RECENTLY_SOLD,0,55084_14,"Recently sold: $229,000. "
5,2,2,0,0,0,,,,,"['Carpet', 'Linoleum / Vinyl']",['Forced air'],True,['Central'],True,,,,,,False,,,1529.0,,,,,,,False,,,False,,False,,,,3,,,,,,['Vinyl'],,,,,,,,,,,,False,0.2 acres,,,,False,200055564,False,False,,,,Single Family,,,,Asphalt,,,False,1996,,False,,,,,,,,,,,,,,,True,False,,Other,,,,,,,,,,False,Taylors Falls,,,[],55084,948 Chestnut St,Taylors Falls,MN,45.41287,-92.660497,171000.0,RECENTLY_SOLD,0,55084_15,"Recently sold: $171,000. Great Setting on a Quiet Street backing up to a large wooded area. Lots of potential in this 1994 tri-level home. Nice U? shaped kitchen with breakfast bar, laminate flooring and a great backyard deck! Should pass all financing types. Come take a look!"
5,2,2,0,0,0,,,[],Finished,"['Carpet', 'Laminate', 'Tile']",['Forced air'],True,['Central'],True,"['Dishwasher', 'Dryer', 'Microwave', 'Range / Oven', 'Refrigerator', 'Washer']",,,,True,False,,,1983.0,,,,['Detached Garage'],4,,False,True,,False,,False,,,,1,,,,,,"['Metal', 'Vinyl']",,,['Park'],True,,,,,,,,False,4.54 acres,,,,False,010014150,False,False,,,,Single Family,,,,Metal,,,False,2002,,False,,,,,,,,,,,,,,,True,False,,Ranch,,,,,,,,,,False,Taylors Falls,,,"[{'name': 'PRESENTUSE', 'value': 'Yearly'}, {'name': 'STATUS', 'value': 'Pending'}, {'name': 'TAXYEAR', 'value': '2018.00'}, {'name': 'ZONING', 'value': 'Residential-Single Family, Agriculture'}, {'name': 'FRONTAGEFEET', 'value': 'Paved Streets, County'}, {'name': 'TOPOGRAPHY', 'value': 'Walkout, Rolling'}, {'name': 'BASEMENT', 'value': 'Full, Finished (Livable), Daylight/Lookout Windows, Walkout'}, {'name': 'CONSTRUCTIONSTATUS', 'value': 'Previously Owned'}, {'name': 'EXTERIOR', 'value': 'Metal, Vinyl'}, {'name': 'FUEL', 'value': 'Propane'}, {'name': 'GARAGEDESCRIPTION', 'value': 'Detached Garage, Garage Door Opener'}, {'name': 'HEATINGDESCRIPTION', 'value': 'Forced Air, Fireplace'}, {'name': 'SEWER', 'value': 'Private'}, {'name': 'WATER', 'value': 'Well'}, {'name': 'APPLIANCES', 'value': 'Range, Refrigerator, Washer, Dryer, Microwave, Dishwasher, Water Softener - Owned, Air-To-Air Exchanger, Fuel Tank - Rented'}, {'name': 'FIREPLACELOC', 'value': 'Gas Burning, Free Standing, Family Room'}, {'name': 'BATHDESC', 'value': 'Main Floor 3/4 Bath, 3/4 Basement, Full Basement, Walk Thru'}, {'name': 'ROOMFLOOR1', 'value': 'Main'}, {'name': 'AMENITIESUNIT', 'value': 'Patio, Kitchen Window, Ceiling Fan(s), Hardwood Floors, Tiled Floors, Washer/Dryer Hookup, Vaulted Ceiling(s), Master Bedroom Walk-In Closet, Main Floor Master Bedroom, Panoramic View, Kitchen Center Island, Paneled Doors'}, {'name': 'DININGROOMDESCRIPTION', 'value': 'Informal Dining Room, Kitchen/Dining Room'}, {'name': 'ROOF', 'value': 'Pitched, Age Over 8 Years, Metal'}, {'name': 'SPECIALSEARCH', 'value': 'Main Floor Bedroom, 3 BR on One Level'}, {'name': 'OUTBUILDINGS', 'value': 'Other, Hen House, Grain Bin'}, {'name': 'FARMTYPE', 'value': 'Hobby'}, {'name': 'HANDICAPACCESS', 'value': 'Other'}, {'name': 'DAYSONMARKET', 'value': '12'}, {'name': 'DAYSONMARKETCUMULATIVE', 'value': '12'}, {'name': 'OFFMARKETDATE', 'value': '2019-05-12T21:12:08'}]",55084,37687 Reed Ave,Taylors Falls,MN,45.494755,-92.753778,295000.0,RECENTLY_SOLD,53,55084_16,"Recently sold: $295,000. Classic architecturally designed modern farmhouse. Home is rambler style that fits in perfectly with its surroundings. One-of-a-kind design &amp; beautifully decorated - shows perfectly. Relax in your corn crib fire pit area on a quiet country evening, Close to Wild Mountain skiing, Wild River State Park &amp; area winery. Home is gorgeous on inside with hardwood laminate &amp; tile floors, panel doors, vaults and wooden staircase. Open design in living-dining-kitchen area. Large granite island &amp; lots of windows that bring in the natural light. Main level also has an office area just off foyer/mud room area.  Bath on main is designed as walk-thru for easy use from master, kitchen, &amp; office. Great for traffic flow. Walkout lower level has 3 separate BR's surrounding a family area with cozy stove heater. Outside there is detached 4-car garage, she shed/chicken coop, paver patios &amp; walkways. 50 yr metal roof with cupola, architectural columns, large yard &amp; lots of wildlife. Welcome to the country!"
3,2,1,1,0,0,,,,,"['Carpet', 'Hardwood']",['Forced air'],True,['Central'],True,"['Dryer', 'Microwave', 'Refrigerator', 'Washer']",,,,,False,,,1568.0,,,,['Off street'],1,,False,True,,False,,False,,,,,,,,,,['Wood'],,,,,,,,,,,,False,,,,,False,200043000,False,False,,,,Single Family,,,,Asphalt,,,False,1978,,False,,,,,,,,,,,,,,,True,False,,Ranch,,,Chisago Lakes 2144,,Chisago Lakes 2144,,Chisago Lakes 2144,,,False,Taylors Falls,,,[],55084,518 Chestnut St,Taylors Falls,MN,45.405135,-92.660696,169900.0,RECENTLY_SOLD,25,55084_17,"Recently sold: $169,900. Large, shaded corner lot located a short walk to unique, small town eats and shops.  The hardwood floors match the beautiful built-in wood features throughout the main level including the 3 bedrooms.  Relax in the large livingroom while viewing out the large bay window. The basement has potential for an separate living area or an extension of the main floor with a walkout to the backyard.  With the right buyer, this property is a diamond in the rough."
4,1,1,0,0,0,,,[],,"['Laminate', 'Tile']",['Baseboard'],True,['Central'],True,"['Dishwasher', 'Dryer', 'Refrigerator']",,,,True,False,,,1580.0,,,,['Detached Garage'],2,,False,True,,False,,False,,,,0,,,False,False,,['Wood'],,,['Water'],True,True,,,,,,,False,0.45 acres,,,,False,080038800,False,False,,,,Single Family,,,,Asphalt,,,False,1980,,False,,,,,,,,,,,,,,,True,False,,Other,,,,,,,,,,False,Taylors Falls,,,"[{'name': None, 'value': 'Cats Allowed'}, {'name': None, 'value': 'Dining Area'}, {'name': None, 'value': 'Garbage not included in rent'}, {'name': None, 'value': 'Laundry: In Unit'}, {'name': None, 'value': 'No Utilities included in rent'}, {'name': None, 'value': 'Oven/Range'}, {'name': None, 'value': 'Small Dogs Allowed'}, {'name': None, 'value': 'View'}]",55084,35435 Wild Mountain Rd,Taylors Falls,MN,45.461894,-92.679468,215000.0,RECENTLY_SOLD,1,55084_18,"Recently sold: $215,000. PRIVATE RIVERFRONT WITHOUT THE TAXES!! Property backs up to DNR protected land along the river. You have all the benefits of owning riverfront! Cozy cabin or year round living all on the river. Can also have a dock and keep a boat on the river. Heavily treed for privacy yet just a 5 minute drive to town. Perfect for someone who wants the up north feel but needs to be close to civilization. Location can't be beat and private access to the St. Croix River is a rarity."
2,2,1,1,0,0,,,[],,"['Carpet', 'Laminate']",['Forced air'],True,['Central'],True,"['Dishwasher', 'Dryer']",,,,True,False,,,1438.0,,,,['Attached Garage'],2,,False,True,,False,,False,,,,,,,False,False,,"['Brick', 'Metal', 'Stone']",,,,,False,,,,,,,False,0.06 acres,,,,False,200003858,False,False,,,,Condo,,,,Asphalt,,,False,2006,,False,,,,,,,,,,,,,,,True,False,,Ranch,,,2144 - Chisago Lakes,,2144 - Chisago Lakes,,2144 - Chisago Lakes,,,False,Taylors Falls,,,"[{'name': 'PRESENTUSE', 'value': 'Yearly'}, {'name': 'STATUS', 'value': 'Pending'}, {'name': 'TAXYEAR', 'value': '2018.00'}, {'name': 'ZONING', 'value': 'Residential-Single Family'}, {'name': 'FRONTAGEFEET', 'value': 'Paved Streets, City'}, {'name': 'CONSTRUCTIONSTATUS', 'value': 'Previously Owned'}, {'name': 'EXTERIOR', 'value': 'Metal, Brick/Stone'}, {'name': 'GARAGEDESCRIPTION', 'value': 'Attached Garage'}, {'name': 'HEATINGDESCRIPTION', 'value': 'Forced Air'}, {'name': 'APPLIANCES', 'value': 'Range, Exhaust Fan/Hood, Refrigerator, Washer, Dryer, Microwave, Dishwasher'}, {'name': 'FIREPLACELOC', 'value': 'Living Room, Gas Burning'}, {'name': 'BATHDESC', 'value': 'Main Floor 3/4 Bath, Main Floor Full Bath'}, {'name': 'DININGROOMDESCRIPTION', 'value': 'Living/Dining Room, Informal Dining Room'}, {'name': 'ROOMFLOOR1', 'value': 'Main'}, {'name': 'ROOF', 'value': 'Asphalt Shingles, Pitched, Age 8 Years or Less'}, {'name': 'SPECIALSEARCH', 'value': 'Main Floor Laundry, All Living Facilities on One Level'}, {'name': 'AMENITIESSHARED', 'value': 'Patio, Lawn Sprinkler'}, {'name': 'FUEL', 'value': 'Natural Gas'}, {'name': 'SEWER', 'value': 'City Sewer/Connected'}, {'name': 'WATER', 'value': 'City Water/Connected'}, {'name': 'AMENITIESUNIT', 'value': 'Patio, Kitchen Window, Natural Woodwork, Walk-In Closet, Vaulted Ceiling(s), Main Floor Master Bedroom'}, {'name': 'ASSOCFEEINCLUDES', 'value': 'Sanitation, Outside Maintenance, Hazard Insurance, Building Exterior, Shared Amenities, Snow Removal, Lawn Care'}, {'name': 'STYLE', 'value': '(TH) Side x Side'}, {'name': 'SHAREDROOMS', 'value': 'Club House'}]",55084,510 Cedar Ct,Taylors Falls,MN,45.416265,-92.659794,179000.0,RECENTLY_SOLD,12,55084_19,"Recently sold: $179,000. Sought after 1 level town home - ready to move in - quick closing possible!  Gas fireplace - 2 Bedroom - 2 Bath all on one level - no stairs!  Quiet cul-de-sac surrounding.  Vaulted ceilings - sunroom - in lovely town of Taylors Falls on the St. Croix River.  Close to shopping, restaurants, parks and only 45 minutes to the Twin Cities!"
3,2,0,0,0,0,,,,Finished,"['Carpet', 'Linoleum / Vinyl']",['Forced air'],True,['Central'],True,"['Dryer', 'Microwave', 'Range / Oven', 'Refrigerator', 'Washer']",,,,False,False,,,2109.0,,,,['Detached Garage'],,,False,,,False,,False,,,,2,,,False,False,,['Wood'],,,['Water'],True,True,,,,,,,False,2 acres,,,,False,080038300,False,False,,,,Single Family,,,,Asphalt,,,False,1985,,False,,,,,,,,,,,,,,,True,False,,Split level,,,Chisago Lakes #2144,,Chisago Lakes #2144,,Chisago Lakes #2144,,,False,Taylors Falls,,,[],55084,35355 Wild Mountain Rd,Taylors Falls,MN,45.460875,-92.677623,282000.0,SOLD,26,55084_20,"Recently sold: $282,000. Wonderful cozy family home next to beautiful and scenic St. Croix River."
4,3,1,1,1,0,,,[],,"['Hardwood', 'Tile']",['Forced air'],True,['Central'],True,"['Dishwasher', 'Dryer', 'Microwave', 'Range / Oven', 'Refrigerator', 'Washer']",,,,True,False,,,2790.0,,,,"['Attached Garage', 'Detached Garage']",6,,False,True,,False,,False,,,,1,,,False,False,,['Metal'],,,['Territorial'],True,False,,,,,,,False,20.08 acres,,,,False,080008800,False,False,,,,Single Family,,,,Asphalt,,,False,1995,,False,,,,,,,,,,,,,,,True,False,,Split level,,,,,,,,,,False,Taylors Falls,,,"[{'name': None, 'value': 'Cable-ready'}, {'name': None, 'value': 'Dining Area'}, {'name': None, 'value': 'Driveway'}, {'name': None, 'value': 'Eat-in Kitchen'}, {'name': None, 'value': 'Oven/Range'}, {'name': None, 'value': 'Stainless Steel Appliances'}, {'name': None, 'value': 'View'}]",55084,34770 Teal Ave,Taylors Falls,MN,45.452833,-92.716555,284000.0,SOLD,0,55084_21,"Recently sold: $284,000. Reduced!!Secluded 4-Level Split on 20 acres. Updated kitchen, wonderful family room, fireplace, warm inviting interior, great porch &amp; patio to enjoy fantastic natural views &amp; lots of wildlife! Att.2 car &amp; det. htd and insulated garage. Enjoy the privacy!"
3,2,,,,,,,,,['Hardwood'],['Forced air'],True,,,,,,,True,False,,,964.0,,,,,,,False,,,False,,False,,,,,,,,,,['Wood'],,,,,,,,,,,,False,0.74 acres,,,,False,200031700,False,False,,,,Single Family,,,,Composition,,,False,1985,,False,,,,,,,,,,,,,,,True,False,,,,,,,,,,,,False,Taylors Falls,,,[],55084,297 West St,Taylors Falls,MN,45.400381,-92.657244,170000.0,SOLD,0,55084_22,"Recently sold: $170,000. "
2,2,1,1,0,0,,,[],Slab,['Hardwood'],['Forced air'],True,,,"['Dishwasher', 'Microwave', 'Range / Oven', 'Refrigerator']",,,,True,False,,,1415.0,,,,['Attached Garage'],,,False,,,False,,False,,,,,,,,,,"['Brick', 'Metal', 'Stone']",,,,,,,,,,,,False,0.14 acres,,,,False,200002872,False,False,,Residential-Single,,Townhouse,,,,Asphalt,,,False,,,False,,,,['City Sewer/Connected'],,,,,,,,,,,True,False,,,,,,,,,,,,False,Taylors Falls,,,"[{'name': 'AmenitiesUnit', 'value': 'Sun Room, Washer/Dryer Hookup'}, {'name': 'BathDesc', 'value': 'Main Floor 3/4 Bath, Private Master, Main Floor Full Bath, 3/4 Master'}, {'name': 'Fuel', 'value': 'Natural Gas'}, {'name': 'GarageDescription', 'value': 'Insulated Garage, Garage Door Opener, Driveway - Asphalt'}, {'name': 'FrontageFeet', 'value': 'Paved Streets, City, Curbs'}, {'name': 'PresentUse', 'value': 'Yearly'}, {'name': 'Roof', 'value': 'Age 8 Years or Less'}, {'name': 'SpecialSearch', 'value': 'Main Floor Laundry, Main Floor Bedroom, All Living Facilities on One Level'}, {'name': 'Water', 'value': 'City Water/Connected'}, {'name': 'HandicapAccess', 'value': 'No Stairs External, Doors 36&rdquo;&#43;, No Stairs Internal'}, {'name': 'TaxYear', 'value': '2017.00'}]",55084,732 Hilltop Dr,Taylors Falls,MN,45.413676,-92.666135,247030.0,SOLD,0,55084_23,"Recently sold: $247,030. "
3,2,2,0,0,0,,,[],,"['Carpet', 'Linoleum / Vinyl']",['Forced air'],True,['Central'],True,,,,,True,False,,,1832.0,,,,['Detached Garage'],,,False,,,False,,False,,,,,,,,,,['Vinyl'],,,,,,,,,,,,False,0.63 acres,,,,False,200059603,False,False,,,,Single Family,,,,Asphalt,,,False,2003,,False,,,,,,,,,,,,,,,True,False,,,,,,,,,,,,False,Taylors Falls,,,"[{'name': 'Features', 'value': 'Sewer/Septic, Water/City Water, Garage Count/3 Car Garage, Cooling/A/C'}]",55084,360 Briar Ln,Taylors Falls,MN,45.417436,-92.655277,243700.0,SOLD,24,55084_24,"Recently sold: $243,700. Stylish and Trendy, this 1999 Chalet is tucked away on a nice private lot surrounded by mature trees. Enjoy bamboo hd floors, 2 gas fireplaces, granite counters, nice back splash &amp; SS appliances. Nice balcony upstairs &amp; a large rear deck offers a relaxing evening get away with hot tub &amp; soft lighting. You''ll notice the large 3-car garage with black top drive as you pull in but do not miss the 16x16 heated workshop area in the back! A great mix of style, privacy &amp; a great River Valley location!"
2,1,1,0,0,0,,,[],Unfinished,['Hardwood'],['Forced air'],True,['Central'],True,"['Dishwasher', 'Dryer', 'Microwave', 'Range / Oven', 'Refrigerator', 'Washer']",,,,False,False,,,1032.0,,,,['Attached Garage'],2,,False,True,,False,,False,,,,2,,,False,False,,['Vinyl'],,,['Park'],True,False,,,,,,,False,5 acres,,,,False,080012417,False,False,,Residential-Single,,Single Family,,,,Asphalt,,,False,2003,,False,,,,"['Private', 'Mound']",,,,,,,,,,,True,False,,Split level,,,,,,,,,,False,Taylors Falls,,,"[{'name': 'AmenitiesUnit', 'value': 'Kitchen Window, Washer/Dryer Hookup'}, {'name': 'GarageDescription', 'value': 'Driveway - Gravel'}, {'name': 'FrontageFeet', 'value': 'Township, Unpaved Streets'}, {'name': 'Fuel', 'value': 'Propane'}, {'name': 'PresentUse', 'value': 'Yearly'}, {'name': 'Roof', 'value': 'Pitched'}, {'name': 'OutBuildings', 'value': 'Pole Building'}, {'name': 'Water', 'value': 'Well'}, {'name': 'BathDesc', 'value': 'Upper Level Full Bath, Rough In'}, {'name': 'TaxYear', 'value': '2018.00'}]",55084,34173 Unity Ave,Taylors Falls,MN,45.441947,-92.68741,267500.0,SOLD,30,55084_25,"Recently sold: $267,500. Awesome wooded setting on private 5 acres with 30x40 pole shed offers concrete and electric, split entry home with vaulted ceilings, open concept, two large upper level bedrooms, master bedroom has WALK-THRU to MASTER BATH, walk in closets, walkout lower level is unfinished and ready for your finishing ideas, possible to add 1-2 more bedrooms/bath and large family room also offers 3 car attached garage. This home has been well cared for!"
3,2,1,1,0,0,,,[],Partial,"['Hardwood', 'Linoleum / Vinyl']",['Baseboard'],True,['Other'],True,"['Dishwasher', 'Dryer', 'Microwave', 'Range / Oven', 'Refrigerator', 'Washer']",,,,False,False,,,1021.0,,,,['Detached Garage'],1,,False,True,,False,,False,,,,1,,,False,False,,['Wood'],,,['City'],True,False,,,,,,,False,0.4 acres,,,,False,200031400,False,False,,Residential-Single,,Single Family,,,,Asphalt,,,False,2006,,False,,,,['City Sewer/Connected'],,,,,,,,,,,True,False,,Craftsman,,,Chisago Lakes School District 2144,,Chisago Lakes School District 2144,,Chisago Lakes School District 2144,,,False,Taylors Falls,,,"[{'name': 'AmenitiesUnit', 'value': 'Kitchen Window'}, {'name': 'Fuel', 'value': 'Natural Gas'}, {'name': 'Fence', 'value': 'Wood, Full'}, {'name': 'HeatingDescription', 'value': 'Hot Water, In-Floor Heating, Boiler'}, {'name': 'BathDesc', 'value': 'Main Floor Full Bath'}, {'name': 'FrontageFeet', 'value': 'Paved Streets, City'}, {'name': 'PresentUse', 'value': 'Yearly'}, {'name': 'Roof', 'value': 'Age 8 Years or Less'}, {'name': 'Style', 'value': '(SF) One Story'}, {'name': 'SpecialSearch', 'value': 'All Living Facilities on One Level'}, {'name': 'Water', 'value': 'City Water/Connected'}, {'name': 'TaxYear', 'value': '2018.00'}]",55084,355 West St,Taylors Falls,MN,45.402102,-92.657163,142500.0,SOLD,2,55084_26,"Recently sold: $142,500. Coming Soon Contact Josh Leonhardt Team 651-982-1725 for more info on this 1923 Built Craftsman Home on Historic Angel Hill in Gorgeous Taylors Falls."
3,3,2,0,1,0,,,[],,"['Carpet', 'Laminate']",['Forced air'],True,['Central'],True,"['Cooktop', 'Water Softener - Owned', 'Wall Oven']",,,,True,False,,,2264.0,,,,['Attached Garage'],,,False,,,False,,False,,,,2,,,False,False,,"['Brick', 'Stone', 'Vinyl']",,,,,False,,,,,,,False,9.96 acres,,,,False,080002130,False,False,,Residential-Single,,Single Family,,,,Asphalt,,,False,2004,,False,,,,"['Private', 'Mound']",,,,,,,,,,,True,False,,,,,,,,,,,,False,Taylors Falls,,,"[{'name': 'AmenitiesUnit', 'value': 'Natural Woodwork, Kitchen Window'}, {'name': 'BathDesc', 'value': 'Private Master, Full Master, Main Floor 1/2 Bath, Upper Level Full Bath, Rough In'}, {'name': 'SpecialSearch', 'value': '3 BR on One Level, Main Floor Laundry'}, {'name': 'FrontageFeet', 'value': 'Township'}, {'name': 'Style', 'value': '(SF) Two Stories'}, {'name': 'Fuel', 'value': 'Propane'}, {'name': 'PresentUse', 'value': 'Yearly'}, {'name': 'Roof', 'value': 'Pitched'}, {'name': 'Water', 'value': 'Well'}, {'name': 'OutBuildings', 'value': 'Stables'}, {'name': 'TaxYear', 'value': '2018.00'}]",55084,19559 360th St,Taylors Falls,MN,45.468008,-92.708044,389000.0,SOLD,24,55084_27,"Recently sold: $389,000. Say 'Hello Gorgeous' to this stunning 2 story home near the St Croix River Valley with views to match! Kitchen is where a gourmet's dreams are made. Large open spaces with beau coup storage, pecan cabinetry, bright/light filled space with a large eat-in area, formal dining space, living room with gas FP! Owners Suite is fabulous with large glass block shower. All on 9.96+/- acres. Set up for horses if you wish with water &amp; electric. Stable could easily be a 2nd garage, shop or storage building."
3,1,0,0,0,0,,,,,['Hardwood'],['Forced air'],True,['None'],True,"['Dishwasher', 'Dryer', 'Garbage disposal', 'Range / Oven', 'Refrigerator', 'Washer']",,,,False,False,,,1886.0,,,,['Off street'],,,False,,,False,,False,,,,2,,,False,False,,['Wood'],,,['Territorial'],True,False,,,,,,,False,0.5 acres,,,,False,200023100,False,False,,,,Single Family,,,,Other,,,False,2017,,False,,,,,,,,,,,,,,,True,False,,Other,,,Chisago Lakes 2144,,Chisago Lakes 2144,,Chisago Lakes 2144,,,False,Taylors Falls,,,[],55084,643 Bench St,Taylors Falls,MN,45.407184,-92.65338,129293.0,SOLD,30,55084_28,"Recently sold: $129,293. EST. 1872 J.H McCourt house. Greek architectural Revival . (Bit of Sweden) restaurant 1938-1954 commercial zoning is still active. 2 city lots .51 acres"
4,2,1,1,0,0,,,,Unfinished,"['Carpet', 'Linoleum / Vinyl']",['Forced air'],True,['Central'],True,"['Dishwasher', 'Dryer', 'Microwave', 'Range / Oven', 'Refrigerator', 'Washer']",,,,False,False,,,1800.0,,,,"['Detached Garage', 'Off street']",,,False,,,False,,False,,,,4,,,False,False,,"['Composition', 'Wood']",,,['Territorial'],True,False,,,,,,,False,5 acres,,,,False,080023800,False,False,,,,Single Family,,,,Asphalt,,,False,1979,,False,,,,,,,,,,,,,,,True,False,,Split level,,,,,,,,,,False,Taylors Falls,,,[],55084,20280 Furuby Rd,Taylors Falls,MN,45.416334,-92.69364,245000.0,SOLD,23,55084_29,"Recently sold: $245,000. This beautiful four bedroom two bath home on 5 park like acres. The house has four easy flowing levels in a unique design.  The main floor includes open living room with 12 ft vaulted ceilings and bow window, kitchen, and dining room with sliding glass doors leading out to the deck and over looking the back yard and pasture. The split for this home is in the center of the home for easy access. The upper level has a  full bath, large master bedroom, two more nice sized bedrooms, with large windows and lots of natural light. The next level down from the main level is a 3/4 bath, bedroom, and a  15 X 20 family room, with an arched entrance door and stained pine wood on the walls and a cabin like feel with antler lighting. This level also has new carpet and new windows. The basement level is a 600 sq. Ft. with laundry room and  furnace. In 2007 both bathrooms were remodeled, as was the family room and lower bedroom. The carpet on the lower level was replaced last month. The furnace, pressure tank, and hot water heater were also replaced along with the windows on the lower level in 2007. The out buildings include a detached 2 1/2 car garage (with electric), a possible, tiny house, shop or studio building, a storage shed, and a 36 X 48 pole barn built in 2005 for horses or livestock which includes 3 good sized box stalls built out of white oak, and a large area for hay storage. The barn has electricity and water. The acreage is fenced with electric fencing, and in 2005 was cleared out and seeded with horse grass. This 5 acres is  surrounded by several hundred open acres.  Peace and quiet are here everyday in this amazing setting! It is one mile outside Taylors Falls and 4 miles from a Walmart,  Marketplace Grocery, Menards, 8 screen movie theater, golf and numerous eating establishments. It is 25 minutes north of Stillwater, and 50 minutes to the Twin cities. Country living within 1 hour from the cities. Agents Welcome at % 2.7. Pre-approved Cash or Conventional or Rural Development.
Hurry before it's gone!!
For appt. Please call 651-706-5142!!"
