3,1,1,0,0,0,,,[],"Full, Concrete Block",['Hardwood'],['Forced air'],True,['Central'],True,"['Range', 'Exhaust Fan/Hood', 'Dishwasher', 'Washer', 'Dryer', 'Cooktop', 'Disposal']",,,,,False,,,1344.0,,,,['Detached Garage'],2,,False,True,,False,,False,,,,1,,,,,,"['Brick', 'Stone']",,,,,True,,,,Other,,,False,0.15 acres,,,,False,272922140025,False,False,,Residential-Single Family,,Single Family,,,,Asphalt,,,False,,,False,,,,['City Sewer/Connected'],,,,,,,,,,,True,False,,,,,St. Paul - 625,,St. Paul - 625,,St. Paul - 625,,,False,Saint Paul,5291820,,"[{'name': 'AmenitiesUnit', 'value': 'Deck, Kitchen Window, Hardwood Floors, Washer/Dryer Hookup'}, {'name': 'Exterior', 'value': 'Brick/Stone, Shakes'}, {'name': 'Fuel', 'value': 'Natural Gas'}, {'name': 'GarageDescription', 'value': 'Detached Garage, Garage Door Opener, Driveway - Concrete, Driveway - Shared'}, {'name': 'BathDesc', 'value': 'Main Floor Full Bath'}, {'name': 'HeatingDescription', 'value': 'Forced Air'}, {'name': 'PresentUse', 'value': 'Yearly'}, {'name': 'Roof', 'value': 'Asphalt Shingles'}, {'name': 'SpecialSearch', 'value': 'All Living Facilities on One Level'}, {'name': 'FrontageFeet', 'value': 'City'}, {'name': 'Water', 'value': 'City Water/Connected'}, {'name': 'Fence', 'value': 'Chain Link'}, {'name': 'OutBuildings', 'value': 'Other'}, {'name': 'LakeWaterfront', 'value': 'Other'}, {'name': 'FireplaceLoc', 'value': 'Other'}, {'name': 'DiningRoomDescription', 'value': 'Other'}, {'name': 'SharedRooms', 'value': 'Other'}, {'name': 'TaxYear', 'value': '2019.00'}, {'name': 'CONSTRUCTIONSTATUS', 'value': 'Previously Owned'}, {'name': 'Status', 'value': 'Active'}]",55106,1047 Flandrau St,Saint Paul,MN,44.973148,-93.02821,219900.0,FOR_SALE,29,55106_84,"For sale: $219,900. Nice rambler home with 2 living rooms in a quite street, charming inside and out, hardwood floors, ceramic bath, and granite countertops. Unfinished lower level for added sweaty equity."
3,2,,,,,,,,,,['Forced air'],True,['Central'],True,,,,,,False,,,1135.0,,,,['Detached Garage'],,,False,,,False,,False,,,,1,,,,,,['Other'],,,,,,,,,,,,False,0.11 acres,,,,False,332922120186,False,False,,,,Single Family,,,,,,,False,,,False,,,,,,,,,,,,,,,True,False,,Bungalow,,,,,,,,,,False,Saint Paul,,,[],55106,1149 5th St E,Saint Paul,MN,44.95974,-93.052123,210695.0,PRE_FORECLOSURE,0,55106_85,"Zestimate&reg; Home Value: $210,695. Newer home in historic Dayton's Bluff neighborhood. Many huge windows! Tile and hardwood floors provide for easy maintenance. Front porch, newer 2 car garage, unfinished lower level for additional future living space."
3,3,0,0,0,0,,,,,,['Other'],True,['Central'],True,,,,,,False,,,864.0,,,,['Detached Garage'],,,False,,,False,,False,,,,1,,,,,,['Other'],,,,,,,,,,,,False,0.14 acres,,,,False,222922420022,False,False,,,,Single Family,,,,,,,False,,,False,,,,,,,,,,,,,,,True,False,,,,,,,,,,,,False,Saint Paul,,,[],55106,1649 Sherwood Ave,Saint Paul,MN,44.984089,-93.030943,216290.0,PRE_FORECLOSURE,5,55106_86,"Zestimate&reg; Home Value: $216,233. Buy this foreclosure deal the right way. Visit us at Auction.com, then login or create a free account to save this property and receive important alerts. We'll let you know if the Est. Credit Bid has posted, when the property has cleared for sale, is postponed or canceled, and the property's winning bid amount if it sells. Auction.com is your source for 30,000+* discounted foreclosure and bank-owned properties and auction events nationwide. Find the best deals in your market now. *Based on data from August 2019."
2,1,0,0,0,0,,,,Finished,,['Forced air'],True,['Central'],True,,,,,,False,,,868.0,,,,['Detached Garage'],,,False,,,False,,False,,,,1,,,,,,['Wood'],,,,,,,,,,,,False,0.11 acres,,,,False,332922320099,False,False,,,,Single Family,,,,,,,False,,,False,,,,,,,,,,,,,,,True,False,,Bungalow,,,,,,,,,,False,Saint Paul,,,[],55106,918 Wakefield Ave,Saint Paul,MN,44.952885,-93.061656,138208.0,FORECLOSED,5,55106_87,"Zestimate&reg; Home Value: $138,537. Investor opportunity! This property is being offered at Public Auction on 08-27-2019. Visit Auction.com now to view additional photos, Property Inspection Report with title information, plat maps and interior inspection reports when available. Auction.com is the nation's leading real estate transaction platform focused exclusively on the sale of residential foreclosure and bank-owned properties. The majority of these properties are priced below market value. Don't miss this special opportunity to buy homes at wholesale prices! In addition to this property, 54 other properties are scheduled for sale at this same Foreclosure Sale. In our online auctions and live Foreclosure Sales, Auction.com currently has 39 properties scheduled for sale in Ramsey County and 446 throughout Minnesota. All properties and sale details can be found with a simple search at Auction.com. Create a FREE account today to find more properties like this one, save searches of properties that meet your investment criteria and have the properties you're looking for emailed directly to you when posted in an upcoming sale event. To view the complete details of this exact property, click the Auction.com link below or paste the Property ID 2810124 into the search bar at Auction.com"
2,2,0,0,0,0,,,[],Partially finished,"['Hardwood', 'Tile']",['Forced air'],True,['Central'],True,"['Dishwasher', 'Dryer', 'Freezer', 'Microwave', 'Range / Oven', 'Refrigerator', 'Washer']",,,,,False,,,730.0,,,,['Detached Garage'],3,,False,True,,False,,False,,,,1,,,,,,['Metal'],,,,,,,,,,,,False,0.12 acres,,,,False,222922410019,False,False,,,,Single Family,,,,Asphalt,,,False,2006,,False,,,,,,,,,,,,,,,True,False,,,,,,,,,,,,False,Saint Paul,,,[],55106,1739 Sherwood Ave,Saint Paul,MN,44.984076,-93.026942,191442.0,FORECLOSED,3,55106_88,"Zestimate&reg; Home Value: $191,578. Well maintained home in a great neighborhood.  Most features updated and basement finished.  Great 3 car garage."
4,2,,,,,,,,,,['Other'],True,['Central'],True,,,,,,False,,,1251.0,,,,,,,False,,,False,,False,,,,1,,,,,,['Stucco'],,,,,,,,,,,,False,0.14 acres,,,,False,222922210070,False,False,,,,Single Family,,,,,,,False,,,False,,,,,,,,,,,,,,,True,False,,Bungalow,,,,,,,,,,False,Saint Paul,,,[],55106,1669 Manton St,Saint Paul,MN,44.991587,-93.039619,194329.0,PRE_FORECLOSURE,0,55106_89,"Zestimate&reg; Home Value: $194,276. This 1251 square foot single family home has 4 bedrooms and 1.5 bathrooms. It is located at 1669 Manton St Saint Paul, Minnesota."
5,2,,,,,,,,,,['Forced air'],True,['Central'],True,,,,,,False,,,1906.0,,,,,,,False,,,False,,False,,,,2,,,,,,['Other'],,,,,,,,,,,,False,0.09 acres,,,,False,282922240191,False,False,,,,Multiple Occupancy,,,,,,,False,,,False,,,,,,,,,,,,,,,True,False,,Colonial,,,,,,,,,,False,Saint Paul,,,[],55106,972 Forest St,Saint Paul,MN,44.970685,-93.06059,223645.0,PRE_FORECLOSURE,0,55106_90,"Recently sold: $205,000. 972 Forest St, Saint Paul, MN is a multiple occupancy home that contains 1,906 sq ft and was built in 1914. It contains 5 bedrooms and 2 bathrooms. This home last sold for $205,000 in November 2018. 
 
The Zestimate for this house is $223,717, which has increased by $893 in the last 30 days. The Rent Zestimate for this home is $1,200/mo, which has decreased by $58/mo in the last 30 days. "
2,1,0,0,0,0,,,,Unfinished,,['Forced air'],True,['None'],True,,,,,,False,,,920.0,,,,['Detached Garage'],1,,False,True,,False,,False,,,,1,,,,,,['Wood'],,,,,,,,,,,,False,0.11 acres,,,,False,332922310119,False,False,,,,Single Family,,,,,,,False,,,False,,,,,,,,,,,,,,,True,False,,,,,St. Paul #625,,St. Paul #625,,St. Paul #625,,,False,Saint Paul,5318126,,[],55106,450 Forest St,Saint Paul,MN,44.955196,-93.060687,125000.0,FOR_SALE,1,55106_91,"For sale: $125,000. Cute and quaint with lots of curb appeal, this 2 bedroom, home has a newer stove, furnace, roof, insulation, 100 amp electrical service, copper plumbing, and some new windows. Hardwood floors, ready for your cosmetic finishes. Quick close possible."
2,1,,,,,,,,Finished,,['Forced air'],True,['Central'],True,,,,,True,False,,,1000.0,,,,['Attached Garage'],,,False,,,False,,False,,,,1,,,,,,['Other'],,,,,,,,,,,,False,0.13 acres,,,,False,272922420108,False,False,,,,Single Family,,,,,,,False,,,False,,,,,,,,,,,,,,,True,False,,,,,,,,,,,,False,Saint Paul,,,[],55106,1569 Stillwater Ave,Saint Paul,MN,44.968027,-93.034217,177930.0,FORECLOSED,0,55106_92,"Zestimate&reg; Home Value: $178,398. This 1000 square foot single family home has 2 bedrooms and 1.0 bathrooms. It is located at 1569 Stillwater Ave Saint Paul, Minnesota."
3,2,2,0,0,0,,,[],,,['Forced air'],True,['Central'],True,,,,,,False,,,1700.0,,,,['Detached Garage'],,,False,,,False,,False,,,,1,,,,,,['Stucco'],,,,,,,,,,,,False,0.16 acres,,,,False,222922140162,False,False,,,,Single Family,,,,,,,False,,,False,,,,,,,,,,,,,,,True,False,,Bungalow,,,625 - St. Paul,,625 - St. Paul,,625 - St. Paul,,,False,Saint Paul,,,"[{'name': 'PRESENTUSE', 'value': 'Yearly'}, {'name': 'STATUS', 'value': 'Pending'}, {'name': 'ZONING', 'value': 'Residential-Single Family'}, {'name': 'BASEMENT', 'value': 'Full'}, {'name': 'CONSTRUCTIONSTATUS', 'value': 'Previously Owned'}, {'name': 'GARAGEDESCRIPTION', 'value': 'Detached Garage'}, {'name': 'HEATINGDESCRIPTION', 'value': 'Forced Air'}, {'name': 'ROOMFLOOR1', 'value': 'Main'}, {'name': 'FUEL', 'value': 'Natural Gas'}, {'name': 'SEWER', 'value': 'City Sewer/Connected'}, {'name': 'WATER', 'value': 'City Water/Connected'}, {'name': 'EXTERIOR', 'value': 'Stucco'}, {'name': 'TAXYEAR', 'value': '2019.00'}, {'name': 'DAYSONMARKET', 'value': '43'}, {'name': 'DAYSONMARKETCUMULATIVE', 'value': '43'}, {'name': 'OFFMARKETDATE', 'value': '2019-12-27T19:07:53'}]",55106,1668 Nevada Ave E,Saint Paul,MN,44.985389,-93.029916,212160.0,PRE_FORECLOSURE,17,55106_93,"Recently sold: $208,000. "
3,2,1,0,1,0,,,[],,,['Forced air'],True,['Central'],True,,,,,True,False,,,2008.0,,,,['Detached Garage'],1,,False,True,,False,,False,,,,2,,,,,,['Stucco'],,,,,,,,,,,,False,0.2 acres,,,,False,222922220004,False,False,,,,Single Family,,,,Asphalt,,,False,,,False,,,,,,,,,,,,,,,True,False,,Colonial,,,,,,,,,,False,Saint Paul,,,"[{'name': 'PRESENTUSE', 'value': 'Yearly'}, {'name': 'STATUS', 'value': 'Pending'}, {'name': 'ZONING', 'value': 'Residential-Single Family'}, {'name': 'BASEMENT', 'value': 'Full, Finished (Livable)'}, {'name': 'CONSTRUCTIONSTATUS', 'value': 'Previously Owned'}, {'name': 'GARAGEDESCRIPTION', 'value': 'Detached Garage, Garage Door Opener, Driveway - Concrete'}, {'name': 'HEATINGDESCRIPTION', 'value': 'Forced Air'}, {'name': 'FRONTAGEFEET', 'value': 'City'}, {'name': 'FIREPLACELOC', 'value': 'Living Room, Family Room, Wood Burning'}, {'name': 'BATHDESC', 'value': 'Main Floor 1/2 Bath'}, {'name': 'ROOMFLOOR1', 'value': 'Main'}, {'name': 'ROOF', 'value': 'Asphalt Shingles'}, {'name': 'FUEL', 'value': 'Natural Gas'}, {'name': 'SEWER', 'value': 'City Sewer/Connected'}, {'name': 'WATER', 'value': 'City Water/Connected'}, {'name': 'SPECIALSEARCH', 'value': '3 BR on One Level'}, {'name': 'DININGROOMDESCRIPTION', 'value': 'Eat In Kitchen, Separate/Formal Dining Room'}, {'name': 'EXTERIOR', 'value': 'Stucco'}, {'name': 'FENCE', 'value': 'Chain Link'}, {'name': 'TAXYEAR', 'value': '2019.00'}, {'name': 'DAYSONMARKET', 'value': '40'}, {'name': 'DAYSONMARKETCUMULATIVE', 'value': '40'}, {'name': 'OFFMARKETDATE', 'value': '2020-02-15T09:02:33'}]",55106,1637 Birmingham St,Saint Paul,MN,44.990771,-93.040951,179706.0,FORECLOSED,3,55106_94,"Recently sold: $178,500. Perfect opportunity to add your finishing touches. Three bedrooms on one level. Hardwoods, conveniently located, fireplace, large eat-in kitchen."
4,1,,,,,,,,,,['Forced air'],True,['Central'],True,,,,,,False,,,1428.0,,,,['Attached Garage'],,,False,,,False,,False,,,,1,,,,,,['Stucco'],,,,,,,,,,,,False,0.19 acres,,,,False,272922440183,False,False,,,,Single Family,,,,,,,False,,,False,,,,,,,,,,,,,,,True,False,,Bungalow,,,625 - St. Paul,,625 - St. Paul,,625 - St. Paul,,,False,Saint Paul,,,[],55106,1689 Minnehaha Ave E,Saint Paul,MN,44.963363,-93.029101,188999.0,PRE_FORECLOSURE,0,55106_95,"Zestimate&reg; Home Value: $188,999. RECENTLY REMODELED HOUSE, NEW KITCHEN WITH GRANITE COUNTER-TOP, STAINLESS STEEL APPLIANCES, CERAMIC TILE FLOORS, HARDWOOD FLOORS, NEW BATH WITH TILE ENCLOSURES, FLOOR. LARGE DECK OFF KITCHEN AND LARGE YARD. MANY LARGE OAK TREES AND MUCH MORE!MUST SEE!!!"
2,1,,,,,,,,Finished,,['Other'],True,['Central'],True,,,,,,False,,,1176.0,,,,['Detached Garage'],,,False,,,False,,False,,,,1,,,,,,['Other'],,,,,,,,,,,,False,0.11 acres,,,,False,332922120170,False,False,,,,Single Family,,,,,,,False,,,False,,,,,,,,,,,,,,,True,False,,Bungalow,,,,,,,,,,False,Saint Paul,,,[],55106,1080 6th St E,Saint Paul,MN,44.960111,-93.05503,163447.0,PRE_FORECLOSURE,0,55106_96,"Zestimate&reg; Home Value: $163,644. This 1176 square foot single family home has 2 bedrooms and 1.0 bathrooms. It is located at 1080 6th St E Saint Paul, Minnesota."
3,1,0,0,0,0,,,,,,['Other'],True,['Central'],True,,,,,,False,,,1260.0,,,,['Detached Garage'],,,False,,,False,,False,,,,,,,,,,['Other'],,,,,,,,,,,,False,0.22 acres,,,,False,342922140069,False,False,,,,Single Family,,,,,,,False,,,False,,,,,,,,,,,,,,,True,False,,Cape cod,,,,,,,,,,False,Saint Paul,,,[],55106,1711 4th St E,Saint Paul,MN,44.958838,-93.02811,186078.0,PRE_FORECLOSURE,0,55106_97,"Zestimate&reg; Home Value: $186,460. Investor opportunity! This property is being offered at Public Auction on 06-06-2019. Visit Auction.com now to view additional photos, Property Inspection Report with title information, plat maps and interior inspection reports when available. Auction.com is the nation's leading real estate transaction platform focused exclusively on the sale of residential foreclosure and bank-owned properties. The majority of these properties are priced below market value. Don't miss this special opportunity to buy homes at wholesale prices! In addition to this property, 25 other properties are scheduled for sale at this same Foreclosure Sale. In our online auctions and live Foreclosure Sales, Auction.com currently has 42 properties scheduled for sale in Ramsey County and 478 throughout Minnesota. All properties and sale details can be found with a simple search at Auction.com. Create a FREE account today to find more properties like this one, save searches of properties that meet your investment criteria and have the properties you're looking for emailed directly to you when posted in an upcoming sale event. To view the complete details of this exact property, click the Auction.com link below or paste the Property ID 2775263 into the search bar at Auction.com"
3,1,,,,,,,,,,['Forced air'],True,['Central'],True,,,,,,False,,,1264.0,,,,['Detached Garage'],,,False,,,False,,False,,,,2,,,,,,['Other'],,,,,,,,,,,,False,0.21 acres,,,,False,332922420150,False,False,,,,Single Family,,,['Crawl/Raised'],,,,False,,,False,,,,,,,,,,,,,,,True,False,,Cape cod,,,,,,,,,,False,Saint Paul,,,[],55106,1087 Hudson Rd,Saint Paul,MN,44.952506,-93.054603,177143.0,PRE_FORECLOSURE,0,55106_98,"Zestimate&reg; Home Value: $177,489. "
0,1,1,0,0,0,,,[],,,['Other'],True,['Central'],True,,,,,,False,,,1549.0,,,,['Detached Garage'],,,False,,,False,,False,,,,1,,,,,,['Other'],,,,,,,,,Walkout,,,False,1.16 acres,,,,False,272922340052,False,False,,Residential-Multi-Family,,Vacant Land,,,,,,,False,,,False,,,,,,,,,,,,,,,True,False,,Bungalow,,,St. Paul,,St. Paul,,St. Paul,,,False,Saint Paul,5259345,,"[{'name': 'Status', 'value': 'Active'}, {'name': 'TaxYear', 'value': '2019.00'}]",55106,1490 7th St E,Saint Paul,MN,44.96639,-93.037615,100000.0,FOR_SALE,2,55106_99,"For sale: $100,000. Incredible opportunity to build your dream home or investment property.  Property zoned RM-1-multi-family.  Close to downtown,  right on the bus line,  utilities are on-site.  This property sits inside the Federal Opportunity Zone!  Tax incentives for development on this parcel are available, please call the city of St Paul or your tax adviser for more information. Additional land may be available for larger projects. See supplements for environmental studies"
3,2,1,1,0,0,,,[],,"['Hardwood', 'Tile']",['Forced air'],True,['Central'],True,"['Dishwasher', 'Dryer', 'Refrigerator', 'Washer']",,,,,False,,,1521.0,,,,['Detached Garage'],2,,False,True,,False,,False,,,,1,,,,,,['Stucco'],,,,,,,,,,,,False,0.11 acres,,,,False,282922120083,False,False,,,,Single Family,,,,Asphalt,,,False,,,False,,,,,,,,,,,,,,,True,False,,Bungalow,,,,,,,,,,False,Saint Paul,,,"[{'name': 'PRESENTUSE', 'value': 'Yearly'}, {'name': 'STATUS', 'value': 'Pending'}, {'name': 'ZONING', 'value': 'Residential-Single Family'}, {'name': 'BASEMENT', 'value': 'Full, Finished (Livable), Sump Pump, Drain Tiled'}, {'name': 'CONSTRUCTIONSTATUS', 'value': 'Previously Owned'}, {'name': 'GARAGEDESCRIPTION', 'value': 'Detached Garage, Garage Door Opener, Driveway - Asphalt'}, {'name': 'HEATINGDESCRIPTION', 'value': 'Forced Air'}, {'name': 'FRONTAGEFEET', 'value': 'City'}, {'name': 'APPLIANCES', 'value': 'Exhaust Fan/Hood, Refrigerator, Washer, Dryer, Dishwasher'}, {'name': 'AMENITIESUNIT', 'value': 'Deck, Kitchen Window, Hardwood Floors, Tiled Floors, Natural Woodwork'}, {'name': 'ROOMFLOOR1', 'value': 'Main'}, {'name': 'ROOF', 'value': 'Asphalt Shingles, Age 8 Years or Less'}, {'name': 'FUEL', 'value': 'Natural Gas'}, {'name': 'SEWER', 'value': 'City Sewer/Connected'}, {'name': 'WATER', 'value': 'City Water/Connected'}, {'name': 'BATHDESC', 'value': 'Main Floor Full Bath, 3/4 Basement'}, {'name': 'SPECIALSEARCH', 'value': 'Main Floor Bedroom'}, {'name': 'DININGROOMDESCRIPTION', 'value': 'Eat In Kitchen'}, {'name': 'EXTERIOR', 'value': 'Stucco'}, {'name': 'FENCE', 'value': 'Wire'}, {'name': 'TAXYEAR', 'value': '2019.00'}, {'name': 'DAYSONMARKET', 'value': '54'}, {'name': 'DAYSONMARKETCUMULATIVE', 'value': '54'}, {'name': 'OFFMARKETDATE', 'value': '2020-03-25T11:32:48'}]",55106,1163 Jessamine Ave E,Saint Paul,MN,44.975078,-93.051388,250000.0,RECENTLY_SOLD,5,55106_100,"Recently sold: $250,000. 3 bedrooms with a Den, 2 bath &amp; 2 car garage with an extra parking space.   Come to see this amazing-freshly renovated home.  New roof, new kitchen cabinets &amp; SS appliances, new bathroom, new carpet &amp; new paint through out, new windows, and re-polished hardwood floor. Walking or biking distance to Phalen Lake park, close to Bruce Vento trail, shopping and delicious eats.  Eastside is home to many deep roots, making it an explorer's destination for culture, cuisine and history."
3,2,2,0,0,0,,,[],,['Tile'],"['Baseboard', 'Radiant']",True,['Central'],True,"['Dishwasher', 'Dryer', 'Garbage disposal']",,,,True,False,,,1965.0,,,,['Detached Garage'],1,,False,True,,False,,False,,,,0,,,,,,"['Brick', 'Stone', 'Stucco']",,,,,,,,,,,,False,0.12 acres,,,,False,212922430126,False,False,,,,Single Family,,,,Asphalt,,,False,,,False,,,,,,,,,,,,,,,True,False,,Cape cod,,,,,,,,,,False,Saint Paul,,,"[{'name': 'PRESENTUSE', 'value': 'Yearly'}, {'name': 'STATUS', 'value': 'Pending'}, {'name': 'ZONING', 'value': 'Residential-Single Family'}, {'name': 'BASEMENT', 'value': 'Full, Finished (Livable)'}, {'name': 'CONSTRUCTIONSTATUS', 'value': 'Previously Owned'}, {'name': 'GARAGEDESCRIPTION', 'value': 'Detached Garage, Garage Door Opener, Driveway - Concrete'}, {'name': 'FRONTAGEFEET', 'value': 'City'}, {'name': 'APPLIANCES', 'value': 'Refrigerator, Washer, Dryer, Microwave, Dishwasher, Disposal, Cooktop, Wall Oven'}, {'name': 'FIREPLACELOC', 'value': 'Living Room, Gas Burning'}, {'name': 'ROOMFLOOR1', 'value': 'Main'}, {'name': 'ROOF', 'value': 'Asphalt Shingles'}, {'name': 'EXTERIOR', 'value': 'Brick/Stone, Stucco'}, {'name': 'FUEL', 'value': 'Natural Gas'}, {'name': 'SEWER', 'value': 'City Sewer/Connected'}, {'name': 'WATER', 'value': 'City Water/Connected'}, {'name': 'AMENITIESUNIT', 'value': 'Patio, Kitchen Window, Ceiling Fan(s), Tiled Floors, Washer/Dryer Hookup, Natural Woodwork, Balcony, Walk-In Closet, Porch, Security System, Sun Room, Master Bedroom Walk-In Closet, French Doors, Paneled Doors'}, {'name': 'BATHDESC', 'value': '3/4 Basement, Upper Level Full Bath'}, {'name': 'DININGROOMDESCRIPTION', 'value': 'Breakfast Area, Separate/Formal Dining Room'}, {'name': 'HEATINGDESCRIPTION', 'value': 'Hot Water, Baseboard, Radiant'}, {'name': 'FENCE', 'value': 'Wood'}, {'name': 'TAXYEAR', 'value': '2019.00'}, {'name': 'DAYSONMARKET', 'value': '19'}, {'name': 'DAYSONMARKETCUMULATIVE', 'value': '19'}, {'name': 'OFFMARKETDATE', 'value': '2020-02-18T08:33:26'}]",55106,1089 Hawthorne Ave E,Saint Paul,MN,44.978684,-93.054558,301000.0,RECENTLY_SOLD,28,55106_101,"Recently sold: $301,000. Classic elegance, immaculately  maintained. City convenience and lake recreation. This charming American Craftsman architecture has all the modern conveniences: a kitchen pantry, all the appliances, relaxing sun room, beautiful 3-season porch, kitchen addition with elegant breakfast dining, his and hers walk-in master closets, cozy family room with custom wood built-ins, a balcony and landscaped back yard. Two blocks from Lake Phalen and walking trails. Phalen Regional Park has a swimming beach and an 18-hole golf course, sports courts &amp; more. One block from the home that the Grumpy and Grumpier Old Men movies were filmed in. A location that is truly iconic. Schedule your showing today!"
8,3,,,,,,,,,,['Forced air'],True,['Central'],True,,,,,,False,,,2576.0,,,,['Attached Garage'],,,False,,,False,,False,,,,2,,,,,,['Stucco'],,,,,,,,,,,,False,0.13 acres,,,,False,282922110046,False,False,,,,Multiple Occupancy,,,,,,,False,,,False,,,,,,,,,,,,,,,True,False,,Colonial,,,,,,,,,,False,Saint Paul,,,[],55106,1180 Lane Pl,Saint Paul,MN,44.97699,-93.049314,290000.0,RECENTLY_SOLD,0,55106_102,"Recently sold: $290,000. 1180 Lane Pl, Saint Paul, MN is a multiple occupancy home that contains 2,576 sq ft and was built in 1963. It contains 8 bedrooms and 2.5 bathrooms. This home last sold for $290,000 in April 2020. 
 
The Zestimate for this house is $290,404, which has increased by $4,145 in the last 30 days. The Rent Zestimate for this home is $1,386/mo, which has increased by $36/mo in the last 30 days. "
3,2,1,0,1,0,,,[],,,['Forced air'],True,,,"['Dryer', 'Range / Oven', 'Refrigerator', 'Washer']",,,,,False,,,2180.0,,,,['Detached Garage'],1,,False,True,,False,,False,,,,1,,,,,,['Vinyl'],,,,,,,,,,,,False,0.11 acres,,,,False,282922220166,False,False,,,,Single Family,,,,Asphalt,,,False,,,False,,,,,,,,,,,,,,,True,False,,Bungalow,,,,,,,,,,False,Saint Paul,,,"[{'name': 'PRESENTUSE', 'value': 'Yearly'}, {'name': 'STATUS', 'value': 'Pending'}, {'name': 'ZONING', 'value': 'Residential-Single Family'}, {'name': 'BASEMENT', 'value': 'Full, Finished (Livable), Daylight/Lookout Windows, Concrete Block'}, {'name': 'CONSTRUCTIONSTATUS', 'value': 'Previously Owned'}, {'name': 'GARAGEDESCRIPTION', 'value': 'Detached Garage, Paved Lot'}, {'name': 'HEATINGDESCRIPTION', 'value': 'Forced Air'}, {'name': 'FRONTAGEFEET', 'value': 'City'}, {'name': 'APPLIANCES', 'value': 'Range, Refrigerator, Washer, Dryer'}, {'name': 'DININGROOMDESCRIPTION', 'value': 'Living/Dining Room, Informal Dining Room'}, {'name': 'ROOMFLOOR1', 'value': 'Main'}, {'name': 'ROOF', 'value': 'Asphalt Shingles'}, {'name': 'EXTERIOR', 'value': 'Vinyl'}, {'name': 'FUEL', 'value': 'Natural Gas'}, {'name': 'SEWER', 'value': 'City Sewer/Connected'}, {'name': 'WATER', 'value': 'City Water/Connected'}, {'name': 'AMENITIESUNIT', 'value': 'Kitchen Window, Washer/Dryer Hookup'}, {'name': 'BATHDESC', 'value': 'Main Floor Full Bath, Upper Level 1/2 Bath'}, {'name': 'SPECIALSEARCH', 'value': 'Main Floor Bedroom'}, {'name': 'FENCE', 'value': 'Chain Link, Partial'}, {'name': 'DAYSONMARKETCUMULATIVE', 'value': '135'}, {'name': 'DAYSONMARKET', 'value': '26'}, {'name': 'TAXYEAR', 'value': '2020.00'}, {'name': 'OFFMARKETDATE', 'value': '2020-02-27T19:45:59'}]",55106,862 Jessamine Ave E,Saint Paul,MN,44.974553,-93.064225,212000.0,RECENTLY_SOLD,0,55106_103,"Recently sold: $212,000. New carpet, paint and flooring.  Basement just got a make-over with an entertainment area, bar stand, and a family room.  East side pride living near lots of delicious eats, downtown, lakes, trails, parks, golf course and shopping areas.  Other multi-cultural areas are also nearby.  Spacious home with extra 4- season porch, finished basement and paved parking area.  Agents and buyers to verify all measurements."
