1,1,0,0,0,0,,,,None,['Hardwood'],['Other'],True,['Central'],True,"['Dishwasher', 'Microwave', 'Range / Oven', 'Refrigerator']",,,,False,False,,,661.0,,,,['Off street'],,,False,,,False,,False,,,,1,,,False,False,,['Brick'],,,,,False,,,,,,,False,0.01 acres,,,,False,312922430695,False,False,,,,Condo,,,,,,,False,2003,,False,,,,,,,,,,,,,,,True,False,,,,,St. Paul #625,,St. Paul #625,,St. Paul #625,,,False,Saint Paul,,,[],55101,523 Jackson St APT 204,Saint Paul,MN,44.952122,-93.093518,132000.0,RECENTLY_SOLD,7,55101_104,"Recently sold: $132,000. Walk in to this upgraded 626sq. feet 1 bedroom with 1 bath condo located in the heart of St. Paul and steps away from the future light rail station and Mears Park! This condo has an open floor plan with newer hardwood floors and exposed brick walls. The open kitchen has a center island, oversized cabinets, granite counter tops and newer appliances. Large floor to ceiling windows brings in natural sunlight throughout the day and brick walls give the true loft feel with ceilings. Walk to restaurants, shops, and work etc. Available May 1st. Fitness room, separate 6x10 storage area and laundry on site. 1 off-street reserve parking place #12 included. Application fee $40/adult in-state or $60 out of state. Trash, water, sewer, snow and lawn care and fitness room included in rent. Tenant responsible for gas and electric. Move in/0ut fee of $50. Please call 612-245-0088 for a showing. Pets allowed under 40lbs (1 dog limit) or 2 cats. Pet fee $250."
1,1,0,0,0,0,,,[],None,['Tile'],['Forced air'],True,['Other'],True,"['Dishwasher', 'Dryer', 'Microwave', 'Range / Oven', 'Refrigerator', 'Washer']",,,,,False,,,918.0,,,,,,,False,,,False,,False,,,,1,,,,,,"['Brick', 'Stone']",,,,,,,,,,,,False,0.03 acres,,,,False,052822220069,False,False,,,,Multi Family,,,,,,,False,,,False,,,,,,,,,,,,,,,True,False,,,,,625 - St. Paul,,625 - St. Paul,,625 - St. Paul,,,False,Saint Paul,,,"[{'name': None, 'value': 'Laundry: In Unit'}, {'name': None, 'value': 'Small Dogs Allowed'}, {'name': None, 'value': 'Water included in rent'}, {'name': None, 'value': 'false'}]",55101,214 4th St E UNIT 201,Saint Paul,MN,44.947672,-93.08628,237000.0,RECENTLY_SOLD,17,55101_105,"Recently sold: $237,000. Available Immediately! Ask about Specials for October signed lease Loft style home in historic Union Depot. Corner condo right in the heart of Lowertown. Amazing amenities throughout. Huge windows, exposed brick, 20 ft tall terracotta ceilings, Terrazzo flooring, GE profile stainless appliances, Independent heating/cooling, In-unit washer/dryer, Subway tile bathroom, Kohler fixtures, Modern trim/finishes, Club room, Rooftop deck w/ Mississippi river view, Workout Facility, Storage Locker, Underground parking, Sky-way connection, Restaurant, Coffee shop, and Lightrail access. Available Immediately! Contract parking starts as low as $35/month. Move-in fee $250. Pets OK with Pet fee."
2,2,1,1,0,0,,,[],None,['Concrete'],['Forced air'],True,['Central'],True,"['Dishwasher', 'Dryer', 'Microwave', 'Range / Oven', 'Refrigerator', 'Washer']",,,,,False,,,1056.0,,,,['Attached Garage'],1,,False,True,,False,,False,,,,1,,,,,,"['Brick', 'Stone']",,,['Water'],True,,,,,,,,False,0.03 acres,,,,False,312922440134,False,False,,Residential-Multi-Family,,Condo,,,,,,,False,,,False,,,,['City Sewer/Connected'],,,,,,,,,,,True,False,,,,,,,,,,,,False,Saint Paul,,,"[{'name': 'AmenitiesUnit', 'value': 'Balcony, Main Floor Master Bedroom, Panoramic View, Cable, City View'}, {'name': 'BathDesc', 'value': 'Main Floor 3/4 Bath, Main Floor Full Bath'}, {'name': 'GarageDescription', 'value': 'Underground Garage, Assigned'}, {'name': 'PresentUse', 'value': 'Yearly'}, {'name': 'SpecialSearch', 'value': 'All Living Facilities on One Level'}, {'name': 'Fuel', 'value': 'Other'}, {'name': 'Water', 'value': 'City Water/Connected'}, {'name': 'SharedRooms', 'value': 'Amusement/Party Room'}, {'name': 'TaxYear', 'value': '2019.00'}, {'name': 'CONSTRUCTIONSTATUS', 'value': 'Previously Owned'}, {'name': 'Status', 'value': 'Active'}, {'name': 'AssocFeeIncludes', 'value': 'Other, Shared Amenities, Sanitation, Snow/Lawn Care, Building Exterior, Professional Mgmt, Water/Sewer, Security Staff, Parking Space, Hazard Insurance, Heating, Air Conditioning, Cable TV, Internet, Snow Removal, Lawn Care'}]",55101,168 6th St E UNIT 2905,Saint Paul,MN,44.94882,-93.089761,288000.0,RECENTLY_SOLD,0,55101_106,"Recently sold: $288,000. Birds nest panorama, with windows on 2 sides! 29th floor Airye Tower in Lowertown. Balcony. Stunning views of both the Capitol and the Mississippi River, CHS field, Mears Park and airport. Lots of closets + storage locker. Skyway to restaurants, Ordway, MN Wild, Union Depot. 2 blocks to light rail. Owned underground parking stall. Dues incl heat, AC, internet/cable, water.. Concrete floors/ceilings. Non-smoking building!"
2,2,2,0,0,0,,,,None,['Concrete'],['Forced air'],True,['Central'],True,"['Dishwasher', 'Dryer', 'Refrigerator', 'Washer']",,,,,False,,,1144.0,,,,['Attached Garage'],,,False,,,False,,False,,,,1,,,,,,['Brick'],,,,,,,,,,,,False,0.03 acres,,,,False,312922440122,False,False,,,,Condo,,,,,,,False,,,False,,,,,,,,,,,,,,,True,False,,Other,,,625 - St. Paul,,625 - St. Paul,,625 - St. Paul,,,False,Saint Paul,,,[],55101,168 6th St E UNIT 2705,Saint Paul,MN,44.94882,-93.089761,292000.0,RECENTLY_SOLD,1,55101_107,"Recently sold: $292,000. Incredible condo unit with SS kitchen appliances, two bedrooms and two full baths! Second bedroom comes with a murphy bed and built in storage. Large windows bring in natural light and views of downtown St. Paul and CHS Field. Minutes walk to Mears Park and countless restaurants and shops, as well as easy access to the 94 Express bus line. Elevator access to the St. Paul skyway makes it an easy walk to more great local restaurants and the Xcel Energy Center! Don't miss out on this opportunity!"
1,1,0,0,0,0,,,[],None,,['Forced air'],True,['Central'],True,,,,,,False,,,850.0,,,,,,,False,,,False,,False,,,,1,,,,,,['Stone'],,,,,,,,,,,,False,0.02 acres,,,,False,322922330076,False,False,,Residential-Single,,Condo,,,,,,,False,,,False,,,,['City Sewer/Connected'],,,,,,,,,,,True,False,,,,,St. Paul #625,,St. Paul #625,,St. Paul #625,,,False,Saint Paul,,,"[{'name': 'Fuel', 'value': 'Natural Gas'}, {'name': 'PresentUse', 'value': 'Yearly'}, {'name': 'GarageDescription', 'value': 'Uncovered/Open, Assigned, Units Vary, Contract Pkg Required'}, {'name': 'Water', 'value': 'City Water/Connected'}]",55101,289 5th St E UNIT 407,Saint Paul,MN,44.950193,-93.085455,211000.0,RECENTLY_SOLD,1,55101_108,"Recently sold: $211,000. "
1,1,1,0,0,0,,,[],None,,['Forced air'],True,['Central'],True,"['Exhaust Fan/Hood', 'Disposal']",,,,,False,,,1128.0,,,,,1,,False,True,,False,,False,,,,1,,,,,,"['Brick', 'Stone']",,,,,,,,,,,,False,0.03 acres,,,,False,312922440698,False,False,,Residential-Multi-Family,,Condo,,,,,,,False,,,False,,,,['City Sewer/Connected'],,,,,,,,,,,True,False,,,,,,,,,,,,False,Saint Paul,,,"[{'name': 'BathDesc', 'value': 'Main Floor 3/4 Bath'}, {'name': 'Fuel', 'value': 'Natural Gas, Electric'}, {'name': 'PresentUse', 'value': 'Yearly'}, {'name': 'SpecialSearch', 'value': 'All Living Facilities on One Level'}, {'name': 'Roof', 'value': 'Age Over 8 Years, Flat'}, {'name': 'AmenitiesShared', 'value': 'Security Building, Other'}, {'name': 'FrontageFeet', 'value': 'City, Curbs, Sidewalks'}, {'name': 'GarageDescription', 'value': 'Underground Garage'}, {'name': 'SharedRooms', 'value': 'Exercise Room, Amusement/Party Room'}, {'name': 'Water', 'value': 'City Water/Connected'}, {'name': 'HandicapAccess', 'value': 'Other'}, {'name': 'TaxYear', 'value': '2019.00'}, {'name': 'CONSTRUCTIONSTATUS', 'value': 'Previously Owned'}, {'name': 'Status', 'value': 'Active'}, {'name': 'AssocFeeIncludes', 'value': 'Sanitation, Outside Maintenance, Building Exterior, Professional Mgmt, Water/Sewer, Hazard Insurance, Heating, Air Conditioning, Cable TV, Internet, Snow Removal, Lawn Care'}]",55101,406 Wacouta St UNIT 514,Saint Paul,MN,44.950638,-93.087585,320000.0,RECENTLY_SOLD,0,55101_109,"Recently sold: $320,000. Rare 5th-floor unit that has one of the 6 double door large balconies with incredible views featuring the Historic Capitol building and the quaint lower town buildings. Meticulously maintained, this 1128 sqft unit will not disappoint.  Brand new Miele washer/dryer!  Custom shower with a built-in bench, gorgeous tile work and frameless glass enclosure. Owned, heated parking space under the building. Skyway attached, and &quot;92&quot; WALK-SCORE! Simply spectacular!"
1,1,1,0,0,0,,,[],None,,['Forced air'],True,['Central'],True,"['Dishwasher', 'Garbage disposal', 'Microwave', 'Range / Oven']",,,,,False,,,750.0,,,,['Attached Garage'],,,False,,,False,,False,,,,0,,,,,,"['Brick', 'Stone']",,,,,,,,,,,,False,0.02 acres,,,,False,312922430206,False,False,,,,Single Family,,,,,,,False,,,False,,,,,,,,,,,,,,,True,False,,,,,St. Paul - 625,,St. Paul - 625,,St. Paul - 625,,,False,Saint Paul,,,"[{'name': 'PRESENTUSE', 'value': 'Yearly'}, {'name': 'STATUS', 'value': 'Pending'}, {'name': 'TAXYEAR', 'value': '2018.00'}, {'name': 'ZONING', 'value': 'Residential-Multi-Family'}, {'name': 'CONSTRUCTIONSTATUS', 'value': 'Previously Owned'}, {'name': 'GARAGEDESCRIPTION', 'value': 'Attached Garage, Garage Door Opener, Assigned'}, {'name': 'HEATINGDESCRIPTION', 'value': 'Forced Air'}, {'name': 'APPLIANCES', 'value': 'Range, Refrigerator, Microwave, Dishwasher, Disposal'}, {'name': 'ROOMFLOOR1', 'value': 'Main'}, {'name': 'EXTERIOR', 'value': 'Brick/Stone'}, {'name': 'FUEL', 'value': 'Natural Gas'}, {'name': 'SEWER', 'value': 'City Sewer/Connected'}, {'name': 'WATER', 'value': 'City Water/Connected'}, {'name': 'AMENITIESSHARED', 'value': 'Hot Tub, Sauna, Elevator(s), Deck, Security Building'}, {'name': 'AMENITIESUNIT', 'value': 'Balcony'}, {'name': 'BATHDESC', 'value': 'Main Floor Full Bath'}, {'name': 'ASSOCFEEINCLUDES', 'value': 'Heating, Air Conditioning, Sanitation, Snow/Lawn Care, Outside Maintenance, Hazard Insurance, Water/Sewer, Building Exterior, Professional Mgmt, Shared Amenities, Cable TV, Parking Space, Security Staff'}, {'name': 'SPECIALSEARCH', 'value': 'Main Floor Bedroom, All Living Facilities on One Level'}, {'name': 'HANDICAPACCESS', 'value': 'Elevator'}, {'name': 'SHAREDROOMS', 'value': 'Amusement/Party Room, Exercise Room'}, {'name': 'STYLE', 'value': '(CC) High Rise (4+ Levels)'}, {'name': 'DAYSONMARKET', 'value': '19'}, {'name': 'DAYSONMARKETCUMULATIVE', 'value': '19'}, {'name': 'OFFMARKETDATE', 'value': '2019-04-02T13:09:20'}]",55101,66 9th St E #R2111,Saint Paul,MN,44.949276,-93.094898,134900.0,RECENTLY_SOLD,22,55101_110,"Recently sold: $134,900. Great views and great walkability!  Spacious one bedroom condo with updated kitchen and flooring.  Enjoy the ease of condo living with great amenities.  Beautiful southern views of the city from the balcony.  Parking garage and additional storage unit.  Skyway connected and convenient to shopping and restaurants.  Urban living at it's best!"
1,1,0,0,0,0,,,[],None,['Hardwood'],['Forced air'],True,['Other'],True,"['Dryer', 'Washer']",,,,,False,,,826.0,,,,['Attached Garage'],,,False,,,False,,False,,,,1,,,,,,"['Brick', 'Stone']",,,,,,,,,,,,False,0.02 acres,,,,False,322922330356,False,False,,,,Apartment,,,,,,,False,,,False,,,,,,,,,,,,,,,True,False,,,,,,,,,,,,False,Saint Paul,,,"[{'name': None, 'value': 'Balcony'}, {'name': None, 'value': 'Cats Allowed'}, {'name': None, 'value': 'Cooling System: Air Conditioning'}, {'name': None, 'value': 'Dogs Allowed'}, {'name': None, 'value': 'Electricity not included in rent'}, {'name': None, 'value': 'Gas not included in rent'}, {'name': None, 'value': 'Large Dogs Allowed'}, {'name': None, 'value': 'Laundry: In Unit'}, {'name': None, 'value': 'Parking Type: Garage'}, {'name': None, 'value': 'Small Dogs Allowed'}]",55101,270 4th St E UNIT 506,Saint Paul,MN,44.948697,-93.085118,210000.0,RECENTLY_SOLD,24,55101_111,"Recently sold: $210,000. Enjoy views of the Mississippi river and St. Paul Farmers' Market from your private balcony at this amazing top floor condo in Lowertown St. Paul! This luxury condo boasts high ceilings and an open floor plan. Beautiful and spacious kitchen, solid surface counters, stainless steel appliances and tons of cabinets make this eat in kitchen a chef's dream! A spacious bath, huge bedroom with custom closet organizer and laundry room are just a few of the perks of this gorgeous condo. Building amenities include exercise room, community room &amp; outdoor courtyard. Brand new hardwood flooring,
Modern and roomy tiled bath.
Independent washer/dryer in unit.
1 free underground, heated parking space.
Central air. Some pets allowed (will be considered in a case-by-case basis) with additional nonrefundable deposit. $250 for cats and small dogs, $500 for large breeds. Security deposit $1,425, additional $250 will be required as nonrefundable HOA move-in fee, total equal to one month's rent. Lease length negotiable, 12-24 month. If you are interested please TEXT (do not call or email) Steve at with the following info: Property for which you are inquiring, move date, any pets, monthly income and number of occupants.

Tenant pays for gas and electricity only! HOA covers water, sewer, trash, snow and lawn care, internet/cable (must provide router)"
1,1,1,0,0,0,,,[],None,['Concrete'],"['Forced air', 'Other']",True,['Central'],True,"['Dishwasher', 'Dryer', 'Microwave', 'Range / Oven', 'Refrigerator', 'Washer']",,,,,False,,,815.0,,,,['Attached Garage'],1,,False,True,,False,,False,,,,1,,,,,,"['Brick', 'Stone']",,,,,,,,,,,,False,0.02 acres,,,,False,312922440669,False,False,,Residential-Single Family,,Condo,,,,,,,False,,,False,,,,['City Sewer/Connected'],,,,,,,,,,,True,False,,,,,625,,625,,625,,,False,Saint Paul,,,"[{'name': 'AmenitiesUnit', 'value': 'Natural Woodwork, Washer/Dryer Hookup, Indoor Sprinklers'}, {'name': 'Fuel', 'value': 'Natural Gas, Other'}, {'name': 'GarageDescription', 'value': 'Garage Door Opener, Covered, Secured, Assigned'}, {'name': 'BathDesc', 'value': 'Main Floor Full Bath'}, {'name': 'HeatingDescription', 'value': 'Other'}, {'name': 'PresentUse', 'value': 'Yearly'}, {'name': 'SpecialSearch', 'value': 'Main Floor Laundry, Main Floor Bedroom, All Living Facilities on One Level'}, {'name': 'AmenitiesShared', 'value': 'Security Building'}, {'name': 'Roof', 'value': 'Age Over 8 Years, Flat'}, {'name': 'SharedRooms', 'value': 'Exercise Room, Amusement/Party Room'}, {'name': 'Water', 'value': 'City Water/Connected'}, {'name': 'FrontageFeet', 'value': 'Sidewalks'}, {'name': 'HandicapAccess', 'value': 'Elevator'}, {'name': 'TaxYear', 'value': '2018.00'}, {'name': 'CONSTRUCTIONSTATUS', 'value': 'Previously Owned'}, {'name': 'Status', 'value': 'Active'}, {'name': 'AssocFeeIncludes', 'value': 'Shared Amenities, Sanitation, Snow/Lawn Care, Outside Maintenance, Building Exterior, Professional Mgmt, Water/Sewer, Parking Space, Hazard Insurance, Heating, Air Conditioning, Cable TV, Internet'}]",55101,406 Wacouta St UNIT 401,Saint Paul,MN,44.950638,-93.087585,215000.0,RECENTLY_SOLD,0,55101_112,"Recently sold: $215,000. Inviting long foyer featuring brick wall and corner closet. True historic loft with exposed brick and beams. Large closet in bedroom, full bath w/laundry. Maple cabinets with granite counter-tops and snack-bar. End unit with brick on 3 walls. Quiet corner, close to elevator and stairs. Sky-way access on 2nd floor, community room, exercise room, across from Mears Park. Walk to Farmers Mkt, CHS field, art galleries, light rail and many restaurants. 2 big dogs ok. Lowertown is a great walk-able community!"
0,1,1,0,0,0,,,[],None,,['Forced air'],True,['Central'],True,"['Dishwasher', 'Microwave', 'Range / Oven', 'Refrigerator']",,,,,False,,,464.0,,,,['Attached Garage'],,,False,,,False,,False,,,,0,,,,True,,"['Brick', 'Stone']",,,,,,,,,,,,False,0.01 acres,,,,False,312922430920,False,False,,Residential-Single Family,,Condo,,,,,,,False,,,False,,,,['City Sewer/Connected'],,,,,,,,,,,True,False,,,,,,,,,,,,False,Saint Paul,,,"[{'name': 'AmenitiesUnit', 'value': 'City View'}, {'name': 'Fuel', 'value': 'Natural Gas'}, {'name': 'GarageDescription', 'value': 'Assigned'}, {'name': 'BathDesc', 'value': 'Main Floor Full Bath'}, {'name': 'PresentUse', 'value': 'Yearly'}, {'name': 'AmenitiesShared', 'value': 'Security Building'}, {'name': 'SharedRooms', 'value': 'Exercise Room, Guest Suite, Club House, Amusement/Party Room'}, {'name': 'Water', 'value': 'City Water/Connected'}, {'name': 'TaxYear', 'value': '2018.00'}, {'name': 'CONSTRUCTIONSTATUS', 'value': 'Previously Owned'}, {'name': 'Status', 'value': 'Active'}, {'name': 'AssocFeeIncludes', 'value': 'Shared Amenities, Sanitation, Outside Maintenance, Building Exterior, Professional Mgmt, Water/Sewer, Security Staff, Hazard Insurance, Security System, Heating, Air Conditioning, Snow Removal, Lawn Care'}]",55101,78 10th St E #R2407,Saint Paul,MN,44.95061,-93.093283,128000.0,RECENTLY_SOLD,15,55101_113,"Recently sold: $128,000. Studio condo with Murphy Bed and recent updates and spectacular views.  Enjoy all the amenities this building has to offer - swimming pool and hot tub, outside deck, large laundry room, private parking, party room, guest suite all conveniently located downtown Saint Paul."
2,1,1,0,0,0,,,[],None,,['Forced air'],True,['Central'],True,['Disposal'],,,,,False,,,807.0,,,,['Attached Garage'],1,,False,True,,False,,False,,,,1,,,True,,,"['Brick', 'Stone']",,,,,,,,,,,,False,0.02 acres,,,,False,312922430795,False,False,,Residential-Multi-Family,,Condo,,,,,,,False,,,False,,,,['City Sewer/Connected'],,,,,,,,,,,True,False,,,,,,,,,,,,False,Saint Paul,,,"[{'name': 'AmenitiesUnit', 'value': 'Washer/Dryer Hookup'}, {'name': 'Fuel', 'value': 'Natural Gas'}, {'name': 'GarageDescription', 'value': 'Garage Door Opener, Heated Garage, Underground Garage'}, {'name': 'BathDesc', 'value': 'Main Floor Full Bath'}, {'name': 'PresentUse', 'value': 'Yearly'}, {'name': 'SpecialSearch', 'value': 'Main Floor Laundry, All Living Facilities on One Level'}, {'name': 'FrontageFeet', 'value': 'City'}, {'name': 'SharedRooms', 'value': 'Exercise Room, Guest Suite, Amusement/Party Room'}, {'name': 'Water', 'value': 'City Water/Connected'}, {'name': 'FireplaceLoc', 'value': 'Other'}, {'name': 'HandicapAccess', 'value': 'Elevator'}, {'name': 'TaxYear', 'value': '2018.00'}]",55101,78 10th St E #R1102,Saint Paul,MN,44.95061,-93.093283,182500.0,RECENTLY_SOLD,36,55101_114,"Recently sold: $182,500. Southwest views of Downtown St. Paul from the corner balcony. This unit offers the desirable in-unit laundry. Updated throughout with lovely new flooring. The open floor plan is great for entertaining. So close to the Farmers Market, Lund groceries, Sport venues, shopping; Lite rail, Restaurants. Amenities include indoor pool, exercise room, jacuzzi, sport court, huge party room, guest suite, off street guest parking, on site staff. Includes one parking stall. Truly a must see!"
1,1,1,0,0,0,,,[],None,"['Carpet', 'Linoleum / Vinyl']",['Other'],True,['Central'],True,"['Dishwasher', 'Dryer', 'Range / Oven', 'Refrigerator', 'Washer']",,,,False,False,,,707.0,,,,,,,False,,,False,,False,,,,24,,,True,False,,['Brick'],,,['City'],True,False,,,,,,,False,0.02 acres,,,,False,312922430572,False,False,,,,Multi Family,,,,,,,False,,,False,,,,,,,,,,,,,,,True,False,,,,,,,,,,,,False,Saint Paul,,,"[{'name': None, 'value': 'New Carpet &amp; Flooring'}, {'name': None, 'value': 'Raised Oak Panel Cabinets'}, {'name': None, 'value': 'Large Closet + Walk-In in Bedroom'}, {'name': None, 'value': 'Parking Space &amp; Storage Unit Included'}, {'name': None, 'value': 'Move In Ready'}]",55101,66 9th St E #R1809,Saint Paul,MN,44.949276,-93.094898,140600.0,RECENTLY_SOLD,35,55101_115,"Recently sold: $140,600. Rarely used one bedroom one bath condo with a Beautiful view of downtown St. Paul, Quiet end unit with New carpet, flooring, paint and Oak raised panel cabinet. Grocery Store and Light Rail within two blocks, Unit includes parking space and storage unit. Move in ready.  Have a realtor, no problem.  Willing to pay a fee to realtors who bring a buyer."
2,1,1,0,0,0,,,,None,"['Carpet', 'Linoleum / Vinyl']",['Forced air'],True,['Central'],True,"['Dishwasher', 'Freezer', 'Microwave', 'Range / Oven', 'Refrigerator']",,,,False,False,,,805.0,,,,['Attached Garage'],1,,False,True,,False,,False,,,,30,,,True,True,,['Brick'],,,['City'],True,False,,,,,,,False,0.02 acres,,,,False,312922430872,False,False,,,,Condo,,,,Metal,,,False,,,False,,,,,,,,,,,,,,,True,False,,Other,,,,,,,,,,False,Saint Paul,,,[],55101,78 10th St E #R1909,Saint Paul,MN,44.95061,-93.093283,175000.0,RECENTLY_SOLD,33,55101_116,"Recently sold: $175,000. Welcome to a unique opportunity to own in a niche Downtown St.Paul community. This corner condo boasts spectacular downtown views from your balcony, a spacious living area, and 24/7 professional management. Extensive amenities include a gym, pool, hot tub, party room, tennis court and much more. There is an additional guest suite available for rent. Low cost monthly parking is available in adjoining parking ramp. Well-connected via highways 35W and 94, and close to theaters, grocery shopping, restaurants, and breweries, this home is truly a must see. If you know anyone looking to move into the neighborhood, please send them our way."
2,1,1,0,0,0,,,[],None,,['Forced air'],True,['Central'],True,,,,,,False,,,805.0,,,,,,,False,,,False,,False,,,,1,,,,,,['Stone'],,,,,,,,,,,,False,0.02 acres,,,,False,312922430792,False,False,,,,Single Family,,,,,,,False,,,False,,,,,,,,,,,,,,,True,False,,,,,,,,,,,,False,Saint Paul,,,"[{'name': 'PRESENTUSE', 'value': 'Yearly'}, {'name': 'STATUS', 'value': 'Pending'}, {'name': 'TAXYEAR', 'value': '2018.00'}, {'name': 'ZONING', 'value': 'Residential-Single Family'}, {'name': 'BASEMENT', 'value': 'Full'}, {'name': 'CONSTRUCTIONSTATUS', 'value': 'Previously Owned'}, {'name': 'FRONTAGEFEET', 'value': 'City'}, {'name': 'DININGROOMDESCRIPTION', 'value': 'Living/Dining Room'}, {'name': 'ROOMFLOOR1', 'value': 'Main'}, {'name': 'EXTERIOR', 'value': 'Brick/Stone'}, {'name': 'SEWER', 'value': 'City Sewer/Connected'}, {'name': 'WATER', 'value': 'City Water/Connected'}, {'name': 'AMENITIESSHARED', 'value': 'Hot Tub, Elevator(s), Concrete Floors & Walls, Fire Sprinkler System, Coin-op Laundry Owned, 24 Hour Guard'}, {'name': 'ASSOCFEEINCLUDES', 'value': 'Heating, Air Conditioning, Sanitation, Snow/Lawn Care, Outside Maintenance, Hazard Insurance, Water/Sewer, Building Exterior, Professional Mgmt, Other, Security System, Security Staff'}, {'name': 'GARAGEDESCRIPTION', 'value': 'Heated Garage, Underground Garage, Covered'}, {'name': 'HANDICAPACCESS', 'value': 'Elevator'}, {'name': 'POOLDESCRIPTION', 'value': 'Shared, Heated, Indoor'}, {'name': 'SHAREDROOMS', 'value': 'Amusement/Party Room, Exercise Room, Guest Suite'}, {'name': 'STYLE', 'value': '(CC) High Rise (4+ Levels)'}, {'name': 'MULTIPIDYN', 'value': 'Yes'}, {'name': 'FUEL', 'value': 'Other'}, {'name': 'HEATINGDESCRIPTION', 'value': 'Steam'}]",55101,78 10th St E #R1009,Saint Paul,MN,44.95061,-93.093283,189900.0,SOLD,24,55101_117,"Recently sold: $189,900. Professionally updated. The kitchen was transformed into a beautiful, functional center of the home ( please, see photos). All new cabinets, stainless appliances in  2017.  open to dining, living and private balcony seating. Thoughtful designed entry and BR California Closets.  Ultimately luxurious heated towel rack in bathroom. Reverse roller blinds at balcony and dining window. East facing for morning sun. . New laminate floors w/  Tile bath. Steps to Green Line Station."
1,1,1,0,0,0,,,[],None,"['Hardwood', 'Tile']",['Forced air'],True,['Central'],True,"['Dishwasher', 'Dryer', 'Microwave', 'Range / Oven', 'Refrigerator']",,,,,False,,,731.0,,,,['Off street'],1,,False,True,,False,,False,,,,0,,,,,,"['Brick', 'Stone']",,,,,,,,,,,,False,0.02 acres,,,,False,322922330338,False,False,,,,Condo,,,,,,,False,,,False,,,,,,,,,,,,,,,True,False,,,,,,,,,,,,False,Saint Paul,,,"[{'name': 'central_air_desc', 'value': 'Central A/C'}, {'name': 'roof_types', 'value': 'Unknown'}, {'name': 'architectural_style', 'value': 'High Rise'}, {'name': 'neighborhoods', 'value': 'Downtown'}, {'name': 'parking', 'value': 'Garage,Heated'}, {'name': 'taxes_annual', 'value': '3377'}, {'name': 'original_listhub_key', 'value': '3yd-RMLSMN-4956041'}]",55101,270 4th St E UNIT 303,Saint Paul,MN,44.948697,-93.085118,173000.0,SOLD,18,55101_118,"Recently sold: $173,000. "
