2,2,0,0,0,0,,,[],None,"['Concrete', 'Hardwood', 'Tile']",['Forced air'],True,['Central'],True,"['Dishwasher', 'Dryer', 'Microwave', 'Range / Oven', 'Refrigerator', 'Washer']",,,,,False,,,894.0,,,,['Attached Garage'],,,False,,,False,,False,,,,1,,,,,,"['Brick', 'Stone']",,,,,,,,,,,,False,0.02 acres,,,,False,312922430937,False,False,,Residential-Multi-Family,,Condo,,,,,,,False,,,False,,,,['Connected'],,,,,,,,,,,True,False,,,,,St. Paul,,St. Paul,,St. Paul,,,False,Saint Paul,,,"[{'name': 'AmenitiesUnit', 'value': 'Balcony'}, {'name': 'AmenitiesUnit', 'value': 'Dryer Hookup'}, {'name': 'GarageDescription', 'value': 'Garage Door Opener'}, {'name': 'BathDesc', 'value': 'Main Floor Full Bath'}, {'name': 'PresentUse', 'value': 'Yearly'}, {'name': 'SpecialSearch', 'value': 'Main Floor Laundry'}, {'name': 'SpecialSearch', 'value': 'All Living Facilities on One Level'}, {'name': 'AmenitiesShared', 'value': 'Coin-op Laundry Owned'}, {'name': 'AmenitiesShared', 'value': 'Security Building'}, {'name': 'Fuel', 'value': 'Other'}, {'name': 'FrontageFeet', 'value': 'City'}, {'name': 'GarageDescription', 'value': 'Secured'}, {'name': 'GarageDescription', 'value': 'Assigned'}, {'name': 'SharedRooms', 'value': 'Party Rm'}, {'name': 'SharedRooms', 'value': 'Exercise Room'}, {'name': 'Water', 'value': 'Connected'}, {'name': 'FrontageFeet', 'value': 'Curbs'}, {'name': 'FrontageFeet', 'value': 'Sidewalks'}, {'name': 'SharedRooms', 'value': 'Guest Suite'}, {'name': 'HandicapAccess', 'value': 'Elevator'}]",55101,78 10th St E #R2604,Saint Paul,MN,44.95061,-93.093283,157000.0,RECENTLY_SOLD,15,55101_51,"Recently sold: $157,000. Perfect match 2/2/2. Upscale unit on 26th floor. Commanding views (Harriet Island, Cathedral, Capital, Downtown Minneapolis &amp; St. Paul). Updated from top to bottom. Excellent location, orientation &amp; building amenities galore. 2 adjoining parking stalls also., Directions Corner of Minnesota &amp; 10th Street."
3,2,2,0,0,0,,,[],None,"['Carpet', 'Hardwood', 'Laminate', 'Tile']",['Forced air'],True,['Central'],True,"['Dishwasher', 'Microwave', 'Range / Oven', 'Refrigerator']",,,,,False,,,1120.0,,,,,1,,False,True,,False,,False,,,,1,,,,,,"['Brick', 'Stone']",,,['City'],True,,,,,,,,False,0.03 acres,,,,False,312922430525,False,False,,,,Single Family,,,,,,,False,,,False,,,,,,,,,,,,,,,True,False,,,,,,,,,,,,False,Saint Paul,,,"[{'name': 'PRESENTUSE', 'value': 'Yearly'}, {'name': 'STATUS', 'value': 'Pending'}, {'name': 'TAXYEAR', 'value': '2018.00'}, {'name': 'ZONING', 'value': 'Residential-Multi-Family'}, {'name': 'CONSTRUCTIONSTATUS', 'value': 'Previously Owned'}, {'name': 'HEATINGDESCRIPTION', 'value': 'Forced Air'}, {'name': 'FRONTAGEFEET', 'value': 'City'}, {'name': 'APPLIANCES', 'value': 'Range, Refrigerator, Microwave, Dishwasher'}, {'name': 'ROOMFLOOR1', 'value': 'Main'}, {'name': 'AMENITIESSHARED', 'value': 'Patio, Hot Tub, Elevator(s), Concrete Floors & Walls, Security Building, Fire Sprinkler System, 24 Hour Guard'}, {'name': 'EXTERIOR', 'value': 'Brick/Stone'}, {'name': 'SEWER', 'value': 'City Sewer/Connected'}, {'name': 'WATER', 'value': 'City Water/Connected'}, {'name': 'AMENITIESUNIT', 'value': 'Patio, Balcony, Walk-In Closet, Indoor Sprinklers, Exercise Room, Hot Tub, Cable'}, {'name': 'BATHDESC', 'value': 'Main Floor Full Bath, Full Master'}, {'name': 'ASSOCFEEINCLUDES', 'value': 'Heating, Air Conditioning, Snow/Lawn Care, Outside Maintenance, Hazard Insurance, Water/Sewer, Building Exterior, Professional Mgmt, Shared Amenities, Security System, Cable TV, Parking Space, Snow Removal, Lawn Care'}, {'name': 'DININGROOMDESCRIPTION', 'value': 'Informal Dining Room'}, {'name': 'SPECIALSEARCH', 'value': 'All Living Facilities on One Level'}, {'name': 'GARAGEDESCRIPTION', 'value': 'Assigned, Covered'}, {'name': 'POOLDESCRIPTION', 'value': 'Outdoor, Shared, Heated'}, {'name': 'ROOF', 'value': 'Flat'}, {'name': 'SHAREDROOMS', 'value': 'Amusement/Party Room, Exercise Room, Other'}, {'name': 'STYLE', 'value': '(CC) High Rise (4+ Levels)'}, {'name': 'FUEL', 'value': 'Other'}, {'name': 'DAYSONMARKET', 'value': '21'}, {'name': 'DAYSONMARKETCUMULATIVE', 'value': '21'}, {'name': 'OFFMARKETDATE', 'value': '2019-10-01T16:30:17'}]",55101,66 9th St E UNIT 1215,Saint Paul,MN,44.949276,-93.094898,250000.0,RECENTLY_SOLD,0,55101_52,"Recently sold: $250,000. "
1,1,1,0,0,0,,,[],None,['Concrete'],['Forced air'],True,['Central'],True,"['Freezer', 'Refrigerator']",,,,,False,,,1000.0,,,,,,,False,,,False,,False,,,,1,,,,,,"['Brick', 'Stone']",,,,,,,,,,,,False,0.02 acres,,,,False,312922431421,False,False,,,,Condo,,,,,,,False,,,False,,,,,,,,,,,,,,,True,False,,,,,,,,,,,,False,Saint Paul,,,"[{'name': 'PRESENTUSE', 'value': 'Yearly'}, {'name': 'STATUS', 'value': 'Pending'}, {'name': 'TAXYEAR', 'value': '2018.00'}, {'name': 'ZONING', 'value': 'Residential-Single Family'}, {'name': 'CONSTRUCTIONSTATUS', 'value': 'Previously Owned'}, {'name': 'HEATINGDESCRIPTION', 'value': 'Forced Air'}, {'name': 'FRONTAGEFEET', 'value': 'City'}, {'name': 'APPLIANCES', 'value': 'Range, Exhaust Fan/Hood, Refrigerator, Dishwasher, Disposal, Freezer, Cooktop'}, {'name': 'AMENITIESSHARED', 'value': 'Patio, Elevator(s), Concrete Floors & Walls, Security Building'}, {'name': 'EXTERIOR', 'value': 'Brick/Stone'}, {'name': 'FUEL', 'value': 'Natural Gas'}, {'name': 'SEWER', 'value': 'City Sewer/Connected'}, {'name': 'WATER', 'value': 'City Water/Connected'}, {'name': 'AMENITIESUNIT', 'value': 'Ceiling Fan(s), Walk-In Closet, Vaulted Ceiling(s)'}, {'name': 'ASSOCFEEINCLUDES', 'value': 'Sanitation, Outside Maintenance, Water/Sewer, Building Exterior, Professional Mgmt, Shared Amenities, Security System, Snow Removal, Lawn Care'}, {'name': 'GARAGEDESCRIPTION', 'value': 'Assigned, Uncovered/Open'}, {'name': 'STYLE', 'value': '(CC) High Rise (4+ Levels)'}, {'name': 'DAYSONMARKET', 'value': '1'}, {'name': 'DAYSONMARKETCUMULATIVE', 'value': '1'}, {'name': 'OFFMARKETDATE', 'value': '2019-09-27T16:32:49'}]",55101,500 Robert St N UNIT 515,Saint Paul,MN,44.951285,-93.094024,209900.0,RECENTLY_SOLD,28,55101_53,"Recently sold: $209,900. New owners will love this historic Rossmor loft, in the heart of St. Paul. The wall of windows brightens up this gorgeous space with natural light. Highlights include: tall 12' ceilings, spacious open-concept layout, and concrete floors. Lunds is conveniently located across the street, plus many other great restaurants and shops nearby. Walkability score of 95! Move in ready."
1,1,0,1,0,0,,,[],None,['Hardwood'],['Forced air'],True,['Central'],True,"['Range', 'Microwave', 'Dishwasher', 'Refrigerator', 'Washer', 'Dryer']",,,,,False,,,927.0,,,,['Attached Garage'],1,,False,True,,False,,False,,,,1,,,,,,"['Brick', 'Stucco']",,,,,,,,,,,,False,0.03 acres,,,,False,312922440472,False,False,,Residential-Single Family,,Condo,,,,,,,False,,,False,,,,['City Sewer/Connected'],,,,,,,,,,,True,False,,,,,625,,625,,625,,,False,Saint Paul,,,"[{'name': 'AmenitiesUnit', 'value': 'Natural Woodwork, Hardwood Floors, Washer/Dryer Hookup, Ceiling Fan(s), Master Bedroom Walk-In Closet'}, {'name': 'BathDesc', 'value': 'Main Floor 3/4 Bath'}, {'name': 'Exterior', 'value': 'Brick/Stone, Stucco'}, {'name': 'Fuel', 'value': 'Natural Gas'}, {'name': 'GarageDescription', 'value': 'Heated Garage, Underground Garage'}, {'name': 'HeatingDescription', 'value': 'Forced Air'}, {'name': 'PresentUse', 'value': 'Yearly'}, {'name': 'SpecialSearch', 'value': 'All Living Facilities on One Level'}, {'name': 'FrontageFeet', 'value': 'City'}, {'name': 'Water', 'value': 'City Water/Connected'}, {'name': 'HandicapAccess', 'value': 'Wheelchair Ramp, Elevator'}, {'name': 'TaxYear', 'value': '2019.00'}, {'name': 'CONSTRUCTIONSTATUS', 'value': 'Previously Owned'}, {'name': 'Status', 'value': 'Active'}, {'name': 'AssocFeeIncludes', 'value': 'Sanitation, Outside Maintenance, Building Exterior, Professional Mgmt, Water/Sewer, Security System, Cable TV, Internet, Snow Removal, Lawn Care'}]",55101,445 Wacouta St UNIT 301,Saint Paul,MN,44.951184,-93.089494,189500.0,RECENTLY_SOLD,3,55101_54,"Recently sold: $189,500. Bright and spacious, one bedroom/one bathroom unit in the Essex, conveniently located in downtown St. Paul. Walk to restaurants, Mears Park and CHS Field. Building roof replaced in the last year, new A/C condenser for unit added at that time. Newer water heater. Open layout, with large galley kitchen featuring ample counter space and tile backsplash! Custom room divider and shelves added to separate living room and bedroom. Bathroom offers double vanity and large walk in shower. In unit laundry. Underground, heated parking space."
1,1,1,0,0,0,,,[],None,['Tile'],['Forced air'],True,['Central'],True,"['Range', 'Microwave', 'Dishwasher', 'Refrigerator']",,,,,False,,,720.0,,,,['Attached Garage'],,,False,,,False,,False,,,,1,,,True,,,['Brick'],,,['City'],True,,,,,,,,False,0.02 acres,,,,False,312922430536,False,False,,Residential-Multi-Family,,Condo,,,,,,,False,,,False,,,,['City Sewer/Connected'],,,,,,,,,,,True,False,,,,,,,,,,,,False,Saint Paul,,,"[{'name': 'AmenitiesUnit', 'value': 'Balcony, Tiled Floors, Walk-In Closet, Master Bedroom Walk-In Closet, Main Floor Master Bedroom, City View'}, {'name': 'Exterior', 'value': 'Brick/Stone'}, {'name': 'DiningRoomDescription', 'value': 'Informal Dining Room'}, {'name': 'Fuel', 'value': 'Natural Gas'}, {'name': 'GarageDescription', 'value': 'Attached Garage, Heated Garage, Underground Garage, Secured, Assigned'}, {'name': 'BathDesc', 'value': 'Main Floor Full Bath'}, {'name': 'HeatingDescription', 'value': 'Forced Air'}, {'name': 'FrontageFeet', 'value': 'Paved Streets, City'}, {'name': 'PresentUse', 'value': 'Yearly'}, {'name': 'SpecialSearch', 'value': 'Main Floor Bedroom, All Living Facilities on One Level'}, {'name': 'AmenitiesShared', 'value': 'Patio, Hot Tub, Sauna, Coin-op Laundry Owned, Security Building, Elevator(s), Concrete Floors & Walls, Deck, 24 Hour Guard'}, {'name': 'SharedRooms', 'value': 'Exercise Room, Amusement/Party Room'}, {'name': 'Water', 'value': 'City Water/Connected'}, {'name': 'Roof', 'value': 'Flat'}, {'name': 'PoolDescription', 'value': 'Below Ground, Heated, Shared'}, {'name': 'HandicapAccess', 'value': 'Elevator, No Stairs Internal'}, {'name': 'TaxYear', 'value': '2019.00'}, {'name': 'CONSTRUCTIONSTATUS', 'value': 'Previously Owned'}, {'name': 'Status', 'value': 'Active'}, {'name': 'AssocFeeIncludes', 'value': 'Shared Amenities, Sanitation, Snow/Lawn Care, Outside Maintenance, Building Exterior, Professional Mgmt, Water/Sewer, Security Staff, Parking Space, Hazard Insurance, Heating, Air Conditioning, Cable TV'}]",55101,66 9th St E UNIT 2310,Saint Paul,MN,44.949276,-93.094898,130000.0,RECENTLY_SOLD,0,55101_55,"Recently sold: $130,000. Soaring almost 250 feet above downtown Saint Paul, this well-appointed unit at CityWalk has everything you could ever need. Many recent upgrades include new paint, carpet, lighting, fixtures, and appliances! With floor to ceiling windows, light fills every room no matter the time of day. The oversized balcony provides a unique opportunity to enjoy summer nights above the skyline. Offered with a rare parking stall and storage space, this unit is sure to provide a flawless, turn-key experience to the new owner."
0,1,1,0,0,0,,,[],None,['Concrete'],['Forced air'],True,['Central'],True,,,,,,False,,,478.0,,,,['Attached Garage'],0,,False,False,,False,,False,,,,1,,,,,,"['Brick', 'Stone']",,,,,,,,,,,,False,0.01 acres,,,,False,312922430688,False,False,,Residential-Single Family,,Condo,,,,,,,False,,,False,,,,['City Sewer/Connected'],,,,,,,,,,,True,False,,,,,,,,,,,,False,Saint Paul,,,"[{'name': 'Exterior', 'value': 'Brick/Stone'}, {'name': 'Fuel', 'value': 'Natural Gas'}, {'name': 'GarageDescription', 'value': 'Attached Garage, Heated Garage, Underground Garage'}, {'name': 'HeatingDescription', 'value': 'Forced Air'}, {'name': 'PresentUse', 'value': 'Yearly'}, {'name': 'AmenitiesShared', 'value': 'Patio, Hot Tub, Sauna, Security Building, Fire Sprinkler System, Elevator(s), Concrete Floors & Walls, Deck, Porch'}, {'name': 'SharedRooms', 'value': 'Exercise Room, Amusement/Party Room'}, {'name': 'Water', 'value': 'City Water/Connected'}, {'name': 'HandicapAccess', 'value': 'Elevator, No Stairs Internal'}, {'name': 'TaxYear', 'value': '2019.00'}, {'name': 'CONSTRUCTIONSTATUS', 'value': 'Previously Owned'}, {'name': 'Status', 'value': 'Active'}, {'name': 'AssocFeeIncludes', 'value': 'Sanitation, Snow/Lawn Care, Heating, Air Conditioning'}]",55101,66 9th St E #R2101,Saint Paul,MN,44.949276,-93.094898,115000.0,RECENTLY_SOLD,0,55101_56,"Recently sold: $115,000. "
1,1,0,1,0,0,,,[],None,['Concrete'],['Forced air'],True,['Central'],True,"['Dishwasher', 'Dryer', 'Refrigerator', 'Washer']",,,,,False,,,1255.0,,,,['Attached Garage'],,,False,,,False,,False,,,,1,,,,,,"['Brick', 'Stone']",,,,,,,,,,,,False,0.03 acres,,,,False,312922410058,False,False,,,,Single Family,,,,,,,False,,,False,,,,,,,,,,,,,,,True,False,,,,,,,,,,,,False,Saint Paul,,,"[{'name': 'PRESENTUSE', 'value': 'Yearly'}, {'name': 'STATUS', 'value': 'Pending'}, {'name': 'FRONTAGEFEET', 'value': 'Paved Streets, Curbs, City, Sidewalks'}, {'name': 'ZONING', 'value': 'Residential-Multi-Family'}, {'name': 'CONSTRUCTIONSTATUS', 'value': 'Previously Owned'}, {'name': 'GARAGEDESCRIPTION', 'value': 'Attached Garage, Heated Garage, Underground Garage, Assigned, Tandem Garage, Secured'}, {'name': 'APPLIANCES', 'value': 'Refrigerator, Washer, Dryer, Dishwasher, Disposal, Cooktop, Wall Oven'}, {'name': 'BATHDESC', 'value': 'Main Floor 3/4 Bath, Walk Thru'}, {'name': 'EXTERIOR', 'value': 'Brick/Stone'}, {'name': 'SEWER', 'value': 'City Sewer/Connected'}, {'name': 'WATER', 'value': 'City Water/Connected'}, {'name': 'AMENITIESUNIT', 'value': 'Ceiling Fan(s)'}, {'name': 'AMENITIESSHARED', 'value': 'Elevator(s), Concrete Floors & Walls, Deck, Security Building, Fire Sprinkler System, Common Garden'}, {'name': 'ASSOCFEEINCLUDES', 'value': 'Heating, Air Conditioning, Sanitation, Snow/Lawn Care, Outside Maintenance, Water/Sewer, Building Exterior, Shared Amenities, Security System'}, {'name': 'HANDICAPACCESS', 'value': 'Elevator, Wheelchair Ramp'}, {'name': 'SHAREDROOMS', 'value': 'Amusement/Party Room'}, {'name': 'STYLE', 'value': '(CC) High Rise (4+ Levels)'}, {'name': 'HEATINGDESCRIPTION', 'value': 'Radiant'}, {'name': 'FUEL', 'value': 'Other'}, {'name': 'TAXYEAR', 'value': '2019.00'}, {'name': 'DAYSONMARKET', 'value': '56'}, {'name': 'DAYSONMARKETCUMULATIVE', 'value': '56'}, {'name': 'OFFMARKETDATE', 'value': '2019-08-22T09:51:28'}]",55101,225 9th St E UNIT 207,Saint Paul,MN,44.952378,-93.090708,375000.0,RECENTLY_SOLD,0,55101_57,"Recently sold: $375,000. "
2,1,1,0,0,0,,,[],None,['Concrete'],['Forced air'],True,['Central'],True,"['Dishwasher', 'Dryer', 'Garbage disposal', 'Microwave', 'Range / Oven']",,,,,False,,,894.0,,,,['Detached Garage'],,,False,,,False,,False,,,,0,,,,,,"['Brick', 'Stone']",,,,,,,,,,,,False,0.02 acres,,,,False,312922440662,False,False,,,,Condo,,,,,,,False,,,False,,,,,,,,,,,,,,,True,False,,,,,625,,625,,625,,,False,Saint Paul,,,"[{'name': 'PRESENTUSE', 'value': 'Yearly'}, {'name': 'STATUS', 'value': 'Pending'}, {'name': 'ZONING', 'value': 'Residential-Single Family'}, {'name': 'CONSTRUCTIONSTATUS', 'value': 'Previously Owned'}, {'name': 'GARAGEDESCRIPTION', 'value': 'Detached Garage, Garage Door Opener, Underground Garage, Assigned, Insulated Garage, Covered, Secured, More Parking Onsite for Fee'}, {'name': 'HEATINGDESCRIPTION', 'value': 'Forced Air'}, {'name': 'FRONTAGEFEET', 'value': 'City, Sidewalks'}, {'name': 'APPLIANCES', 'value': 'Range, Washer, Dryer, Microwave, Dishwasher, Disposal'}, {'name': 'SPECIALSEARCH', 'value': 'Main Floor Laundry, Main Floor Bedroom, All Living Facilities on One Level'}, {'name': 'EXTERIOR', 'value': 'Brick/Stone'}, {'name': 'FUEL', 'value': 'Natural Gas'}, {'name': 'SEWER', 'value': 'City Sewer/Connected'}, {'name': 'WATER', 'value': 'City Water/Connected'}, {'name': 'AMENITIESUNIT', 'value': 'Kitchen Window, Washer/Dryer Hookup, Natural Woodwork'}, {'name': 'AMENITIESSHARED', 'value': 'Concrete Floors & Walls, Deck, Security Building, Fire Sprinkler System'}, {'name': 'BATHDESC', 'value': 'Main Floor Full Bath'}, {'name': 'ASSOCFEEINCLUDES', 'value': 'Heating, Air Conditioning, Sanitation, Outside Maintenance, Hazard Insurance, Water/Sewer, Building Exterior, Professional Mgmt, Shared Amenities, Security System, Cable TV, Internet, Snow Removal, Lawn Care'}, {'name': 'SHAREDROOMS', 'value': 'Amusement/Party Room, Exercise Room'}, {'name': 'STYLE', 'value': '(CC) High Rise (4+ Levels)'}, {'name': 'ROOF', 'value': 'Age Over 8 Years'}, {'name': 'TAXYEAR', 'value': '2019.00'}, {'name': 'DAYSONMARKET', 'value': '19'}, {'name': 'DAYSONMARKETCUMULATIVE', 'value': '19'}, {'name': 'OFFMARKETDATE', 'value': '2019-10-07T13:02:11'}]",55101,406 Wacouta St UNIT 311,Saint Paul,MN,44.950638,-93.087585,225000.0,RECENTLY_SOLD,13,55101_58,"Recently sold: $225,000. Sunny and bright loft with views of Mears Park in outside your windows! Fabulous loft with original exposed wood beams and brick, with a second bedroom that can be used as an office as well. Well maintained building on the skyway. Convenient location to Mears Park, CHS Field, the Light Rail, Farmer's Market, numerous restaurants, and on the skyway."
2,2,2,0,0,0,,,[],None,"['Hardwood', 'Tile']",['Forced air'],True,['Other'],True,"['Dishwasher', 'Dryer', 'Garbage disposal', 'Microwave', 'Range / Oven', 'Refrigerator', 'Washer']",,,,True,False,,,1100.0,,,,['Detached Garage'],2,,False,True,,False,,False,,,,7,,,False,False,,['Brick'],,,,True,False,,,,,,,False,0.02 acres,,,,False,322922330271,False,False,,,,Condo,,,,Other,,,False,2005,,False,,,,,,,,,,,,,,,True,False,,Modern,,,625 - St. Paul,,625 - St. Paul,,625 - St. Paul,,,False,Saint Paul,,,"[{'name': None, 'value': 'Cable-ready'}, {'name': None, 'value': 'Clubhouse'}, {'name': None, 'value': 'Covered/Garage Parking'}, {'name': None, 'value': 'Dining Area'}, {'name': None, 'value': 'Eat-in Kitchen'}, {'name': None, 'value': 'Granite Countertops'}, {'name': None, 'value': 'Hardwood Floors'}, {'name': None, 'value': 'High Ceilings'}, {'name': None, 'value': 'Oven/Range'}, {'name': None, 'value': 'Secured Entry'}, {'name': None, 'value': 'Stainless Steel Appliances'}]",55101,300 Wall St UNIT 202,Saint Paul,MN,44.948651,-93.084226,339900.0,RECENTLY_SOLD,49,55101_59,"Recently sold: $339,900. Gorgeous Lowertown condo! Call Katie at 651-242-0302 to look at it today! 2.7% buyers agent commission fee! This recently renovated condo is located in the fabulous historical Great Northern Lofts building. The condo has high end amenities like stainless steel appliances, large windows, hardwood flooring, and granite counter tops. Each bedroom is on the opposite side of the condo with custom designed walk in closets (1 with hidden bookshelf door!), and its own bathroom with heated floors. Fully integrated smart home and living room/master shares a fireplace! The building is equipped with a full gym, event room, secure access, courtyard with grill, is located across the street from the Farmers Market and Saints stadium. The unit includes 2 parking spaces in the enclosed secure parking ramp and a 10x10 secure storage locker. Located in the heart of lower town walking distance to great restaurant's, nightlife, dog park and right around the corner from the Mississippi river!

The following is all recent improvements throughout!
2 sided bio ethanol fireplace with one way mirror glass and Cherry underlit mantle.
Refinished hardwood floors,
Granite countertops and under mount sink.
Refinished cabinets and under cabinet lighting
New tile backsplash. Entire unit repainted,
Retiled both bathrooms and showers
Heated bathroom floors. Hidden cherry bookcase walk in closet and Built in cabinets in both walk in closets. Rolling library ladder to storage above closet. Built in office cabinet in second bedroom and built in Murphy bed
Remote power blackout shades, High end fixtures in both bathrooms and kitchen. Cabinet microwave and Induction oven/cooktop."
1,1,1,0,0,0,,,[],None,"['Hardwood', 'Tile']",['Forced air'],True,['Central'],True,['Disposal'],,,,False,False,,,1054.0,,,,,,,False,,,False,,False,,,,1,,,False,False,,"['Brick', 'Cement concrete', 'Stone', 'Stucco']",,,,,False,,,,,,,False,0.03 acres,,,,False,312922440478,False,False,,Residential-Multi-Family,,Condo,,,,,,,False,,,False,,,,['Connected'],,,,,,,,,,,True,False,,,,,,,,,,,,False,Saint Paul,,,"[{'name': 'Fuel', 'value': 'Natural Gas'}, {'name': 'GarageDescription', 'value': 'Garage Door Opener'}, {'name': 'BathDesc', 'value': 'Main Floor Full Bath'}, {'name': 'PresentUse', 'value': 'Yearly'}, {'name': 'SpecialSearch', 'value': 'Main Floor Laundry'}, {'name': 'SpecialSearch', 'value': 'All Living Facilities on One Level'}, {'name': 'GarageDescription', 'value': 'Underground Garage'}, {'name': 'Water', 'value': 'Connected'}, {'name': 'BathDesc', 'value': 'Master Walk-Thru'}, {'name': 'HandicapAccess', 'value': 'Wheelchair Ramp'}, {'name': 'HandicapAccess', 'value': 'Elevator'}, {'name': 'HandicapAccess', 'value': 'Doors 36&quot;+'}]",55101,445 Wacouta St UNIT 307,Saint Paul,MN,44.951184,-93.089494,215000.0,RECENTLY_SOLD,23,55101_60,"Recently sold: $215,000. Enjoy wonderful city living, walking distance to parks &amp; restaurants! Heated underground garage, freshly painted bedroom &amp; bath, newly installed granite counter tops, closet organizer, reverse osmosis system and more! Must see!"
1,2,0,1,1,0,,,[],None,"['Hardwood', 'Tile']",['Forced air'],True,['Central'],True,"['Exhaust Fan/Hood', 'Cooktop', 'Central Vacuum', 'Water Osmosis System']",,,,True,False,,,1450.0,,,,['Detached Garage'],2,,False,True,,False,,False,,,,1,,,,,,"['Brick', 'Stone']",,,['City'],True,,,,,,,,False,0.03 acres,,,,False,322922330266,False,False,,Residential-Multi-Family,,Condo,,,,,,,False,,,False,,,,['City Sewer/Connected'],,,,,,,,,,,True,False,,Loft,,,625 - St. Paul,,625 - St. Paul,,625 - St. Paul,,,False,Saint Paul,,,"[{'name': 'AmenitiesUnit', 'value': 'Kitchen Window, Washer/Dryer Hookup, Kitchen Center Island, French Doors, Master Bedroom Walk-In Closet, Main Floor Master Bedroom, Paneled Doors, Wet Bar'}, {'name': 'BathDesc', 'value': 'Main Floor 3/4 Bath, Private Master, Main Floor 1/2 Bath'}, {'name': 'GarageDescription', 'value': 'Garage Door Opener, Covered, Secured, Assigned'}, {'name': 'PresentUse', 'value': 'Yearly'}, {'name': 'SpecialSearch', 'value': 'Main Floor Laundry, Main Floor Bedroom, All Living Facilities on One Level'}, {'name': 'AmenitiesShared', 'value': 'Security Building, Other'}, {'name': 'Fuel', 'value': 'Other'}, {'name': 'FrontageFeet', 'value': 'City, Curbs, Sidewalks'}, {'name': 'SharedRooms', 'value': 'Exercise Room, Other, Amusement/Party Room'}, {'name': 'Water', 'value': 'City Water/Connected'}, {'name': 'HandicapAccess', 'value': 'Wheelchair Ramp, No Stairs Internal'}, {'name': 'TaxYear', 'value': '2018.00'}, {'name': 'CONSTRUCTIONSTATUS', 'value': 'Previously Owned'}, {'name': 'Status', 'value': 'Active'}, {'name': 'AssocFeeIncludes', 'value': 'Other, Shared Amenities, Sanitation, Outside Maintenance, Building Exterior, Professional Mgmt, Water/Sewer, Parking Space, Hazard Insurance, Security System, Heating, Air Conditioning, Internet, Snow Removal, Lawn Care'}]",55101,300 Wall St UNIT 104,Saint Paul,MN,44.948651,-93.084226,450000.0,RECENTLY_SOLD,0,55101_61,"Recently sold: $450,000. Complete re-design of this stunning Great Northern Loft. 14-foot barrel vault ceilings. Sun-filled, with 9 Paladian windows and SW orientation. Complete renovation, with superb attention to details. New foyer with french doors. Bronze hardware throughout. 3/4&quot; oak hand-scraped floors. Full gourmet kitchen: custom crafted cabinets+new walk-in pantry+36&quot;Bosch induction range with roll-down vent. Glass shelves with LED+island with multi-outlets and heavy-duty sliding shelves+breakfast nook w built-in storage+beverage bar+ Rohl polished nickel faucets+prep sink. Reverse osmosis water system.  2 new Baths (incl walk-in shower). 53&quot; Troy chandelier. Wood plantation shutters. Upgraded electric/plumbing. Large walk-in master closet. 2 owned garage stalls + free guest parking.Owned storage. Workout Room.  Bike storage. Community Courtyard and Gathering Room. Assn. dues include Heat+AC+Internet. One blk from the Farmer's Market. 1450 sq ft is CAD-verified."
1,1,1,0,0,0,,,,None,['Concrete'],['Forced air'],True,['Central'],True,"['Dishwasher', 'Microwave', 'Refrigerator']",,,,,False,,,903.0,,,,,,,False,,,False,,False,,,,1,,,,,,['Brick'],,,,,,,,,,,,False,0.02 acres,,,,False,312922431416,False,False,,,,Condo,,,,,,,False,,,False,,,,,,,,,,,,,,,True,False,,Other,,,625 - St. Paul,,625 - St. Paul,,625 - St. Paul,,,False,Saint Paul,,,[],55101,500 Robert St N UNIT 510,Saint Paul,MN,44.951075,-93.09393,206975.0,RECENTLY_SOLD,11,55101_62,"Recently sold: $206,975. Rossmor Loft Living in Lowertown! Industrial feel open concept design with a wall of 8 ft tall windows, 12 ft ceilings and concrete floors. Unit features 1 full bath, kitchen, large walk-in closet. View to Pedro Dog Park. Located near Lunds grocery and walking distance to light rail, farmers market, CHS Field, Mears Park and restaurants. Laundry on each floor. Parking and storage available."
