2,2,2,0,0,0,,,[],None,['Concrete'],['Other'],True,['Central'],True,['Washer'],,,,False,False,,,1300.0,,,,['Attached Garage'],1,,False,True,,False,,False,,,,0,,,False,False,,"['Brick', 'Stone']",,,"['City', 'Park']",True,False,,,,,,,False,0.04 acres,,,,False,312922440625,False,False,,,,Condo,,,,,,,False,2005,,False,,,,,,,,,,,,,,,True,False,,Loft,,,625 - St. Paul,,625 - St. Paul,,625 - St. Paul,,,False,Saint Paul,,,"[{'name': 'central_air_desc', 'value': 'Central A/C'}, {'name': 'roof_types', 'value': 'Unknown'}, {'name': 'has_ceiling_fan_fl', 'value': 'Y'}, {'name': 'has_security_system_fl', 'value': 'Y'}, {'name': 'architectural_style', 'value': 'High Rise'}, {'name': 'neighborhoods', 'value': 'Downtown'}, {'name': 'taxes_annual', 'value': '4738'}, {'name': 'parking', 'value': 'Assigned,Fee,Garage - Attached,Heated,Offsite,Open'}]",55101,406 Wacouta St UNIT 105,Saint Paul,MN,44.950638,-93.087585,362000.0,SOLD,22,55101_203,"Recently sold: $362,000. Historic River Park Loft in Lowertown, views Mears Pk, connected to skyway. Open plan w/spiral stairs to loft w/2nd br and bath. 17' ceiling, exposed brick, beams, heated pkg, granite tops, whirlpool, comm rm, exc rm, patio/bbq. Big dogs ok. Very cool!"
1,1,0,0,0,0,,,[],None,['Hardwood'],['Forced air'],True,['Other'],True,,,,,,False,,,894.0,,,,['Attached Garage'],,,False,,,False,,False,,,,1,,,,,,['Brick'],,,,,,,,,,,,False,0.01 acres,,,,False,312922430876,False,False,,,,Apartment,,,,,,,False,,,False,,,,,,,,,,,,,,,True,False,,,,,,,,,,,,False,Saint Paul,,,"[{'name': None, 'value': 'Balcony'}, {'name': None, 'value': 'Cats Allowed'}, {'name': None, 'value': 'Cooling System: Air Conditioning'}, {'name': None, 'value': 'Parking Type: Garage'}, {'name': None, 'value': 'Small Dogs Allowed'}]",55101,78 10th St E #R2003,Saint Paul,MN,44.95061,-93.093283,169900.0,SOLD,18,55101_204,"Recently sold: $169,900. Owner pays for association Dues. Application fee is $75 per tenant, must pass background &amp; credit check. Serious inquiries only. Pet's allowed with a non-refundable deposit."
1,1,1,0,0,0,,,[],None,['Concrete'],['Forced air'],True,['Central'],True,"['Exhaust Fan/Hood', 'Disposal']",,,,,False,,,636.0,,,,['Attached Garage'],,,False,,,False,,False,,,,1,,,True,,,"['Brick', 'Metal', 'Stone', 'Stucco']",,,,,,,,,,,,False,0.01 acres,,,,False,312922430781,False,False,,Residential-Single,,Condo,,,,,,,False,,,False,,,,['City Sewer/Connected'],,,,,,,,,,,True,False,,,,,,,,,,,,False,Saint Paul,,,"[{'name': 'AmenitiesUnit', 'value': 'Balcony, Washer/Dryer Hookup'}, {'name': 'Fuel', 'value': 'Natural Gas'}, {'name': 'GarageDescription', 'value': 'Garage Door Opener, Covered, Secured, Assigned, Driveway - Concrete, Driveway - Shared'}, {'name': 'BathDesc', 'value': 'Main Floor Full Bath'}, {'name': 'FrontageFeet', 'value': 'Paved Streets, City, Curbs, Sidewalks'}, {'name': 'PresentUse', 'value': 'Yearly'}, {'name': 'SpecialSearch', 'value': 'Main Floor Laundry, Main Floor Bedroom'}, {'name': 'AmenitiesShared', 'value': 'Security Building'}, {'name': 'Roof', 'value': 'Unspecified Shingle, Flat'}, {'name': 'SharedRooms', 'value': 'Amusement/Party Rm, Exercise Room, Guest Suite'}, {'name': 'Water', 'value': 'City Water/Connected'}, {'name': 'HandicapAccess', 'value': 'Elevator, No Stairs Internal'}]",55101,78 10th St E #R908,Saint Paul,MN,44.95061,-93.093283,162787.0,SOLD,0,55101_205,"Recently sold: $162,787. Urban condo with views of downtown and Cathedral Hill. Walking distance from the Capitol, Regions Hospital, St. Joseph's Hospital, and downtown office buildings. Floor plan with an open kitchen, spacious living room and bathroom, in-unit laundry and a private balcony. Luxury living at The Pointe of Saint Paul; amenities include on-site management, pool, hot tub, sauna, gym, tennis court and half-basketball court, free visitor parking, bike storage, dry cleaning pickup, spacious party room and a guest suite. Conveniently located to downtown amenities such as Lund's grocery store, bars, restaurants, theaters, CHS Field, and the Excel Energy Center. Includes a covered parking spot. One block from Green Line light rail station, and along or near several bus lines.

Note: Furniture in pictures from previous tenant; unit is not furnished.

Rent includes all expenses other than electricity, cable and internet. $50 application fee required by building. Lease terms of 12 months, longer term leases also possible."
1,1,1,0,0,0,,,,None,,['Forced air'],True,['Central'],True,,,,,,False,,,626.0,,,,,,,False,,,False,,False,,,,1,,,True,,,['Brick'],,,,,,,,,,,,False,0.01 acres,,,,False,312922430776,False,False,,,,Condo,,,,,,,False,,,False,,,,,,,,,,,,,,,True,False,,,,,St. Paul,,St. Paul,,St. Paul,,,False,Saint Paul,,,[],55101,78 10th St E #R903,Saint Paul,MN,44.95061,-93.093283,150000.0,SOLD,18,55101_206,"Recently sold: $150,000. Downtown living!  Sweet move-in ready unit.  Southeast view towards Lowertown from the balcony.  Close to everything!  Well run building with indoor pool and exercise facilities.  Secured building with on site staff."
2,1,,,,,,,,None,,['Forced air'],True,,,,,,,,False,,,801.0,,,,,,,False,,,False,,False,,,,1,,,,,,['Brick'],,,,,,,,,,,,False,,,,,False,312922430882,False,False,,,,Condo,,,,,,,False,,,False,,,,,,,,,,,,,,,True,False,,,,,,,,,,,,False,Saint Paul,,,[],55101,78 10th St E #R2009,Saint Paul,MN,44.95061,-93.093283,194000.0,SOLD,11,55101_207,"Recently sold: $194,000. Highly desirable 2 bedroom floor plan at The Pointe of Saint Paul. Tenant occupied. 2 parking stalls! City and river views! Amenities include: pool, tennis and basketball courts, grill and patio area, fitness center, community room, hot tub, sauna, and guest parking. Contact co-listing agent Tiffany Otte for more information or to schedule a showing. 507-273-8523"
2,1,1,0,0,0,,,[],None,"['Concrete', 'Hardwood']",['Forced air'],True,['Central'],True,['Exhaust Fan/Hood'],,,,False,False,,,805.0,,,,['Attached Garage'],1,,False,True,,False,,False,,,,1,,,True,True,,"['Brick', 'Stone']",,,"['City', 'Water']",True,True,,,,,,,False,0.02 acres,,,,False,312922430865,False,False,,Residential-Multi-Family,,Condo,,,,,,,False,,,False,,,,['City Sewer/Connected'],,,,,,,,,,,True,False,,Contemporary,,,,,,,,,,False,Saint Paul,,,"[{'name': 'AmenitiesUnit', 'value': 'Balcony, Washer/Dryer Hookup'}, {'name': 'GarageDescription', 'value': 'Garage Door Opener, Covered, Secured'}, {'name': 'BathDesc', 'value': 'Main Floor Full Bath'}, {'name': 'PresentUse', 'value': 'Yearly'}, {'name': 'SpecialSearch', 'value': 'Main Floor Laundry, Main Floor Bedroom, All Living Facilities on One Level'}, {'name': 'AmenitiesShared', 'value': 'Security Building'}, {'name': 'Fuel', 'value': 'Other'}, {'name': 'FrontageFeet', 'value': 'City'}, {'name': 'SharedRooms', 'value': 'Amusement/Party Rm, Exercise Room, Guest Suite'}, {'name': 'Water', 'value': 'City Water/Connected'}, {'name': 'HandicapAccess', 'value': 'Elevator'}]",55101,78 10th St E #R1902,Saint Paul,MN,44.95061,-93.093283,189576.0,SOLD,0,55101_208,"Recently sold: $189,576. Most charming corner unit at the Pointe -- the most quiet corner in the building. Great views of steeples and historic architecture from the balcony. New wood floors. New contemporary closet doors. New dishwasher. 2BR + 1 Full Bath. The Pointe has the most amenities of any condo building downtown: Free guest parking+on-site helpful staff+ security cameras,+guest suite+indoor pool+sauna+whirlpool+workout+huge community room+owned parking. Grocery store &amp; light rail in ONE block!"
1,1,1,0,0,0,,,[],None,,['Forced air'],True,['Central'],True,['Exhaust Fan/Hood'],,,,True,False,,,1115.0,,,,,,,False,,,False,,False,,,,1,,,False,False,,"['Brick', 'Stone']",,,,,False,,,,,,,False,0.03 acres,,,,False,312922410079,False,False,,Residential-Single,,Condo,,,,,,,False,,,False,,,,['City Sewer/Connected'],,,,,,,,,,,True,False,,,,,St. Paul - 625,,St. Paul - 625,,St. Paul - 625,,,False,Saint Paul,,,"[{'name': 'Fuel', 'value': 'Natural Gas'}, {'name': 'GarageDescription', 'value': 'Heated Garage, Underground Garage'}, {'name': 'BathDesc', 'value': 'Main Floor Full Bath'}, {'name': 'PresentUse', 'value': 'Yearly'}, {'name': 'SpecialSearch', 'value': 'Main Floor Laundry'}, {'name': 'AmenitiesShared', 'value': 'Security Building'}, {'name': 'Water', 'value': 'City Water/Connected'}, {'name': 'HandicapAccess', 'value': 'Elevator'}]",55101,225 9th St E UNIT 502,Saint Paul,MN,44.952378,-93.090708,276121.0,SOLD,0,55101_209,"Recently sold: $276,121. Come see this incredibly elegant loft with sleek finishes and the urban view you're looking for! This one of a kind loft features solar blinds, built-in Murphy bed, in-unit laundry, beautifully updated bathroom and a gorgeous chandelier. The open layout is perfect for entertaining and could easily have a second bedroom. Don't miss out on your chance to be in one of the most high demand buildings with a strong association. Just steps to restaurants, CHS Stadium, and farmers market."
1,1,1,0,0,0,,,[],None,['Tile'],['Forced air'],True,['Central'],True,"['Dryer', 'Microwave', 'Range / Oven', 'Refrigerator', 'Washer']",,,,,False,,,866.0,,,,['Attached Garage'],,,False,,,False,,False,,,,1,,,,,,"['Brick', 'Stone']",,,,,,,,,,,,False,0.03 acres,,,,False,052822220064,False,False,,Residential-Multi-Family,,Condo,,,,,,,False,,,False,,,,['City Sewer/Connected'],,,,,,,,,,,True,False,,,,,,,,,,,,False,Saint Paul,,,"[{'name': 'AmenitiesUnit', 'value': 'Washer/Dryer Hookup'}, {'name': 'Fuel', 'value': 'Natural Gas'}, {'name': 'GarageDescription', 'value': 'Garage Door Opener, Underground Garage, Assigned, Tuckunder'}, {'name': 'BathDesc', 'value': 'Main Floor Full Bath'}, {'name': 'PresentUse', 'value': 'Yearly'}, {'name': 'SpecialSearch', 'value': 'Main Floor Laundry'}, {'name': 'AmenitiesShared', 'value': 'Security Building'}, {'name': 'Water', 'value': 'City Water/Connected'}]",55101,214 4th St E UNIT 105,Saint Paul,MN,44.947991,-93.08659,226563.0,SOLD,0,55101_210,"Recently sold: $226,563. "
1,1,,,,,,,,None,,['Forced air'],True,['Central'],True,,,,,,False,,,623.0,,,,,,,False,,,False,,False,,,,1,,,,,,['Brick'],,,,,,,,,,,,False,0.02 acres,,,,False,312922430112,False,False,,,,Condo,,,,,,,False,,,False,,,,,,,,,,,,,,,True,False,,,,,,,,,,,,False,Saint Paul,,,[],55101,66 9th St E #R1504,Saint Paul,MN,44.949276,-93.094898,103030.0,SOLD,0,55101_211,"Recently sold: $103,030. 66 9th St E #R1504, Saint Paul, MN is a condo home that contains 623 sq ft and was built in 1983. It contains 1 bedroom and 1 bathroom. This home last sold for $103,030 in April 2018. 
 
The Zestimate for this house is $116,304, which has increased by $485 in the last 30 days. The Rent Zestimate for this home is $1,200/mo, which has increased by $23/mo in the last 30 days. "
1,1,0,0,0,0,,,[],None,['Hardwood'],['Forced air'],True,['Central'],True,"['Exhaust Fan/Hood', 'Disposal']",,,,False,False,,,911.0,,,,['Attached Garage'],,,False,,,False,,False,,,,1,,,False,False,,"['Brick', 'Stone']",,,,,False,,,,,,,False,0.02 acres,,,,False,322922330340,False,False,,Residential-Multi-Family,,Condo,,,,,,,False,,,False,,,,['City Sewer/Connected'],,,,,,,,,,,True,False,,,,,St. Paul #625,,St. Paul #625,,St. Paul #625,,,False,Saint Paul,,,"[{'name': 'AmenitiesUnit', 'value': 'Balcony, Kitchen Window, Washer/Dryer Hookup'}, {'name': 'Fuel', 'value': 'Natural Gas'}, {'name': 'GarageDescription', 'value': 'Garage Door Opener, Heated Garage, Covered, Secured, Assigned, Driveway - Concrete'}, {'name': 'BathDesc', 'value': 'Main Floor Full Bath'}, {'name': 'FrontageFeet', 'value': 'Paved Streets, City, Curbs, Sidewalks'}, {'name': 'PresentUse', 'value': 'Yearly'}, {'name': 'SpecialSearch', 'value': 'All Living Facilities on One Level'}, {'name': 'AmenitiesShared', 'value': 'Security Building'}, {'name': 'SharedRooms', 'value': 'Amusement/Party Rm, Exercise Room'}, {'name': 'Water', 'value': 'City Water/Connected'}, {'name': 'HandicapAccess', 'value': 'Elevator, No Stairs Internal'}]",55101,270 4th St E UNIT 305,Saint Paul,MN,44.948697,-93.085118,170000.0,SOLD,0,55101_212,"Recently sold: $170,000. Lot270 condo right across the street from the Farmer's Market! This building has large lobby windows that overlook the Farmer's Market. One block to:  CHS Field (St Paul Saints), Lowertown restaurants, historic Union Depot, Light Rail and the Mississippi River!  Condo 305 has tall ceilings and a private balcony at the back (quiet) side of the building. Cherry cabinets, walk-in closet, spacious bedroom and bath.  Heated parking space on the main level of the building (no big ramp to park in)!"
2,2,2,0,0,0,,,[],None,,['Forced air'],True,['Central'],True,"['Disposal', 'Other']",,,,,False,,,1476.0,,,,['Attached Garage'],1,,False,True,,False,,False,,,,1,,,,,,"['Brick', 'Stone']",,,,,,,,,,,,False,0.04 acres,,,,False,312922440626,False,False,,Residential-Single,,Condo,,,,,,,False,,,False,,,,['City Sewer/Connected'],,,,,,,,,,,True,False,,,,,625 - St. Paul,,625 - St. Paul,,625 - St. Paul,,,False,Saint Paul,,,"[{'name': 'AmenitiesUnit', 'value': 'Washer/Dryer Hookup'}, {'name': 'BathDesc', 'value': 'Full Master, Main Floor Full Bath, Upper Level Full Bath'}, {'name': 'GarageDescription', 'value': 'Heated Garage, Secured'}, {'name': 'PresentUse', 'value': 'Yearly'}, {'name': 'SpecialSearch', 'value': 'Main Floor Laundry, Main Floor Bedroom'}, {'name': 'AmenitiesShared', 'value': 'Security Building'}, {'name': 'Fuel', 'value': 'Other'}, {'name': 'FrontageFeet', 'value': 'City'}, {'name': 'SharedRooms', 'value': 'Amusement/Party Rm, Exercise Room'}, {'name': 'Water', 'value': 'City Water/Connected'}, {'name': 'HandicapAccess', 'value': 'Wheelchair Ramp, Doors 36&rdquo;&#43;, Hallways 42&rdquo;&#43;'}]",55101,406 Wacouta St UNIT 106,Saint Paul,MN,44.950638,-93.087585,452500.0,SOLD,17,55101_213,"Recently sold: $452,500. Sophisticated urban loft in Premier Lowertown building. Rare opportunity to own this 1st floor, two story condo with soaring 16 ft. ceilings and a 13 ft wall of glass looking out over Saint Paul &amp; adjacent Mears Park. With an open, flowing floor plan, 2 complete bedrooms, 2 baths &amp; a separate study/office this condo overflows with architectural details, designs and finishes you must see. 2 blocks to CHS field, the Farmer's Market, the Green Line, &amp; many other restaurant and entertainment venues."
1,1,1,0,0,0,,,,None,,['Other'],True,['Central'],True,,,,,False,False,,,636.0,,,,,,,False,,,False,,False,,,,1,,,False,False,,['Brick'],,,,,False,,,,,,,False,0.01 acres,,,,False,312922430866,False,False,,,,Condo,,,,,,,False,,,False,,,,,,,,,,,,,,,True,False,,,,,,,,,,,,False,Saint Paul,,,[],55101,78 10th St E #R1903,Saint Paul,MN,44.95061,-93.093283,165000.0,SOLD,0,55101_214,"Recently sold: $165,000. Have it all downtown St. Paul!! This beautifully updated condo at The Pointe is move in ready with new shaker cabinets, quartz counter tops, luxury vinyl floors, stunning back splash, stainless steel appliances, spacious balcony and much more. LOCATION LOCATION LOCATION! Near the light rail, Lunds, bar/restaurants, theaters and sports venues. PLUS AMENITIES: on site management, pool, hot tub, sauna, sport court, gym, tennis court, visitor parking, spacious party room and a guest suite."
1,1,1,0,0,0,,,[],None,,['Forced air'],True,['Central'],True,"['Dishwasher', 'Dryer', 'Garbage disposal', 'Range / Oven']",,,,,False,,,780.0,,,,,,,False,,,False,,False,,,,0,,,,,,"['Brick', 'Stone']",,,,,,,,,,,,False,0.02 acres,,,,False,322922330075,False,False,,,,Condo,,,,,,,False,,,False,,,,,,,,,,,,,,,True,False,,,,,,,,,,,,False,Saint Paul,,,"[{'name': 'central_air_desc', 'value': 'Central A/C'}, {'name': 'roof_types', 'value': 'Unknown'}, {'name': 'architectural_style', 'value': 'High Rise'}, {'name': 'neighborhoods', 'value': 'Downtown'}, {'name': 'taxes_annual', 'value': '1957'}]",55101,289 5th St E UNIT 406,Saint Paul,MN,44.950193,-93.085455,154750.0,SOLD,24,55101_215,"Recently sold: $154,750. Stunning 1 BR loft/1 BA, 14 foot ceilings, beams, hardwood floors, in-unit laundry. Tons of Storage. Market House Restaurant downstairs in the building. Close to all the amenities and nightlife that ST Paul has to offer. Near CHS Field."
2,2,1,0,1,0,,,,None,,['Forced air'],True,['Central'],True,,,,,,False,,,894.0,,,,,,,False,,,False,,False,,,,1,,,,,,['Brick'],,,,,,,,,,,,False,0.02 acres,,,,False,312922430927,False,False,,,,Condo,,,,,,,False,,,False,,,,,,,,,,,,,,,True,False,,,,,,,,,,,,False,Saint Paul,,,[],55101,78 10th St E #R2504,Saint Paul,MN,44.95061,-93.093283,175000.0,SOLD,0,55101_216,"Recently sold: $175,000. Sold Before Print. Sold &quot;As Is&quot;"
1,2,1,0,1,0,,,[],None,"['Concrete', 'Hardwood', 'Tile']",['Forced air'],True,['Central'],True,"['Cooktop', 'Disposal', 'Wall Oven']",,,,,False,,,1505.0,,,,['Attached Garage'],,,False,,,False,,False,,,,1,,,,,,"['Brick', 'Stone']",,,['City'],True,True,,,,,,,False,0.05 acres,,,,False,052822220080,False,False,,Residential-Multi-Family,,Condo,,,,,,,False,,,False,,,,['City Sewer/Connected'],,,,,,,,,,,True,False,,,,,625 - St. Paul,,625 - St. Paul,,625 - St. Paul,,,False,Saint Paul,,,"[{'name': 'AmenitiesUnit', 'value': 'Natural Woodwork, Washer/Dryer Hookup'}, {'name': 'BathDesc', 'value': 'Private Master, Full Master, Main Floor 1/2 Bath'}, {'name': 'Fuel', 'value': 'Natural Gas'}, {'name': 'FrontageFeet', 'value': 'Paved Streets, City, Curbs, Sidewalks'}, {'name': 'PresentUse', 'value': 'Yearly'}, {'name': 'SpecialSearch', 'value': 'Main Floor Laundry, Main Floor Bedroom'}, {'name': 'GarageDescription', 'value': 'Underground Garage'}, {'name': 'Water', 'value': 'City Water/Connected'}]",55101,214 4th St E UNIT 215,Saint Paul,MN,44.947672,-93.08628,299900.0,SOLD,0,55101_217,"Recently sold: $299,900. "
0,1,1,0,0,0,,,[],None,['Hardwood'],['Other'],True,['Central'],True,"['Exhaust Fan/Hood', 'Disposal']",,,,,False,,,713.0,,,,,,,False,,,False,,False,,,,1,,,,,,"['Brick', 'Stone']",,,,,,,,,,,,False,0.02 acres,,,,False,312922430710,False,False,,Residential-Single,,Condo,,,,Other,,,False,,,False,,,,['City Sewer/Connected'],,,,,,,,,,,True,False,,Other,,,625 - St. Paul,,625 - St. Paul,,625 - St. Paul,,,False,Saint Paul,,,"[{'name': 'AmenitiesUnit', 'value': 'Other'}, {'name': 'Fuel', 'value': 'Electric'}, {'name': 'BathDesc', 'value': 'Main Floor Full Bath'}, {'name': 'PresentUse', 'value': 'Yearly'}, {'name': 'SpecialSearch', 'value': 'All Living Facilities on One Level'}, {'name': 'GarageDescription', 'value': 'Uncovered/Open, Assigned'}, {'name': 'AmenitiesShared', 'value': 'Coin-op Laundry Owned, Security Building, Other'}, {'name': 'HeatingDescription', 'value': 'Other'}, {'name': 'SharedRooms', 'value': 'Exercise Room'}, {'name': 'Water', 'value': 'City Water/Connected'}, {'name': 'Roof', 'value': 'Flat'}]",55101,523 Jackson St APT 301,Saint Paul,MN,44.952122,-93.093518,132000.0,SOLD,9,55101_218,"Recently sold: $132,000. New York style loft studio with charming brick, hardwood floors, high ceilings. 1-owner, immaculate. Huge windows bring natural light &amp; skyline views. Additional storage &amp; exercise room. Lunds grocery 1 block away and many bars, restaurants, parks, sporting events, theaters, and all that St. Paul has to offer.  Quick close possible."
1,1,1,0,0,0,,,[],None,['Concrete'],['Forced air'],True,['Central'],True,"['Dishwasher', 'Dryer', 'Microwave', 'Range / Oven', 'Refrigerator', 'Washer']",,,,,False,,,1108.0,,,,,,,False,,,False,,False,,,,1,,,,,,"['Brick', 'Stone']",,,,,,,,,,,,False,0.03 acres,,,,False,312922440718,False,False,,Residential-Single,,Condo,,,,,,,False,,,False,,,,['City Sewer/Connected'],,,,,,,,,,,True,False,,,,,625,,625,,625,,,False,Saint Paul,,,"[{'name': 'AmenitiesUnit', 'value': 'Natural Woodwork, Balcony, Washer/Dryer Hookup, Indoor Sprinklers'}, {'name': 'Fuel', 'value': 'Natural Gas'}, {'name': 'GarageDescription', 'value': 'Insulated Garage, Garage Door Opener, Heated Garage, Underground Garage, Secured, Assigned, More Parking Offsite for Fee'}, {'name': 'BathDesc', 'value': 'Main Floor Full Bath, Walk Thru, Full Jack &amp; Jill'}, {'name': 'HeatingDescription', 'value': 'Other'}, {'name': 'PresentUse', 'value': 'Yearly'}, {'name': 'SpecialSearch', 'value': 'Main Floor Laundry, Main Floor Bedroom, All Living Facilities on One Level'}, {'name': 'AmenitiesShared', 'value': 'Security Building'}, {'name': 'Roof', 'value': 'Age Over 8 Years, Flat'}, {'name': 'SharedRooms', 'value': 'Amusement/Party Rm, Exercise Room, Other'}, {'name': 'Water', 'value': 'City Water/Connected'}, {'name': 'FrontageFeet', 'value': 'Sidewalks'}, {'name': 'HandicapAccess', 'value': 'Elevator'}]",55101,406 Wacouta St UNIT 617,Saint Paul,MN,44.950638,-93.087585,289515.0,SOLD,0,55101_219,"Recently sold: $289,515. "
2,1,1,0,0,0,,,[],None,['Hardwood'],['Forced air'],True,['Central'],True,"['Dryer', 'Microwave', 'Refrigerator', 'Washer']",,,,,False,,,1343.0,,,,,,,False,,,False,,False,,,,1,,,,,,['Stone'],,,,,,,,,,,,False,0.03 acres,,,,False,322922330074,False,False,,Residential-Single,,Condo,,,,,,,False,,,False,,,,['City Sewer/Connected'],,,,,,,,,,,True,False,,,,,St. Paul,,St. Paul,,St. Paul,,,False,Saint Paul,,,"[{'name': 'AmenitiesUnit', 'value': 'Kitchen Window'}, {'name': 'Fuel', 'value': 'Natural Gas'}, {'name': 'BathDesc', 'value': 'Main Floor Full Bath'}, {'name': 'PresentUse', 'value': 'Yearly'}, {'name': 'SpecialSearch', 'value': 'Main Floor Laundry, All Living Facilities on One Level'}, {'name': 'AmenitiesShared', 'value': 'Security Building'}, {'name': 'GarageDescription', 'value': 'Secured, Assigned, Other, Unassigned, More Parking Offsite for Fee, Contract Pkg Required'}, {'name': 'Water', 'value': 'City Water/Connected'}, {'name': 'HandicapAccess', 'value': 'Elevator'}]",55101,289 5th St E UNIT 405,Saint Paul,MN,44.950193,-93.085455,215333.0,SOLD,24,55101_220,"Recently sold: $215,333. Seller has secured a transferable contract at the Oxcart Parking Ramp just a half a block away from the unit. Seller will pay for 1 year of the buyers parking with offer. Open &amp; spacious SE corner facing condo that has stunning features which include exposed brick, massive timber beams, soaring 16' ceilings, over-sized windows &amp; a lofted bedroom/den. You can watch the Saints game from your living room! Conveniently located across the street from the Farmer's Market &amp; Mears Park!"
1,1,1,0,0,0,,,[],None,['Concrete'],['Forced air'],True,['Central'],True,"['Dishwasher', 'Microwave', 'Range / Oven', 'Refrigerator']",,,,False,False,,,1092.0,,,,"['Off street', 'On street']",1,,False,True,,False,,False,,,,0,,,False,False,,['Brick'],,,['City'],True,False,,,,,,,False,0.03 acres,,,,False,312922431484,False,False,,,,Condo,,,,,,,False,,,False,,,,,,,,,,,,,,,True,False,,Loft,,,,,,,,,,False,Saint Paul,,,"[{'name': 'Features', 'value': 'City'}, {'name': 'Features', 'value': 'City Water'}, {'name': 'Features', 'value': 'Over 50 Years Old'}]",55101,500 Robert St N UNIT 210,Saint Paul,MN,44.951075,-93.09393,179272.0,SOLD,24,55101_221,"Recently sold: $179,272. Live at the Rossmor downtown Saint Paul! Formerly the Foot, Schulze and Co. shoe factory, home of the Saint Paul arts scene, and in 2003 converted to residential loft condominiums. Loft has exposed brick walls and concrete floors, a large open space with 8'windows, 12' high ceilings, modern kitchen and bath. Convenient location near Lund's, Sawatdee, Tin Whiskers, Black Sheep Pizza. Free laundry every floor. Parking available behind and next to the building. Two light rail stops within 3 blocks."
0,1,0,0,0,0,,,[],None,,['Forced air'],True,['Central'],True,"['Dishwasher', 'Microwave', 'Range / Oven', 'Refrigerator']",,,,,False,,,613.0,,,,,,,False,,,False,,False,,,,0,,,,,,"['Brick', 'Stone']",,,,,,,,,,,,False,0.01 acres,,,,False,312922431369,False,False,,,,Condo,,,,,,,False,,,False,,,,,,,,,,,,,,,True,False,,,,,,,,,,,,False,Saint Paul,,,"[{'name': 'central_air_desc', 'value': 'Central A/C'}, {'name': 'roof_types', 'value': 'Unknown'}, {'name': 'architectural_style', 'value': 'High Rise'}, {'name': 'neighborhoods', 'value': 'Downtown'}, {'name': 'taxes_annual', 'value': '1457'}]",55101,500 Robert St N UNIT 310,Saint Paul,MN,44.951075,-93.09393,124000.0,SOLD,23,55101_222,"Recently sold: $124,000. Loft charm, stairs to upper storage area. Free laundry on each floor. Lunds/Byerly's and park across the street. Restaurants on first floor. Patio, grill area in back of building. Alternative parking available across the street.  Garage stall is rented for $70 per month."
0,1,1,0,0,0,,,[],None,['Concrete'],['Forced air'],True,['Central'],True,"['Dishwasher', 'Freezer', 'Microwave', 'Range / Oven', 'Refrigerator']",,,,False,False,,,1008.0,,,,"['Off street', 'On street']",1,,False,True,,False,,False,,,,7,,,False,False,,"['Brick', 'Stone']",,,"['City', 'Park']",True,False,,,,,,,False,0.02 acres,,,,False,312922431482,False,False,,Residential-Multi-Family,,Condo,,,,Other,,,False,2008,,False,,,,['City Sewer/Connected'],,,,,,,,,,,True,False,,Loft,,,St. Paul,,St. Paul,,St. Paul,,,False,Saint Paul,,,"[{'name': 'BathDesc', 'value': 'Main Floor Full Bath'}, {'name': 'FrontageFeet', 'value': 'Paved Streets, City, Curbs, Sidewalks'}, {'name': 'PresentUse', 'value': 'Yearly'}, {'name': 'SpecialSearch', 'value': 'All Living Facilities on One Level'}, {'name': 'Fuel', 'value': 'Other'}, {'name': 'Water', 'value': 'City Water/Connected'}, {'name': 'GarageDescription', 'value': 'Contract Pkg Required'}]",55101,500 Robert St N UNIT 208,Saint Paul,MN,44.951075,-93.09393,165878.0,SOLD,0,55101_223,"Recently sold: $165,878. Fantastic light-filled loft at the historic Rossmor building in the heart of St. Paul. Open layout w/12-foot ceilings, modern kitchen, and concrete floors.  Large hallways, patio for grilling. On site: Black Sheep Pizza, Keys Cafe, Sawatdee, and Tin Whiskers Brewery! Across the street from Lunds &amp; Byerly's! 2 blocks to light rail. Walking distance to the Saints Stadium, Farmer's Market, Darkhorse Brewery and many more. Parking options include the adjoining lot for $115/month and a ramp across the street."
