2,2,2,0,0,0,,,[],None,"['Hardwood', 'Tile']",['Forced air'],True,['Central'],True,"['Dryer', 'Microwave', 'Refrigerator', 'Washer']",,,,True,False,,,1541.0,,,,,,,False,,,False,,False,,,,1,,,,,,"['Brick', 'Stone']",,,,,,,,,,,,False,0.03 acres,,,,False,322922330334,False,False,,,,Condo,,,,,,,False,,,False,,,,,,,,,,,,,,,True,False,,,,,,,,,,,,False,Saint Paul,,,"[{'name': 'PRESENTUSE', 'value': 'Yearly'}, {'name': 'STATUS', 'value': 'Pending'}, {'name': 'TAXYEAR', 'value': '2018.00'}, {'name': 'ZONING', 'value': 'Residential-Single Family'}, {'name': 'CONSTRUCTIONSTATUS', 'value': 'Previously Owned'}, {'name': 'HEATINGDESCRIPTION', 'value': 'Forced Air'}, {'name': 'APPLIANCES', 'value': 'Range, Exhaust Fan/Hood, Refrigerator, Washer, Dryer, Microwave, Dishwasher'}, {'name': 'AMENITIESUNIT', 'value': 'Deck, Kitchen Window, Hardwood Floors, Tiled Floors'}, {'name': 'DININGROOMDESCRIPTION', 'value': 'Living/Dining Room, Eat In Kitchen'}, {'name': 'ROOMFLOOR1', 'value': 'Main'}, {'name': 'EXTERIOR', 'value': 'Brick/Stone'}, {'name': 'FUEL', 'value': 'Natural Gas'}, {'name': 'SEWER', 'value': 'City Sewer/Connected'}, {'name': 'WATER', 'value': 'City Water/Connected'}, {'name': 'AMENITIESSHARED', 'value': 'Elevator(s), Deck, Fire Sprinkler System, Common Garden'}, {'name': 'ASSOCFEEINCLUDES', 'value': 'Sanitation, Snow/Lawn Care, Outside Maintenance, Hazard Insurance, Water/Sewer, Building Exterior, Professional Mgmt, Shared Amenities, Cable TV, Snow Removal'}, {'name': 'SPECIALSEARCH', 'value': 'All Living Facilities on One Level'}, {'name': 'GARAGEDESCRIPTION', 'value': 'Heated Garage, Underground Garage'}, {'name': 'SHAREDROOMS', 'value': 'Amusement/Party Room, Exercise Room'}, {'name': 'STYLE', 'value': '(CC) High Rise (4+ Levels)'}, {'name': 'DAYSONMARKET', 'value': '12'}, {'name': 'DAYSONMARKETCUMULATIVE', 'value': '12'}, {'name': 'OFFMARKETDATE', 'value': '2019-04-30T14:04:00'}]",55101,270 4th St E UNIT 208,Saint Paul,MN,44.948697,-93.085118,427500.0,RECENTLY_SOLD,27,55101_50,"Recently sold: $427,500. This incredible condo has updates galore! The recently renovated, high-end kitchen has granite counter-tops, 10' cherry cabinets, stainless steel pro appliances, and an artisan glass back-splash. Other home highlights include full sized stacked washer &amp; dryer in-unit, teak floors, updated bathrooms, spacious rooms, a lovely deck and beautiful built-ins. Conveniently located across from the Lowertown Farmers' Market, &amp; close to the light rail, CHS Field and many other shops and dining options"
0,1,1,0,0,0,,,,None,,['Forced air'],True,['Central'],True,"['Dishwasher', 'Microwave', 'Range / Oven', 'Refrigerator']",,,,,False,,,1152.0,,,,,,,False,,,False,,False,,,,0,,,,,,['Brick'],,,,,,,,,,,,False,0.03 acres,,,,False,312922431427,False,False,,,,Condo,,,,,,,False,,,False,,,,,,,,,,,,,,,True,False,,,,,St. Paul #625,,St. Paul #625,,St. Paul #625,,,False,Saint Paul,,,[],55101,500 Robert St N UNIT 601,Saint Paul,MN,44.951075,-93.09393,225000.0,RECENTLY_SOLD,30,55101_51,"Recently sold: $225,000. Your urban lifestyle awaits! A truly RARE opportunity to own a corner unit in the Rossmor! Breathtaking 180 degree views of Lowertown, Saint Paul. Open Kitchen w/ stainless appliances, countertops, island and shelving. This is NOT your typical studio; Check out the custom built loft bed with walk-in closet below which also serves as entertainment center. There is so much to love about this place, you MUST see for yourself!"
1,1,1,0,0,0,,,,None,"['Carpet', 'Hardwood']",['Forced air'],True,['Central'],True,"['Dishwasher', 'Freezer', 'Garbage disposal', 'Microwave', 'Range / Oven', 'Refrigerator']",,,,False,False,,,720.0,,,,"['Attached Garage', 'Off street']",1,,False,True,,False,,False,,,,27,,,True,True,,"['Brick', 'Cement concrete', 'Stucco']",,,['City'],True,False,,,,,,,False,0.02 acres,,,,False,312922430579,False,False,,,,Condo,,,,,,,False,,,False,,,,,,,,,,,,,,,True,False,,,,,,,,,,,,False,Saint Paul,,,[],55101,66 9th St E #R1214,Saint Paul,MN,44.949276,-93.094898,140000.0,RECENTLY_SOLD,22,55101_52,"Recently sold: $140,000. Newly updated condo in the heart of downtown St. Paul is connected to the skyway and walking distance to many St. Paul attractions and the Light Rail. This charming condo has hardwood floors, stainless steel appliances, and granite counter tops. Easily accessible storage on same floor as unit. Other building amenities include rooftop deck with pool, fitness center, hot tub, sauna, and party room. Enjoy summer's warmth relaxing on your private balcony! Steep rent getting you down? Check out this affordably priced investment opportunity and start building equity!"
1,1,1,0,0,0,,,[],None,['Hardwood'],['Forced air'],True,['Central'],True,"['Exhaust Fan/Hood', 'Disposal']",,,,False,False,,,925.0,,,,['Attached Garage'],1,,False,True,,False,,False,,,,1,,,False,False,,"['Brick', 'Stone']",,,['City'],True,False,,,,,,,False,0.02 acres,,,,False,322922330339,False,False,,Residential-Multi-Family,,Condo,,,,,,,False,,,False,,,,['City Sewer/Connected'],,,,,,,,,,,True,False,,Contemporary,,,,,,,,,,False,Saint Paul,,,"[{'name': 'AmenitiesUnit', 'value': 'Balcony, Washer/Dryer Hookup'}, {'name': 'Fuel', 'value': 'Natural Gas'}, {'name': 'GarageDescription', 'value': 'Garage Door Opener, Heated Garage, Secured, Assigned'}, {'name': 'BathDesc', 'value': 'Main Floor Full Bath'}, {'name': 'FrontageFeet', 'value': 'Paved Streets, City, Curbs, Sidewalks'}, {'name': 'PresentUse', 'value': 'Yearly'}, {'name': 'SpecialSearch', 'value': 'Main Floor Laundry, Main Floor Bedroom, All Living Facilities on One Level'}, {'name': 'AmenitiesShared', 'value': 'Security Building'}, {'name': 'SharedRooms', 'value': 'Amusement/Party Rm, Exercise Room, Other'}, {'name': 'Water', 'value': 'City Water/Connected'}, {'name': 'HandicapAccess', 'value': 'Elevator, Doors 36&rdquo;&#43;'}, {'name': 'TaxYear', 'value': '2018.00'}]",55101,270 4th St E UNIT 304,Saint Paul,MN,44.948697,-93.085118,218000.0,RECENTLY_SOLD,0,55101_53,"Recently sold: $218,000. Right by the Farmers' Market! One block to Light Rail, Union Depot, CHS baseball field, dozens of restaurants and cafes! The best condo parking downtown. Newer building with tall ceilings and refined metal windows. The balcony faces Wall Street, with views of the Farmers' Market! Pristine condition, newly painted with an extra large in-unit laundry room. New microwave. HEATED parking stall a few yards from the lobby. (The garage is only two levels -- very clean and accessible.)Extra large laundry room in the condo, with a large capacity Washer/Dryer. Walk-in Closet. Workout room Community Room. Private Courtyard for the residents.  Nearly 10' ceilings! 36&quot; doors. This is a great building and location -- come see this Lowertown condo! The Farmers' Market is year-around, and a food market collaborative is one block away."
1,1,1,0,0,0,,,[],None,['Concrete'],['Forced air'],True,['Central'],True,"['Dishwasher', 'Freezer', 'Microwave', 'Range / Oven', 'Refrigerator']",,,,,False,,,1024.0,,,,['Off street'],,,False,,,False,,False,,,,1,,,,,,"['Brick', 'Stone']",,,,,,,,,,,,False,0.02 acres,,,,False,312922431490,False,False,,,,Single Family,,,,,,,False,,,False,,,,,,,,,,,,,,,True,False,,,,,,,,,,,,False,Saint Paul,,,"[{'name': 'PRESENTUSE', 'value': 'Yearly'}, {'name': 'STATUS', 'value': 'Pending'}, {'name': 'ZONING', 'value': 'Residential-Multi-Family'}, {'name': 'CONSTRUCTIONSTATUS', 'value': 'Previously Owned'}, {'name': 'HEATINGDESCRIPTION', 'value': 'Forced Air'}, {'name': 'FRONTAGEFEET', 'value': 'City'}, {'name': 'APPLIANCES', 'value': 'Range, Refrigerator, Microwave, Dishwasher, Freezer, Cooktop'}, {'name': 'ROOMFLOOR1', 'value': 'Main'}, {'name': 'FUEL', 'value': 'Electric'}, {'name': 'EXTERIOR', 'value': 'Brick/Stone'}, {'name': 'SEWER', 'value': 'City Sewer/Connected'}, {'name': 'WATER', 'value': 'City Water/Connected'}, {'name': 'AMENITIESSHARED', 'value': 'Elevator(s), Concrete Floors & Walls, Security Building, Fire Sprinkler System'}, {'name': 'BATHDESC', 'value': 'Main Floor Full Bath'}, {'name': 'AMENITIESUNIT', 'value': 'Walk-In Closet'}, {'name': 'ASSOCFEEINCLUDES', 'value': 'Sanitation, Snow/Lawn Care, Outside Maintenance, Hazard Insurance, Water/Sewer, Building Exterior, Snow Removal'}, {'name': 'DININGROOMDESCRIPTION', 'value': 'Kitchen/Dining Room'}, {'name': 'HANDICAPACCESS', 'value': 'Doors 36&rdquo;&#43;, Hallways 42&rdquo;&#43;, Elevator, Wheelchair Ramp'}, {'name': 'ROOF', 'value': 'Flat'}, {'name': 'STYLE', 'value': '(CC) High Rise (4+ Levels)'}, {'name': 'GARAGEDESCRIPTION', 'value': 'Uncovered/Open, Contract Pkg Required'}, {'name': 'TAXYEAR', 'value': '2019.00'}, {'name': 'DAYSONMARKET', 'value': '4'}, {'name': 'DAYSONMARKETCUMULATIVE', 'value': '4'}, {'name': 'OFFMARKETDATE', 'value': '2019-04-29T21:09:24'}]",55101,500 Robert St N UNIT 216,Saint Paul,MN,44.951075,-93.09393,197600.0,RECENTLY_SOLD,15,55101_54,"Recently sold: $197,600. "
2,2,1,0,1,0,,,[],None,"['Concrete', 'Hardwood']",['Forced air'],True,['Central'],True,['Disposal'],,,,False,False,,,1284.0,,,,['Attached Garage'],3,,False,True,,False,,False,,,,2,,,True,True,,"['Brick', 'Stone']",,,['City'],True,False,,,,,,,False,0.06 acres,,,,False,312922431504,False,False,,Residential-Multi-Family,,Condo,,,,,,,False,,,False,,,,['City Sewer/Connected'],,,,,,,,,,,True,False,,,,,,,,,,,,False,Saint Paul,,,"[{'name': 'AmenitiesUnit', 'value': 'Balcony, Washer/Dryer Hookup, Other, Indoor Sprinklers'}, {'name': 'BathDesc', 'value': 'Main Floor 1/2 Bath, Upper Level Full Bath'}, {'name': 'PresentUse', 'value': 'Yearly'}, {'name': 'AmenitiesShared', 'value': 'Security Building, Other'}, {'name': 'Fuel', 'value': 'Other'}, {'name': 'SharedRooms', 'value': 'Amusement/Party Rm, Exercise Room, Guest Suite, Club House, Play Area'}, {'name': 'Water', 'value': 'City Water/Connected'}, {'name': 'SpecialSearch', 'value': '2nd Floor Laundry'}, {'name': 'Roof', 'value': 'Other'}, {'name': 'TaxYear', 'value': '2017.00'}]",55101,78 10th St E #R3305,Saint Paul,MN,44.950602,-93.093275,310000.0,RECENTLY_SOLD,0,55101_55,"Recently sold: $310,000. RARE opportunity to own a BEAUTIFULLY finished 2 STORY LUXURY PENTHOUSE spanning the top 2 floors (33-34) of The Pointe of St Paul. The spacious main level is perfect for entertaining and boasts spectacular Mississippi River views! Watch sunrises and seasons change from the comfort of your own private balcony! This unit has secure elevator access, 2 large bedrooms, in unit laundry, ample closet space and 3 garage stalls! Walk or bike to everything exciting DOWNTOWN with all the comforts of home."
0,1,1,0,0,0,,,[],None,['Concrete'],['Forced air'],True,,,"['Exhaust Fan/Hood', 'Disposal']",,,,,False,,,505.0,,,,['Attached Garage'],,,False,,,False,,False,,,,0,,,,True,,"['Brick', 'Stone']",,,,,,,,,,,,False,,,,,False,312922430820,False,False,,Residential-Single Family,,Condo,,,,,,,False,,,False,,,,['City Sewer/Connected'],,,,,,,,,,,True,False,,,,,,,,,,,,False,Saint Paul,,,"[{'name': 'AmenitiesUnit', 'value': 'Balcony'}, {'name': 'Fuel', 'value': 'Natural Gas'}, {'name': 'GarageDescription', 'value': 'Garage Door Opener, Covered, Secured, Assigned'}, {'name': 'BathDesc', 'value': 'Main Floor Full Bath'}, {'name': 'PresentUse', 'value': 'Yearly'}, {'name': 'SpecialSearch', 'value': 'All Living Facilities on One Level'}, {'name': 'AmenitiesShared', 'value': 'Coin-op Laundry Owned, Security Building'}, {'name': 'FrontageFeet', 'value': 'City'}, {'name': 'SharedRooms', 'value': 'Exercise Room, Guest Suite, Amusement/Party Room'}, {'name': 'Water', 'value': 'City Water/Connected'}, {'name': 'HandicapAccess', 'value': 'Elevator'}, {'name': 'TaxYear', 'value': '2018.00'}, {'name': 'CONSTRUCTIONSTATUS', 'value': 'Previously Owned'}, {'name': 'Status', 'value': 'Active'}, {'name': 'AssocFeeIncludes', 'value': 'Shared Amenities, Sanitation, Snow/Lawn Care, Outside Maintenance, Building Exterior, Professional Mgmt, Water/Sewer, Security Staff, Parking Space, Hazard Insurance, Heating, Air Conditioning'}]",55101,78 10th St E #R1407,Saint Paul,MN,44.95061,-93.093283,136000.0,RECENTLY_SOLD,32,55101_56,"Recently sold: $136,000. EVERYTHING FRESHLY REDONE! This sun-drenched unit faces east for glorious sunrises and has impressive 14th floor views. Finished with absolute top quality materials such as luxury flooring with cork subfloor, granite countertops, solid cabinetry with soft-close and built in adjustable drawer organizers, all new solid doors, paint, ceilings, you name it! Incredible in-unit storage space and parking space. Amazing balcony. Most furniture can be included in sale if desired!"
1,1,1,0,0,0,,,[],None,['Concrete'],['Forced air'],True,['Central'],True,"['Exhaust Fan/Hood', 'Cooktop']",,,,False,False,,,983.0,,,,,,,False,,,False,,False,,,,1,,,False,False,,"['Brick', 'Stone']",,,,,False,,,,,,,False,0.02 acres,,,,False,312922431458,False,False,,Residential-Multi-Family,,Condo,,,,,,,False,,,False,,,,['City Sewer/Connected'],,,,,,,,,,,True,False,,,,,,,,,,,,False,Saint Paul,,,"[{'name': 'AmenitiesUnit', 'value': 'Indoor Sprinklers, Panoramic View, City View'}, {'name': 'Fuel', 'value': 'Natural Gas'}, {'name': 'PresentUse', 'value': 'Yearly'}, {'name': 'Water', 'value': 'City Water/Connected'}, {'name': 'GarageDescription', 'value': 'More Parking Onsite for Fee'}, {'name': 'HandicapAccess', 'value': 'Elevator'}, {'name': 'TaxYear', 'value': '2018.00'}, {'name': 'CONSTRUCTIONSTATUS', 'value': 'Previously Owned'}, {'name': 'Status', 'value': 'Active'}, {'name': 'AssocFeeIncludes', 'value': 'Sanitation, Snow/Lawn Care, Outside Maintenance, Building Exterior, Professional Mgmt, Water/Sewer, Hazard Insurance, Security System, Internet'}]",55101,500 Robert St N UNIT 711,Saint Paul,MN,44.951075,-93.09393,176000.0,RECENTLY_SOLD,1,55101_57,"Recently sold: $176,000. "
1,1,1,0,0,0,,,,None,['Tile'],['Forced air'],True,['Central'],True,"['Dishwasher', 'Dryer', 'Microwave', 'Range / Oven', 'Refrigerator']",,,,,False,,,918.0,,,,,1,,False,True,,False,,False,,,,1,,,,,,"['Brick', 'Stone']",,,,,,,,,,,,False,0.03 acres,,,,False,312922440474,False,False,,,,Condo,,,,Other,,,False,,,False,,,,,,,,,,,,,,,True,False,,Other,,,625 - St. Paul,,625 - St. Paul,,625 - St. Paul,,,False,Saint Paul,,,[],55101,445 Wacouta St UNIT 303,Saint Paul,MN,44.951184,-93.089494,185000.0,RECENTLY_SOLD,15,55101_58,"Recently sold: $185,000. Wonderful opportunity to own at ESSEX ON THE PARK!  This garden view condo has it all: Open floor plan, 10' ceilings, spacious bathroom, in unit laundry, large kitchen with a center island and gas range, plus HEATED PARKING STALL WITH OUTLET FOR ELECTRIC CAR CHARGING.  PRIME LOCATION! Steps from the best of Lowertown!  Parks, Bars, Breweries, Restaurants, Farmers Market, CHS Field, Light Rail, and Bike Trails.  Pet friendly!"
1,1,1,0,0,0,,,,None,,['Other'],True,['Central'],True,['Refrigerator'],,,,True,False,,,750.0,,,,,,,False,,,False,,False,,,,1,,,True,True,,['Brick'],,,,,False,,,,,,,False,0.02 acres,,,,False,312922430090,False,False,,,,Condo,,,,,,,False,,,False,,,,,,,,,,,,,,,True,False,,,,,St. Paul 625,,St. Paul 625,,St. Paul 625,,,False,Saint Paul,,,[],55101,66 9th St E #R1311,Saint Paul,MN,44.949276,-93.094898,130000.0,RECENTLY_SOLD,14,55101_59,"Recently sold: $130,000. Larger 1BR condo on the Skyway. Large balcony with wide patio doors o'looking the pool and patio filled with flowers. (The balcony is one floor above the patio). Owned gar. stall. Wood flrs. Free laundry on the same flr. Extra storage. Workout. Cable incl."
0,1,0,1,0,0,,,[],None,['Tile'],['Forced air'],True,['Central'],True,"['Dishwasher', 'Microwave', 'Range / Oven', 'Refrigerator']",,,,,False,,,1025.0,,,,,1,,False,True,,False,,False,,,,1,,,,,,"['Brick', 'Stone']",,,,,,,,,,,,False,0.02 acres,,,,False,312922431462,False,False,,Residential-Multi-Family,,Condo,,,,,,,False,,,False,,,,['City Sewer/Connected'],,,,,,,,,,,True,False,,,,,,,,,,,,False,Saint Paul,,,"[{'name': 'AmenitiesUnit', 'value': 'Indoor Sprinklers, Kitchen Center Island, Broadband Available, Panoramic View, Cable, City View'}, {'name': 'BathDesc', 'value': 'Main Floor 3/4 Bath'}, {'name': 'Fuel', 'value': 'Natural Gas'}, {'name': 'PresentUse', 'value': 'Yearly'}, {'name': 'SpecialSearch', 'value': 'Main Floor Laundry, Main Floor Bedroom, All Living Facilities on One Level'}, {'name': 'AmenitiesShared', 'value': 'Coin-op Laundry Owned, Security Building, Other'}, {'name': 'Water', 'value': 'City Water/Connected'}, {'name': 'HandicapAccess', 'value': 'Other, Roll&#45;In Shower, Elevator, Doors 36&rdquo;&#43;, Grab Bars In Bathroom, No Stairs Internal, Hallways 42&rdquo;&#43;'}, {'name': 'GarageDescription', 'value': 'Other, More Parking Onsite for Fee'}, {'name': 'SharedRooms', 'value': 'Other'}, {'name': 'TaxYear', 'value': '2019.00'}, {'name': 'CONSTRUCTIONSTATUS', 'value': 'Previously Owned'}, {'name': 'Status', 'value': 'Active'}, {'name': 'AssocFeeIncludes', 'value': 'Other, Shared Amenities, Sanitation, Snow/Lawn Care, Outside Maintenance, Building Exterior, Water/Sewer, Hazard Insurance, Security System, Snow Removal'}]",55101,500 Robert St N UNIT 715,Saint Paul,MN,44.951075,-93.09393,190000.0,RECENTLY_SOLD,36,55101_60,"Recently sold: $190,000. TOP FLOOR OF THE ROSSMORE BUILDING! STUNNING CAPITOL VIEWS!  QUITE POSSIBLY THE BEST VIEW IN THIS BUILDING! SOARING CEILINGS AND WINDOWS! LARGE OPEN SPACE WITH ONE THOUSAND TWENTY FIVE SQUARE FEET! LARGE WINDOWS! GREAT LIGHTING! NICE BIG BATHROOM WITH WALK-IN SHOWER AND BIG CLOSET! LIVE HERE, PLAY HERE, WORK HERE! THIS IS AN INCREDIBLE OPPORTUNITY! THIS IS IN FANTASTIC CONDITION! NEW PAINT and  FLOORS POLISHED! Great location across from L&amp;B Grocery, restaurants, coffee, bars, Pedro Park and light rail! Enjoy the best of Saint Paul: The Arts, Farmers Market, bars/restaurants/breweries, theaters, library, Union Depot, Mississippi River, bike trail, CHS Field, parks, bike path, W 7th and Xcel Energy Center &amp; MORE, quick walk to sky-way access, great freeway access &amp; transportation. Pet Friendly! New Park coming! WALK SCORE 95! THIS IS THE ONE!"
1,1,0,0,0,0,,,,None,['Hardwood'],['Other'],True,['Central'],True,"['Dishwasher', 'Microwave', 'Range / Oven', 'Refrigerator']",,,,False,False,,,661.0,,,,['Off street'],,,False,,,False,,False,,,,1,,,False,False,,['Brick'],,,,,False,,,,,,,False,0.01 acres,,,,False,312922430695,False,False,,,,Condo,,,,,,,False,2003,,False,,,,,,,,,,,,,,,True,False,,,,,St. Paul #625,,St. Paul #625,,St. Paul #625,,,False,Saint Paul,,,[],55101,523 Jackson St APT 204,Saint Paul,MN,44.952122,-93.093518,132000.0,RECENTLY_SOLD,7,55101_61,"Recently sold: $132,000. Walk in to this upgraded 626sq. feet 1 bedroom with 1 bath condo located in the heart of St. Paul and steps away from the future light rail station and Mears Park! This condo has an open floor plan with newer hardwood floors and exposed brick walls. The open kitchen has a center island, oversized cabinets, granite counter tops and newer appliances. Large floor to ceiling windows brings in natural sunlight throughout the day and brick walls give the true loft feel with ceilings. Walk to restaurants, shops, and work etc. Available May 1st. Fitness room, separate 6x10 storage area and laundry on site. 1 off-street reserve parking place #12 included. Application fee $40/adult in-state or $60 out of state. Trash, water, sewer, snow and lawn care and fitness room included in rent. Tenant responsible for gas and electric. Move in/0ut fee of $50. Please call 612-245-0088 for a showing. Pets allowed under 40lbs (1 dog limit) or 2 cats. Pet fee $250."
1,1,1,0,0,0,,,[],None,,['Forced air'],True,['Central'],True,"['Dishwasher', 'Garbage disposal', 'Microwave', 'Range / Oven']",,,,,False,,,750.0,,,,['Attached Garage'],,,False,,,False,,False,,,,0,,,,,,"['Brick', 'Stone']",,,,,,,,,,,,False,0.02 acres,,,,False,312922430206,False,False,,,,Single Family,,,,,,,False,,,False,,,,,,,,,,,,,,,True,False,,,,,St. Paul - 625,,St. Paul - 625,,St. Paul - 625,,,False,Saint Paul,,,"[{'name': 'PRESENTUSE', 'value': 'Yearly'}, {'name': 'STATUS', 'value': 'Pending'}, {'name': 'TAXYEAR', 'value': '2018.00'}, {'name': 'ZONING', 'value': 'Residential-Multi-Family'}, {'name': 'CONSTRUCTIONSTATUS', 'value': 'Previously Owned'}, {'name': 'GARAGEDESCRIPTION', 'value': 'Attached Garage, Garage Door Opener, Assigned'}, {'name': 'HEATINGDESCRIPTION', 'value': 'Forced Air'}, {'name': 'APPLIANCES', 'value': 'Range, Refrigerator, Microwave, Dishwasher, Disposal'}, {'name': 'ROOMFLOOR1', 'value': 'Main'}, {'name': 'EXTERIOR', 'value': 'Brick/Stone'}, {'name': 'FUEL', 'value': 'Natural Gas'}, {'name': 'SEWER', 'value': 'City Sewer/Connected'}, {'name': 'WATER', 'value': 'City Water/Connected'}, {'name': 'AMENITIESSHARED', 'value': 'Hot Tub, Sauna, Elevator(s), Deck, Security Building'}, {'name': 'AMENITIESUNIT', 'value': 'Balcony'}, {'name': 'BATHDESC', 'value': 'Main Floor Full Bath'}, {'name': 'ASSOCFEEINCLUDES', 'value': 'Heating, Air Conditioning, Sanitation, Snow/Lawn Care, Outside Maintenance, Hazard Insurance, Water/Sewer, Building Exterior, Professional Mgmt, Shared Amenities, Cable TV, Parking Space, Security Staff'}, {'name': 'SPECIALSEARCH', 'value': 'Main Floor Bedroom, All Living Facilities on One Level'}, {'name': 'HANDICAPACCESS', 'value': 'Elevator'}, {'name': 'SHAREDROOMS', 'value': 'Amusement/Party Room, Exercise Room'}, {'name': 'STYLE', 'value': '(CC) High Rise (4+ Levels)'}, {'name': 'DAYSONMARKET', 'value': '19'}, {'name': 'DAYSONMARKETCUMULATIVE', 'value': '19'}, {'name': 'OFFMARKETDATE', 'value': '2019-04-02T13:09:20'}]",55101,66 9th St E #R2111,Saint Paul,MN,44.949276,-93.094898,134900.0,RECENTLY_SOLD,22,55101_62,"Recently sold: $134,900. Great views and great walkability!  Spacious one bedroom condo with updated kitchen and flooring.  Enjoy the ease of condo living with great amenities.  Beautiful southern views of the city from the balcony.  Parking garage and additional storage unit.  Skyway connected and convenient to shopping and restaurants.  Urban living at it's best!"
1,1,1,0,0,0,,,[],None,['Concrete'],"['Forced air', 'Other']",True,['Central'],True,"['Dishwasher', 'Dryer', 'Microwave', 'Range / Oven', 'Refrigerator', 'Washer']",,,,,False,,,815.0,,,,['Attached Garage'],1,,False,True,,False,,False,,,,1,,,,,,"['Brick', 'Stone']",,,,,,,,,,,,False,0.02 acres,,,,False,312922440669,False,False,,Residential-Single Family,,Condo,,,,,,,False,,,False,,,,['City Sewer/Connected'],,,,,,,,,,,True,False,,,,,625,,625,,625,,,False,Saint Paul,,,"[{'name': 'AmenitiesUnit', 'value': 'Natural Woodwork, Washer/Dryer Hookup, Indoor Sprinklers'}, {'name': 'Fuel', 'value': 'Natural Gas, Other'}, {'name': 'GarageDescription', 'value': 'Garage Door Opener, Covered, Secured, Assigned'}, {'name': 'BathDesc', 'value': 'Main Floor Full Bath'}, {'name': 'HeatingDescription', 'value': 'Other'}, {'name': 'PresentUse', 'value': 'Yearly'}, {'name': 'SpecialSearch', 'value': 'Main Floor Laundry, Main Floor Bedroom, All Living Facilities on One Level'}, {'name': 'AmenitiesShared', 'value': 'Security Building'}, {'name': 'Roof', 'value': 'Age Over 8 Years, Flat'}, {'name': 'SharedRooms', 'value': 'Exercise Room, Amusement/Party Room'}, {'name': 'Water', 'value': 'City Water/Connected'}, {'name': 'FrontageFeet', 'value': 'Sidewalks'}, {'name': 'HandicapAccess', 'value': 'Elevator'}, {'name': 'TaxYear', 'value': '2018.00'}, {'name': 'CONSTRUCTIONSTATUS', 'value': 'Previously Owned'}, {'name': 'Status', 'value': 'Active'}, {'name': 'AssocFeeIncludes', 'value': 'Shared Amenities, Sanitation, Snow/Lawn Care, Outside Maintenance, Building Exterior, Professional Mgmt, Water/Sewer, Parking Space, Hazard Insurance, Heating, Air Conditioning, Cable TV, Internet'}]",55101,406 Wacouta St UNIT 401,Saint Paul,MN,44.950638,-93.087585,215000.0,RECENTLY_SOLD,0,55101_63,"Recently sold: $215,000. Inviting long foyer featuring brick wall and corner closet. True historic loft with exposed brick and beams. Large closet in bedroom, full bath w/laundry. Maple cabinets with granite counter-tops and snack-bar. End unit with brick on 3 walls. Quiet corner, close to elevator and stairs. Sky-way access on 2nd floor, community room, exercise room, across from Mears Park. Walk to Farmers Mkt, CHS field, art galleries, light rail and many restaurants. 2 big dogs ok. Lowertown is a great walk-able community!"
