3,2,1,0,1,0,,,,,,['Forced air'],True,,,"['Dishwasher', 'Dryer', 'Garbage disposal']",,,,True,False,,,1684.0,,,,['Attached Garage'],,,False,,,False,,False,,,,0,,,,,,,,,,,,,,,,,,False,0.16 acres,,,,False,421400004220,False,False,,,,Single Family,,,,Asphalt,,,False,1978,,False,,,,,,,,,,,,,,,True,False,,,,,197 - West St. Paul-Mendota Hts.,,197 - West St. Paul-Mendota Hts.,,197 - West St. Paul-Mendota Hts.,,,False,West Saint Paul,,,[],55118,17 Imperial Dr E,West Saint Paul,MN,44.905729,-93.084368,285000.0,RECENTLY_SOLD,30,55118_150,"Recently sold: $285,000. ONLY BACK AVAILABLE DUE TO LAST MINUTE BUYER FINANCING FALL THRU!!! Welcome home! This charming home features 3 beds (all on main floor) and 2 bathrooms. Hardwood floors can be found throughout. Bright kitchen w/ tile backsplash &amp; brick accent wall. Both living areas boast brick fireplaces. Enjoy a spacious four season porch all year long and a nicely sized deck overlooking the fenced in back yard! The finished lower level offers additional living space. Oversized 2 car garage and shed out back offer plenty of extra storage. Wonderful &amp; convenient West Saint Paul location!"
3,1,1,0,0,0,,,[],,['Hardwood'],['Forced air'],True,,,"['Dryer', 'Microwave', 'Refrigerator', 'Washer']",,,,,False,,,912.0,,,,['Detached Garage'],2,,False,True,,False,,False,,,,1,,,,,,['Vinyl'],,,,,,,,,,,,False,0.12 acres,,,,False,424350001020,False,False,,,,Single Family,,,,Asphalt,,,False,1962,,False,,,,,,,,,,,,,,,True,False,,,,,,,,,,,,False,West Saint Paul,,,"[{'name': 'PRESENTUSE', 'value': 'Yearly'}, {'name': 'STATUS', 'value': 'Pending'}, {'name': 'ZONING', 'value': 'Residential-Single Family'}, {'name': 'FRONTAGEFEET', 'value': 'Paved Streets, Curbs, City, Sidewalks'}, {'name': 'BASEMENT', 'value': 'Full, Concrete Block'}, {'name': 'CONSTRUCTIONSTATUS', 'value': 'Previously Owned'}, {'name': 'GARAGEDESCRIPTION', 'value': 'Detached Garage, Garage Door Opener, Driveway - Asphalt'}, {'name': 'HEATINGDESCRIPTION', 'value': 'Forced Air'}, {'name': 'APPLIANCES', 'value': 'Range, Refrigerator, Washer, Dryer, Microwave'}, {'name': 'ROOMFLOOR1', 'value': 'Main'}, {'name': 'ROOF', 'value': 'Asphalt Shingles'}, {'name': 'FUEL', 'value': 'Natural Gas'}, {'name': 'SEWER', 'value': 'City Sewer/Connected'}, {'name': 'WATER', 'value': 'City Water/Connected'}, {'name': 'AMENITIESUNIT', 'value': 'Patio, Hardwood Floors, Washer/Dryer Hookup'}, {'name': 'BATHDESC', 'value': 'Main Floor Full Bath'}, {'name': 'SPECIALSEARCH', 'value': 'Main Floor Bedroom'}, {'name': 'DININGROOMDESCRIPTION', 'value': 'Separate/Formal Dining Room'}, {'name': 'FENCE', 'value': 'Chain Link, Partial'}, {'name': 'TAXYEAR', 'value': '2019.00'}, {'name': 'DAYSONMARKET', 'value': '27'}, {'name': 'DAYSONMARKETCUMULATIVE', 'value': '27'}, {'name': 'OFFMARKETDATE', 'value': '2019-08-22T10:51:08'}]",55118,120 Bernard St E,West Saint Paul,MN,44.915751,-93.079891,178000.0,RECENTLY_SOLD,16,55118_151,"Recently sold: $178,000. Adorable 3BR home with so much potential! Beautiful hardwood floors throughout the main level! An unfinished lower level and attic space are just waiting to be finished to add square footage. A full privacy fence surrounding a charming backyard oasis, and so close to everything! With this house, you truly are getting the best of both worlds! You don't want to miss this one!"
2,1,1,0,0,0,,,[],,,['Forced air'],True,,,"['Range', 'Microwave', 'Exhaust Fan/Hood', 'Refrigerator', 'Washer', 'Dryer']",,,,,False,,,1000.0,,,,['Attached Garage'],,,False,,,False,,False,,,,1,,,,,,['Vinyl'],,,,,,,,,,,,False,,,,,False,424865005141,False,False,,Residential-Single Family,,Condo,,,,,,,False,,,False,,,,['City Sewer/Connected'],,,,,,,,,,,True,False,,,,,,,,,,,,False,West Saint Paul,,,"[{'name': 'AmenitiesUnit', 'value': 'Deck, Master Bedroom Walk-In Closet'}, {'name': 'DiningRoomDescription', 'value': 'Informal Dining Room'}, {'name': 'Fuel', 'value': 'Natural Gas'}, {'name': 'Exterior', 'value': 'Vinyl'}, {'name': 'GarageDescription', 'value': 'Attached Garage, Driveway - Asphalt'}, {'name': 'HeatingDescription', 'value': 'Forced Air'}, {'name': 'PresentUse', 'value': 'Yearly'}, {'name': 'Roof', 'value': 'Age 8 Years or Less'}, {'name': 'Water', 'value': 'City Water/Connected'}, {'name': 'TaxYear', 'value': '2019.00'}, {'name': 'CONSTRUCTIONSTATUS', 'value': 'Previously Owned'}, {'name': 'Status', 'value': 'Active'}, {'name': 'AssocFeeIncludes', 'value': 'Sanitation, Outside Maintenance, Professional Mgmt, Water/Sewer, Hazard Insurance, Snow Removal, Lawn Care'}]",55118,1913 Fox Ridge Dr APT C,West Saint Paul,MN,44.888787,-93.083791,152000.0,RECENTLY_SOLD,0,55118_152,"Recently sold: $152,000. "
4,4,2,1,1,0,,,,Partially finished,"['Carpet', 'Hardwood', 'Tile']",['Forced air'],True,['Central'],True,"['Dishwasher', 'Dryer', 'Garbage disposal', 'Microwave', 'Range / Oven', 'Refrigerator', 'Washer']",,,,True,False,,,5244.0,,,,['Attached Garage'],3,,False,True,,False,,False,,,,2,,,False,False,,"['Stucco', 'Wood']",,,['City'],True,False,,,,,,,False,0.6 acres,,,,False,277127503020,False,False,,,,Single Family,,,,Asphalt,,,False,1980,,False,,,,,,,,,,,,,,,True,False,,Tudor,,,,,,,,,,False,Mendota Heights,,,[],55118,1598 Diane Rd,Mendota Heights,MN,44.897891,-93.135644,499900.0,RECENTLY_SOLD,0,55118_153,"Recently sold: $499,900. English Tudor design. Backyard abuts local horse and pony farm. 10-minutes from downtown St. Paul; 15-minutes from downtown Minneapolis. Pride of ownership throughout."
3,3,1,2,0,0,,,[],,,['Forced air'],True,,,"['Dishwasher', 'Dryer', 'Microwave', 'Range / Oven', 'Refrigerator', 'Washer']",,,,,False,,,1834.0,,,,['Attached Garage'],1,,False,True,,False,,False,,,,,,,,,,['Stucco'],,,,,,,,,,,,False,0.05 acres,,,,False,421717501170,False,False,,,,Single Family,,,,Asphalt,,,False,1984,,False,,,,,,,,,,,,,,,True,False,,,,,,,,,,,,False,West Saint Paul,,,"[{'name': 'PRESENTUSE', 'value': 'Yearly'}, {'name': 'STATUS', 'value': 'Pending'}, {'name': 'ZONING', 'value': 'Residential-Single Family'}, {'name': 'FRONTAGEFEET', 'value': 'Paved Streets, Private, No Outlet/Dead End'}, {'name': 'BASEMENT', 'value': 'Full, Finished (Livable)'}, {'name': 'CONSTRUCTIONSTATUS', 'value': 'Previously Owned'}, {'name': 'HEATINGDESCRIPTION', 'value': 'Forced Air'}, {'name': 'APPLIANCES', 'value': 'Range, Refrigerator, Washer, Dryer, Microwave, Dishwasher'}, {'name': 'GARAGEDESCRIPTION', 'value': 'Driveway - Asphalt, Tuckunder Garage, Other'}, {'name': 'ROOMFLOOR1', 'value': 'Main'}, {'name': 'ROOF', 'value': 'Asphalt Shingles'}, {'name': 'FUEL', 'value': 'Natural Gas'}, {'name': 'SEWER', 'value': 'City Sewer/Connected'}, {'name': 'WATER', 'value': 'City Water/Connected'}, {'name': 'BATHDESC', 'value': 'Main Floor Full Bath, 3/4 Basement, 3/4 Master'}, {'name': 'DININGROOMDESCRIPTION', 'value': 'Informal Dining Room'}, {'name': 'ASSOCFEEINCLUDES', 'value': 'Sanitation, Snow/Lawn Care, Outside Maintenance, Shared Amenities'}, {'name': 'EXTERIOR', 'value': 'Stucco'}, {'name': 'STYLE', 'value': '(TH) Side x Side'}, {'name': 'AMENITIESSHARED', 'value': 'Other'}, {'name': 'TAXYEAR', 'value': '2019.00'}, {'name': 'DAYSONMARKET', 'value': '16'}, {'name': 'DAYSONMARKETCUMULATIVE', 'value': '16'}, {'name': 'OFFMARKETDATE', 'value': '2019-08-09T21:35:17'}]",55118,2012 Charlton Rdg,West Saint Paul,MN,44.885335,-93.098823,242000.0,RECENTLY_SOLD,0,55118_154,"Recently sold: $242,000. "
3,3,1,1,1,0,,,[],,,['Forced air'],True,,,"['Dryer', 'Microwave', 'Range / Oven', 'Refrigerator', 'Washer']",,,,,False,,,3016.0,,,,['Attached Garage'],2,,False,True,,False,,False,,,,,,,,,,['Wood'],,,,,,,,,,,,False,0.08 acres,,,,False,244495010010,False,False,,,,Single Family,,,,,,,False,1985,,False,,,,,,,,,,,,,,,True,False,,,,,,,,,,,,False,Mendota Heights,,,"[{'name': 'PRESENTUSE', 'value': 'Yearly'}, {'name': 'STATUS', 'value': 'Pending'}, {'name': 'ZONING', 'value': 'Residential-Single Family'}, {'name': 'BASEMENT', 'value': 'Full, Finished (Livable), Egress Windows, Daylight/Lookout Windows, Walkout'}, {'name': 'CONSTRUCTIONSTATUS', 'value': 'Previously Owned'}, {'name': 'GARAGEDESCRIPTION', 'value': 'Attached Garage, Driveway - Asphalt'}, {'name': 'HEATINGDESCRIPTION', 'value': 'Forced Air'}, {'name': 'FRONTAGEFEET', 'value': 'City'}, {'name': 'APPLIANCES', 'value': 'Range, Refrigerator, Washer, Dryer, Microwave, Cooktop'}, {'name': 'FIREPLACELOC', 'value': 'Gas Burning, Family Room, Wood Burning'}, {'name': 'DININGROOMDESCRIPTION', 'value': 'Living/Dining Room, Informal Dining Room'}, {'name': 'ROOMFLOOR1', 'value': 'Main'}, {'name': 'SPECIALSEARCH', 'value': 'Main Floor Laundry, Main Floor Bedroom'}, {'name': 'FUEL', 'value': 'Natural Gas'}, {'name': 'HANDICAPACCESS', 'value': 'No Stairs External'}, {'name': 'SEWER', 'value': 'City Sewer/Connected'}, {'name': 'WATER', 'value': 'City Water/Connected'}, {'name': 'AMENITIESUNIT', 'value': 'Patio, Kitchen Window, Ceiling Fan(s), Walk-In Closet, Master Bedroom Walk-In Closet, Main Floor Master Bedroom, Kitchen Center Island'}, {'name': 'BATHDESC', 'value': 'Main Floor Full Bath, Private Master, 3/4 Master'}, {'name': 'ASSOCFEEINCLUDES', 'value': 'Snow/Lawn Care, Outside Maintenance, Building Exterior, Snow Removal'}, {'name': 'EXTERIOR', 'value': 'Wood'}, {'name': 'POOLDESCRIPTION', 'value': 'Shared, Below Ground'}, {'name': 'STYLE', 'value': '(TH) Side x Side'}, {'name': 'ROOF', 'value': 'Shakes'}, {'name': 'TAXYEAR', 'value': '2019.00'}, {'name': 'DAYSONMARKET', 'value': '53'}, {'name': 'DAYSONMARKETCUMULATIVE', 'value': '53'}, {'name': 'OFFMARKETDATE', 'value': '2019-07-20T06:08:44'}]",55118,1775 Lexington Ave S APT 15,Mendota Heights,MN,44.893504,-93.148312,340000.0,RECENTLY_SOLD,0,55118_155,"Recently sold: $340,000. "
1,2,1,1,0,0,,,[],Full,['Laminate'],['Forced air'],True,['Central'],True,"['Dishwasher', 'Dryer', 'Garbage disposal', 'Microwave', 'Range / Oven', 'Refrigerator', 'Washer']",,,,True,False,,,1340.0,,,,['Attached Garage'],2,,False,True,,False,,False,,,,1,,,False,,,['Brick'],,,['Water'],True,True,,,,,,,False,,,,,False,246310000110,False,False,,Residential-Multi-Family,,Condo,,,,Built up,,,False,,,False,,,,['City Sewer/Connected'],,,,,,,,,,,True,False,,Other,,,197,,197,,197,,,False,Mendota Heights,,,"[{'name': 'Exterior', 'value': 'Brick/Stone'}, {'name': 'Fuel', 'value': 'Natural Gas, Electric'}, {'name': 'GarageDescription', 'value': 'Garage Door Opener, Heated Garage, Underground Garage, Driveway - Concrete'}, {'name': 'HeatingDescription', 'value': 'Forced Air'}, {'name': 'PresentUse', 'value': 'Yearly'}, {'name': 'Water', 'value': 'City Water/Connected'}, {'name': 'TaxYear', 'value': '2019.00'}, {'name': 'CONSTRUCTIONSTATUS', 'value': 'Previously Owned'}, {'name': 'Status', 'value': 'Active'}, {'name': 'AssocFeeIncludes', 'value': 'Other, Shared Amenities, Sanitation, Snow/Lawn Care, Outside Maintenance, Building Exterior, Professional Mgmt, Water/Sewer, Security Staff, Hazard Insurance, Security System'}]",55118,1077 Sibley Memorial Hwy APT 207,Mendota Heights,MN,44.897332,-93.145306,300000.0,RECENTLY_SOLD,20,55118_156,"Recently sold: $300,000. Beautifully remodeled riverfront condo.  1 bedroom, den , 2 bathrooms, in unit laundry.  Two garage stalls, sided by side with storage units.  There is an enclosed porch with nice views of the river and green spaces.

Building amenities:  Professional staff on site.  Indoor pool, hot tub, exercise rooms, tennis courts, beautiful and relaxing party room, rec room, library and pool patio.

The condo is close to both Minneapolis and St. Paul, and minutes from the airport."
3,1,1,0,0,0,,,[],,,['Forced air'],True,,,"['Dishwasher', 'Dryer', 'Microwave', 'Range / Oven', 'Refrigerator']",,,,False,False,,,1050.0,,,,['Attached Garage'],1,,False,True,,False,,False,,,,0,,,False,False,,['Stucco'],,,,,False,,,,,,,False,0.17 acres,,,,False,423400202060,False,False,,,,Single Family,,,,Asphalt,,,False,1976,,False,,,,,,,,,,,,,,,True,False,,,,,,,,,,,,False,West Saint Paul,,,"[{'name': 'PRESENTUSE', 'value': 'Yearly'}, {'name': 'STATUS', 'value': 'Pending'}, {'name': 'TAXYEAR', 'value': '2018.00'}, {'name': 'ZONING', 'value': 'Residential-Single Family'}, {'name': 'BASEMENT', 'value': 'Full, Sump Pump, Drain Tiled'}, {'name': 'CONSTRUCTIONSTATUS', 'value': 'Previously Owned'}, {'name': 'GARAGEDESCRIPTION', 'value': 'Attached Garage, Garage Door Opener'}, {'name': 'HEATINGDESCRIPTION', 'value': 'Forced Air'}, {'name': 'FRONTAGEFEET', 'value': 'City'}, {'name': 'APPLIANCES', 'value': 'Range, Refrigerator, Washer, Dryer, Microwave, Dishwasher'}, {'name': 'FIREPLACELOC', 'value': 'Living Room, Wood Burning'}, {'name': 'AMENITIESUNIT', 'value': 'Deck, Kitchen Window, Washer/Dryer Hookup, Vaulted Ceiling(s)'}, {'name': 'ROOMFLOOR1', 'value': 'Main'}, {'name': 'ROOF', 'value': 'Asphalt Shingles'}, {'name': 'FUEL', 'value': 'Natural Gas'}, {'name': 'SEWER', 'value': 'City Sewer/Connected'}, {'name': 'WATER', 'value': 'City Water/Connected'}, {'name': 'BATHDESC', 'value': 'Main Floor Full Bath, 1/2 Basement'}, {'name': 'DININGROOMDESCRIPTION', 'value': 'Eat In Kitchen'}, {'name': 'EXTERIOR', 'value': 'Stucco'}, {'name': 'OUTBUILDINGS', 'value': 'Storage Shed'}, {'name': 'FENCE', 'value': 'Full, Chain Link'}, {'name': 'DAYSONMARKET', 'value': '9'}, {'name': 'DAYSONMARKETCUMULATIVE', 'value': '9'}, {'name': 'OFFMARKETDATE', 'value': '2019-07-12T11:03:39'}]",55118,235 Arion St E,West Saint Paul,MN,44.91445,-93.075191,200000.0,RECENTLY_SOLD,70,55118_157,"Recently sold: $200,000. This charming 3BR/1BA home features a spacious upstairs bedroom, an adorable galley kitchen, and a large sliding-glass door that leads out to a nice deck. Nice space in the backyard with a fire pit and a storage shed. Conveniently located close to Hwy 52. Great starter home!"
5,3,2,0,1,0,,,[],,['Hardwood'],['Forced air'],True,,,"['Dishwasher', 'Dryer', 'Freezer', 'Range / Oven', 'Refrigerator']",,,,True,False,,,2991.0,,,,['Attached Garage'],,,False,,,False,,False,,,,0,,,,,,,,,,,,,,,,,,False,0.74 acres,,,,False,277115014050,False,False,,,,Single Family,,,,Asphalt,,,False,1979,,False,,,,,,,,,,,,,,,True,False,,,,,,,,,,,,False,Mendota Heights,,,"[{'name': 'PRESENTUSE', 'value': 'Yearly'}, {'name': 'STATUS', 'value': 'Pending'}, {'name': 'ZONING', 'value': 'Residential-Single Family'}, {'name': 'BASEMENT', 'value': 'Full'}, {'name': 'CONSTRUCTIONSTATUS', 'value': 'Previously Owned'}, {'name': 'GARAGEDESCRIPTION', 'value': 'Attached Garage, Driveway - Asphalt'}, {'name': 'HEATINGDESCRIPTION', 'value': 'Forced Air'}, {'name': 'FRONTAGEFEET', 'value': 'City'}, {'name': 'APPLIANCES', 'value': 'Range, Refrigerator, Washer, Dryer, Dishwasher, Freezer, Furnace Humidifier'}, {'name': 'FIREPLACELOC', 'value': 'Living Room, Gas Burning'}, {'name': 'BATHDESC', 'value': 'Main Floor 3/4 Bath, Upper Level Full Bath, Basement'}, {'name': 'ROOMFLOOR1', 'value': 'Main'}, {'name': 'ROOF', 'value': 'Asphalt Shingles, Age Over 8 Years'}, {'name': 'FUEL', 'value': 'Natural Gas'}, {'name': 'SEWER', 'value': 'City Sewer/Connected'}, {'name': 'WATER', 'value': 'City Water/Connected'}, {'name': 'AMENITIESUNIT', 'value': 'Patio, Kitchen Window, Hardwood Floors, Washer/Dryer Hookup, Walk-In Closet, In-Ground Sprinkler, Master Bedroom Walk-In Closet, Cable'}, {'name': 'SPECIALSEARCH', 'value': '3 BR on One Level'}, {'name': 'DININGROOMDESCRIPTION', 'value': 'Eat In Kitchen, Separate/Formal Dining Room'}, {'name': 'EXTERIOR', 'value': 'Fiber Board'}, {'name': 'MULTIPIDYN', 'value': 'Yes'}, {'name': 'OUTBUILDINGS', 'value': 'Storage Shed'}, {'name': 'FENCE', 'value': 'Chain Link'}, {'name': 'TAXYEAR', 'value': '2019.00'}, {'name': 'DAYSONMARKET', 'value': '12'}, {'name': 'DAYSONMARKETCUMULATIVE', 'value': '12'}, {'name': 'OFFMARKETDATE', 'value': '2019-08-15T13:40:54'}]",55118,26 Dorset Rd,Mendota Heights,MN,44.906407,-93.109319,449900.0,RECENTLY_SOLD,37,55118_158,"Recently sold: $449,900. Situated on a beautiful double lot with mature trees, this 5 bedroom 3 bathroom home offers comfort and style with outdoor living and serene views! This charming home features a spacious living room with beautiful hardwood floors, a cozy gas-fireplace with stone surround and tons of natural light. Off of the living room is the formal dining room with lovely built in cabinets. The updated kitchen offers stainless steel appliances, tile backsplash and plenty of cabinet &amp; counter space!  You will love the upper level full bathroom featuring a separate dressing room &amp; closet with built-in vanity. Located blocks from Somerset Country Club, Wentworth Park &amp; the Mississippi River with easy access to 35E and downtown Saint Paul. Beautiful home inside and out!"
4,2,2,0,0,0,,,,Unfinished,"['Carpet', 'Hardwood', 'Tile']",,,,,"['Dryer', 'Microwave', 'Range / Oven', 'Refrigerator', 'Washer']",,,,True,False,,,2100.0,,,,['Detached Garage'],1,,False,True,,False,,False,,,,2,,,False,False,,['Stucco'],,,,,False,,,,,,,False,0.16 acres,,,,False,424810006050,False,False,,,,Multi Family,,,,Asphalt,,,False,1954,,False,,,,,,,,,,,,,,,True,False,,,,,West St. Paul-Mendota Hts. #197,,West St. Paul-Mendota Hts. #197,,West St. Paul-Mendota Hts. #197,,,False,West Saint Paul,,,[],55118,963 Gorman Ave,West Saint Paul,MN,44.917229,-93.084023,280000.0,RECENTLY_SOLD,0,55118_159,"Recently sold: $280,000. "
3,2,0,0,0,0,,,,,['Hardwood'],,,['Central'],True,,,,,,False,,,1620.0,,,,['Detached Garage'],2,,False,True,,False,,False,,,,1,,,,,,['Stucco'],,,,,,,,,,,,False,0.17 acres,,,,False,426670000121,False,False,,,,Single Family,,,,,,,False,1975,,False,,,,,,,,,,,,,,,True,False,,,,,West St. Paul-Mendota Hts. #197,,West St. Paul-Mendota Hts. #197,,West St. Paul-Mendota Hts. #197,,,False,West Saint Paul,,,[],55118,901 Bidwell St,West Saint Paul,MN,44.919008,-93.091386,245000.0,RECENTLY_SOLD,0,55118_160,"Recently sold: $245,000. "
3,1,1,0,0,0,,,[],,"['Hardwood', 'Tile']",['Forced air'],True,['Central'],True,"['Dishwasher', 'Microwave', 'Range / Oven', 'Refrigerator']",,,,False,False,,,1150.0,,,,['Detached Garage'],1,,False,True,,False,,False,,,,2,,,False,False,,['Stucco'],,,,,False,,,,,,,False,0.12 acres,,,,False,423495002150,False,False,,Residential-Single,,Single Family,,,,Asphalt,,,False,1947,,False,,,,['Connected'],,,,,,,,,,,True,False,,,,,,,,,,,,False,West Saint Paul,,,"[{'name': 'Fuel', 'value': 'Natural Gas'}, {'name': 'HandicapAccess', 'value': 'None'}, {'name': 'BathDesc', 'value': 'Main Floor Full Bath'}, {'name': 'FrontageFeet', 'value': 'Paved Streets'}, {'name': 'PresentUse', 'value': 'Yearly'}, {'name': 'Style', 'value': '2 Stories'}, {'name': 'Roof', 'value': 'Age Over 8 Years'}, {'name': 'Fence', 'value': 'None'}, {'name': 'FrontageFeet', 'value': 'City'}, {'name': 'Water', 'value': 'Connected'}, {'name': 'FrontageFeet', 'value': 'Curbs'}, {'name': 'FrontageFeet', 'value': 'Sidewalks'}]",55118,990 Ottawa Ave,West Saint Paul,MN,44.916554,-93.102794,223000.0,RECENTLY_SOLD,26,55118_161,"Recently sold: $223,000. Cozy Cherokee Park neighborhood home walking distance to coffee shops, restaurants, and more! This completely updated home includes newer roof, kitchen, bath, washer, &amp; central a/c. Come see today!"
3,3,2,0,1,0,,,[],,,['Forced air'],True,,,"['Dishwasher', 'Dryer', 'Microwave', 'Range / Oven', 'Refrigerator', 'Washer']",,,,,False,,,2328.0,,,,['Attached Garage'],,,False,,,False,,False,,,,,,,,,,"['Brick', 'Cement concrete', 'Stone', 'Vinyl']",,,,,,,,,,,,False,,,,,False,,False,False,,,,Single Family,,,,Asphalt,,,False,,,False,,,,,,,,,,,,,,,True,False,,,,,,,,,,,,False,West St Paul,,,"[{'name': 'PRESENTUSE', 'value': 'Yearly'}, {'name': 'STATUS', 'value': 'Pending'}, {'name': 'ZONING', 'value': 'Residential-Single Family'}, {'name': 'BASEMENT', 'value': 'Full, Finished (Livable), Walkout'}, {'name': 'CONSTRUCTIONSTATUS', 'value': 'Previously Owned'}, {'name': 'GARAGEDESCRIPTION', 'value': 'Attached Garage'}, {'name': 'HEATINGDESCRIPTION', 'value': 'Forced Air'}, {'name': 'FRONTAGEFEET', 'value': 'City'}, {'name': 'APPLIANCES', 'value': 'Range, Refrigerator, Washer, Dryer, Microwave, Dishwasher, Water Softener - Owned'}, {'name': 'FIREPLACELOC', 'value': 'Living Room, Gas Burning'}, {'name': 'BATHDESC', 'value': 'Main Floor 1/2 Bath, Private Master, Full Basement'}, {'name': 'DININGROOMDESCRIPTION', 'value': 'Living/Dining Room'}, {'name': 'ROOMFLOOR1', 'value': 'Main'}, {'name': 'ROOF', 'value': 'Asphalt Shingles, Age Over 8 Years'}, {'name': 'EXTERIOR', 'value': 'Vinyl, Brick/Stone, Cement Board'}, {'name': 'FUEL', 'value': 'Natural Gas'}, {'name': 'SEWER', 'value': 'City Sewer/Connected'}, {'name': 'WATER', 'value': 'City Water/Connected'}, {'name': 'ASSOCFEEINCLUDES', 'value': 'Sanitation, Snow/Lawn Care, Outside Maintenance, Hazard Insurance, Building Exterior, Professional Mgmt'}, {'name': 'STYLE', 'value': '(TH) Side x Side'}, {'name': 'TAXYEAR', 'value': '2019.00'}, {'name': 'DAYSONMARKET', 'value': '5'}, {'name': 'DAYSONMARKETCUMULATIVE', 'value': '5'}, {'name': 'OFFMARKETDATE', 'value': '2019-07-21T14:14:58'}]",55118,1558 Crawford Dr,West St Paul,MN,44.899054,-93.078351,320000.0,RECENTLY_SOLD,0,55118_162,"Recently sold: $320,000. "
1,2,1,1,0,0,,,[],,"['Hardwood', 'Tile']",['Forced air'],True,,,"['Exhaust Fan/Hood', 'Disposal']",,,,True,False,,,1242.0,,,,['Attached Garage'],1,,False,True,,False,,False,,,,1,,,True,True,,"['Brick', 'Stone', 'Stucco']",,,['Water'],True,True,,,,"High Ground, Walkout",,,False,,,,,False,246310000800,False,False,,Residential-Single,,Condo,,,,,,,False,,,False,,,,['City Sewer/Connected'],,,,,,,,,,,True,False,,,,,,,,,,,,False,Mendota Heights,,,"[{'name': 'AmenitiesUnit', 'value': 'Washer/Dryer Hookup, Exercise Room, In-Ground Sprinkler, Local Area Network'}, {'name': 'BathDesc', 'value': 'Main Floor 3/4 Bath, Private Master, Main Floor Full Bath, 3/4 Master, Walk-In Shower Stall'}, {'name': 'Fuel', 'value': 'Natural Gas, Electric'}, {'name': 'GarageDescription', 'value': 'Garage Door Opener, Heated Garage, Driveway - Asphalt, Underground Garage, Secured, Assigned, Driveway - Shared'}, {'name': 'FrontageFeet', 'value': 'Paved Streets, State, Curbs, Sidewalks'}, {'name': 'PresentUse', 'value': 'Yearly'}, {'name': 'SpecialSearch', 'value': 'Main Floor Laundry'}, {'name': 'Water', 'value': 'Well, City Water - In Street'}, {'name': 'AmenitiesShared', 'value': 'Security Building, Lawn Sprinkler, Car Wash'}, {'name': 'SharedRooms', 'value': 'Amusement/Party Rm, Exercise Room'}, {'name': 'Roof', 'value': 'Flat, Tar/Gravel'}, {'name': 'HandicapAccess', 'value': 'Elevator'}, {'name': 'TaxYear', 'value': '2018.00'}]",55118,1101 Sibley Memorial Hwy APT 304,Mendota Heights,MN,44.897424,-93.14573,210000.0,RECENTLY_SOLD,0,55118_163,"Recently sold: $210,000. "
5,2,2,0,0,0,,,[],,,['Forced air'],True,,,"['Dishwasher', 'Dryer', 'Range / Oven', 'Refrigerator', 'Washer']",,,,,False,,,1741.0,,,,['Detached Garage'],1,,False,True,,False,,False,,,,,,,,,,['Stucco'],,,,,,,,,,,,False,0.24 acres,,,,False,428330102120,False,False,,,,Single Family,,,,,,,False,1970,,False,,,,,,,,,,,,,,,True,False,,,,,,,,,,,,False,West Saint Paul,,,"[{'name': 'PRESENTUSE', 'value': 'Yearly'}, {'name': 'STATUS', 'value': 'Pending'}, {'name': 'ZONING', 'value': 'Residential-Single Family'}, {'name': 'CONSTRUCTIONSTATUS', 'value': 'Previously Owned'}, {'name': 'GARAGEDESCRIPTION', 'value': 'Detached Garage'}, {'name': 'HEATINGDESCRIPTION', 'value': 'Forced Air'}, {'name': 'APPLIANCES', 'value': 'Range, Refrigerator, Washer, Dryer, Dishwasher'}, {'name': 'ROOMFLOOR1', 'value': 'Main'}, {'name': 'FUEL', 'value': 'Natural Gas'}, {'name': 'SEWER', 'value': 'City Sewer/Connected'}, {'name': 'WATER', 'value': 'City Water/Connected'}, {'name': 'DININGROOMDESCRIPTION', 'value': 'Kitchen/Dining Room, Eat In Kitchen'}, {'name': 'EXTERIOR', 'value': 'Stucco'}, {'name': 'BASEMENT', 'value': 'Walkout'}, {'name': 'FENCE', 'value': 'Chain Link'}, {'name': 'TAXYEAR', 'value': '2019.00'}, {'name': 'DAYSONMARKET', 'value': '43'}, {'name': 'DAYSONMARKETCUMULATIVE', 'value': '43'}, {'name': 'OFFMARKETDATE', 'value': '2019-08-29T10:59:20'}]",55118,265 Butler Ave E,West Saint Paul,MN,44.912625,-93.073789,220000.0,RECENTLY_SOLD,0,55118_164,"Recently sold: $220,000. "
3,2,0,0,0,0,,,,,,,,['Central'],True,,,,,True,False,,,1759.0,,,,['Attached Garage'],,,False,,,False,,False,,,,,,,,,,,,,,,,,,,,,,False,0.23 acres,,,,False,426720003020,False,False,,,,Single Family,,,,,,,False,1971,,False,,,,,,,,,,,,,,,True,False,,,,,West St. Paul-Mendota Hts. #197,,West St. Paul-Mendota Hts. #197,,West St. Paul-Mendota Hts. #197,,,False,West Saint Paul,,,[],55118,1315 Galvin Ave,West Saint Paul,MN,44.906739,-93.098129,225000.0,RECENTLY_SOLD,0,55118_165,"Recently sold: $225,000. "
