3,2,1,1,0,0,,,[],Unfinished,['Hardwood'],['Forced air'],True,['Central'],True,"['Dryer', 'Range / Oven', 'Refrigerator', 'Washer']",,,,False,False,,,1100.0,,,,['Detached Garage'],1,,False,True,,False,,False,,,,2,,,False,False,,['Vinyl'],,,,,False,,,,,,,False,0.23 acres,,,,False,421360002320,False,False,,,,Single Family,,,,Asphalt,,,False,1973,,False,,,,,,,,,,,,,,,True,False,,Bungalow,,,,,,,,,,False,West Saint Paul,,,"[{'name': 'PRESENTUSE', 'value': 'Yearly'}, {'name': 'STATUS', 'value': 'Pending'}, {'name': 'ZONING', 'value': 'Residential-Single Family'}, {'name': 'FRONTAGEFEET', 'value': 'Paved Streets, Curbs, City, Sidewalks'}, {'name': 'BASEMENT', 'value': 'Full, Unfinished'}, {'name': 'CONSTRUCTIONSTATUS', 'value': 'Previously Owned'}, {'name': 'GARAGEDESCRIPTION', 'value': 'Detached Garage, Garage Door Opener, Driveway - Asphalt'}, {'name': 'HEATINGDESCRIPTION', 'value': 'Forced Air'}, {'name': 'APPLIANCES', 'value': 'Range, Refrigerator, Washer, Dryer'}, {'name': 'DININGROOMDESCRIPTION', 'value': 'Living/Dining Room, Breakfast Area'}, {'name': 'ROOMFLOOR1', 'value': 'Main'}, {'name': 'ROOF', 'value': 'Asphalt Shingles, Pitched, Age 8 Years or Less'}, {'name': 'EXTERIOR', 'value': 'Vinyl'}, {'name': 'FUEL', 'value': 'Natural Gas'}, {'name': 'SEWER', 'value': 'City Sewer/Connected'}, {'name': 'WATER', 'value': 'City Water/Connected'}, {'name': 'AMENITIESUNIT', 'value': 'Patio, Kitchen Window, Ceiling Fan(s), Hardwood Floors, Washer/Dryer Hookup, Natural Woodwork'}, {'name': 'BATHDESC', 'value': 'Main Floor Full Bath, Upper Level 3/4 Bath'}, {'name': 'SPECIALSEARCH', 'value': 'Main Floor Bedroom'}, {'name': 'FENCE', 'value': 'Full, Chain Link'}, {'name': 'TAXYEAR', 'value': '2019.00'}, {'name': 'DAYSONMARKET', 'value': '14'}, {'name': 'DAYSONMARKETCUMULATIVE', 'value': '14'}, {'name': 'OFFMARKETDATE', 'value': '2019-04-17T08:55:40'}]",55118,206 Stanley St,West Saint Paul,MN,44.913027,-93.076689,205000.0,RECENTLY_SOLD,63,55118_227,"Recently sold: $205,000. This adorable 1.5 story bungalow is in great condition and priced right to make it the perfect starter home. Located on a quiet street just steps from several parks, lakes, walk trails and the Mississippi. Main level features, living room, dining room, kitchen, full bathroom and master bedroom. 2nd floor is complete with 2 bedrooms and 3/4 bathroom."
3,1,1,0,0,0,,,[],,['Hardwood'],['Forced air'],True,,,"['Dishwasher', 'Dryer', 'Microwave', 'Range / Oven', 'Refrigerator', 'Washer']",,,,,False,,,940.0,,,,['Detached Garage'],1,,False,True,,False,,False,,,,,,,,,,['Vinyl'],,,,,,,,,,,,False,0.11 acres,,,,False,424730002050,False,False,,,,Single Family,,,,Asphalt,,,False,1972,,False,,,,,,,,,,,,,,,True,False,,,,,,,,,,,,False,West Saint Paul,,,"[{'name': 'PRESENTUSE', 'value': 'Yearly'}, {'name': 'STATUS', 'value': 'Pending'}, {'name': 'TAXYEAR', 'value': '2018.00'}, {'name': 'ZONING', 'value': 'Residential-Single Family'}, {'name': 'BASEMENT', 'value': 'Full, Unfinished'}, {'name': 'CONSTRUCTIONSTATUS', 'value': 'Previously Owned'}, {'name': 'GARAGEDESCRIPTION', 'value': 'Detached Garage'}, {'name': 'HEATINGDESCRIPTION', 'value': 'Forced Air'}, {'name': 'FRONTAGEFEET', 'value': 'City'}, {'name': 'APPLIANCES', 'value': 'Range, Refrigerator, Washer, Dryer, Microwave, Dishwasher'}, {'name': 'ROOMFLOOR1', 'value': 'Main'}, {'name': 'ROOF', 'value': 'Asphalt Shingles, Age Over 8 Years'}, {'name': 'EXTERIOR', 'value': 'Vinyl'}, {'name': 'FUEL', 'value': 'Natural Gas'}, {'name': 'SEWER', 'value': 'City Sewer/Connected'}, {'name': 'WATER', 'value': 'City Water/Connected'}, {'name': 'AMENITIESUNIT', 'value': 'Kitchen Window, Hardwood Floors, Natural Woodwork'}, {'name': 'BATHDESC', 'value': 'Main Floor Full Bath'}, {'name': 'DININGROOMDESCRIPTION', 'value': 'Informal Dining Room'}, {'name': 'SPECIALSEARCH', 'value': 'Main Floor Bedroom'}]",55118,272 Mainzer St,West Saint Paul,MN,44.916609,-93.073763,181450.0,RECENTLY_SOLD,0,55118_228,"Recently sold: $181,450. "
4,3,,,,,,,,,,,,,,,,,,,False,,,3000.0,,,,['Attached Garage'],2,,False,True,,False,,False,,,,2,,,,,,,,,,,,,,,,,,False,0.3 acres,,,,False,424310203040,False,False,,,,Single Family,,,,,,,False,1972,,False,,,,,,,,,,,,,,,True,False,,,,,,,,,,,,False,West Saint Paul,,,[],55118,350 Moreland Ave W,West Saint Paul,MN,44.908594,-93.09987,425000.0,RECENTLY_SOLD,0,55118_229,"Recently sold: $425,000. 350 Moreland Ave W, West Saint Paul, MN is a single family home that contains 3,000 sq ft and was built in 1967. It contains 4 bedrooms and 3 bathrooms. This home last sold for $425,000 in May 2019. 
 
The Zestimate for this house is $450,245, which has increased by $3,021 in the last 30 days. The Rent Zestimate for this home is $2,327/mo, which has decreased by $173/mo in the last 30 days. "
4,5,3,0,2,0,,,[],,"['Hardwood', 'Tile']",['Forced air'],True,['Central'],True,"['Dryer', 'Microwave', 'Refrigerator', 'Washer']",,,,True,False,,,6819.0,,,,"['Attached Garage', 'Detached Garage']",3,,False,True,,False,,False,,,,2,,,,,,['Wood'],,,,,,,,,,,,False,5.27 acres,,,,False,273274001010,False,False,,,,Single Family,,,,,,,False,,,False,,,,,,,,,,,,,,,True,False,,,,,,,,,,,,False,Mendota Heights,,,"[{'name': 'PRESENTUSE', 'value': 'Yearly'}, {'name': 'STATUS', 'value': 'Pending'}, {'name': 'TAXYEAR', 'value': '2018.00'}, {'name': 'ZONING', 'value': 'Residential-Single Family'}, {'name': 'BASEMENT', 'value': 'Full, Finished (Livable), Egress Windows, Sump Pump, Daylight/Lookout Windows, Walkout, Drain Tiled'}, {'name': 'CONSTRUCTIONSTATUS', 'value': 'Previously Owned'}, {'name': 'GARAGEDESCRIPTION', 'value': 'Attached Garage, Detached Garage, Garage Door Opener, Driveway - Asphalt, Heated Garage, Driveway - Shared, Insulated Garage'}, {'name': 'HEATINGDESCRIPTION', 'value': 'Forced Air'}, {'name': 'SEWER', 'value': 'Private'}, {'name': 'WATER', 'value': 'Well'}, {'name': 'FRONTAGEFEET', 'value': 'City'}, {'name': 'APPLIANCES', 'value': 'Refrigerator, Washer, Dryer, Microwave, Dishwasher, Disposal, Cooktop, Wall Oven'}, {'name': 'AMENITIESUNIT', 'value': 'Deck, Patio, Kitchen Window, Hardwood Floors, Tiled Floors, Washer/Dryer Hookup, Natural Woodwork, Walk-In Closet, In-Ground Sprinkler, Security System'}, {'name': 'FIREPLACELOC', 'value': 'Gas Burning, Family Room, Amusement Room'}, {'name': 'BATHDESC', 'value': 'Main Floor 1/2 Bath, 3/4 Basement, Upper Level Full Bath, Full Master, 1/2 Basement'}, {'name': 'ROOMFLOOR1', 'value': 'Main'}, {'name': 'SPECIALSEARCH', 'value': 'Main Floor Laundry, Main Floor Bedroom, All Living Facilities on One Level'}, {'name': 'FUEL', 'value': 'Natural Gas'}, {'name': 'DININGROOMDESCRIPTION', 'value': 'Informal Dining Room, Separate/Formal Dining Room'}, {'name': 'EXTERIOR', 'value': 'Wood'}, {'name': 'ROOF', 'value': 'Age Over 8 Years'}, {'name': 'OUTBUILDINGS', 'value': 'Barn'}, {'name': 'DAYSONMARKETCUMULATIVE', 'value': '229'}, {'name': 'DAYSONMARKET', 'value': '229'}, {'name': 'OFFMARKETDATE', 'value': '2019-04-13T10:10:45'}]",55118,620 Wentworth Ave,Mendota Heights,MN,44.896288,-93.113833,1272500.0,RECENTLY_SOLD,42,55118_230,"Recently sold: $1,272,500. Tranquil setting on 5+acres in the heart of Mendota Heights.  Stunning main level living with spacious room sizes and breathtaking views throughout.  Upper level boasts 2 bedrooms and 2 offices, while lower level has perfect apt. space for a live in nanny, au pair or mother in-law suite. The grounds are meticulously maintained with flower gardens and  decks for outdoor entertaining. Think of all the possibilities with the barn."
2,1,1,0,0,0,,,[],,,,,,,"['Dishwasher', 'Dryer', 'Microwave', 'Range / Oven', 'Refrigerator', 'Washer']",,,,,False,,,944.0,,,,['Detached Garage'],2,,False,True,,False,,False,,,,,,,,,,,,,,,,,,,,,,False,0.18 acres,,,,False,423495001110,False,False,,,,Single Family,,,,Asphalt,,,False,1966,,False,,,,,,,,,,,,,,,True,False,,,,,,,,,,,,False,West Saint Paul,,,"[{'name': 'PRESENTUSE', 'value': 'Yearly'}, {'name': 'STATUS', 'value': 'Pending'}, {'name': 'TAXYEAR', 'value': '2018.00'}, {'name': 'ZONING', 'value': 'Residential-Single Family'}, {'name': 'BASEMENT', 'value': 'Full, Partial Finished'}, {'name': 'CONSTRUCTIONSTATUS', 'value': 'Previously Owned'}, {'name': 'GARAGEDESCRIPTION', 'value': 'Detached Garage'}, {'name': 'APPLIANCES', 'value': 'Range, Refrigerator, Washer, Dryer, Microwave, Dishwasher'}, {'name': 'ROOMFLOOR1', 'value': 'Main'}, {'name': 'ROOF', 'value': 'Asphalt Shingles'}, {'name': 'FUEL', 'value': 'Natural Gas'}, {'name': 'SEWER', 'value': 'City Sewer/Connected'}, {'name': 'WATER', 'value': 'City Water/Connected'}, {'name': 'SPECIALSEARCH', 'value': 'Main Floor Bedroom'}, {'name': 'EXTERIOR', 'value': 'Fiber Board'}, {'name': 'HEATINGDESCRIPTION', 'value': 'Hot Water'}, {'name': 'DAYSONMARKET', 'value': '26'}, {'name': 'DAYSONMARKETCUMULATIVE', 'value': '26'}, {'name': 'OFFMARKETDATE', 'value': '2019-04-08T23:51:00'}]",55118,923 Smith Ave S,West Saint Paul,MN,44.918506,-93.102172,226500.0,RECENTLY_SOLD,0,55118_231,"Recently sold: $226,500. "
3,1,1,0,0,0,,,[],,,['Forced air'],True,,,"['Dryer', 'Microwave', 'Refrigerator', 'Washer']",,,,,False,,,1948.0,,,,['Detached Garage'],2,,False,True,,False,,False,,,,,,,,,,['Stucco'],,,,,,,,,,,,False,0.16 acres,,,,False,424810007050,False,False,,,,Single Family,,,,Asphalt,,,False,1984,,False,,,,,,,,,,,,,,,True,False,,,,,,,,,,,,False,West Saint Paul,,,"[{'name': 'PRESENTUSE', 'value': 'Yearly'}, {'name': 'STATUS', 'value': 'Pending'}, {'name': 'TAXYEAR', 'value': '2018.00'}, {'name': 'ZONING', 'value': 'Residential-Single Family'}, {'name': 'BASEMENT', 'value': 'Full, Finished (Livable)'}, {'name': 'CONSTRUCTIONSTATUS', 'value': 'Previously Owned'}, {'name': 'GARAGEDESCRIPTION', 'value': 'Detached Garage'}, {'name': 'HEATINGDESCRIPTION', 'value': 'Forced Air'}, {'name': 'FRONTAGEFEET', 'value': 'City'}, {'name': 'APPLIANCES', 'value': 'Range, Refrigerator, Washer, Dryer, Microwave'}, {'name': 'AMENITIESUNIT', 'value': 'Deck'}, {'name': 'ROOMFLOOR1', 'value': 'Main'}, {'name': 'ROOF', 'value': 'Asphalt Shingles'}, {'name': 'FUEL', 'value': 'Natural Gas'}, {'name': 'SEWER', 'value': 'City Sewer/Connected'}, {'name': 'WATER', 'value': 'City Water/Connected'}, {'name': 'BATHDESC', 'value': 'Main Floor Full Bath'}, {'name': 'DININGROOMDESCRIPTION', 'value': 'Eat In Kitchen'}, {'name': 'EXTERIOR', 'value': 'Stucco'}, {'name': 'FENCE', 'value': 'Wood'}, {'name': 'DAYSONMARKETCUMULATIVE', 'value': '0'}, {'name': 'DAYSONMARKET', 'value': '0'}, {'name': 'OFFMARKETDATE', 'value': '2019-03-06T17:06:52'}]",55118,961 Livingston Ave,West Saint Paul,MN,44.917218,-93.082556,230000.0,RECENTLY_SOLD,1,55118_232,"Recently sold: $230,000. Great Home! Property has hardwood floors, screened porch, newly redone bathroom, freshly painted interior and new carpet in upper level. Bsmnt is fin. which adds an add'l approx. 700sf. Add an add'l bath (already has shower), bedroom or office!"
5,4,2,1,1,0,,,[],,['Hardwood'],['Forced air'],True,,,"['Dishwasher', 'Dryer', 'Microwave', 'Range / Oven', 'Refrigerator']",,,,,False,,,3386.0,,,,['Attached Garage'],2,,False,True,,False,,False,,,,0,,,,,,['Cement concrete'],,,,,,,,,,,,False,0.4 acres,,,,False,425060004040,False,False,,,,Single Family,,,,Asphalt,,,False,1996,,False,,,,,,,,,,,,,,,True,False,,,,,,,,,,,,False,West Saint Paul,,,"[{'name': 'PRESENTUSE', 'value': 'Yearly'}, {'name': 'STATUS', 'value': 'Pending'}, {'name': 'TAXYEAR', 'value': '2018.00'}, {'name': 'ZONING', 'value': 'Residential-Single Family'}, {'name': 'BASEMENT', 'value': 'Full, Finished (Livable), Egress Windows, Daylight/Lookout Windows, Concrete Block, Walkout'}, {'name': 'CONSTRUCTIONSTATUS', 'value': 'Previously Owned'}, {'name': 'GARAGEDESCRIPTION', 'value': 'Attached Garage'}, {'name': 'HEATINGDESCRIPTION', 'value': 'Forced Air'}, {'name': 'FRONTAGEFEET', 'value': 'City'}, {'name': 'APPLIANCES', 'value': 'Range, Refrigerator, Washer, Dryer, Microwave, Dishwasher'}, {'name': 'AMENITIESUNIT', 'value': 'Deck, Patio, Kitchen Window, Ceiling Fan(s), Hardwood Floors, Walk-In Closet, Porch, Vaulted Ceiling(s)'}, {'name': 'BATHDESC', 'value': 'Main Floor 1/2 Bath, 3/4 Basement, Private Master, Upper Level Full Bath, Full Master, Jetted Tub'}, {'name': 'ROOMFLOOR1', 'value': 'Main'}, {'name': 'ROOF', 'value': 'Asphalt Shingles, Pitched, Age 8 Years or Less'}, {'name': 'SPECIALSEARCH', 'value': 'Main Floor Laundry, 3 BR on One Level'}, {'name': 'FUEL', 'value': 'Natural Gas'}, {'name': 'SEWER', 'value': 'City Sewer/Connected'}, {'name': 'WATER', 'value': 'City Water/Connected'}, {'name': 'DININGROOMDESCRIPTION', 'value': 'Informal Dining Room, Breakfast Area, Eat In Kitchen'}, {'name': 'FIREPLACELOC', 'value': 'Family Room'}, {'name': 'EXTERIOR', 'value': 'Cement Board'}, {'name': 'DAYSONMARKET', 'value': '246'}, {'name': 'DAYSONMARKETCUMULATIVE', 'value': '246'}, {'name': 'OFFMARKETDATE', 'value': '2019-04-05T09:21:47'}]",55118,2033 Charlton St,West Saint Paul,MN,44.884802,-93.099947,385000.0,RECENTLY_SOLD,41,55118_233,"Recently sold: $385,000. Room for the growing family in the 5 BR 4 Bth 5 level split home that is next to Nature Preserve. Enjoy the wildlife on your deck or 3 season porch overlooking the backyard! Master BR with Master Bath with Jacuzzi tub, shower, his and her sinks and walk in closet! Walkout from Family Room with fireplace and walk out from Rec Room as well! Private front yard with beautiful patio! Upgraded eat in kitchen with top of the line appliances. Walk in Pantry!"
3,1,0,1,0,0,,,,,,['Forced air'],True,['Central'],True,,,,,,False,,,1539.0,,,,['Detached Garage'],2,,False,True,,False,,False,,,,1,,,,,,,,,,,,,,,,,,False,0.32 acres,,,,False,273130002100,False,False,,,,Single Family,,,,,,,False,1973,,False,,,,,,,,,,,,,,,True,False,,,,,,,,,,,,False,Mendota Heights,,,[],55118,541 Miriam St,Mendota Heights,MN,44.916889,-93.108458,232500.0,RECENTLY_SOLD,0,55118_234,"Recently sold: $232,500. Wonderful rambler in Mendota Heights waiting for your creativity! Home boasts hardwood floors, plenty of natural daylight, and a surprisingly spacious layout! 3 BDs on the main floor for added convenience share 3/4 bath. Generously sized kitchen with a breakfast area for weekend pancakes. Stunning 3-season porch w/vaulted ceilings and views of expansive backyard. Family Room in the lower level is waiting for you to transform it! Super storage thruout. Excellent location w/easy drive to Downtown!"
4,3,2,0,1,0,,,[],,,,,,,"['Dishwasher', 'Dryer', 'Garbage disposal']",,,,True,False,,,4600.0,,,,['Attached Garage'],4,,False,True,,False,,False,,,,0,,,,,,,,,,,,,,,,,,False,0.48 acres,,,,False,273860003071,False,False,,,,Single Family,,,,Asphalt,,,False,,,False,,,,,,,,,,,,,,,True,False,,,,,,,,,,,,False,Mendota Heights,,,"[{'name': 'central_air_desc', 'value': 'Central A/C'}, {'name': 'architectural_style', 'value': 'Other'}, {'name': 'has_ceiling_fan_fl', 'value': 'Y'}, {'name': 'taxes_annual', 'value': '8145'}, {'name': 'heating_desc', 'value': 'Fireplace,Forced Air'}, {'name': 'original_listhub_key', 'value': '3yd-RMLSMN-5136640'}]",55118,1900 Oak St,Mendota Heights,MN,44.886264,-93.119182,840000.0,RECENTLY_SOLD,43,55118_235,"Recently sold: $840,000. Welcome home to this beautiful custom-built, artfully designed home in high demand Mendota Heights neighborhood. Main level features stunning entertaining spaces, gourmet kitchen, plus easy screen porch to enjoy your morning coffee. Fabulous patio w/outdoor fireplace. Master suite designed to perfection has walk-in shower &amp; 11x12 closet. Oversized garage is heated &amp; insulated. Excellent location w/easy access to the Village at Mendota Heights, trails, parks, shopping, &amp; both downtown's."
2,3,2,0,1,0,,,[],,['Tile'],['Forced air'],True,,,"['Dishwasher', 'Dryer', 'Garbage disposal', 'Range / Oven']",,,,,False,,,2072.0,,,,['Attached Garage'],2,,False,True,,False,,False,,,,0,,,,,,['Stucco'],,,,,,,,,,,,False,0.04 acres,,,,False,272245002100,False,False,,,,Single Family,,,,Asphalt,,,False,1981,,False,,,,,,,,,,,,,,,True,False,,,,,,,,,,,,False,Mendota Heights,,,"[{'name': 'PRESENTUSE', 'value': 'Yearly'}, {'name': 'STATUS', 'value': 'Pending'}, {'name': 'FRONTAGEFEET', 'value': 'Paved Streets, City'}, {'name': 'ZONING', 'value': 'Residential-Multi-Family'}, {'name': 'BASEMENT', 'value': 'Full, Egress Windows, Concrete Block, Unfinished'}, {'name': 'CONSTRUCTIONSTATUS', 'value': 'Previously Owned'}, {'name': 'GARAGEDESCRIPTION', 'value': 'Attached Garage, Driveway - Asphalt, Heated Garage, Insulated Garage'}, {'name': 'HEATINGDESCRIPTION', 'value': 'Forced Air'}, {'name': 'APPLIANCES', 'value': 'Range, Refrigerator, Washer, Dryer, Dishwasher, Disposal, Cooktop'}, {'name': 'FIREPLACELOC', 'value': 'Living Room, Wood Burning, Brick, Amusement Room'}, {'name': 'BATHDESC', 'value': 'Main Floor 1/2 Bath, Private Master, Upper Level Full Bath, Full Master, Separate Tub & Shower, Bathroom Ensuite'}, {'name': 'ROOMFLOOR1', 'value': 'Main'}, {'name': 'ROOF', 'value': 'Asphalt Shingles, Flat, Age Over 8 Years'}, {'name': 'FUEL', 'value': 'Natural Gas'}, {'name': 'SEWER', 'value': 'City Sewer/Connected'}, {'name': 'WATER', 'value': 'City Water/Connected'}, {'name': 'AMENITIESUNIT', 'value': 'Patio, Tiled Floors, Washer/Dryer Hookup, Walk-In Closet, Vaulted Ceiling(s), Security System, Tennis Court, Master Bedroom Walk-In Closet'}, {'name': 'ASSOCFEEINCLUDES', 'value': 'Sanitation, Snow/Lawn Care, Outside Maintenance, Shared Amenities'}, {'name': 'DININGROOMDESCRIPTION', 'value': 'Kitchen/Dining Room, Separate/Formal Dining Room'}, {'name': 'POOLDESCRIPTION', 'value': 'Shared, Below Ground'}, {'name': 'EXTERIOR', 'value': 'Stucco'}, {'name': 'STYLE', 'value': '(TH) Side x Side'}, {'name': 'SHAREDROOMS', 'value': 'Club House'}, {'name': 'AMENITIESSHARED', 'value': 'Tennis Courts'}, {'name': 'TAXYEAR', 'value': '2019.00'}]",55118,1805 Eagle Ridge Dr APT 9,Mendota Heights,MN,44.890527,-93.135035,255000.0,RECENTLY_SOLD,0,55118_236,"Recently sold: $255,000. High demand area! Community pool, clubhouse, and tennis courts! This home has a lot of space and great potential for building equity while remodeling to your own unique style. The unfinished basement provides room to grow! 2nd bedroom has it's own bath and 2nd closet for storage! The vaulted living room has a huge sliding glass door to enjoy views of nature in the back  and to let in plenty of natural light. 2 wood-burning fireplaces. Master suite has large walk-in closet with shelving, separate tub/toilet room. Remodeled shower. The main floor family room is near the kitchen. Large patio in back with lovely landscaping and perennials. There is also a courtyard in the front entrance area of the home which is accessible from the informal dining area.  Large laundry area with new washer and dryer. Cedar closet located in laundry room. See supplement for more details!"
2,2,,,,,,,,,,"['Forced air', 'Other']",True,['Central'],True,"['Dishwasher', 'Dryer', 'Range / Oven', 'Refrigerator', 'Washer']",,,,,False,,,1728.0,,,,['Detached Garage'],2,,False,True,,False,,False,,,,1,,,,,,['Vinyl'],,,,,,,,,,,,False,0.22 acres,,,,False,274210001010,False,False,,,,Single Family,,,,Asphalt,,,False,1970,,False,,,,,,,,,,,,,,,True,False,,Other,,,West St. Paul-Mendota Hts.,,West St. Paul-Mendota Hts.,,West St. Paul-Mendota Hts.,,,False,Mendota Heights,,,[],55118,548 Junction Ln,Mendota Heights,MN,44.914434,-93.108965,255000.0,RECENTLY_SOLD,16,55118_237,"Recently sold: $255,000. Fine Mendota Heights home. Many updates; windows, roof, and more. Hardwood floors. 2 fireplaces. maintenance free exterior, well groomed and manageable yard."
3,1,1,0,0,0,,,[],Finished,['Hardwood'],['Forced air'],True,,,"['Range / Oven', 'Refrigerator', 'Washer']",,,,False,False,,,1644.0,,,,['Attached Garage'],1,,False,True,,False,,False,,,,0,,,False,False,,['Wood'],,,,,False,,,,,,,False,0.24 acres,,,,False,425670001030,False,False,,,,Single Family,,,,Asphalt,,,False,1972,,False,,,,,,,,,,,,,,,True,False,,Ranch,,,,,,,,,,False,West Saint Paul,,,"[{'name': 'PRESENTUSE', 'value': 'Yearly'}, {'name': 'STATUS', 'value': 'Pending'}, {'name': 'TAXYEAR', 'value': '2018.00'}, {'name': 'ZONING', 'value': 'Residential-Single Family'}, {'name': 'CONSTRUCTIONSTATUS', 'value': 'Previously Owned'}, {'name': 'GARAGEDESCRIPTION', 'value': 'Attached Garage'}, {'name': 'HEATINGDESCRIPTION', 'value': 'Forced Air'}, {'name': 'FRONTAGEFEET', 'value': 'City'}, {'name': 'APPLIANCES', 'value': 'Range, Refrigerator, Dishwasher'}, {'name': 'BASEMENT', 'value': 'Finished (Livable), Sump Pump'}, {'name': 'ROOMFLOOR1', 'value': 'Main'}, {'name': 'ROOF', 'value': 'Asphalt Shingles, Age Over 8 Years'}, {'name': 'FUEL', 'value': 'Natural Gas'}, {'name': 'SEWER', 'value': 'City Sewer/Connected'}, {'name': 'WATER', 'value': 'City Water/Connected'}, {'name': 'AMENITIESUNIT', 'value': 'Patio, Kitchen Window, Ceiling Fan(s), Hardwood Floors, Natural Woodwork'}, {'name': 'BATHDESC', 'value': 'Main Floor Full Bath'}, {'name': 'SPECIALSEARCH', 'value': '3 BR on One Level'}, {'name': 'DININGROOMDESCRIPTION', 'value': 'Eat In Kitchen'}, {'name': 'EXTERIOR', 'value': 'Wood'}, {'name': 'FENCE', 'value': 'Chain Link'}]",55118,380 Emerson Ave W,West Saint Paul,MN,44.904949,-93.101071,235000.0,RECENTLY_SOLD,13,55118_238,"Recently sold: $235,000. Spacious 3 bedroom, 1 bathroom rambler with updates!  3 bedrooms on main level. 3rd bedroom also perfect for home office. Stove and fridge were purchased in December of 2016, dishwasher and garbage disposal in 2014. Newly remodeled bathroom in December 2016. New garage door 2018, New central AC 2016,  carpets replaced with gleaming hardwood floors in 2 of the 3 bedrooms.  Newly refinished basement with new carpeting and flooring.  New Furnace in 2016.  Office in lower level lacks only an egress window to become a 4th bedroom. Awesome fenced in back yard with patio, garden and fire pit. Owner must relocate for work. Willing to work without realtor to interested party. Great location close to Robert St and Downtown is just a few miles down Smith Ave."
5,4,2,2,0,0,,,[],,,['Forced air'],True,,,,,,,,False,,,2304.0,,,,['Detached Garage'],3,,False,True,,False,,False,,,,2,,,,,,['Vinyl'],,,,,,,,,,,,False,0.78 acres,,,,False,270380037120,False,False,,,,Single Family,,,,,,,False,1970,,False,,,,,,,,,,,,,,,True,False,,,,,,,,,,,,False,Mendota Heights,,,"[{'name': 'PRESENTUSE', 'value': 'Yearly'}, {'name': 'STATUS', 'value': 'Pending'}, {'name': 'TAXYEAR', 'value': '2018.00'}, {'name': 'ZONING', 'value': 'Residential-Single Family'}, {'name': 'CONSTRUCTIONSTATUS', 'value': 'Previously Owned'}, {'name': 'GARAGEDESCRIPTION', 'value': 'Detached Garage, Driveway - Asphalt'}, {'name': 'HEATINGDESCRIPTION', 'value': 'Forced Air'}, {'name': 'BATHDESC', 'value': 'Main Floor 3/4 Bath, Main Floor Full Bath, Upper Level Full Bath, Upper Level 3/4 Bath'}, {'name': 'ROOMFLOOR1', 'value': 'Main'}, {'name': 'EXTERIOR', 'value': 'Vinyl'}, {'name': 'FUEL', 'value': 'Natural Gas'}, {'name': 'SEWER', 'value': 'City Sewer/Connected'}, {'name': 'WATER', 'value': 'City Water/Connected'}, {'name': 'BASEMENT', 'value': 'Sump Pump, Concrete Block, Partial, Unfinished'}]",55118,720 Wentworth Ave,Mendota Heights,MN,44.897476,-93.120483,318000.0,RECENTLY_SOLD,0,55118_239,"Recently sold: $318,000. "
