3,1,1,0,0,0,,,[],,"['Hardwood', 'Tile']",['Forced air'],True,,,"['Dishwasher', 'Dryer', 'Microwave', 'Range / Oven', 'Refrigerator', 'Washer']",,,,False,False,,,1533.0,,,,['Detached Garage'],2,,False,True,,False,,False,,,,1,,,False,False,,['Vinyl'],,,,,False,,,,,,,False,0.15 acres,,,,False,275750003110,False,False,,,,Single Family,,,,Asphalt,,,False,1974,,False,,,,,,,,,,,,,,,True,False,,,,,,,,,,,,False,Mendota Heights,,,"[{'name': 'PRESENTUSE', 'value': 'Yearly'}, {'name': 'STATUS', 'value': 'Pending'}, {'name': 'ZONING', 'value': 'Residential-Single Family'}, {'name': 'BASEMENT', 'value': 'Full, Finished (Livable), Egress Windows'}, {'name': 'CONSTRUCTIONSTATUS', 'value': 'Previously Owned'}, {'name': 'GARAGEDESCRIPTION', 'value': 'Detached Garage, Garage Door Opener, Driveway - Shared'}, {'name': 'HEATINGDESCRIPTION', 'value': 'Forced Air'}, {'name': 'FRONTAGEFEET', 'value': 'City'}, {'name': 'APPLIANCES', 'value': 'Range, Refrigerator, Washer, Dryer, Microwave, Dishwasher'}, {'name': 'AMENITIESUNIT', 'value': 'Deck, Kitchen Window, Ceiling Fan(s), Hardwood Floors, Tiled Floors, Washer/Dryer Hookup, Natural Woodwork, Main Floor Master Bedroom, Cable'}, {'name': 'ROOMFLOOR1', 'value': 'Main'}, {'name': 'ROOF', 'value': 'Asphalt Shingles'}, {'name': 'EXTERIOR', 'value': 'Vinyl'}, {'name': 'FUEL', 'value': 'Natural Gas'}, {'name': 'SEWER', 'value': 'City Sewer/Connected'}, {'name': 'WATER', 'value': 'City Water/Connected'}, {'name': 'BATHDESC', 'value': 'Main Floor Full Bath'}, {'name': 'DININGROOMDESCRIPTION', 'value': 'Informal Dining Room'}, {'name': 'TAXYEAR', 'value': '2019.00'}, {'name': 'DAYSONMARKET', 'value': '110'}, {'name': 'DAYSONMARKETCUMULATIVE', 'value': '110'}, {'name': 'OFFMARKETDATE', 'value': '2020-02-24T10:54:14'}]",55118,546 Hiawatha Ave,Mendota Heights,MN,44.918257,-93.108638,244500.0,RECENTLY_SOLD,17,55118_72,"Recently sold: $244,500. Nice 3 bedroom home blocks from Cherokee Park. Hardwood floors throughout. Newer windows, and newer 2.5 car garage. Custom family room w/ built ins."
4,2,2,0,0,0,,,[],,['Hardwood'],,,['Central'],True,"['Dryer', 'Refrigerator', 'Washer']",,,,True,False,,,2033.0,,,,['Attached Garage'],2,,False,True,,False,,False,,,,,,,,,,"['Stone', 'Vinyl']",,,,,,,,,,,,False,0.4 acres,,,,False,274440000110,False,False,,,,Single Family,,,,Asphalt,,,False,1990,,False,,,,,,,,,,,,,,,True,False,,,,,,,,,,,,False,Mendota Heights,,,"[{'name': 'PRESENTUSE', 'value': 'Yearly'}, {'name': 'STATUS', 'value': 'Pending'}, {'name': 'ZONING', 'value': 'Residential-Single Family'}, {'name': 'BASEMENT', 'value': 'Full, Finished (Livable), Daylight/Lookout Windows, Concrete Block'}, {'name': 'CONSTRUCTIONSTATUS', 'value': 'Previously Owned'}, {'name': 'GARAGEDESCRIPTION', 'value': 'Attached Garage, Garage Door Opener, Driveway - Asphalt'}, {'name': 'FRONTAGEFEET', 'value': 'City'}, {'name': 'APPLIANCES', 'value': 'Range, Refrigerator, Washer, Dryer, Dishwasher, Water Softener - Owned'}, {'name': 'FIREPLACELOC', 'value': 'Living Room, Gas Burning, Family Room, Wood Burning'}, {'name': 'ROOF', 'value': 'Asphalt Shingles'}, {'name': 'EXTERIOR', 'value': 'Vinyl, Brick/Stone'}, {'name': 'FUEL', 'value': 'Natural Gas'}, {'name': 'SEWER', 'value': 'City Sewer/Connected'}, {'name': 'WATER', 'value': 'City Water/Connected'}, {'name': 'AMENITIESUNIT', 'value': 'Kitchen Window, Hardwood Floors, Natural Woodwork'}, {'name': 'BATHDESC', 'value': 'Main Floor Full Bath, Full Basement'}, {'name': 'DININGROOMDESCRIPTION', 'value': 'Eat In Kitchen'}, {'name': 'HEATINGDESCRIPTION', 'value': 'Hot Water, Boiler'}, {'name': 'ROOMFLOOR1', 'value': 'Upper'}, {'name': 'FENCE', 'value': 'Chain Link'}, {'name': 'TAXYEAR', 'value': '2019.00'}, {'name': 'OFFMARKETDATE', 'value': '2020-02-09T20:38:16'}]",55118,558 Winston Ct,Mendota Heights,MN,44.915066,-93.109878,326500.0,RECENTLY_SOLD,40,55118_73,"Recently sold: $326,500. 1 owner home, well maintained throughout the years on 1 incredible large, kid &amp; pet friendly fenced in yard with a shed.  Many nice updates, maintenance free vinyl siding, soffits &amp; fascia, gutters, roof, driveway, boiler, water softener. Ez to care for Deck, great patio area, oversized garage, Nice floor plan good sized rooms, 2 full bathrooms with ceramic tile, double vanity,2 beautiful brick fireplaces, hardwood floors in bedroom."
2,1,1,0,0,0,,,[],None,['Hardwood'],['Baseboard'],True,['Wall'],True,"['Dishwasher', 'Dryer', 'Microwave', 'Range / Oven', 'Refrigerator', 'Washer']",,,,False,False,,,825.0,,,,['Detached Garage'],2,,False,True,,False,,False,,,,3,,,False,False,,"['Brick', 'Stone']",,,['Park'],True,False,,,,,,,False,,,,,False,424875002309,False,False,,,,Single Family,,,,,,,False,,,False,,,,,,,,,,,,,,,True,False,,,,,West St. Paul-Mendota Hts.,,West St. Paul-Mendota Hts.,,West St. Paul-Mendota Hts.,,,False,West Saint Paul,,,"[{'name': 'PRESENTUSE', 'value': 'Yearly'}, {'name': 'STATUS', 'value': 'Pending'}, {'name': 'ZONING', 'value': 'Residential-Single Family'}, {'name': 'CONSTRUCTIONSTATUS', 'value': 'Previously Owned'}, {'name': 'GARAGEDESCRIPTION', 'value': 'Detached Garage, Garage Door Opener, Driveway - Asphalt, Heated Garage, Assigned, Insulated Garage, No Int Access to Dwelling, Covered'}, {'name': 'FRONTAGEFEET', 'value': 'City'}, {'name': 'APPLIANCES', 'value': 'Range, Exhaust Fan/Hood, Refrigerator, Washer, Dryer, Microwave, Dishwasher, Disposal'}, {'name': 'AMENITIESUNIT', 'value': 'Deck, Hardwood Floors, Balcony, Security System, Exercise Room, Local Area Network, Main Floor Master Bedroom'}, {'name': 'DININGROOMDESCRIPTION', 'value': 'Living/Dining Room, Breakfast Area, Eat In Kitchen'}, {'name': 'ROOMFLOOR1', 'value': 'Main'}, {'name': 'EXTERIOR', 'value': 'Brick/Stone'}, {'name': 'FUEL', 'value': 'Natural Gas'}, {'name': 'SEWER', 'value': 'City Sewer/Connected'}, {'name': 'WATER', 'value': 'City Water/Connected'}, {'name': 'BATHDESC', 'value': 'Main Floor Full Bath'}, {'name': 'ASSOCFEEINCLUDES', 'value': 'Heating, Sanitation, Outside Maintenance, Hazard Insurance, Water/Sewer, Building Exterior, Professional Mgmt, Shared Amenities, Security System, Parking Space, Snow Removal, Lawn Care'}, {'name': 'SPECIALSEARCH', 'value': 'All Living Facilities on One Level'}, {'name': 'HEATINGDESCRIPTION', 'value': 'Hot Water, Baseboard'}, {'name': 'SHAREDROOMS', 'value': 'Exercise Room'}, {'name': 'AMENITIESSHARED', 'value': 'Security Building'}, {'name': 'STYLE', 'value': '(CC) Low Rise (3- Levels)'}, {'name': 'TAXYEAR', 'value': '2019.00'}, {'name': 'DAYSONMARKET', 'value': '32'}, {'name': 'DAYSONMARKETCUMULATIVE', 'value': '32'}, {'name': 'OFFMARKETDATE', 'value': '2020-02-14T11:07:40'}]",55118,1620 Charlton St APT 309,West Saint Paul,MN,44.897477,-93.095147,126700.0,RECENTLY_SOLD,35,55118_74,"Recently sold: $126,700. Top floor, corner unit overlooking the park. Private balcony, lovely hardwood floors, updated kitchen and bathroom, washer/dryer in unit. Great location and great price. 2 garage spots included."
4,2,0,0,0,0,,,[],,,['Forced air'],True,['Central'],True,"['Dishwasher', 'Garbage disposal', 'Range / Oven', 'Refrigerator', 'Washer']",,,,False,False,,,1350.0,,,,"['Off street', 'On street']",,,False,,,False,,False,,,,2,,,False,False,,,,,,,False,,,,,,,False,0.11 acres,,,,False,422360001120,False,False,,,,Single Family,,,,,,,False,1956,,False,,,,,,,,,,,,,,,True,False,,,,,,,,,,,,False,West Saint Paul,,,"[{'name': None, 'value': 'Cats Allowed'}, {'name': None, 'value': 'Heat: forced air'}, {'name': None, 'value': 'Large Dogs Allowed'}, {'name': None, 'value': 'Living room'}, {'name': None, 'value': 'Small Dogs Allowed'}, {'name': None, 'value': 'central'}, {'name': None, 'value': 'street'}]",55118,303 Hurley St E,West Saint Paul,MN,44.918865,-93.072335,169900.0,RECENTLY_SOLD,8,55118_75,"Recently sold: $169,900. This property is available on a rent-to-own basis.

Contract For Deed w/ EZ Terms.
Become a homeowner Instantly, we will finance you!
No Bank Qualifying!  Poor Credit is ok!  SECTION 8 NOT ACCEPTED for this property.

This spacious 1-1/2 story home is located in a nice quiet St. Paul Neighborhood with lots of charm.  A great layout with 2 bedrooms on the main level and 2 spacious rooms upstairs. The main level features a living room surrounded by natural light and a nice sized kitchen with lots of counter space that flows into a dining room. The lower level has lots of storage space and has great potential to become additional living space. 

Bonus Features:
New Roof,
New Carpet,
Central Air, 
District 197 Schools

Flexible Terms"
4,1,0,0,0,0,,,,,['Hardwood'],,,['Central'],True,,,,,,False,,,1296.0,,,,['Detached Garage'],1,,False,True,,False,,False,,,,,,,,,,['Metal'],,,,,,,,,,,,False,0.2 acres,,,,False,423800045030,False,False,,,,Single Family,,,,,,,False,1962,,False,,,,,,,,,,,,,,,True,False,,,,,West St. Paul-Mendota Hts. #197,,West St. Paul-Mendota Hts. #197,,West St. Paul-Mendota Hts. #197,,,False,West Saint Paul,5550143,,[],55118,981 Allen Ave,West Saint Paul,MN,44.916663,-93.094291,219900.0,FOR_SALE,21,55118_76,"For sale: $219,900. Charming 4 bedroom home with spacious kitchen and dinning with nice deck. Big yard. Very clean , new flooring &amp; paint, great value! Must see! Many updates over the years including an addition off the kitchen."
4,3,1,1,1,0,,,[],"Full, Finished (Livable), Concrete Block, Egress Windows",,['Forced air'],True,,,,,,,,False,,,2050.0,,,,['Detached Garage'],1,,False,True,,False,,False,,,,,,,,,,"['Vinyl', 'Wood']",,,,,,,,,,,,False,0.18 acres,,,,False,425370103130,False,False,,Residential-Single Family,,Single Family,,,,,,,False,1983,,False,,,,['City Sewer/Connected'],,,,,,,,,,,True,False,,,,,,,,,,,,False,West Saint Paul,,,"[{'name': 'BathDesc', 'value': 'Main Floor 3/4 Bath, Main Floor Full Bath, 1/2 Basement'}, {'name': 'Fuel', 'value': 'Natural Gas'}, {'name': 'Exterior', 'value': 'Vinyl, Wood'}, {'name': 'GarageDescription', 'value': 'Insulated Garage, Detached Garage, Garage Door Opener'}, {'name': 'HeatingDescription', 'value': 'Forced Air'}, {'name': 'PresentUse', 'value': 'Yearly'}, {'name': 'OutBuildings', 'value': 'Storage Shed'}, {'name': 'Roof', 'value': 'Age Over 8 Years'}, {'name': 'FrontageFeet', 'value': 'City'}, {'name': 'Water', 'value': 'City Water/Connected'}, {'name': 'HandicapAccess', 'value': 'Other'}, {'name': 'TaxYear', 'value': '2019.00'}, {'name': 'CONSTRUCTIONSTATUS', 'value': 'Previously Owned'}, {'name': 'Status', 'value': 'Active'}]",55118,1341 Calumet Ave,West Saint Paul,MN,44.905661,-93.077178,263000.0,RECENTLY_SOLD,0,55118_77,"Recently sold: $263,000. "
3,2,2,0,0,0,,,[],Finished,"['Carpet', 'Hardwood', 'Tile']",['Forced air'],True,['Central'],True,"['Dishwasher', 'Dryer', 'Garbage disposal', 'Range / Oven', 'Refrigerator', 'Washer']",,,,False,False,,,1712.0,,,,['Detached Garage'],1,,False,True,,False,,False,,,,2,,,False,False,,['Metal'],,,['City'],True,False,,,,,,,False,0.14 acres,,,,False,428381003030,False,False,,,,Single Family,,,,Shake/Shingle,,,False,2006,,False,,,,,,,,,,,,,,,True,False,,Bungalow,,,,,,,,,,False,West Saint Paul,,,"[{'name': 'PRESENTUSE', 'value': 'Yearly'}, {'name': 'STATUS', 'value': 'Pending'}, {'name': 'ZONING', 'value': 'Residential-Single Family'}, {'name': 'BASEMENT', 'value': 'Full, Finished (Livable), Sump Pump, Daylight/Lookout Windows, Concrete Block, Drain Tiled'}, {'name': 'CONSTRUCTIONSTATUS', 'value': 'Previously Owned'}, {'name': 'EXTERIOR', 'value': 'Metal'}, {'name': 'GARAGEDESCRIPTION', 'value': 'Detached Garage, Driveway - Concrete'}, {'name': 'HEATINGDESCRIPTION', 'value': 'Forced Air'}, {'name': 'FRONTAGEFEET', 'value': 'City'}, {'name': 'APPLIANCES', 'value': 'Range, Exhaust Fan/Hood, Refrigerator, Washer, Dryer, Microwave, Dishwasher'}, {'name': 'ROOMFLOOR1', 'value': 'Main'}, {'name': 'ROOF', 'value': 'Asphalt Shingles, Pitched, Age Over 8 Years'}, {'name': 'FUEL', 'value': 'Natural Gas'}, {'name': 'SEWER', 'value': 'City Sewer/Connected'}, {'name': 'WATER', 'value': 'City Water/Connected'}, {'name': 'AMENITIESUNIT', 'value': 'Kitchen Window, Ceiling Fan(s), Hardwood Floors, Tiled Floors, Natural Woodwork, Wet Bar'}, {'name': 'DININGROOMDESCRIPTION', 'value': 'Kitchen/Dining Room'}, {'name': 'FIREPLACELOC', 'value': 'Family Room, Electric'}, {'name': 'FENCE', 'value': 'Wood'}, {'name': 'TAXYEAR', 'value': '2019.00'}, {'name': 'DAYSONMARKETCUMULATIVE', 'value': '89'}, {'name': 'DAYSONMARKET', 'value': '89'}, {'name': 'OFFMARKETDATE', 'value': '2019-12-17T09:47:28'}]",55118,1132 Kruse St,West Saint Paul,MN,44.912018,-93.078348,230460.0,RECENTLY_SOLD,52,55118_78,"Recently sold: $230,460. Great Location off busline and convenient to absolutely everything W St Paul has to offer! Walk into this turnkey property that has been completely updates from top to bottom! Lower level features huge family room with bar and roughed in for water! 3/4 bath in lower level as well! Beautiful hardwood floors on main floor with sliding doors from dining to deck for those summer BBQ's! Upper level master bedroom with sitting room and walk in closet! Detached 1+ car garage &amp; fenced in yard!"
4,2,1,1,0,0,,,[],,"['Hardwood', 'Tile']","['Baseboard', 'Forced air']",True,['Central'],True,"['Dryer', 'Refrigerator', 'Washer']",,,,True,False,,,1801.0,,,,['Attached Garage'],2,,False,True,,False,,False,,,,1,,,False,False,,"['Cement concrete', 'Stone', 'Wood']",,,,,False,,,,,,,False,0.43 acres,,,,False,277640001390,False,False,,,,Single Family,,,,Metal,,,False,1983,,False,,,,,,,,,,,,,,,True,False,,,,,,,,,,,,False,Mendota Heights,,,[],55118,1663 Victoria Rd S,Mendota Heights,MN,44.8958,-93.137092,322900.0,RECENTLY_SOLD,33,55118_79,"Recently sold: $322,900. Premiere location and high end finishes combine in this must see charmer. New metal roof with a 50 yr warranty, new cement board siding &amp; concrete driveway. Gorgeous open sunny living room with hardwood floors &amp; fireplace. Jacuzzi with light/aromatherapy. Finished walkout basement is deluxe mother in law suite: bedroom, bathroom with double shower, family room, and infrared sauna. Insulated attached garage with heater, custom shelving and attic storage. Dream yard, beautifully landscaped front and back."
3,2,2,0,0,0,,,,Unfinished,"['Concrete', 'Hardwood', 'Tile']",['Forced air'],True,['Central'],True,"['Dishwasher', 'Dryer', 'Garbage disposal', 'Microwave', 'Range / Oven', 'Refrigerator', 'Washer']",,,,False,False,,,1475.0,,,,['Detached Garage'],1,,False,True,,False,,False,,,,2,,,False,False,,['Vinyl'],,,,,False,,,,,,,False,0.17 acres,,,,False,427360001171,False,False,,,,Single Family,,,,Asphalt,,,False,2014,,False,,,,,,,,,,,,,,,True,False,,,,,West St. Paul-Mendota Hts. #197,,West St. Paul-Mendota Hts. #197,,West St. Paul-Mendota Hts. #197,,,False,West Saint Paul,,,[],55118,936 Dodd Rd,West Saint Paul,MN,44.917856,-93.098756,235000.0,RECENTLY_SOLD,18,55118_80,"Recently sold: $235,000. Lovely Old Home Like New, Local Contractor Remodeled this Gem, Large Porch, Huge Deck &amp; Backyard, Ample Parking with 1+ Car Garage, Private Alley, New Kitchen, New Baths, New Bedrooms, Main Floor Laundry, Formal Dining, Convenient Location, #197 Schools"
3,4,3,0,1,0,,,[],Finished,"['Carpet', 'Laminate', 'Tile']","['Forced air', 'Radiant']",True,['Central'],True,"['Dishwasher', 'Microwave', 'Range / Oven', 'Refrigerator']",,,,,False,,,4020.0,,,,"['Attached Garage', 'On street']",,,False,,,False,,False,,,,,,,,,,"['Brick', 'Stone', 'Wood']",,,['Park'],True,,,,,,,,False,0.48 acres,,,,False,271650001030,False,False,,,,Single Family,,,,Asphalt,,,False,1984,,False,,,,,,,,,,,,,,,True,False,,Split level,,,,,,,,,,False,Mendota Heights,,,"[{'name': 'PRESENTUSE', 'value': 'Yearly'}, {'name': 'STATUS', 'value': 'Pending'}, {'name': 'ZONING', 'value': 'Residential-Single Family'}, {'name': 'FRONTAGEFEET', 'value': 'Paved Streets, Curbs, County, City'}, {'name': 'BASEMENT', 'value': 'Full, Finished (Livable), Daylight/Lookout Windows, Concrete Block'}, {'name': 'CONSTRUCTIONSTATUS', 'value': 'Previously Owned'}, {'name': 'GARAGEDESCRIPTION', 'value': 'Attached Garage, Garage Door Opener, Heated Garage, Driveway - Concrete, Tandem Garage, Tuckunder Garage'}, {'name': 'HEATINGDESCRIPTION', 'value': 'Forced Air, Radiant, Space Heater'}, {'name': 'APPLIANCES', 'value': 'Range, Refrigerator, Microwave, Dishwasher, Cooktop'}, {'name': 'FIREPLACELOC', 'value': 'Living Room, Wood Burning, Amusement Room'}, {'name': 'ROOF', 'value': 'Asphalt Shingles'}, {'name': 'EXTERIOR', 'value': 'Brick/Stone, Wood'}, {'name': 'FUEL', 'value': 'Natural Gas'}, {'name': 'SEWER', 'value': 'City Sewer/Connected'}, {'name': 'WATER', 'value': 'City Water/Connected'}, {'name': 'SPECIALSEARCH', 'value': 'Main Floor Bedroom'}, {'name': 'DININGROOMDESCRIPTION', 'value': 'Eat In Kitchen, Separate/Formal Dining Room'}, {'name': 'BATHDESC', 'value': 'Upper Level Full Bath, Full Master, Other, Separate Tub & Shower, Jetted Tub, Master Walk-Thru, Full Basement'}, {'name': 'ROOMFLOOR1', 'value': 'Upper'}, {'name': 'TAXYEAR', 'value': '2019.00'}, {'name': 'DAYSONMARKET', 'value': '46'}, {'name': 'DAYSONMARKETCUMULATIVE', 'value': '208'}, {'name': 'OFFMARKETDATE', 'value': '2019-12-06T10:22:39'}]",55118,1005 Marie Ave W,Mendota Heights,MN,44.89124,-93.140654,480000.0,RECENTLY_SOLD,0,55118_81,"Recently sold: $480,000. "
3,2,1,1,0,0,,,[],Full,['Hardwood'],['Forced air'],True,,,"['Range', 'Microwave', 'Dishwasher', 'Refrigerator', 'Washer', 'Dryer']",,,,,False,,,1224.0,,,,,2,,False,True,,False,,False,,,,,,,,,,['Vinyl'],,,,,,,,,,,,False,0.15 acres,,,,False,424350002060,False,False,,Residential-Single Family,,Single Family,,,,Asphalt,,,False,1968,,False,,,,['City Sewer/Connected'],,,,,,,,,,,True,False,,,,,,,,,,,,False,West Saint Paul,5498659,,"[{'name': 'AmenitiesUnit', 'value': 'Natural Woodwork, Kitchen Window, Hardwood Floors, Washer/Dryer Hookup, Main Floor Master Bedroom'}, {'name': 'Fuel', 'value': 'Natural Gas'}, {'name': 'Exterior', 'value': 'Vinyl'}, {'name': 'GarageDescription', 'value': 'Driveway - Asphalt'}, {'name': 'BathDesc', 'value': 'Main Floor Full Bath, 3/4 Basement'}, {'name': 'HeatingDescription', 'value': 'Forced Air'}, {'name': 'PresentUse', 'value': 'Yearly'}, {'name': 'Roof', 'value': 'Asphalt Shingles'}, {'name': 'Fence', 'value': 'Partial, Chain Link'}, {'name': 'DiningRoomDescription', 'value': 'Living/Dining Room, Eat In Kitchen'}, {'name': 'Water', 'value': 'City Water/Connected'}, {'name': 'FrontageFeet', 'value': 'Curbs, Sidewalks'}, {'name': 'SecondUnit', 'value': 'Easily Divided'}, {'name': 'TaxYear', 'value': '2019.00'}, {'name': 'CONSTRUCTIONSTATUS', 'value': 'Previously Owned'}, {'name': 'Status', 'value': 'Active'}]",55118,1018 Kruse St,West Saint Paul,MN,44.915416,-93.078778,224900.0,FOR_SALE,30,55118_82,"For sale: $224,900. Charming farmhouse style at this renovated efficient home with refinished hardwood floors, fresh paint, farmhouse light fixtures, spray foamed upper level, Nest thermostat, private driveway and double deep fenced backyard (seller will complete fence with acceptable offer). New main floor bath all remodeled with farmhouse shelves and light fixtures. Separate back entrance to an all-new refinished upper level with a gas line for a stove and water lines for a kitchen/bathroom sink, etc. Ideal opportunity for a roommate, in-law living situation, etc. Basement has plenty of expansion potential with high ceilings and a 3/4 bathroom in the lower level. Brand new 2 car garage 20'x20' included in list price if buyer prefers. Home is just a block from the busline."
3,2,1,0,1,0,,,,Partially finished,"['Carpet', 'Hardwood', 'Linoleum / Vinyl', 'Tile']",['Forced air'],True,['Central'],True,"['Dryer', 'Range / Oven', 'Refrigerator', 'Washer']",,,,False,False,,,1317.0,,,,['Detached Garage'],2,,False,True,,False,,False,,,,2,,,False,False,,['Vinyl'],,,,,False,,,,,,,False,0.15 acres,,,,False,427250103050,False,False,,,,Single Family,,,,Asphalt,,,False,2016,,False,,,,,,,,,,,,,,,True,False,,Cape cod,,,West St. Paul-Mendota Hts. #197,,West St. Paul-Mendota Hts. #197,,West St. Paul-Mendota Hts. #197,,,False,West Saint Paul,,,[],55118,1261 Cherokee Ave,West Saint Paul,MN,44.908188,-93.104979,235000.0,RECENTLY_SOLD,1,55118_83,"Recently sold: $235,000. Beautifully updated 3 bedroom home in highly desirable West St. Paul neighborhood! Recent updates include kitchen, engineered wood flooring, upstairs carpet, roof and siding, furnace, windows, and completely renovated main floor bath. Delightful screen porch looks over a freshly landscaped yard enclosed by new cedar fencing and a cozy patio area perfect for grilling or entertaining. Tandem two car garage has great storage without taking up too much space. Just move in and enjoy!"
3,1,1,0,0,0,,,,,,['Forced air'],True,['Central'],True,,,,,,False,,,1073.0,,,,['Detached Garage'],3,,False,True,,False,,False,,,,1,,,,,,,,,,,,,,,,,,False,0.22 acres,,,,False,423495208110,False,False,,,,Single Family,,,,,,,False,1967,,False,,,,,,,,,,,,,,,True,False,,,,,West St. Paul-Mendota Hts.,,West St. Paul-Mendota Hts.,,West St. Paul-Mendota Hts.,,,False,West Saint Paul,,,[],55118,1215 Charlton St,West Saint Paul,MN,44.909479,-93.096368,222000.0,RECENTLY_SOLD,11,55118_84,"Recently sold: $222,000. Updated West St. Paul rambler with a rare 3-car garage and a great deck and fenced backyard for entertaining! Conveniently located near several parks, schools, and restaurants. You'll love the beautiful hardwood floors and having 3 bedrooms on one level."
6,4,1,2,1,0,,,[],"Full, Finished (Livable), Drain Tiled, Walkout, Partial Finished, Daylight/Lookout Windows","['Carpet', 'Hardwood', 'Tile']",['Forced air'],True,['Central'],True,"['Exhaust Fan/Hood', 'Dishwasher', 'Refrigerator', 'Washer', 'Dryer', 'Cooktop', 'Disposal', 'Wall Oven', 'Indoor Grill']",,,,True,False,,,4702.0,,,,['Attached Garage'],2,,False,True,,False,,False,,,,,,,False,False,,['Stucco'],,,,,False,,,,,,,False,0.34 acres,,,,False,274495001020,False,False,,Residential-Single Family,,Single Family,,,,Shake/Shingle,,,False,1985,,False,,,,['City Sewer - In Street'],,,,,,,,,,,True,False,,,,,,,,,,,,False,Mendota Heights,,,"[{'name': 'AmenitiesUnit', 'value': 'Deck, Porch, Natural Woodwork, Kitchen Window, Vaulted Ceiling(s), Hardwood Floors, Tiled Floors, Washer/Dryer Hookup, Patio, Walk-In Closet, Ceiling Fan(s), Master Bedroom Walk-In Closet, Paneled Doors, Wet Bar'}, {'name': 'BathDesc', 'value': 'Private Master, Main Floor 1/2 Bath, 3/4 Basement, Upper Level Full Bath'}, {'name': 'FireplaceLoc', 'value': 'Wood Burning, Family Room, Brick, Amusement Room'}, {'name': 'Fuel', 'value': 'Natural Gas'}, {'name': 'GarageDescription', 'value': 'Attached Garage, Insulated Garage, Garage Door Opener, Driveway - Concrete'}, {'name': 'SpecialSearch', 'value': '3 BR on One Level'}, {'name': 'HeatingDescription', 'value': 'Forced Air'}, {'name': 'FrontageFeet', 'value': 'Paved Streets, City, Curbs'}, {'name': 'PresentUse', 'value': 'Yearly'}, {'name': 'Roof', 'value': 'Asphalt Shingles'}, {'name': 'DiningRoomDescription', 'value': 'Breakfast Area, Eat In Kitchen, Separate/Formal Dining Room'}, {'name': 'Exterior', 'value': 'Stucco'}, {'name': 'Water', 'value': 'City Water - In Street'}, {'name': 'TaxYear', 'value': '2019.00'}, {'name': 'CONSTRUCTIONSTATUS', 'value': 'Previously Owned'}, {'name': 'Status', 'value': 'Active'}]",55118,1864 Summit Ln,Mendota Heights,MN,44.888594,-93.142019,525000.0,RECENTLY_SOLD,0,55118_85,"Recently sold: $525,000. Welcome home to this one owner home in Mendota Heights!  Conveniently located near parks, trails and easy access to both downtowns and the airport.  You'll love the spacious eat in kitchen that opens up to family room, porch and deck for easy entertaining.  Mudroom and bath off garage that leads to extra bonus space-perfect for guest suite, playroom or office!  Large master suite features hardwood floors, walk in closet and updated bath. Head downstairs to find two additional bedrooms, den and sauna.  Possibilities are endless with the large, open basement with wet bar and walk out to enclosed patio space.  Cedar closet off laundry room. New paint and carpet. This is a must see!"
