2,2,0,2,0,0,,,[],,"['Concrete', 'Hardwood', 'Tile']",['Baseboard'],True,['Central'],True,"['Exhaust Fan/Hood', 'Cooktop']",,,,True,False,,,2615.0,,,,,,,False,,,False,,False,,,,,,,,,,['Stone'],,,,,,,,,,,,False,1.27 acres,,,,False,3211721230078,False,False,,Residential-Single Family,,Condo,,,,,,,False,1975,,False,,,,['City Sewer/Connected'],,,,,,,,,,,True,False,,,,,273 - Edina,,273 - Edina,,273 - Edina,,,False,Edina,,,"[{'name': 'AmenitiesUnit', 'value': 'Natural Woodwork, Sun Room, Kitchen Center Island, Main Floor Master Bedroom, Paneled Doors, Panoramic View'}, {'name': 'BathDesc', 'value': 'Main Floor 3/4 Bath, Private Master, 3/4 Master, Bathroom Ensuite'}, {'name': 'Fence', 'value': 'Wood, Full'}, {'name': 'GarageDescription', 'value': 'Insulated Garage, Garage Door Opener, Heated Garage, Driveway - Asphalt, Underground Garage'}, {'name': 'Fuel', 'value': 'Electric'}, {'name': 'FrontageFeet', 'value': 'Paved Streets, City, Curbs, No Outlet/Dead End'}, {'name': 'PresentUse', 'value': 'Yearly'}, {'name': 'SpecialSearch', 'value': 'Main Floor Laundry, Main Floor Bedroom, All Living Facilities on One Level'}, {'name': 'AmenitiesShared', 'value': 'Security Building, Lawn Sprinkler, Car Wash'}, {'name': 'SharedRooms', 'value': 'Exercise Room, Amusement/Party Room'}, {'name': 'Water', 'value': 'City Water/Connected'}, {'name': 'Roof', 'value': 'Flat'}, {'name': 'HandicapAccess', 'value': 'Elevator, Hallways 42&rdquo;&#43;'}, {'name': 'TaxYear', 'value': '2018.00'}, {'name': 'CONSTRUCTIONSTATUS', 'value': 'Previously Owned'}, {'name': 'Status', 'value': 'Active'}, {'name': 'AssocFeeIncludes', 'value': 'Shared Amenities, Sanitation, Outside Maintenance, Building Exterior, Professional Mgmt, Water/Sewer, Hazard Insurance, Snow Removal, Lawn Care'}]",55436,6105 Eden Prairie Rd #A-11,Edina,MN,44.899929,-93.379611,462500.0,RECENTLY_SOLD,24,55436_289,"Recently sold: $462,500. Totally remodeled - this unit is absolutely gorgeous - end unit you won't be disappointed!"
5,4,,,,,,,,Finished,['Hardwood'],['Forced air'],True,['Central'],True,,,,,True,False,,,4463.0,,,,['Attached Garage'],3,,False,True,,False,,False,,,,1,,,True,,,['Wood'],,,,,,,,,,,,False,0.4 acres,,,,False,3011721430057,False,False,,,,Single Family,,,,Other,,,False,2000,,False,,,,,,,,,,,,,,,True,False,,Ranch,,,,,,,,,,False,Edina,,,[],55436,5223 Larada Ln,Edina,MN,44.907773,-93.388993,1095000.0,RECENTLY_SOLD,0,55436_290,"Recently sold: $1,095,000. Exceptional home on a quiet street in Parkwood Knolls. Private yard, one level living w/3 additional bedrooms in lower level. Inviting master w/large bath. Vaulted LR, bright open kitchen, stainless, granite &amp; more."
5,5,4,0,1,0,,,[],Finished,['Carpet'],['Forced air'],True,['Central'],True,"['Dishwasher', 'Microwave', 'Range / Oven']",,,,True,False,,,4150.0,,,,['Attached Garage'],2,,False,True,,False,,False,,,,0,,,,,,['Wood'],,,,,,,,,,,,False,0.25 acres,,,,False,3211721410029,False,False,,,,Single Family,,,,Asphalt,,,False,1980,,False,,,,,,,,,,,,,,,True,False,,,,,,,,,,,,False,Edina,,,"[{'name': None, 'value': 'Architecture Style: Split-level'}, {'name': None, 'value': 'Elementary School: Countryside'}, {'name': None, 'value': 'Heating and Cooling  central_air_desc  Yes'}, {'name': None, 'value': 'Heating and Cooling  heating_desc  Central Gas Furnace'}, {'name': None, 'value': 'High School: Edina'}, {'name': None, 'value': 'MLS Listing ID: 502047505'}, {'name': None, 'value': 'MLS Name: Keller Williams (Keller Williams)'}, {'name': None, 'value': 'Middle School: Central Middle School'}, {'name': None, 'value': 'Other Rooms  living_rooms  1'}, {'name': None, 'value': 'Schools  grade_school  COUNTRYSIDE'}, {'name': None, 'value': 'central_air_desc  Yes'}, {'name': None, 'value': 'garage  2'}, {'name': None, 'value': 'grade_school  COUNTRYSIDE'}, {'name': None, 'value': 'heating_desc  Central Gas Furnace'}, {'name': None, 'value': 'living_rooms  1'}]",55436,5529 Countryside Rd,Edina,MN,44.895392,-93.365828,420000.0,RECENTLY_SOLD,10,55436_291,"Recently sold: $420,000. Great location in one of Edina's finest neighborhoods. Choose from our extensive design library or work with our experienced team of architects &amp; designers to create your DREAM HOME. Gourmet kitchen, home theater, spa....possibilities are endless. You dream it, we'll build it. Property is TO BE BUILT - all measurements estimate based on concept design."
1,1,0,0,0,0,,,[],,['Tile'],['Other'],True,['Wall'],True,"['Dishwasher', 'Microwave', 'Range / Oven', 'Refrigerator']",,,,,False,,,844.0,,,,,,,False,,,False,,False,,,,,,,,,,"['Brick', 'Stone']",,,,,,,,,,,,False,,,,,False,2811721220094,False,False,,Residential-Single,,Condo,,,,Asphalt,,,False,1965,,False,,,,['City Sewer/Connected'],,,,,,,,,,,True,False,,,,,Edina,,Edina,,Edina,,,False,Edina,,,"[{'name': 'AmenitiesUnit', 'value': 'Balcony'}, {'name': 'BathDesc', 'value': 'Main Floor 3/4 Bath'}, {'name': 'Fuel', 'value': 'Natural Gas'}, {'name': 'GarageDescription', 'value': 'Insulated Garage, Garage Door Opener, Heated Garage, Underground Garage, Assigned'}, {'name': 'HeatingDescription', 'value': 'Hot Water, Boiler'}, {'name': 'PresentUse', 'value': 'Yearly'}, {'name': 'SpecialSearch', 'value': 'All Living Facilities on One Level'}, {'name': 'AmenitiesShared', 'value': 'Coin-op Laundry Owned, Security Building, Car Wash'}, {'name': 'FrontageFeet', 'value': 'Private'}, {'name': 'SharedRooms', 'value': 'Amusement/Party Rm'}, {'name': 'Water', 'value': 'City Water/Connected'}, {'name': 'HandicapAccess', 'value': 'Elevator, Grab Bars In Bathroom'}]",55436,4370 Brookside Ct APT 109,Edina,MN,44.919105,-93.356143,123752.0,RECENTLY_SOLD,21,55436_292,"Recently sold: $123,752. The best view of the complex! Amazing southern exposure with a walkout 3 season porch to a gorgeous park. New carpet and paint throughout. Party room, in ground indoor heated swimming pool, sauna, car wash in underground heated garage stall. Additional storage locker as well as storage in front of garage stall., Directions Hwy 100 to Vernon, west to Interlachen, north to Brookside, follow to complex."
5,4,0,0,0,0,,,,Finished,['Hardwood'],['Other'],True,['Central'],True,,,,,True,False,,,4628.0,,,,['Attached Garage'],2,,False,True,,False,,False,,,,1,,,,,,['Wood'],,,,,,,,,,,,False,0.26 acres,,,,False,3311721230029,False,False,,,,Single Family,,,,Asphalt,,,False,2013,,False,,,,,,,,,,,,,,,True,False,,Ranch,,,Edina #273,,Edina #273,,Edina #273,,,False,Edina,,,[],55436,5721 Bernard Pl,Edina,MN,44.899273,-93.357901,1250000.0,RECENTLY_SOLD,0,55436_293,"Recently sold: $1,250,000. "
4,3,1,1,1,0,,,[],"Walkout, Daylight/Lookout Windows",['Carpet'],['Other'],True,,,,,,,True,False,,,2387.0,,,,['Attached Garage'],2,,False,True,,False,,False,,,,1,,,,,,['Wood'],,,,,,,,,,,,False,0.35 acres,,,,False,3211721420012,False,False,,Residential-Single Family,,Single Family,,,,Asphalt,,,False,1963,,False,,,,['City Sewer/Connected'],,,,,,,,,,,True,False,,Ranch,,,,,,,,,,False,Edina,,,"[{'name': 'AmenitiesUnit', 'value': 'Deck, Natural Woodwork, Kitchen Window, Washer/Dryer Hookup'}, {'name': 'BathDesc', 'value': 'Private Master, Main Floor Full Bath, Main Floor 1/2 Bath, 3/4 Basement, 1/2 Master'}, {'name': 'Fuel', 'value': 'Natural Gas'}, {'name': 'GarageDescription', 'value': 'Attached Garage'}, {'name': 'HeatingDescription', 'value': 'Hot Water'}, {'name': 'PresentUse', 'value': 'Yearly'}, {'name': 'Roof', 'value': 'Asphalt Shingles, Age Over 8 Years'}, {'name': 'Exterior', 'value': 'Wood'}, {'name': 'DiningRoomDescription', 'value': 'Eat In Kitchen'}, {'name': 'FrontageFeet', 'value': 'City'}, {'name': 'Water', 'value': 'City Water/Connected'}, {'name': 'HandicapAccess', 'value': 'Other'}, {'name': 'TaxYear', 'value': '2018.00'}, {'name': 'CONSTRUCTIONSTATUS', 'value': 'Previously Owned'}, {'name': 'Status', 'value': 'Active'}]",55436,5801 Stuart Ave,Edina,MN,44.897961,-93.370084,414900.0,RECENTLY_SOLD,0,55436_294,"Recently sold: $414,900. "
5,5,1,3,1,0,,,[],Finished,['Hardwood'],['Forced air'],True,['Central'],True,"['Dishwasher', 'Dryer', 'Freezer', 'Microwave', 'Refrigerator', 'Washer']",,,,True,False,,,5600.0,,,,['Attached Garage'],3,,False,True,,False,,False,,,,3,,,False,False,,"['Brick', 'Stone']",,,['Water'],True,True,,,,,,,False,3.19 acres,,,,False,2811721220022,False,False,,,,Single Family,,,,Asphalt,,,False,2018,,False,,,,,,,,,,,,,,,True,False,,Modern,,,Edina #273,,Edina #273,,Edina #273,,,False,Edina,,,"[{'name': 'PRESENTUSE', 'value': 'Yearly'}, {'name': 'STATUS', 'value': 'Pending'}, {'name': 'TAXYEAR', 'value': '2018.00'}, {'name': 'ZONING', 'value': 'Residential-Single Family'}, {'name': 'TOPOGRAPHY', 'value': 'Walkout'}, {'name': 'BASEMENT', 'value': 'Full, Finished (Livable), Sump Pump, Poured Concrete, Slab, Walkout, Drain Tiled'}, {'name': 'GARAGEDESCRIPTION', 'value': 'Attached Garage, Garage Door Opener, Heated Garage, Driveway - Concrete, Insulated Garage'}, {'name': 'HEATINGDESCRIPTION', 'value': 'Forced Air, Boiler, In-Floor Heating'}, {'name': 'APPLIANCES', 'value': 'Exhaust Fan/Hood, Refrigerator, Washer, Dryer, Microwave, Dishwasher, Disposal, Freezer, Cooktop, Wall Oven, Water Softener - Owned, Air-To-Air Exchanger, Furnace Humidifier, Tankless Water Heater, Indoor Grill'}, {'name': 'FIREPLACELOC', 'value': 'Gas Burning, Family Room, Stone, Amusement Room'}, {'name': 'BATHDESC', 'value': 'Main Floor 1/2 Bath, 3/4 Basement, Private Master, Upper Level Full Bath, Full Master, Walk-In Shower Stall, Upper Level 3/4 Bath, Bathroom Ensuite, 3/4 Jack &amp; Jill'}, {'name': 'ROOF', 'value': 'Asphalt Shingles, Pitched'}, {'name': 'WATERFRONTVIEW', 'value': 'Lake'}, {'name': 'EXTERIOR', 'value': 'Brick/Stone, Fiber Board'}, {'name': 'FUEL', 'value': 'Natural Gas'}, {'name': 'SEWER', 'value': 'City Sewer/Connected'}, {'name': 'WATER', 'value': 'City Water/Connected'}, {'name': 'AMENITIESUNIT', 'value': 'Patio, Ceiling Fan(s), Hardwood Floors, Washer/Dryer Hookup, Walk-In Closet, Porch, In-Ground Sprinkler, Security System, Local Area Network'}, {'name': 'SPECIALSEARCH', 'value': '2nd Floor Laundry, 4 BR on One Level'}, {'name': 'DININGROOMDESCRIPTION', 'value': 'Separate/Formal Dining Room'}, {'name': 'LAKEWATERFRONT', 'value': 'Pond'}, {'name': 'CONSTRUCTIONSTATUS', 'value': 'Completed New Construction'}, {'name': 'DAYSONMARKET', 'value': '150'}, {'name': 'DAYSONMARKETCUMULATIVE', 'value': '335'}, {'name': 'OFFMARKETDATE', 'value': '2019-06-10T09:59:25'}]",55436,5340 Division St,Edina,MN,44.917174,-93.360292,1550000.0,RECENTLY_SOLD,38,55436_295,"Recently sold: $1,550,000. Fabulous new construction on an exceptional homesite in the prestigious Hilldale neighborhood. Beautiful views of the lake and preserves are complimented by the finest craftsmanship, finishes and high-end millwork including walnut floors, A Wolf/Sub-Zero dream kitchen, spa-like master suite, three-season porch, Smart House touch-screen technology and much, much more. The expansive, full walkout level has a media center, huge bonus room, wine cellar, heated floors and a private guest suite, all seamlessly flowing to the outdoors and a spacious, professionally landscaped yard."
3,2,1,1,0,0,,,[],"Full, Finished (Livable), Concrete Block, Daylight/Lookout Windows","['Hardwood', 'Tile']",['Forced air'],True,['Central'],True,"['Range', 'Microwave', 'Dishwasher', 'Refrigerator', 'Disposal']",,,,True,False,,,1770.0,,,,['Detached Garage'],1,,False,True,,False,,False,,,,0,,,,,,"['Brick', 'Stone']",,,,,,,,,,,,False,0.18 acres,,,,False,3311721210065,False,False,,Residential-Single Family,,Single Family,,,,Asphalt,,,False,1950,,False,,,,['City Sewer/Connected'],,,,,,,,,,,True,False,,Ranch,,,,,,,,,,False,Edina,5545770,,"[{'name': 'AmenitiesUnit', 'value': 'Natural Woodwork, Kitchen Window, Hardwood Floors, Tiled Floors, Washer/Dryer Hookup, Patio, Main Floor Master Bedroom'}, {'name': 'Exterior', 'value': 'Brick/Stone'}, {'name': 'Fuel', 'value': 'Natural Gas'}, {'name': 'FireplaceLoc', 'value': 'Living Room, Gas Burning, Stone'}, {'name': 'SpecialSearch', 'value': '3 BR on One Level, Main Floor Bedroom'}, {'name': 'GarageDescription', 'value': 'Detached Garage, Driveway - Concrete, Driveway - Shared'}, {'name': 'BathDesc', 'value': 'Main Floor Full Bath, 3/4 Basement'}, {'name': 'HeatingDescription', 'value': 'Forced Air'}, {'name': 'FrontageFeet', 'value': 'Paved Streets, City, Curbs'}, {'name': 'PresentUse', 'value': 'Yearly'}, {'name': 'Roof', 'value': 'Asphalt Shingles, Pitched'}, {'name': 'DiningRoomDescription', 'value': 'Breakfast Area, Eat In Kitchen, Separate/Formal Dining Room'}, {'name': 'Water', 'value': 'City Water/Connected'}, {'name': 'TaxYear', 'value': '2019.00'}, {'name': 'CONSTRUCTIONSTATUS', 'value': 'Previously Owned'}, {'name': 'Status', 'value': 'Active'}]",55436,5028 Windsor Ave,Edina,MN,44.904501,-93.352124,425000.0,FOR_SALE,36,55436_296,"For sale: $425,000. STONE FRONT &amp; BRICK RAMBLER WITH 3 BR &amp; 2 BATHS.  NEW KITCHEN:  CABINETS, APPL, QUARTZ COUNTERTOPS &amp; BACKSPLASH.  BOTH BATHS TOTAL REDO!  BEAUTIFUL CERAMIC FLOORING, REFINISHED HARDWOOD FLOORING!  NEW WINDOWS THROUGHOUT! BEAUTIFUL BRIGHT LL FAMILY ROOM W/NEW CARPETING &amp; 4TH BEDROOM SPACE.  COME HOME 2 EDINA MORTGAGE. PROGRAM AVAILABLE ON THIS HOME (UP TO $60,000 DOWN PAYMENT ASSISTANCE) WHICH YOU CAN DEFER ALL PAYMENTS UNTIL SALE!  SEE SUPPLEMENT!"
2,2,0,0,0,0,,,,,['Hardwood'],,,['Central'],True,,,,,True,False,,,1360.0,,,,,,,False,,,False,,False,,,,,,,,,,['Brick'],,,,,,,,,,,,False,,,,,False,3111721330413,False,False,,,,Condo,,,,,,,False,1975,,False,,,,,,,,,,,,,,,True,False,,,,,Hopkins #270,,Hopkins #270,,Hopkins #270,,,False,Edina,,,[],55436,6085 Lincoln Dr APT 314,Edina,MN,44.893771,-93.397362,205000.0,RECENTLY_SOLD,0,55436_297,"Recently sold: $205,000. "
5,5,1,2,2,0,,,[],Finished,"['Hardwood', 'Tile']",['Forced air'],True,['Central'],True,"['Dishwasher', 'Dryer', 'Garbage disposal', 'Microwave', 'Range / Oven', 'Refrigerator', 'Washer']",,,,True,False,,,5614.0,,,,['Attached Garage'],4,,False,True,,False,,False,,,,1,,,True,False,,['Cement concrete'],,,,,False,,,,,,,False,0.44 acres,,,,False,3111721240084,False,False,,,,Single Family,,,,Shake/Shingle,,,False,1979,,False,,,,,,,,,,,,,,,True,False,,Other,,,Edina,,Edina,,Edina,,,False,Edina,,,"[{'name': 'PRESENTUSE', 'value': 'Yearly'}, {'name': 'STATUS', 'value': 'Pending'}, {'name': 'TAXYEAR', 'value': '2018.00'}, {'name': 'ZONING', 'value': 'Residential-Single Family'}, {'name': 'BASEMENT', 'value': 'Full, Finished (Livable), Sump Pump, Daylight/Lookout Windows, Concrete Block, Walkout, Drain Tiled'}, {'name': 'CONSTRUCTIONSTATUS', 'value': 'Previously Owned'}, {'name': 'GARAGEDESCRIPTION', 'value': 'Attached Garage, Heated Garage, Driveway - Other Surface'}, {'name': 'HEATINGDESCRIPTION', 'value': 'Forced Air'}, {'name': 'FRONTAGEFEET', 'value': 'City'}, {'name': 'APPLIANCES', 'value': 'Range, Exhaust Fan/Hood, Refrigerator, Washer, Dryer, Microwave, Dishwasher, Disposal, Water Softener - Rented, Water Softener - Owned, Furnace Humidifier'}, {'name': 'FIREPLACELOC', 'value': 'Gas Burning, Amusement Room, Other'}, {'name': 'BATHDESC', 'value': 'Main Floor 1/2 Bath, Main Floor Full Bath, 3/4 Basement, Private Master, 3/4 Master, Walk-In Shower Stall, 1/2 Basement'}, {'name': 'ROOMFLOOR1', 'value': 'Main'}, {'name': 'SPECIALSEARCH', 'value': 'Main Floor Laundry, Main Floor Bedroom'}, {'name': 'FUEL', 'value': 'Natural Gas'}, {'name': 'SEWER', 'value': 'City Sewer/Connected'}, {'name': 'WATER', 'value': 'City Water/Connected'}, {'name': 'AMENITIESUNIT', 'value': 'Patio, Kitchen Window, Ceiling Fan(s), Hardwood Floors, Tiled Floors, Washer/Dryer Hookup, Natural Woodwork, Balcony, Walk-In Closet, Porch, In-Ground Sprinkler, Vaulted Ceiling(s), Security System, Exercise Room, Skylight, Sauna'}, {'name': 'DININGROOMDESCRIPTION', 'value': 'Breakfast Area, Eat In Kitchen, Separate/Formal Dining Room'}, {'name': 'POOLDESCRIPTION', 'value': 'Outdoor, Below Ground, Heated'}, {'name': 'EXTERIOR', 'value': 'Cement Board'}, {'name': 'ROOF', 'value': 'Age Over 8 Years, Shakes'}, {'name': 'DAYSONMARKET', 'value': '32'}, {'name': 'DAYSONMARKETCUMULATIVE', 'value': '149'}, {'name': 'OFFMARKETDATE', 'value': '2019-05-13T14:05:40'}]",55436,6609 Dovre Dr,Edina,MN,44.900852,-93.393657,1225000.0,RECENTLY_SOLD,0,55436_298,"Recently sold: $1,225,000. Complete remodel in Parkwood Knolls! Sprawling lot w fenced in private backyard, w/ gorgeous landscaping. 5 bd, 5 ba, one level living w open floor concept! Laundry both up and down w main floor bedrooms. All new Hunter Douglas Blinds, Anderson Windows, lighting, newer paint and so much more! Enjoy preparing meals in the gourmet kitchen w new appliances; 2 islands making this an entertainer&Acirc;?s dream! Relax by the gorgeous pool w/ newer heating, filtration system. Enjoy!"
3,2,1,0,1,0,,,[],Unfinished,"['Hardwood', 'Tile']",['Forced air'],True,['Central'],True,"['Trash compactor', 'Washer']",,,,True,False,,,1108.0,,,,['Detached Garage'],2,,False,True,,False,,False,,,,1,,,False,False,,"['Brick', 'Stone', 'Wood']",,,['City'],True,False,,,,,,,False,0.22 acres,,,,False,2811721320144,False,False,,,,Single Family,,,,Other,,,False,1970,,False,,,,,,,,,,,,,,,True,False,,Ranch,,,273 - Edina,,273 - Edina,,273 - Edina,,,False,Edina,,,"[{'name': 'PRESENTUSE', 'value': 'Yearly'}, {'name': 'STATUS', 'value': 'Pending'}, {'name': 'ZONING', 'value': 'Residential-Single Family'}, {'name': 'CONSTRUCTIONSTATUS', 'value': 'Previously Owned'}, {'name': 'GARAGEDESCRIPTION', 'value': 'Detached Garage'}, {'name': 'HEATINGDESCRIPTION', 'value': 'Forced Air'}, {'name': 'FRONTAGEFEET', 'value': 'City'}, {'name': 'APPLIANCES', 'value': 'Range, Refrigerator, Washer, Dryer, Microwave, Dishwasher, Disposal, Water Softener - Owned'}, {'name': 'BASEMENT', 'value': 'Finished (Livable), Egress Windows, Sump Pump'}, {'name': 'FIREPLACELOC', 'value': 'Living Room, Family Room'}, {'name': 'AMENITIESUNIT', 'value': 'Deck, Patio, Kitchen Window, Ceiling Fan(s), Hardwood Floors, Tiled Floors, Washer/Dryer Hookup, Natural Woodwork, Vaulted Ceiling(s), Main Floor Master Bedroom'}, {'name': 'ROOMFLOOR1', 'value': 'Main'}, {'name': 'EXTERIOR', 'value': 'Brick/Stone, Wood, Shakes'}, {'name': 'FUEL', 'value': 'Natural Gas'}, {'name': 'SEWER', 'value': 'City Sewer/Connected'}, {'name': 'WATER', 'value': 'City Water/Connected'}, {'name': 'BATHDESC', 'value': 'Main Floor Full Bath'}, {'name': 'DININGROOMDESCRIPTION', 'value': 'Informal Dining Room, Eat In Kitchen'}, {'name': 'ROOF', 'value': 'Metal'}, {'name': 'TAXYEAR', 'value': '2019.00'}, {'name': 'DAYSONMARKET', 'value': '31'}, {'name': 'DAYSONMARKETCUMULATIVE', 'value': '31'}, {'name': 'OFFMARKETDATE', 'value': '2019-06-03T18:14:11'}]",55436,5120 Hankerson Ave,Edina,MN,44.910683,-93.356681,322500.0,RECENTLY_SOLD,36,55436_299,"Recently sold: $322,500. Architecturally designed home features; beautiful hardwood floors, generous rooms, updated kitchen, updated bathrooms &amp; exceptional finishes. Home has an expansive yard with mature trees, a private deck and patio. This is a perfect urban condo alternative."
1,1,1,0,0,0,,,[],None,"['Carpet', 'Laminate', 'Tile']",['Baseboard'],True,['Wall'],True,"['Dishwasher', 'Freezer', 'Garbage disposal', 'Range / Oven', 'Refrigerator']",,,,,False,,,900.0,,,,['Attached Garage'],1,,False,True,,False,,False,,,,,,,,,,"['Brick', 'Stone']",,,,,,,,,,,,False,,,,,False,2811721210148,False,False,,,,Single Family,,,,Other,,,False,1965,,False,,,,,,,,,,,,,,,True,False,,Other,,,Edina,,Edina,,Edina,,,False,Edina,,,"[{'name': 'PRESENTUSE', 'value': 'Yearly'}, {'name': 'STATUS', 'value': 'Pending'}, {'name': 'ZONING', 'value': 'Residential-Single Family'}, {'name': 'FRONTAGEFEET', 'value': 'Paved Streets, Curbs, City, Sidewalks'}, {'name': 'CONSTRUCTIONSTATUS', 'value': 'Previously Owned'}, {'name': 'APPLIANCES', 'value': 'Range, Refrigerator, Dishwasher, Disposal'}, {'name': 'DININGROOMDESCRIPTION', 'value': 'Living/Dining Room'}, {'name': 'ROOMFLOOR1', 'value': 'Main'}, {'name': 'EXTERIOR', 'value': 'Brick/Stone'}, {'name': 'FUEL', 'value': 'Natural Gas'}, {'name': 'SEWER', 'value': 'City Sewer/Connected'}, {'name': 'WATER', 'value': 'City Water/Connected'}, {'name': 'AMENITIESUNIT', 'value': 'Patio, Security System'}, {'name': 'AMENITIESSHARED', 'value': 'Sauna, Security Building, Coin-op Laundry Leased'}, {'name': 'BATHDESC', 'value': 'Main Floor Full Bath'}, {'name': 'ASSOCFEEINCLUDES', 'value': 'Heating, Sanitation, Snow/Lawn Care, Outside Maintenance, Hazard Insurance, Water/Sewer, Building Exterior, Professional Mgmt, Shared Amenities, Security System'}, {'name': 'GARAGEDESCRIPTION', 'value': 'Underground Garage'}, {'name': 'HANDICAPACCESS', 'value': 'Elevator'}, {'name': 'HEATINGDESCRIPTION', 'value': 'Hot Water, Baseboard'}, {'name': 'ROOF', 'value': 'Flat'}, {'name': 'SHAREDROOMS', 'value': 'Amusement/Party Room'}, {'name': 'POOLDESCRIPTION', 'value': 'Below Ground, Heated, Indoor'}, {'name': 'STYLE', 'value': '(CC) Low Rise (3- Levels)'}, {'name': 'TAXYEAR', 'value': '2019.00'}, {'name': 'DAYSONMARKET', 'value': '5'}, {'name': 'DAYSONMARKETCUMULATIVE', 'value': '5'}, {'name': 'OFFMARKETDATE', 'value': '2019-06-26T10:39:31'}]",55436,4350 Brookside Ct APT 116,Edina,MN,44.920075,-93.354633,156900.0,RECENTLY_SOLD,63,55436_300,"Recently sold: $156,900. For Sale By Owner, call 952-807-2814 (Gavin) for info or to request a showing!

Fully remodeled condo with high-end finishes in Edina! New wide plank wood laminate flooring and trim throughout living, dining, kitchen and hallway, granite and marble counters, subway tile backsplash, stainless steel appliances, updated cabinets, new custom closets, all new plumbing and light fixtures and fresh paint throughout. Every surface of this spacious 900 SF unit has been brought back to life with new and fresh design touches. Enjoy your large walk-out patio with green space overlooking the well-kept Brookside grounds. Underground parking and storage unit included. Access to indoor pool and party room for entertaining. Low property taxes for a highly sought-after neighborhood in the Edina School District. HOA covers water/sewer, garbage/recycling, snow removal and landscaping. This beautiful 100% move-in-ready condo won't last long!"
4,2,1,1,0,0,,,[],Daylight/Lookout Windows,"['Carpet', 'Hardwood', 'Linoleum / Vinyl', 'Tile']",['Forced air'],True,['Central'],True,['Water Softener - Owned'],,,,True,False,,,2300.0,,,,['Attached Garage'],2,,False,True,,False,,False,,,,1,,,False,False,,"['Brick', 'Metal']",,,['City'],True,False,,,,,,,False,0.23 acres,,,,False,3311721330039,False,False,,Residential-Single Family,,Single Family,,,,Asphalt,,,False,1970,,False,,,,['City Sewer/Connected'],,,,,,,,,,,True,False,,Ranch,,,,,,,,,,False,Edina,,,"[{'name': 'AmenitiesUnit', 'value': 'Natural Woodwork, Kitchen Window, Washer/Dryer Hookup, Main Floor Master Bedroom, Walk-Up Attic'}, {'name': 'Fuel', 'value': 'Natural Gas'}, {'name': 'GarageDescription', 'value': 'Garage Door Opener, Driveway - Concrete'}, {'name': 'SpecialSearch', 'value': '3 BR on One Level, Main Floor Bedroom'}, {'name': 'BathDesc', 'value': 'Main Floor Full Bath'}, {'name': 'FrontageFeet', 'value': 'Paved Streets, City'}, {'name': 'PresentUse', 'value': 'Yearly'}, {'name': 'Roof', 'value': 'Age 8 Years or Less'}, {'name': 'Fence', 'value': 'Partial'}, {'name': 'Water', 'value': 'City Water/Connected'}, {'name': 'TaxYear', 'value': '2019.00'}, {'name': 'CONSTRUCTIONSTATUS', 'value': 'Previously Owned'}, {'name': 'Status', 'value': 'Active'}]",55436,5208 Birchcrest Dr,Edina,MN,44.892618,-93.356718,455000.0,RECENTLY_SOLD,0,55436_301,"Recently sold: $455,000. Walkout rambler.  Kitchen was remodeled in 2006."
4,3,3,0,0,0,,,[],"Full, Finished (Livable), Daylight/Lookout Windows","['Carpet', 'Concrete', 'Laminate', 'Tile']","['Forced air', 'Radiant']",True,['Central'],True,"['Range', 'Microwave', 'Exhaust Fan/Hood', 'Dishwasher', 'Refrigerator', 'Washer', 'Dryer', 'Water Softener - Owned']",,,,False,False,,,2233.0,,,,"['Attached Garage', 'Off street']",4,,False,True,,False,,False,,,,2,,,False,False,,['Wood'],,,,,False,,,,,,,False,0.5 acres,,,,False,3211721410086,False,False,,Residential-Single Family,,Single Family,,,,Asphalt,,,False,1985,,False,,,,['City Sewer/Connected'],,,,,,,,,,,True,False,,Contemporary,,,Edina - 273,,Edina - 273,,Edina - 273,,,False,Edina,,,"[{'name': 'AmenitiesUnit', 'value': 'Deck, Natural Woodwork, Kitchen Window, Vaulted Ceiling(s), Hardwood Floors, Tiled Floors, Washer/Dryer Hookup, Security System, Sauna, Master Bedroom Walk-In Closet'}, {'name': 'BathDesc', 'value': 'Private Master, Full Basement, Upper Level Full Bath, 3/4 Master, Upper Level 3/4 Bath, Bathroom Ensuite'}, {'name': 'DiningRoomDescription', 'value': 'Informal Dining Room, Breakfast Area'}, {'name': 'Fuel', 'value': 'Natural Gas'}, {'name': 'GarageDescription', 'value': 'Attached Garage, Garage Door Opener, Driveway - Asphalt, Other'}, {'name': 'HeatingDescription', 'value': 'Forced Air'}, {'name': 'FrontageFeet', 'value': 'Paved Streets, City'}, {'name': 'PresentUse', 'value': 'Yearly'}, {'name': 'Roof', 'value': 'Asphalt Shingles'}, {'name': 'Exterior', 'value': 'Wood'}, {'name': 'Fence', 'value': 'Partial, Chain Link, Rail'}, {'name': 'OutBuildings', 'value': 'Storage Shed'}, {'name': 'Water', 'value': 'City Water/Connected'}, {'name': 'TaxYear', 'value': '2019.00'}, {'name': 'CONSTRUCTIONSTATUS', 'value': 'Previously Owned'}, {'name': 'Status', 'value': 'Active'}]",55436,5429 Benton Ave,Edina,MN,44.896693,-93.363038,499697.0,RECENTLY_SOLD,0,55436_302,"Recently sold: $499,697. Beautiful MCM home with elegant interior upgrades."
