1,1,,,,,,,,,,,,,,,,,,,False,,,720.0,,,,,,,False,,,False,,False,,,,,,,,,,,,,,,,,,,,,,False,,,,,False,3111721340617,False,False,,,,Condo,,,,,,,False,1972,,False,,,,,,,,,,,,,,,True,False,,,,,,,,,,,,False,Edina,,,[],55436,6670 Vernon Ave S APT 415,Edina,MN,44.894984,-93.39393,160000.0,SOLD,0,55436_469,"Recently sold: $160,000. 6670 Vernon Ave S APT 415, Edina, MN is a condo home that contains 720 sq ft and was built in 1972. It contains 1 bedroom and 1 bathroom. This home last sold for $160,000 in November 2018. 
 
The Zestimate for this house is $172,956, which has increased by $1,890 in the last 30 days. The Rent Zestimate for this home is $1,300/mo, which has decreased by $51/mo in the last 30 days. "
3,2,0,0,0,0,,,,,['Hardwood'],,,['Central'],True,,,,,True,False,,,1928.0,,,,,,,False,,,False,,False,,,,,,,,,,['Wood'],,,,,,,,,,,,False,,,,,False,3111721330102,False,False,,,,Condo,,,,,,,False,1990,,False,,,,,,,,,,,,,,,True,False,,,,,Hopkins #270,,Hopkins #270,,Hopkins #270,,,False,Edina,,,[],55436,6115 Lincoln Dr APT 248,Edina,MN,44.893745,-93.397578,373000.0,SOLD,0,55436_470,"Recently sold: $373,000. "
4,4,0,0,0,0,,,,Finished,['Hardwood'],['Forced air'],True,['Central'],True,,,,,True,False,,,2510.0,,,,['Attached Garage'],2,,False,True,,False,,False,,,,2,,,,,,['Metal'],,,,,,,,,,,,False,0.23 acres,,,,False,3311721340097,False,False,,,,Single Family,,,,Asphalt,,,False,1975,,False,,,,,,,,,,,,,,,True,False,,Other,,,Edina #273,,Edina #273,,Edina #273,,,False,Edina,,,[],55436,5115 Valley View Rd,Edina,MN,44.891927,-93.353425,492000.0,SOLD,31,55436_471,"Recently sold: $492,000. "
3,2,,,,,,,,,,,,,,,,,,,False,,,1935.0,,,,,,,False,,,False,,False,,,,,,,,,,,,,,,,,,,,,,False,0.03 acres,,,,False,0511621220082,False,False,,,,Single Family,,,,,,,False,1977,,False,,,,,,,,,,,,,,,True,False,,,,,,,,,,,,False,Edina,,,[],55436,6324 Falcon Ct,Edina,MN,44.889006,-93.377074,215000.0,SOLD,0,55436_472,"Recently sold: $215,000. 6324 Falcon Ct, Edina, MN is a single family home that contains 1,935 sq ft and was built in 1977. It contains 3 bedrooms and 1.75 bathrooms. This home last sold for $215,000 in November 2018. 
 
The Zestimate for this house is $290,948, which has decreased by $250 in the last 30 days. The Rent Zestimate for this home is $1,850/mo, which has decreased by $23/mo in the last 30 days. "
2,2,2,0,0,0,,,[],,,['Baseboard'],True,['Central'],True,"['Dishwasher', 'Dryer', 'Garbage disposal', 'Microwave', 'Range / Oven']",,,,True,False,,,1360.0,,,,,2,,False,True,,False,,False,,,,0,,,,True,,['Brick'],,,,,,,,,,,,False,,,,,False,3111721330431,False,False,,,,Condo,,,,,,,False,1975,,False,,,,,,,,,,,,,,,True,False,,,,,270 - Hopkins,,270 - Hopkins,,270 - Hopkins,,,False,Edina,,,"[{'name': 'central_air_desc', 'value': 'Central A/C'}, {'name': 'architectural_style', 'value': 'Other'}, {'name': 'has_lawn_fl', 'value': 'Y'}, {'name': 'has_security_system_fl', 'value': 'Y'}, {'name': 'has_sprinkler_system_fl', 'value': 'Y'}, {'name': 'roof_types', 'value': 'Tar and Gravel'}, {'name': 'taxes_annual', 'value': '1641'}, {'name': 'parking', 'value': 'Assigned,Garage,Heated'}, {'name': 'original_listhub_key', 'value': '3yd-RMLSMN-4975054'}]",55436,6085 Lincoln Dr APT 124,Edina,MN,44.893771,-93.397362,175000.0,SOLD,19,55436_473,"Recently sold: $175,000. Spacious &amp; conveniently located condo in Edina West.  Gorgeous wooded lot on a private road.  This main floor condo has everything!  Screened in porch, huge living room, separate dining room with open views to the kitchen, den &amp; living room.  Enjoy laundry in your own unit &amp; a huge master bedroom with walk in closet and master bath.  Plenty of storage and all the amenities you expect."
5,3,1,2,0,0,,,[],Finished,['Carpet'],['Forced air'],True,['Central'],True,"['Water Softener - Owned', 'Wall Oven']",,,,True,False,,,2334.0,,,,['Attached Garage'],2,,False,True,,False,,False,,,,1,,,,,,['Wood'],,,,,,,,,,,,False,0.31 acres,,,,False,3211721310071,False,False,,Residential-Single,,Single Family,,,,Asphalt,,,False,1978,,False,,,,['City Sewer/Connected'],,,,,,,,,,,True,False,,,,,Edina #273,,Edina #273,,Edina #273,,,False,Edina,,,"[{'name': 'AmenitiesUnit', 'value': 'Natural Woodwork, Kitchen Window, Washer/Dryer Hookup, In-Ground Sprinkler'}, {'name': 'Fuel', 'value': 'Natural Gas'}, {'name': 'SpecialSearch', 'value': '3 BR on One Level, Main Floor Bedroom'}, {'name': 'BathDesc', 'value': 'Main Floor Full Bath, 3/4 Master'}, {'name': 'PresentUse', 'value': 'Yearly'}, {'name': 'Roof', 'value': 'Age 8 Years or Less'}, {'name': 'Water', 'value': 'City Water/Connected'}, {'name': 'TaxYear', 'value': '2017.00'}]",55436,5916 Sun Rd,Edina,MN,44.896417,-93.374771,519261.0,SOLD,0,55436_474,"Recently sold: $519,261. "
3,3,1,1,1,0,,,[],Finished,"['Carpet', 'Hardwood', 'Tile']",['Forced air'],True,['Central'],True,"['Dishwasher', 'Dryer', 'Freezer', 'Garbage disposal', 'Microwave', 'Range / Oven', 'Refrigerator', 'Washer']",,,,True,False,,,3407.0,,,,['Attached Garage'],3,,False,True,,False,,False,,,,1,,,False,False,,"['Brick', 'Stone', 'Wood']",,,,,True,,,,,,,False,0.37 acres,,,,False,3111721430075,False,False,,,,Single Family,,,,Asphalt,,,False,2009,,False,,,,,,,,,,,,,,,True,False,,Other,,,Edina #273,,Edina #273,,Edina #273,,,False,Edina,,,"[{'name': 'central_air_desc', 'value': 'Central A/C'}, {'name': 'architectural_style', 'value': 'Other'}, {'name': 'has_ceiling_fan_fl', 'value': 'Y'}, {'name': 'has_security_system_fl', 'value': 'Y'}, {'name': 'taxes_annual', 'value': '7645'}]",55436,6412 Glacier Pl,Edina,MN,44.894445,-93.387573,590000.0,SOLD,0,55436_475,"Recently sold: $590,000. Beautiful and well maintained W/O rambler by 9 Mile Creek and Bredesen Park with lots of natural light located in a cul-de-sac on a nice private lot. Home features vaulted ceiling on main floor and in master bedroom, a large deck, large master suite, large informal dining room, granite counter tops and new SS appliances. Two water heaters, water softener &amp; roof all replaced in the past 5 years. This home truly offers main level living in Edina at its finest."
5,5,4,0,1,0,,,[],Finished,"['Hardwood', 'Tile']",['Other'],True,['Central'],True,"['Exhaust Fan/Hood', 'Cooktop', 'Disposal', 'Water Softener - Owned', 'Wall Oven', 'Furnace Humidifier', 'Air-To-Air Exchanger']",,,,True,False,,,4316.0,,,,['Attached Garage'],3,,False,True,,False,,False,,,,2,,,False,False,,['Cement concrete'],,,,,False,,,,,,,False,0.28 acres,,,,False,3211721130006,False,False,,Residential-Single,,Single Family,,,,Asphalt,,,False,2014,,False,,,,['City Sewer/Connected'],,,,,,,,,,,True,False,,Colonial,,,Edina,,Edina,,Edina,,,False,Edina,,,"[{'name': 'AmenitiesUnit', 'value': 'Natural Woodwork, Kitchen Window, Exercise Room, In-Ground Sprinkler'}, {'name': 'BathDesc', 'value': 'Private Master, Full Master, Main Floor 1/2 Bath, Upper Level Full Bath, Separate Tub & Shower, Full Jack &amp; Jill, Bathroom Ensuite'}, {'name': 'Fuel', 'value': 'Natural Gas'}, {'name': 'GarageDescription', 'value': 'Insulated Garage, Driveway - Concrete'}, {'name': 'Fence', 'value': 'Wood, Partial'}, {'name': 'Style', 'value': '(SF) Two Stories'}, {'name': 'FrontageFeet', 'value': 'Paved Streets, City'}, {'name': 'PresentUse', 'value': 'Yearly'}, {'name': 'Roof', 'value': 'Pitched, Age 8 Years or Less'}, {'name': 'OutBuildings', 'value': 'Storage Shed'}, {'name': 'Water', 'value': 'City Water/Connected'}, {'name': 'Exterior', 'value': 'Shakes'}, {'name': 'SpecialSearch', 'value': '2nd Floor Laundry, 4 BR on One Level'}, {'name': 'TaxYear', 'value': '2017.00'}]",55436,5608 Warden Ave,Edina,MN,44.899978,-93.366909,1065000.0,SOLD,0,55436_476,"Recently sold: $1,065,000. Luxury new build! Beautiful design &amp; finishes include open great room, modern lighting, Chef's kitchen-marble counters, custom cabinets &amp; butler's pantry, informal &amp; formal dining. LL family room with wet-bar. Expansive master with private bath &amp; walk-in!, Directions:  Hwy 100 to Vernon Ave, West to Tracy Ave, South to Warden, East to Property."
5,5,3,1,1,0,,,[],Finished,"['Hardwood', 'Tile']",['Other'],True,['Central'],True,"['Dishwasher', 'Dryer', 'Garbage disposal', 'Microwave', 'Range / Oven', 'Refrigerator', 'Washer']",,,,True,False,,,4238.0,,,,['Attached Garage'],3,,False,True,,False,,False,,,,2,,,False,False,,"['Cement concrete', 'Wood']",,,['Park'],True,False,,,,,,,False,0.22 acres,,,,False,3311721310045,False,False,,,,Single Family,,,,Metal,,,False,2015,,False,,,,,,,,,,,,,,,True,False,,Modern,,,Edina - 273,,Edina - 273,,Edina - 273,,,False,Edina,,,"[{'name': 'Features', 'value': 'Special Program/QC Approved Listing, Lot Size/Under 1/2 Acre, Interior/Exercise Area, Garage Count/3 Car Garage, Bath Features/Stall Shower, Exterior Description/Other, Pre-Wiring/Phone Jacks, Road Type/City / Town Street, Other/Water Softener - Own, Sewer/City, Water/City Water, Age/1-5 Years Old, Fencing/Wood Fence, Lot Description/Corner'}]",55436,5100 W 58th St,Edina,MN,44.898253,-93.353735,1050000.0,SOLD,0,55436_477,"Recently sold: $1,050,000. STUNNING DETAILS THROUGHOUT - BUTLER'S PANTRY TO FORMAL DINING ROOM. LUXURIOUS MASTER SUITE, HEATED FLOORS, 2 FIREPLACES &amp; WET BAR. ENJOY THE FINER DETAILS. TOO MUCH TO LIST! A MUST SEE!, Directions:  BENTON AVE TO TINGDALE NORTH TO 58TH ST W"
5,4,3,0,1,0,,,[],Finished,['Carpet'],['Forced air'],True,['Central'],True,"['Dishwasher', 'Dryer', 'Garbage disposal']",,,,True,False,,,4442.0,,,,['Attached Garage'],2,,False,True,,False,,False,,,,2,,,,,,['Stucco'],,,,,,,,,,,,False,0.37 acres,,,,False,3011721310043,False,False,,,,Single Family,,,,Asphalt,,,False,1998,,False,,,,,,,,,,,,,,,True,False,,Other,,,,,,,,,,False,Edina,,,"[{'name': 'central_air_desc', 'value': 'Central A/C'}, {'name': 'roof_types', 'value': 'Unknown'}, {'name': 'architectural_style', 'value': 'Other'}, {'name': 'has_ceiling_fan_fl', 'value': 'Y'}, {'name': 'taxes_annual', 'value': '12197'}, {'name': 'original_listhub_key', 'value': '3yd-RMLSMN-4932705'}]",55436,5017 Park Ter,Edina,MN,44.91208,-93.394152,465000.0,SOLD,3,55436_478,"Recently sold: $465,000. Priority in open enrollment to Edina Public Schools. Stunning two story in Parkwood Knolls! Spacious open floorplan w/ beautiful hardwoods on main &amp; upper levels. Gourmet kitchen opens dining &amp; family room. Master suite &amp; charming upper bedrooms &amp; baths. Lower level w/ new wool carpet, large family room, bar &amp; home gym/yoga studio. Other highlights: newly updated laundry room/multipurpose space w/ new cabinets &amp; counter, new exterior Hardie Board siding.  Minutes to Interlachen CC!"
2,2,1,1,0,0,,,[],,"['Concrete', 'Tile']",['Forced air'],True,,,['Exhaust Fan/Hood'],,,,True,False,,,1054.0,,,,,,,False,,,False,,False,,,,,,,True,,,"['Brick', 'Stone']",,,,,,,,,,,,False,,,,,False,3111721310078,False,False,,Residential-Multi-Family,,Condo,,,,,,,False,1972,,False,,,,['City Sewer/Connected'],,,,,,,,,,,True,False,,,,,,,,,,,,False,Edina,,,"[{'name': 'AmenitiesUnit', 'value': 'Balcony, Exercise Room'}, {'name': 'BathDesc', 'value': 'Main Floor 3/4 Bath, Main Floor Full Bath, 3/4 Master'}, {'name': 'Fuel', 'value': 'Natural Gas'}, {'name': 'GarageDescription', 'value': 'Garage Door Opener, Heated Garage, Secured, Tuckunder'}, {'name': 'PresentUse', 'value': 'Yearly'}, {'name': 'AmenitiesShared', 'value': 'Coin-op Laundry Owned, Car Wash'}, {'name': 'FrontageFeet', 'value': 'City'}, {'name': 'SharedRooms', 'value': 'Amusement/Party Rm, Exercise Room, Guest Suite'}, {'name': 'Water', 'value': 'City Water/Connected'}, {'name': 'Roof', 'value': 'Flat'}]",55436,6670 Vernon Ave S APT 305,Edina,MN,44.894984,-93.39393,139900.0,SOLD,0,55436_479,"Recently sold: $139,900. Spacious 2 BR 2 BA condo with lots of windows bringing in light. This special unit has new paint and flooring thru out, new light fixtures, fireplace in dining room, and two garage stalls (#59 and 60). The 12'x8' balcony overlooks views of the wildlife refuge and walking and biking paths! Association amenities include party room, guest suite, tennis courts, outdoor and indoor pools."
3,2,2,0,0,0,,,[],,,['Forced air'],True,,,"['Dishwasher', 'Dryer', 'Microwave', 'Range / Oven', 'Refrigerator']",,,,True,False,,,1301.0,,,,['Attached Garage'],,,False,,,False,,False,,,,0,,,,,,,,,,,,,,,,,,False,,,,,False,3111721310059,False,False,,,,Condo,,,,Asphalt,,,False,1981,,False,,,,,,,,,,,,,,,True,False,,,,,,,,,,,,False,Edina,,,"[{'name': 'central_air_desc', 'value': 'Central A/C'}, {'name': 'architectural_style', 'value': 'Other'}, {'name': 'taxes_annual', 'value': '1622'}, {'name': 'original_listhub_key', 'value': '3yd-RMLSMN-4997920'}]",55436,6823 Langford Dr,Edina,MN,44.89521,-93.397859,206000.0,SOLD,17,55436_480,"Recently sold: $206,000. Rarely available! Upper Level Edina Manor Home with Serene Views of Wetland and Beautiful Trees. Updated Kitchen, New Windows, Newer Mechanicals, Wet Bar, Master Suite with walk-in closet. Private balcony, eat-in kitchen, separate dining room, and so much more."
0,1,1,0,0,0,,,[],,['Concrete'],['Forced air'],True,,,['Disposal'],,,,,False,,,554.0,,,,,,,False,,,False,,False,,,,,,,True,,,['Stone'],,,,,,,,,,,,False,,,,,False,3111721340494,False,False,,Residential-Single,,Condo,,,,,,,False,1972,,False,,,,['City Sewer/Connected'],,,,,,,,,,,True,False,,,,,,,,,,,,False,Edina,,,"[{'name': 'AmenitiesUnit', 'value': 'Natural Woodwork'}, {'name': 'Fuel', 'value': 'Natural Gas'}, {'name': 'GarageDescription', 'value': 'Insulated Garage, Garage Door Opener, Heated Garage, Underground Garage, Secured, Assigned, Driveway - Concrete'}, {'name': 'BathDesc', 'value': 'Main Floor Full Bath'}, {'name': 'PresentUse', 'value': 'Yearly'}, {'name': 'SpecialSearch', 'value': 'Main Floor Laundry, All Living Facilities on One Level'}, {'name': 'AmenitiesShared', 'value': 'Security Building, Other, Lawn Sprinkler, Car Wash, Coin-op Laundry Leased'}, {'name': 'FrontageFeet', 'value': 'Private'}, {'name': 'SharedRooms', 'value': 'Amusement/Party Rm, Exercise Room, Guest Suite, Play Area'}, {'name': 'Water', 'value': 'City Water/Connected'}, {'name': 'Roof', 'value': 'Flat'}, {'name': 'HandicapAccess', 'value': 'Elevator'}, {'name': 'TaxYear', 'value': '2018.00'}]",55436,6730 Vernon Ave S APT 209,Edina,MN,44.894984,-93.39393,84000.0,SOLD,22,55436_481,"Recently sold: $84,000. Single person? Retiree? Studio condo in a great location! Quit the health club...everything is here. Indoor/outdoor pools, saunas, hot tub, full gym, tennis, racketball, outside BBQ's, cable TV, heat, AC and underground heated parking all included in HOA's. Unit has walk-in closet, storage locker down the hall, laundry on same floor and elevators to garage."
4,2,2,0,0,0,,,[],Finished,"['Carpet', 'Hardwood', 'Tile']",['Forced air'],True,['Central'],True,"['Dishwasher', 'Dryer', 'Garbage disposal', 'Microwave', 'Range / Oven', 'Refrigerator', 'Washer']",,,,False,False,,,2600.0,,,,['Detached Garage'],2,,False,True,,False,,False,,,,1,,,False,False,,['Wood'],,,,,False,,,,,,,False,0.16 acres,,,,False,2811721320058,False,False,,,,Single Family,,,,Asphalt,,,False,1985,,False,,,,,,,,,,,,,,,True,False,,Ranch,,,,,,,,,,False,Edina,,,"[{'name': 'central_air_desc', 'value': 'Central A/C'}, {'name': 'architectural_style', 'value': 'Other'}, {'name': 'taxes_annual', 'value': '3257'}, {'name': 'original_listhub_key', 'value': '3yd-RMLSMN-4997297'}]",55436,5329 Interlachen Blvd,Edina,MN,44.913045,-93.359481,300000.0,SOLD,1,55436_482,"Recently sold: $300,000. Charming 1-story home in great Edina location! Near many parks, lakes and Hwy 100. Huge family room w/wall to wall windows and bar. Kitchen offers granite counters and expansive peninsula. Beautiful vaulted ceilings and open concept w/great entertaining spaces!"
3,2,0,0,0,0,,,,Finished,['Hardwood'],['Forced air'],True,['Central'],True,,,,,True,False,,,2172.0,,,,['Attached Garage'],2,,False,True,,False,,False,,,,1,,,,,,['Vinyl'],,,,,,,,,,,,False,0.56 acres,,,,False,3211721410077,False,False,,,,Single Family,,,,Asphalt,,,False,1980,,False,,,,,,,,,,,,,,,True,False,,Ranch,,,Edina #273,,Edina #273,,Edina #273,,,False,Edina,,,[],55436,5517 Benton Ave,Edina,MN,44.896525,-93.36447,425000.0,SOLD,0,55436_483,"Recently sold: $425,000. "
4,3,0,0,0,0,,,,Finished,['Hardwood'],['Forced air'],True,['Central'],True,"['Dishwasher', 'Garbage disposal', 'Microwave', 'Range / Oven', 'Refrigerator']",,,,True,False,,,3748.0,,,,['Attached Garage'],1,,False,True,,False,,False,,,,1,,,False,False,,['Wood'],,,,,False,,,,,,,False,0.37 acres,,,,False,3211721240050,False,False,,,,Single Family,,,,Composition,,,False,1977,,False,,,,,,,,,,,,,,,True,False,,Ranch,,,Edina #273,,Edina #273,,Edina #273,,,False,Edina,,,[],55436,5512 Highwood Dr,Edina,MN,44.90243,-93.375871,710000.0,SOLD,1,55436_484,"Recently sold: $710,000. Let the sun shine in! Fabulous, expansive, updated Mid-Century rambler in Highland! Perched on a hill with walls of windows overlooking a beautiful yard with gorgeous perennial gardens. Gourmet kitchen with high end appliances. Open and spacious floor plan."
5,3,2,1,0,0,,,[],Finished,['Hardwood'],['Forced air'],True,['Central'],True,"['Dishwasher', 'Dryer', 'Garbage disposal', 'Microwave', 'Range / Oven', 'Refrigerator', 'Washer']",,,,True,False,,,5003.0,,,,['Attached Garage'],2,,False,True,,False,,False,,,,1,,,False,False,,"['Brick', 'Stone', 'Wood']",,,,,False,,,,,,,False,0.44 acres,,,,False,3111721110048,False,False,,,,Single Family,,,,Asphalt,,,False,2005,,False,,,,,,,,,,,,,,,True,False,,Ranch,,,Edina #273,,Edina #273,,Edina #273,,,False,Edina,,,"[{'name': 'Features', 'value': 'Special Program/QC Approved Listing, Lot Size/Under 1/2 Acre, Garage Count/3 Car Garage, Sewer/City, Water/City Water, Age/Over 50 Years Old'}]",55436,6209 Idylwood Ln,Edina,MN,44.904304,-93.382577,933955.0,SOLD,0,55436_485,"Recently sold: $933,955. Outstanding Carl Hanson Build! South-facing backyard oasis w/ private yard and salt water pool. Chef''s kitchen with premium appliances and huge center island. Main floor living, with master suite and two additional bedrooms. Immaculate Lower level includes a family room, bar, wine cellar, exercise room, laundry room as well as fourth and fifth bedrooms/ bath. Closest thing to new construction without the price! Everything new and turn Key Ready! Move in now! Edina Schools."
4,2,1,1,0,0,,,[],Finished,"['Carpet', 'Hardwood', 'Tile']",['Forced air'],True,['Central'],True,"['Disposal', 'Water Softener - Owned']",,,,True,False,,,2000.0,,,,['Detached Garage'],2,,False,True,,False,,False,,,,1,,,False,False,,"['Brick', 'Wood']",,,,,False,,,,,,,False,0.15 acres,,,,False,2811721320120,False,False,,Residential-Single,,Single Family,,,,Asphalt,,,False,1975,,False,,,,['City Sewer/Connected'],,,,,,,,,,,True,False,,Ranch,,,Edina,,Edina,,Edina,,,False,Edina,,,"[{'name': 'AmenitiesUnit', 'value': 'Washer/Dryer Hookup'}, {'name': 'Exterior', 'value': 'Shakes'}, {'name': 'Fuel', 'value': 'Natural Gas'}, {'name': 'GarageDescription', 'value': 'Garage Door Opener'}, {'name': 'Fence', 'value': 'Wood, Full'}, {'name': 'SpecialSearch', 'value': '3 BR on One Level, Main Floor Bedroom'}, {'name': 'BathDesc', 'value': 'Main Floor Full Bath'}, {'name': 'PresentUse', 'value': 'Yearly'}, {'name': 'Style', 'value': '(SF) One Story'}, {'name': 'Water', 'value': 'City Water/Connected'}, {'name': 'TaxYear', 'value': '2018.00'}]",55436,5108 William Ave,Edina,MN,44.911063,-93.357965,418000.0,SOLD,0,55436_486,"Recently sold: $418,000. 4br/2ba rambler in Edina. Remodeled kitchen and bathrooms. Finished lower level. Large vaulted family room addition. Hardwood floors, brick fireplace &amp; quartz countertops."
3,3,1,1,1,0,,,[],Unfinished,"['Hardwood', 'Tile']",['Forced air'],True,['Central'],True,"['Exhaust Fan/Hood', 'Water Softener - Owned']",,,,True,False,,,2954.0,,,,['Attached Garage'],2,,False,True,,False,,False,,,,2,,,False,False,,"['Brick', 'Cement concrete', 'Stone']",,,,,False,,,,,,,False,0.8 acres,,,,False,2911721330038,False,False,,Residential-Single,,Single Family,,,,Asphalt,,,False,2007,,False,,,,['City Sewer/Connected'],,,,,,,,,,,True,False,,Colonial,,,Hopkins - 270,,Hopkins - 270,,Hopkins - 270,,,False,Edina,,,"[{'name': 'AmenitiesUnit', 'value': 'Natural Woodwork, Washer/Dryer Hookup'}, {'name': 'BathDesc', 'value': 'Private Master, Main Floor 1/2 Bath, Upper Level Full Bath, Upper Level 3/4 Bath'}, {'name': 'Fuel', 'value': 'Natural Gas'}, {'name': 'SpecialSearch', 'value': '3 BR on One Level, Main Floor Laundry'}, {'name': 'Style', 'value': '(SF) Two Stories'}, {'name': 'PresentUse', 'value': 'Yearly'}, {'name': 'Roof', 'value': 'Age Over 8 Years'}, {'name': 'FrontageFeet', 'value': 'City'}, {'name': 'Water', 'value': 'City Water/Connected'}, {'name': 'TaxYear', 'value': '2017.00'}]",55436,6016 Pine Grove Rd,Edina,MN,44.906563,-93.37801,825000.0,SOLD,9,55436_487,"Recently sold: $825,000. Classic center-hall colonial on quiet, private wooded lot in Edina's Gray Tower Estates. Current owner contracted top area remodeler for complete makeover: kitchen (wolf, subzero), custom millwork, baths, living, dining and master suite. Plans are available to finish basement, bringing total living space over 4000 sq ft. Front veranda, large rear deck and new tree top screen porch offer expansive outdoor living. Now priced under $900k with Edina Schools priority for Fall of 2018"
3,2,1,0,1,0,,,[],Finished,['Carpet'],['Forced air'],True,['Central'],True,"['Dishwasher', 'Dryer', 'Garbage disposal', 'Microwave', 'Range / Oven']",,,,True,False,,,1866.0,,,,['Attached Garage'],1,,False,True,,False,,False,,,,1,,,,,,['Wood'],,,,,,,,,,,,False,0.17 acres,,,,False,2811721240062,False,False,,,,Single Family,,,,Asphalt,,,False,1980,,False,,,,,,,,,,,,,,,True,False,,Ranch,,,273 - Edina,,273 - Edina,,273 - Edina,,,False,Edina,,,"[{'name': 'central_air_desc', 'value': 'Central A/C'}, {'name': 'architectural_style', 'value': 'Other'}, {'name': 'has_ceiling_fan_fl', 'value': 'Y'}, {'name': 'taxes_annual', 'value': '4025'}, {'name': 'original_listhub_key', 'value': '3yd-RMLSMN-4985230'}]",55436,5044 Edinbrook Ln,Edina,MN,44.9155,-93.353198,390000.0,SOLD,56,55436_488,"Recently sold: $390,000. "
3,2,1,1,0,0,,,[],Finished,"['Carpet', 'Hardwood', 'Tile']",['Forced air'],True,['Central'],True,"['Dishwasher', 'Dryer', 'Freezer', 'Garbage disposal', 'Microwave', 'Range / Oven', 'Refrigerator', 'Washer']",,,,True,False,,,1840.0,,,,['Detached Garage'],4,,False,True,,False,,False,,,,1,,,False,False,,"['Brick', 'Metal', 'Stone', 'Vinyl']",,,,,False,,,,,,,False,0.23 acres,,,,False,3311721310026,False,False,,Residential-Single,,Single Family,,,,Asphalt,,,False,1953,,False,,,,['City Sewer/Connected'],,,,,,,,,,,True,False,,Ranch,,,,,,,,,,False,Edina,,,"[{'name': 'Fuel', 'value': 'Natural Gas'}, {'name': 'PresentUse', 'value': 'Yearly'}, {'name': 'Roof', 'value': 'Pitched'}, {'name': 'Style', 'value': '(SF) One Story'}, {'name': 'FrontageFeet', 'value': 'City'}, {'name': 'Water', 'value': 'City Water/Connected'}, {'name': 'TaxYear', 'value': '2018.00'}]",55436,5036 W 60th St,Edina,MN,44.895502,-93.352541,385000.0,SOLD,0,55436_489,"Recently sold: $385,000. "
3,3,0,0,0,0,,,,Finished,['Hardwood'],['Forced air'],True,['Central'],True,,,,,True,False,,,3441.0,,,,['Attached Garage'],2,,False,True,,False,,False,,,,1,,,,,,['Stucco'],,,,,,,,,,,,False,0.12 acres,,,,False,3211721240079,False,False,,,,Single Family,,,,Asphalt,,,False,1997,,False,,,,,,,,,,,,,,,True,False,,Ranch,,,Edina #273,,Edina #273,,Edina #273,,,False,Edina,,,[],55436,5804 Vernon Ln,Edina,MN,44.90113,-93.373427,755000.0,SOLD,0,55436_490,"Recently sold: $755,000. "
2,2,2,0,0,0,,,,,['Hardwood'],,,['Central'],True,,,,,True,False,,,1360.0,,,,,,,False,,,False,,False,,,,,,,False,False,,['Wood'],,,,,False,,,,,,,False,,,,,False,3111721330128,False,False,,,,Condo,,,,,,,False,1975,,False,,,,,,,,,,,,,,,True,False,,,,,Hopkins #270,,Hopkins #270,,Hopkins #270,,,False,Edina,,,[],55436,6085 Lincoln Dr APT 319,Edina,MN,44.893745,-93.397578,230000.0,SOLD,0,55436_491,"Recently sold: $230,000. Beautiful two bedroom condo in the sought after Edina West Condominiums community. Freshly updated throughout - a complete 10! Bright, sun-filled spaces with gleaming hardwood floors and smooth ceilings.  Updated kitchen with ample storage and 2 storage units.  Enjoy the private wooded views. Edina West has a robust community: recreational center, outdoor pool, tennis courts, party rooms and lovely manicured grounds.  A treat to show and a must see to appreciate!"
3,3,0,0,0,0,,,,Finished,['Hardwood'],['Forced air'],True,['Central'],True,,,,,True,False,,,3441.0,,,,['Attached Garage'],2,,False,True,,False,,False,,,,1,,,,,,['Stucco'],,,,,,,,,,,,False,0.12 acres,,,,False,3211721240079,False,False,,,,Single Family,,,,Asphalt,,,False,1997,,False,,,,,,,,,,,,,,,True,False,,Ranch,,,Edina #273,,Edina #273,,Edina #273,,,False,Edina,,,[],55436,5804 Vernon Ln,Edina,MN,44.90113,-93.373427,755000.0,SOLD,0,55436_492,"Recently sold: $755,000. "
2,1,1,0,0,0,,,,,,,,,,,,,,True,False,,,900.0,,,,,,,False,,,False,,False,,,,,,,,,,,,,,,,,,,,,,False,,,,,False,3111721310050,False,False,,,,Condo,,,,,,,False,1981,,False,,,,,,,,,,,,,,,True,False,,,,,,,,,,,,False,Edina,,,[],55436,6805 Langford Dr,Edina,MN,44.89521,-93.397859,178500.0,SOLD,0,55436_493,"Recently sold: $178,500. First floor unit offers main level living with spectacular view of wetlands and Nine Mile Creek Regional Trail from private patio. Property is located in the last building in the development offering a quiet, secluded home in this great area. Features include wood burning living room fireplace, attached garage and shared wildflower garden."
