3,4,2,1,1,0,,,,Finished,"['Hardwood', 'Tile']",['Forced air'],True,['Central'],True,"['Dishwasher', 'Dryer', 'Microwave', 'Range / Oven', 'Refrigerator', 'Washer']",,,,True,False,,,5776.0,,,,['Attached Garage'],2,,False,True,,False,,False,,,,,,,,,,['Wood'],,,,,,,,,,,,False,0.44 acres,,,,False,3011721310023,False,False,,,,Single Family,,,,Shake/Shingle,,,False,1988,,False,,,,,,,,,,,,,,,True,False,,Other,,,,,,,,,,False,Edina,,,[],55436,6645 Interlachen Blvd,Edina,MN,44.913158,-93.392381,645000.0,RECENTLY_SOLD,0,55436_148,"Recently sold: $645,000. Step into this authentic Cape Cod 3 bed, 4 bath and be amazed with the attention to detail! Such a great floor plan with a main floor master suite, formal living and dining rooms, den, eat-in kitchen (with fireplace!) and family room. Generous storage rooms in the walk out lower level as well as nicely finished spaces. Attached garage. A happy gardener lived here and her yard is a testament to her long hours and keen eye. Flowers bloom all summer long....you will love the birds and butterflies that are drawn to this magical place. Edina public schools newly passed 510c changes open enrollment policy, now offering priority placement for Edina residents."
3,2,1,1,0,0,,,[],,"['Hardwood', 'Tile']",['Baseboard'],True,['Wall'],True,"['Dishwasher', 'Microwave', 'Range / Oven', 'Refrigerator']",,,,,False,,,1706.0,,,,,,,False,,,False,,False,,,,,,,,,,"['Brick', 'Stone']",,,,,,,,,,,,False,,,,,False,2811721220026,False,False,,,,Single Family,,,,Built up,,,False,1965,,False,,,,,,,,,,,,,,,True,False,,,,,,,,,,,,False,Edina,,,"[{'name': 'PRESENTUSE', 'value': 'Yearly'}, {'name': 'STATUS', 'value': 'Pending'}, {'name': 'FRONTAGEFEET', 'value': 'Private'}, {'name': 'ZONING', 'value': 'Residential-Multi-Family'}, {'name': 'CONSTRUCTIONSTATUS', 'value': 'Previously Owned'}, {'name': 'APPLIANCES', 'value': 'Range, Exhaust Fan/Hood, Refrigerator, Microwave, Dishwasher'}, {'name': 'FIREPLACELOC', 'value': 'Living Room, Wood Burning'}, {'name': 'GARAGEDESCRIPTION', 'value': 'Driveway - Asphalt, Heated Garage, Underground Garage, Assigned, Insulated Garage, Paved Lot'}, {'name': 'BATHDESC', 'value': 'Main Floor 3/4 Bath, Main Floor Full Bath, Private Master, 3/4 Master, Walk-In Shower Stall'}, {'name': 'ROOMFLOOR1', 'value': 'Main'}, {'name': 'EXTERIOR', 'value': 'Brick/Stone'}, {'name': 'FUEL', 'value': 'Natural Gas'}, {'name': 'HANDICAPACCESS', 'value': 'No Stairs Internal, Elevator, Grab Bars In Bathroom'}, {'name': 'SEWER', 'value': 'City Sewer/Connected'}, {'name': 'WATER', 'value': 'City Water/Connected'}, {'name': 'AMENITIESUNIT', 'value': 'Ceiling Fan(s), Hardwood Floors, Tiled Floors, Porch, In-Ground Sprinkler, Security System, Main Floor Master Bedroom, Cable'}, {'name': 'AMENITIESSHARED', 'value': 'Sauna, Elevator(s), Security Building, Coin-op Laundry Owned, In-Ground Sprinkler System'}, {'name': 'ASSOCFEEINCLUDES', 'value': 'Heating, Sanitation, Snow/Lawn Care, Outside Maintenance, Hazard Insurance, Water/Sewer, Building Exterior, Professional Mgmt, Shared Amenities, Security System, Cable TV, Internet, Parking Space, Snow Removal, Lawn Care'}, {'name': 'DININGROOMDESCRIPTION', 'value': 'Informal Dining Room, Separate/Formal Dining Room'}, {'name': 'ROOF', 'value': 'Age 8 Years or Less, Flat, Rubber'}, {'name': 'SPECIALSEARCH', 'value': 'Main Floor Bedroom, 3 BR on One Level, All Living Facilities on One Level'}, {'name': 'HEATINGDESCRIPTION', 'value': 'Hot Water, Baseboard'}, {'name': 'POOLDESCRIPTION', 'value': 'Shared, Below Ground, Heated, Indoor'}, {'name': 'SHAREDROOMS', 'value': 'Amusement/Party Room, Exercise Room'}, {'name': 'LAKEWATERFRONT', 'value': 'Creek/Stream'}, {'name': 'STYLE', 'value': '(CC) Low Rise (3- Levels)'}, {'name': 'TAXYEAR', 'value': '2019.00'}, {'name': 'DAYSONMARKET', 'value': '40'}, {'name': 'DAYSONMARKETCUMULATIVE', 'value': '40'}, {'name': 'OFFMARKETDATE', 'value': '2019-10-15T23:44:27'}]",55436,4360 Brookside Ct APT 101,Edina,MN,44.92017,-93.355527,234500.0,RECENTLY_SOLD,0,55436_149,"Recently sold: $234,500. "
4,4,2,1,1,0,,,,Finished,"['Carpet', 'Hardwood']",['Forced air'],True,['Central'],True,"['Dishwasher', 'Dryer', 'Freezer', 'Garbage disposal', 'Microwave', 'Range / Oven', 'Refrigerator', 'Washer']",,,,True,False,,,5000.0,,,,['Attached Garage'],3,,False,True,,False,,False,,,,2,,,False,False,,"['Brick', 'Wood']",,,['Water'],True,True,,,,,,,False,0.58 acres,,,,False,2911721140047,False,False,,,,Single Family,,,,Shake/Shingle,,,False,2008,,False,,,,,,,,,,,,,,,True,False,,Other,,,Edina #273,,Edina #273,,Edina #273,,,False,Edina,,,[],55436,3 Orchard Ln,Edina,MN,44.91435,-93.362325,900000.0,RECENTLY_SOLD,0,55436_150,"Recently sold: $900,000. Classic New England style two story home with stylish updates throughout. Situated in a parklike setting in the sought after Hilldale neighborhood. The main floor features both formal and informal living and dining spaces. The spacious kitchen and open floor plan are perfect for everyday living and entertaining. Relax on the charming four season porch and fantastic deck while enjoying incredible views overlooking pond and nature. Spacious master suite with private bath. Beautifully landscaped backyard with several entertaining areas. This home has been extensively renovated and rebuilt. Welcome home!"
1,1,,,,,,,,,,,,,,,,,,,False,,,720.0,,,,,,,False,,,False,,False,,,,,,,,,,,,,,,,,,,,,,False,,,,,False,3111721340498,False,False,,,,Condo,,,,,,,False,1972,,False,,,,,,,,,,,,,,,True,False,,,,,,,,,,,,False,Edina,,,[],55436,6730 Vernon Ave S APT 213,Edina,MN,44.894984,-93.39393,116000.0,RECENTLY_SOLD,0,55436_151,"Recently sold: $116,000. 6730 Vernon Ave S APT 213, Edina, MN is a condo home that contains 720 sq ft and was built in 1972. It contains 1 bedroom and 1 bathroom. This home last sold for $116,000 in December 2019. 
 
The Zestimate for this house is $131,925, which has increased by $3,111 in the last 30 days. The Rent Zestimate for this home is $1,250/mo, which has decreased by $92/mo in the last 30 days. "
1,1,1,0,0,0,,,[],,"['Carpet', 'Laminate']",['Forced air'],True,['Central'],True,"['Range', 'Microwave', 'Dishwasher', 'Refrigerator']",,,,,False,,,720.0,,,,['Attached Garage'],,,False,,,False,,False,,,,,,,True,,,['Brick'],,,,,,,,,,,,False,,,,,False,3111721340408,False,False,,Residential-Single Family,,Single Family,,,,,,,False,1972,,False,,,,['City Sewer/Connected'],,,,,,,,,,,True,False,,,,,,,,,,,,False,Edina,,,"[{'name': 'AmenitiesUnit', 'value': 'Porch, Main Floor Master Bedroom'}, {'name': 'Exterior', 'value': 'Brick/Stone'}, {'name': 'Fuel', 'value': 'Natural Gas'}, {'name': 'GarageDescription', 'value': 'Attached Garage, Insulated Garage, Garage Door Opener, Heated Garage, Underground Garage, Tuckunder Garage'}, {'name': 'BathDesc', 'value': 'Main Floor Full Bath'}, {'name': 'HeatingDescription', 'value': 'Forced Air'}, {'name': 'PresentUse', 'value': 'Yearly'}, {'name': 'SpecialSearch', 'value': 'All Living Facilities on One Level'}, {'name': 'AmenitiesShared', 'value': 'Patio, Hot Tub, Sauna, Coin-op Laundry Owned, Security Building, Concrete Floors & Walls, Tennis Courts, In-Ground Sprinkler System'}, {'name': 'FrontageFeet', 'value': 'City'}, {'name': 'SharedRooms', 'value': 'Exercise Room, Amusement/Party Room'}, {'name': 'Water', 'value': 'City Water/Connected'}, {'name': 'DiningRoomDescription', 'value': 'Separate/Formal Dining Room'}, {'name': 'Roof', 'value': 'Flat'}, {'name': 'PoolDescription', 'value': 'Below Ground, Outdoor, Shared, Indoor'}, {'name': 'HandicapAccess', 'value': 'No Stairs Internal'}, {'name': 'TaxYear', 'value': '2019.00'}, {'name': 'CONSTRUCTIONSTATUS', 'value': 'Previously Owned'}, {'name': 'Status', 'value': 'Active'}, {'name': 'AssocFeeIncludes', 'value': 'Shared Amenities, Sanitation, Snow/Lawn Care, Outside Maintenance, Building Exterior, Professional Mgmt, Water/Sewer, Parking Space, Hazard Insurance, Security System, Heating, Electric, Air Conditioning, Cable TV, Snow Removal, Lawn Care'}]",55436,6730 Vernon Ave S APT 213,Edina,MN,44.894984,-93.39393,116000.0,RECENTLY_SOLD,0,55436_152,"Recently sold: $116,000. Freshly painted condo unit in the lovely Fountain Wood development. This 2nd floor unit faces a wooded area for treehouse-like privacy. Great amenities, indoor/outdoor pools, hot tub, gym, tennis courts,party room, saunas guest suite and storage locker. Cement construction for soundproofing and safety. Underground parking as well as unassigned surface parking. On a bus line for convenient transport."
1,1,1,0,0,0,,,,,"['Carpet', 'Linoleum / Vinyl']",['Baseboard'],True,['Wall'],True,"['Dishwasher', 'Garbage disposal', 'Microwave', 'Range / Oven', 'Refrigerator']",,,,,False,,,900.0,,,,,1,,False,True,,False,,False,,,,3,,,False,,,['Brick'],,,,,,,,,,,,False,,,,,False,2811721220098,False,False,,,,Condo,,,,Built up,,,False,1965,,False,,,,,,,,,,,,,,,True,False,,,,,,,,,,,,False,Edina,,,[],55436,4370 Brookside Ct APT 113,Edina,MN,44.919105,-93.356143,153000.0,RECENTLY_SOLD,45,55436_153,"Recently sold: $153,000. This great ground floor condo has views on Minnehaha Creek from the living room, patio and bedroom. This spacious one bedroom home in the Brookside Court community has new carpeting and stainless steel appliances. Building amenities include an indoor heated swimming pool and party room. This fantastic condo is close to HWY 100, 50th France and Todd Park."
2,2,1,1,0,0,,,[],,,['Forced air'],True,['Central'],True,,,,,True,False,,,1684.0,,,,,,,False,,,False,,False,,,,,,,,,,"['Stone', 'Stucco']",,,,,,,,,,,,False,,,,,False,2811721330090,False,False,,Residential-Multi-Family,,Condo,,,,Composition,,,False,2005,,False,,,,['City Sewer/Connected'],,,,,,,,,,,True,False,,,,,Edina,,Edina,,Edina,,,False,Edina,,,"[{'name': 'Exterior', 'value': 'Brick/Stone, Stucco'}, {'name': 'Fuel', 'value': 'Natural Gas'}, {'name': 'FireplaceLoc', 'value': 'Living Room, Gas Burning'}, {'name': 'GarageDescription', 'value': 'Garage Door Opener, Heated Garage, Underground Garage'}, {'name': 'HeatingDescription', 'value': 'Forced Air'}, {'name': 'PresentUse', 'value': 'Yearly'}, {'name': 'Water', 'value': 'City Water/Connected'}, {'name': 'HandicapAccess', 'value': 'Wheelchair Ramp, Elevator, Hallways 42&rdquo;&#43;'}, {'name': 'TaxYear', 'value': '2019.00'}, {'name': 'CONSTRUCTIONSTATUS', 'value': 'Previously Owned'}, {'name': 'Status', 'value': 'Active'}, {'name': 'AssocFeeIncludes', 'value': 'Shared Amenities, Sanitation, Outside Maintenance, Building Exterior, Professional Mgmt, Water/Sewer, Parking Space, Hazard Insurance, Security System, Cable TV, Snow Removal, Lawn Care'}]",55436,5275 Grandview Sq APT 3402,Edina,MN,44.907263,-93.35614,525000.0,RECENTLY_SOLD,17,55436_154,"Recently sold: $525,000. Top-floor end unit in the newest of the Grandview Square buildings.  Quiet and peaceful with gorgeous park views.  Two bedrooms, two baths, and a den.  Adjacent parking spots right near the elevator.  Large climate-controlled storage.  Indoor car wash, guest suite, exercise room, and party room.  Attentive live-in caretakers.  Immaculate, one-owner condominium, move-in condition throughout"
2,2,1,1,0,0,,,[],,['Concrete'],['Baseboard'],True,['Wall'],True,"['Dishwasher', 'Microwave', 'Range / Oven', 'Refrigerator']",,,,,False,,,1276.0,,,,['Attached Garage'],,,False,,,False,,False,,,,,,,,,,"['Brick', 'Stone']",,,,,,,,,,,,False,3.12 acres,,,,False,2811721220064,False,False,,,,Single Family,,,,Built up,,,False,1965,,False,,,,,,,,,,,,,,,True,False,,,,,Edina,,Edina,,Edina,,,False,Edina,,,"[{'name': 'PRESENTUSE', 'value': 'Yearly'}, {'name': 'STATUS', 'value': 'Pending'}, {'name': 'ZONING', 'value': 'Residential-Single Family'}, {'name': 'FRONTAGEFEET', 'value': 'Private'}, {'name': 'CONSTRUCTIONSTATUS', 'value': 'Previously Owned'}, {'name': 'GARAGEDESCRIPTION', 'value': 'Attached Garage, Garage Door Opener, Driveway - Asphalt, Underground Garage, Driveway - Shared, Assigned, Units Vary, Insulated Garage, Uncovered/Open, Secured, Floor Drain, Paved Lot, Storage'}, {'name': 'APPLIANCES', 'value': 'Range, Exhaust Fan/Hood, Refrigerator, Microwave, Dishwasher, Disposal'}, {'name': 'FIREPLACELOC', 'value': 'Living Room'}, {'name': 'ROOMFLOOR1', 'value': 'Main'}, {'name': 'EXTERIOR', 'value': 'Brick/Stone'}, {'name': 'FUEL', 'value': 'Natural Gas'}, {'name': 'HANDICAPACCESS', 'value': 'No Stairs Internal, Doors 36&rdquo;&#43;, Hallways 42&rdquo;&#43;, Elevator'}, {'name': 'SEWER', 'value': 'City Sewer/Connected'}, {'name': 'WATER', 'value': 'City Water/Connected'}, {'name': 'AMENITIESSHARED', 'value': 'Sauna, Elevator(s), Car Wash, Concrete Floors & Walls, Security Building, Coin-op Laundry Owned, In-Ground Sprinkler System'}, {'name': 'BATHDESC', 'value': 'Main Floor Full Bath, 3/4 Master'}, {'name': 'ASSOCFEEINCLUDES', 'value': 'Heating, Sanitation, Outside Maintenance, Hazard Insurance, Water/Sewer, Professional Mgmt, Security System, Cable TV, Internet, Parking Space, Snow Removal, Lawn Care'}, {'name': 'DININGROOMDESCRIPTION', 'value': 'Informal Dining Room'}, {'name': 'ROOF', 'value': 'Age 8 Years or Less, Flat, Rubber'}, {'name': 'HEATINGDESCRIPTION', 'value': 'Hot Water, Boiler, Baseboard'}, {'name': 'POOLDESCRIPTION', 'value': 'Shared, Heated, Indoor'}, {'name': 'SHAREDROOMS', 'value': 'Amusement/Party Room'}, {'name': 'LAKEWATERFRONT', 'value': 'Creek/Stream, Shared, Association Access'}, {'name': 'STYLE', 'value': '(CC) Low Rise (3- Levels)'}, {'name': 'TAXYEAR', 'value': '2019.00'}, {'name': 'DAYSONMARKET', 'value': '32'}, {'name': 'DAYSONMARKETCUMULATIVE', 'value': '32'}, {'name': 'OFFMARKETDATE', 'value': '2019-11-25T09:52:59'}]",55436,4360 Brookside Ct APT 220,Edina,MN,44.92017,-93.355527,165000.0,RECENTLY_SOLD,1,55436_155,"Recently sold: $165,000. "
3,1,,,,,,,,Finished,['Hardwood'],['Forced air'],True,['Central'],True,,,,,True,False,,,2276.0,,,,['Attached Garage'],3,,False,True,,False,,False,,,,1,,,,,,['Wood'],,,,,,,,,,,,False,0.72 acres,,,,False,3111721110005,False,False,,,,Single Family,,,,Asphalt,,,False,1990,,False,,,,,,,,,,,,,,,True,False,,Ranch,,,,,,,,,,False,Edina,,,[],55436,6212 Parkwood Rd,Edina,MN,44.905811,-93.383531,820000.0,RECENTLY_SOLD,0,55436_156,"Recently sold: $820,000. "
2,2,,,,,,,,,,['Other'],True,['Wall'],True,,,,,True,False,,,1733.0,,,,,,,False,,,False,,False,,,,,,,,,,['Brick'],,,,,,,,,,,,False,,,,,False,2811721220085,False,False,,,,Condo,,,,Built up,,,False,1985,,False,,,,,,,,,,,,,,,True,False,,,,,,,,,,,,False,Edina,,,[],55436,4360 Brookside Ct APT 321,Edina,MN,44.92017,-93.355527,360000.0,RECENTLY_SOLD,0,55436_157,"Recently sold: $360,000. 4360 Brookside Ct APT 321, Edina, MN is a condo home that contains 1,733 sq ft and was built in 1965. It contains 2 bedrooms and 1.75 bathrooms. This home last sold for $360,000 in December 2019. 
 
The Zestimate for this house is $368,416, which has increased by $2,568 in the last 30 days. The Rent Zestimate for this home is $1,795/mo, which has increased by $21/mo in the last 30 days. "
3,3,3,0,0,0,,,[],"Full, Finished (Livable), Egress Windows, Daylight/Lookout Windows","['Hardwood', 'Tile']",['Forced air'],True,['Central'],True,"['Range', 'Microwave', 'Exhaust Fan/Hood', 'Dishwasher', 'Refrigerator', 'Washer', 'Dryer', 'Freezer']",,,,True,False,,,3800.0,,,,['Attached Garage'],3,,False,True,,False,,False,,,,1,,,,,,['Wood'],,,,,,,,,,,,False,0.39 acres,,,,False,3011721430026,False,False,,Residential-Single Family,,Single Family,,,,Other,,,False,1985,,False,,,,['City Sewer/Connected'],,,,,,,,,,,True,False,,Ranch,,,,,,,,,,False,Edina,,,"[{'name': 'AmenitiesUnit', 'value': 'Deck, Porch, Kitchen Window, Vaulted Ceiling(s), Hardwood Floors, Tiled Floors, Patio, Skylight, Walk-In Closet, Ceiling Fan(s), Kitchen Center Island'}, {'name': 'DiningRoomDescription', 'value': 'Informal Dining Room, Eat In Kitchen'}, {'name': 'FireplaceLoc', 'value': 'Wood Burning, Living Room, Family Room, Other'}, {'name': 'Fuel', 'value': 'Natural Gas'}, {'name': 'GarageDescription', 'value': 'Attached Garage, Driveway - Asphalt'}, {'name': 'BathDesc', 'value': 'Main Floor Full Bath, 3/4 Master'}, {'name': 'HeatingDescription', 'value': 'Forced Air'}, {'name': 'PresentUse', 'value': 'Yearly'}, {'name': 'Exterior', 'value': 'Wood'}, {'name': 'Roof', 'value': 'Age Over 8 Years, Shakes'}, {'name': 'FrontageFeet', 'value': 'City'}, {'name': 'Water', 'value': 'City Water/Connected'}, {'name': 'TaxYear', 'value': '2019.00'}, {'name': 'CONSTRUCTIONSTATUS', 'value': 'Previously Owned'}, {'name': 'Status', 'value': 'Active'}]",55436,6505 Willow Wood Rd,Edina,MN,44.906171,-93.390706,733000.0,RECENTLY_SOLD,0,55436_158,"Recently sold: $733,000. Charming curb appeal and convenient main-floor living will draw you to this meticulously maintained home. Enjoy peaceful summer afternoons in the sun-dappled back yard form a spacious deck and screen porch. Welcome your family and guests into the light-filled living spaces with over-sized picture windows capturing views of the private back yard. This is a must see property if you are looking for main floor convenience in a peaceful setting! Now approved for priority in open enrollment to Edina Public Schools, (510C)."
1,1,0,0,0,0,,,,,,,,['Central'],True,,,,,,False,,,720.0,,,,,,,False,,,False,,False,,,,,,,,,,,,,,,,,,,,,,False,,,,,False,3111721340086,False,False,,,,Condo,,,,,,,False,1972,,False,,,,,,,,,,,,,,,True,False,,,,,Hopkins #270,,Hopkins #270,,Hopkins #270,,,False,Edina,,,[],55436,6650 Vernon Ave S APT 204,Edina,MN,44.893573,-93.393963,132000.0,RECENTLY_SOLD,0,55436_159,"Recently sold: $132,000. "
3,2,,,,,,,,,,['Other'],True,['Wall'],True,,,,,,False,,,1733.0,,,,,,,False,,,False,,False,,,,,,,,,,['Brick'],,,,,,,,,,,,False,,,,,False,2811721220106,False,False,,,,Condo,,,,Built up,,,False,1965,,False,,,,,,,,,,,,,,,True,False,,,,,,,,,,,,False,Edina,,,[],55436,4370 Brookside Ct APT 121,Edina,MN,44.919105,-93.356143,325000.0,RECENTLY_SOLD,0,55436_160,"Recently sold: $325,000. 4370 Brookside Ct APT 121, Edina, MN is a condo home that contains 1,733 sq ft and was built in 1965. It contains 3 bedrooms and 1.75 bathrooms. This home last sold for $325,000 in December 2019. 
 
The Zestimate for this house is $332,705, which has increased by $2,309 in the last 30 days. The Rent Zestimate for this home is $1,795/mo, which has increased by $70/mo in the last 30 days. "
4,3,1,2,0,0,,,[],Finished,"['Carpet', 'Hardwood', 'Tile']",['Forced air'],True,"['Central', 'Other']",True,"['Dishwasher', 'Dryer', 'Garbage disposal', 'Microwave', 'Range / Oven', 'Refrigerator', 'Washer']",,,,True,False,,,2511.0,,,,['Attached Garage'],2,,False,True,,False,,False,,,,1,,,False,False,,"['Brick', 'Stone', 'Wood']",,,['City'],True,False,,,,,,,False,0.32 acres,,,,False,3311721220008,False,False,,,,Single Family,,,,Asphalt,,,False,1985,,False,,,,,,,,,,,,,,,True,False,,Ranch,,,Edina - 273,,Edina - 273,,Edina - 273,,,False,Edina,,,"[{'name': None, 'value': 'huge deck'}, {'name': None, 'value': 'Central Heat'}, {'name': None, 'value': 'washer/ dryer in unit'}, {'name': None, 'value': 'huge backyard'}, {'name': None, 'value': 'Breakfast Nook'}, {'name': None, 'value': 'Vaulted Ceilings'}, {'name': None, 'value': 'Central A/C'}, {'name': None, 'value': 'Walk-in closet'}, {'name': None, 'value': 'Hardwood Floors'}]",55436,5412 Edenmoor St,Edina,MN,44.905144,-93.355792,545000.0,RECENTLY_SOLD,54,55436_161,"Recently sold: $545,000. MUST SEE large Edina 1-story rambler with 3 bedrooms and 2 bathrooms on the main level.  Recently renovated home with updated kitchen, bathrooms, and living space with high end fixtures and high end appliances throughout.  New stainless steel kitchen appliances, breakfast bar, and built-in wine rack.  The kitchen opens up to the vaulted ceiling of the living room with a gas fireplace and lots of light from an abundance of windows.  The huge master bedroom suite has a walk-in closet and ensuite master bathroom with extra large shower, along with a dressing area, and accent windows.  Wood floors were refinished throughout the home.  GE cafe series appliances in the kitchen.  Hanstone quartz kitchen countertops. Extra large new deck with private back yard. 2 car attached garage with direct entry into the house. New landscaping in 2017.  Roof is 3 years old.  Do not miss this home."
5,3,3,0,0,0,,,[],Finished,"['Carpet', 'Hardwood', 'Softwood', 'Tile', 'Other']",['Forced air'],True,['Central'],True,"['Dishwasher', 'Dryer', 'Freezer', 'Garbage disposal', 'Microwave', 'Range / Oven', 'Refrigerator', 'Washer']",,,,True,False,,,3050.0,,,,['Detached Garage'],2,,False,True,,False,,False,,,,1,,,False,False,,"['Cement concrete', 'Stone', 'Wood', 'Wood products']",,,['Park'],True,False,,,,,,,False,0.52 acres,,,,False,0511621120014,False,False,,,,Single Family,,,,Asphalt,,,False,2019,,False,,,,,,,,,,,,,,,True,False,,Ranch,,,273 - Edina,,273 - Edina,,273 - Edina,,,False,Edina,,,"[{'name': 'PRESENTUSE', 'value': 'Yearly'}, {'name': 'STATUS', 'value': 'Pending'}, {'name': 'ZONING', 'value': 'Residential-Single Family'}, {'name': 'FRONTAGEFEET', 'value': 'Paved Streets, Curbs, City, Sidewalks'}, {'name': 'BASEMENT', 'value': 'Full, Finished (Livable), Egress Windows, Sump Pump, Concrete Block, Poured Concrete, Drain Tiled'}, {'name': 'CONSTRUCTIONSTATUS', 'value': 'Previously Owned'}, {'name': 'GARAGEDESCRIPTION', 'value': 'Detached Garage, Driveway - Asphalt'}, {'name': 'HEATINGDESCRIPTION', 'value': 'Forced Air'}, {'name': 'APPLIANCES', 'value': 'Exhaust Fan/Hood, Refrigerator, Microwave, Dishwasher, Cooktop, Wall Oven'}, {'name': 'FIREPLACELOC', 'value': 'Living Room, Gas Burning, Family Room, Stone'}, {'name': 'ROOMFLOOR1', 'value': 'Main'}, {'name': 'ROOF', 'value': 'Asphalt Shingles, Pitched, Age 8 Years or Less'}, {'name': 'SPECIALSEARCH', 'value': 'Main Floor Laundry, 3 BR on One Level, All Living Facilities on One Level'}, {'name': 'EXTERIOR', 'value': 'Brick/Stone, Wood, Other'}, {'name': 'FUEL', 'value': 'Natural Gas'}, {'name': 'SEWER', 'value': 'City Sewer/Connected'}, {'name': 'WATER', 'value': 'City Water/Connected'}, {'name': 'BATHDESC', 'value': 'Main Floor Full Bath, Private Master, Full Master, Bathroom Ensuite, Full Basement'}, {'name': 'DININGROOMDESCRIPTION', 'value': 'Informal Dining Room, Breakfast Area'}, {'name': 'TAXYEAR', 'value': '2019.00'}, {'name': 'DAYSONMARKET', 'value': '24'}, {'name': 'DAYSONMARKETCUMULATIVE', 'value': '62'}, {'name': 'OFFMARKETDATE', 'value': '2019-11-11T10:16:33'}]",55436,6213 Tracy Ave,Edina,MN,44.889682,-93.36833,667000.0,RECENTLY_SOLD,49,55436_162,"Recently sold: $667,000. Agents welcome!!!  Complete remodel by award winning Advanced Home Inc with 15 years plus of high end new construction and remodeling. Complete with gourmet kitchen, quartz countertops and custom cabinetry! Over 1850 main level living at its finest with 2 laundry rooms one on each level. A must see. Insulated 2 car garage located on a private half acre lot in prime Edina with a 16x16 Trex deck. LP SmartSide on entire home with natural stone! Come see this masterpiece completely remodeled home by Advanced Home Inc today! Call 763-498-1535 for more info."
4,3,1,1,1,0,,,[],Partial Finished,['Tile'],['Forced air'],True,['Central'],True,['Furnace Humidifier'],,,,True,False,,,3557.0,,,,['Attached Garage'],3,,False,True,,False,,False,,,,2,,,False,False,,['Stone'],,,,,False,,,,,,,False,0.48 acres,,,,False,3111721430071,False,False,,Residential-Single,,Single Family,,,,Asphalt,,,False,1979,,False,,,,['Connected'],,,,,,,,,,,True,False,,Other,,,Edina,,Edina,,Edina,,,False,Edina,,,"[{'name': 'AmenitiesUnit', 'value': 'Kitchen Window'}, {'name': 'AmenitiesUnit', 'value': 'Dryer Hookup'}, {'name': 'AmenitiesUnit', 'value': 'Multiple Phone Lines'}, {'name': 'Fuel', 'value': 'Natural Gas'}, {'name': 'Style', 'value': '(SF) Two Stories'}, {'name': 'GarageDescription', 'value': 'Garage Door Opener'}, {'name': 'GarageDescription', 'value': 'Driveway - Asphalt'}, {'name': 'HandicapAccess', 'value': 'None'}, {'name': 'BathDesc', 'value': '2 Bath'}, {'name': 'PresentUse', 'value': 'Yearly'}, {'name': 'Fence', 'value': 'None'}, {'name': 'FrontageFeet', 'value': 'City'}, {'name': 'AmenitiesUnit', 'value': 'In-Ground Sprinkler'}, {'name': 'Water', 'value': 'Connected'}, {'name': 'BathDesc', 'value': 'Upper Level Full Bath'}, {'name': 'BathDesc', 'value': '4 Master'}, {'name': 'BathDesc', 'value': '4 Bath'}]",55436,6409 Glacier Pl,Edina,MN,44.89346,-93.387559,525000.0,RECENTLY_SOLD,27,55436_163,"Recently sold: $525,000. Priced to sell! Great location! New roof 2013, new furnace 2012, new windows!"
