2,2,1,0,1,0,,,[],,['Hardwood'],['Forced air'],True,,,['Exhaust Fan/Hood'],,,,,False,,,935.0,,,,['Attached Garage'],,,False,,,False,,False,,,,,,,,,,['Vinyl'],,,,,,,,,,,,False,,,,,False,2611921210095,False,False,,Residential-Multi-Family,,Townhouse,,,,Asphalt,,,False,,,False,,,,['City Sewer/Connected'],,,,,,,,,,,True,False,,Other,,,,,,,,,,False,Brooklyn Park,,,"[{'name': 'AmenitiesUnit', 'value': 'Natural Woodwork, Kitchen Window, Washer/Dryer Hookup'}, {'name': 'Fuel', 'value': 'Natural Gas'}, {'name': 'GarageDescription', 'value': 'Garage Door Opener, Driveway - Asphalt'}, {'name': 'BathDesc', 'value': 'Main Floor 1/2 Bath, Upper Level Full Bath'}, {'name': 'PresentUse', 'value': 'Yearly'}, {'name': 'Roof', 'value': 'Pitched, Age 8 Years or Less'}, {'name': 'FrontageFeet', 'value': 'Private'}, {'name': 'Water', 'value': 'City Water/Connected'}]",55444,2567 Brookdale Ln,Brooklyn Park,MN,45.092429,-93.314103,145000.0,SOLD,24,55444_491,"Recently sold: $145,000. Owner of 33 yrs makes this 2 story townhome available. Nicely cared for and upgraded! All woodwork was replaced within the unit and knockdown ceilings. Laminate floors. Nuetral decor. Newer mechanicals and appliances. Spacious, attached 22x9 garage could go tandem for small cas or park motorcyle, bikes etc. Peaceful location and abundant extra parking nearby. Hurry."
5,3,2,1,0,0,,,[],Finished,"['Carpet', 'Hardwood', 'Tile']",['Forced air'],True,['Central'],True,"['Disposal', 'Water Softener - Owned']",,,,True,False,,,2660.0,,,,['Attached Garage'],2,,False,True,,False,,False,,,,,,,False,False,,"['Brick', 'Stone', 'Vinyl']",,,,,False,,,,,,,False,0.39 acres,,,,False,1111921330067,False,False,,Residential-Single,,Single Family,,,,Asphalt,,,False,,,False,,,,['City Sewer/Connected'],,,,,,,,,,,True,False,,Other,,,11 - Anoka-Hennepin,,11 - Anoka-Hennepin,,11 - Anoka-Hennepin,,,False,Brooklyn Park,,,"[{'name': 'AmenitiesUnit', 'value': 'Natural Woodwork, Kitchen Window, Washer/Dryer Hookup, In-Ground Sprinkler'}, {'name': 'BathDesc', 'value': 'Private Master, Upper Level Full Bath, 3/4 Master'}, {'name': 'Fuel', 'value': 'Natural Gas'}, {'name': 'GarageDescription', 'value': 'Garage Door Opener, Driveway - Asphalt'}, {'name': 'SpecialSearch', 'value': '3 BR on One Level'}, {'name': 'PresentUse', 'value': 'Yearly'}, {'name': 'Roof', 'value': 'Age 8 Years or Less'}, {'name': 'OutBuildings', 'value': 'Storage Shed'}, {'name': 'FrontageFeet', 'value': 'City'}, {'name': 'Water', 'value': 'City Water/Connected'}]",55444,9333 Washburn Ave N,Brooklyn Park,MN,45.12509,-93.320318,310000.0,SOLD,17,55444_492,"Recently sold: $310,000. "
5,2,,,,,,,,,,,,,,,,,,,False,,,1128.0,,,,"['Carport', 'Attached Garage']",,,False,,,False,,False,,,,,,,,,,,,,,,,,,,,,,False,0.29 acres,,,,False,2311921440030,False,False,,,,Single Family,,,,,,,False,,,False,,,,,,,,,,,,,,,True,False,,,,,279 - Osseo,,279 - Osseo,,279 - Osseo,,,False,Brooklyn Park,,,[],55444,1724 Brookdale Dr,Brooklyn Park,MN,45.094646,-93.304162,210000.0,SOLD,0,55444_493,"Recently sold: $210,000. This is a Real Estate-Owned (REO)/post-foreclosure home owned by a bank. Offers significantly less than market value are often accepted."
3,2,1,1,0,0,,,[],Finished,"['Carpet', 'Laminate', 'Tile']",['Forced air'],True,['Central'],True,['Exhaust Fan/Hood'],,,,False,False,,,1848.0,,,,['Attached Garage'],2,,False,True,,False,,False,,,,,,,False,False,,['Vinyl'],,,,,False,,,,,,,False,0.22 acres,,,,False,2311921140048,False,False,,Residential-Single,,Single Family,,,,Asphalt,,,False,,,False,,,,['City Sewer/Connected'],,,,,,,,,,,True,False,,Split level,,,,,,,,,,False,Brooklyn Park,,,"[{'name': 'AmenitiesUnit', 'value': 'Kitchen Window, Washer/Dryer Hookup'}, {'name': 'Fuel', 'value': 'Natural Gas'}, {'name': 'GarageDescription', 'value': 'Garage Door Opener, Driveway - Asphalt'}, {'name': 'PresentUse', 'value': 'Yearly'}, {'name': 'Roof', 'value': 'Age 8 Years or Less'}, {'name': 'OutBuildings', 'value': 'Storage Shed'}, {'name': 'FrontageFeet', 'value': 'City, Curbs, Cul De Sac'}, {'name': 'Water', 'value': 'City Water/Connected'}, {'name': 'Style', 'value': '(SF) Three Level Split'}]",55444,8216 Sierra Pkwy,Brooklyn Park,MN,45.104313,-93.303629,252500.0,SOLD,0,55444_494,"Recently sold: $252,500. Freshly updated and affordable home in a quiet and relaxing residential neighborhood!  Recent upgrades include granite countertops, stainless steel appliances, paint/carpet throughout!  Two nice and sunny living spaces plus three bedrooms with generous closet space!  Large eat in kitchen is open to formal dining and living room! Kitty-corner to a nice park and close to quality shopping, golf, and schools!"
2,1,0,0,0,0,,,[],,['Hardwood'],['Forced air'],True,['Other'],True,"['Dryer', 'Washer']",,,,True,False,,,1082.0,,,,"['Attached Garage', 'Off street']",,,False,,,False,,False,,,,,,,,,,['Shingle'],,,,,,,,,,,,False,0.12 acres,,,,False,2411921310100,False,False,,,,Single Family,,,,Asphalt,,,False,,,False,,,,,,,,,,,,,,,True,False,,,,,11 - Anoka-Hennepin,,11 - Anoka-Hennepin,,11 - Anoka-Hennepin,,,False,Brooklyn Park,,,"[{'name': None, 'value': 'Balcony'}, {'name': None, 'value': 'Cooling System: Air Conditioning'}, {'name': None, 'value': 'Garbage included in rent'}, {'name': None, 'value': 'Laundry: In Unit'}, {'name': None, 'value': 'Parking Type: Garage'}]",55444,1058 80th Ave N,Brooklyn Park,MN,45.100348,-93.294731,122500.0,SOLD,17,55444_495,"Recently sold: $122,500. Close to highway, downtown Minneapolis. Quiet neighborhood. 2 bedroom 1 bathroom with laundry adjacent to the bedrooms. Stainless steel appliances in the kitchen along with ample storage. Qualifications: no UDs or evictions within the past 5 years, no felonies/violent or drug convictions within 10 years. Must be able to display income of 2.5 times rent. Credit score of 550+.

Owner pays for trash service"
4,2,1,1,0,0,,,[],,['Hardwood'],['Forced air'],True,,,"['Exhaust Fan/Hood', 'Water Softener - Owned']",,,,True,False,,,2000.0,,,,['Attached Garage'],,,False,,,False,,False,,,,,,,,,,"['Brick', 'Stone', 'Vinyl']",,,,,,,,,,,,False,0.24 acres,,,,False,1111921230009,False,False,,Residential-Single,,Single Family,,,,,,,False,,,False,,,,['City Sewer/Connected'],,,,,,,,,,,True,False,,,,,,,,,,,,False,Brooklyn Park,,,"[{'name': 'AmenitiesUnit', 'value': 'Kitchen Window, In-Ground Sprinkler'}, {'name': 'FireplaceLoc', 'value': 'Wood Stove'}, {'name': 'Fuel', 'value': 'Natural Gas'}, {'name': 'GarageDescription', 'value': 'Insulated Garage, Heated Garage, Uncovered/Open, Driveway - Concrete'}, {'name': 'FrontageFeet', 'value': 'Paved Streets, City'}, {'name': 'PresentUse', 'value': 'Yearly'}, {'name': 'Roof', 'value': 'Age 8 Years or Less'}, {'name': 'BathDesc', 'value': 'Upper Level Full Bath, Separate Tub & Shower, Walk-In Shower Stall'}, {'name': 'OutBuildings', 'value': 'Storage Shed'}, {'name': 'Water', 'value': 'City Water/Connected'}, {'name': 'Style', 'value': '(SF) Four or More Level Split'}]",55444,2832 98th Ave N,Brooklyn Park,MN,45.132885,-93.317987,273000.0,SOLD,0,55444_496,"Recently sold: $273,000. "
5,2,2,0,0,0,,,[],Partial,,['Forced air'],True,,,['Exhaust Fan/Hood'],,,,True,False,,,2594.0,,,,['Attached Garage'],,,False,,,False,,False,,,,,,,,,,['Vinyl'],,,,,,,,,,,,False,0.25 acres,,,,False,2311921320033,False,False,,Residential-Single,,Single Family,,,,Asphalt,,,False,,,False,,,,['City Sewer/Connected'],,,,,,,,,,,True,False,,,,,,,,,,,,False,Brooklyn Park,,,"[{'name': 'AmenitiesUnit', 'value': 'Kitchen Window'}, {'name': 'Fuel', 'value': 'Natural Gas'}, {'name': 'GarageDescription', 'value': 'Driveway - Asphalt'}, {'name': 'SpecialSearch', 'value': '3 BR on One Level, Main Floor Bedroom'}, {'name': 'BathDesc', 'value': 'Main Floor Full Bath'}, {'name': 'FrontageFeet', 'value': 'Paved Streets, City'}, {'name': 'PresentUse', 'value': 'Yearly'}, {'name': 'Roof', 'value': 'Age 8 Years or Less'}, {'name': 'OutBuildings', 'value': 'Storage Shed'}, {'name': 'Water', 'value': 'City Water/Connected'}, {'name': 'Style', 'value': '(SF) Four or More Level Split'}]",55444,2919 80th Cir N,Brooklyn Park,MN,45.100981,-93.319405,318000.0,SOLD,0,55444_497,"Recently sold: $318,000. "
2,2,1,0,1,0,,,[],,['Carpet'],['Forced air'],True,,,"['Dishwasher', 'Refrigerator']",,,,False,False,,,1144.0,,,,['Attached Garage'],2,,False,True,,False,,False,,,,0,,,False,False,,['Other'],,,,,False,,,,,,,False,0.03 acres,,,,False,1111921210306,False,False,,,,Townhouse,,,,,,,False,,,False,,,,,,,,,,,,,,,True,False,,Other,,,,,,,,,,False,Brooklyn Park,,,"[{'name': 'central_air_desc', 'value': 'Central A/C'}, {'name': 'roof_types', 'value': 'Unknown'}, {'name': 'architectural_style', 'value': 'Other'}, {'name': 'has_lawn_fl', 'value': 'Y'}, {'name': 'has_sprinkler_system_fl', 'value': 'Y'}, {'name': 'taxes_annual', 'value': '1611'}]",55444,2605 101st Ln N,Brooklyn Park,MN,45.137073,-93.314452,172500.0,SOLD,36,55444_498,"Recently sold: $172,500. Enjoy this nicely updated townhome close to parks, walking/bike trails and the Coon Rapids Dam Regional Park. This inviting 2 bed, 2 bath townhome with open concept living area features new carpet and paint throughout, new refrigerator and plumbing fixtures, and recently replaced deck! Quick access to Hwy 610 makes this townhome the perfect mix of accessibility and quiet, natural landscape!"
3,2,1,1,0,0,,,[],,,['Forced air'],True,,,,,,,,False,,,1908.0,,,,['Attached Garage'],,,False,,,False,,False,,,,,,,,,,"['Stone', 'Vinyl']",,,,,,,,,,,,False,0.25 acres,,,,False,2311921230039,False,False,,Residential-Single,,Single Family,,,,Asphalt,,,False,,,False,,,,['City Sewer/Connected'],,,,,,,,,,,True,False,,,,,,,,,,,,False,Brooklyn Park,,,"[{'name': 'Fuel', 'value': 'Natural Gas'}, {'name': 'BathDesc', 'value': 'Main Floor Full Bath'}, {'name': 'PresentUse', 'value': 'Yearly'}, {'name': 'Roof', 'value': 'Pitched'}, {'name': 'SpecialSearch', 'value': 'Main Floor Bedroom'}, {'name': 'Water', 'value': 'City Water/Connected'}]",55444,2708 Pearson Pkwy,Brooklyn Park,MN,45.104218,-93.317241,189000.0,SOLD,22,55444_499,"Recently sold: $189,000. Back on market. Negotiation did not come together. Solid home awaits your ideas and energy to make this a home. Needs updates throughout including but not limited to: paint, flooring, cabinetry, stair railings, new appliances, possibly windows, some staining in LL bedroom. Convenient, quiet location close to shopping, transportation, schools. Mature trees shade your yard, deck for grilling. Sold AS IS. Seller will not make repairs for any reason."
4,2,0,0,0,0,,,,Finished,['Hardwood'],['Forced air'],True,['Central'],True,"['Dishwasher', 'Microwave', 'Range / Oven', 'Refrigerator']",,,,False,False,,,1620.0,,,,['Attached Garage'],1,,False,True,,False,,False,,,,,,,False,False,,['Vinyl'],,,,,False,,,,,,,False,0.27 acres,,,,False,2311921420025,False,False,,,,Single Family,,,,Asphalt,,,False,,,False,,,,,,,,,,,,,,,True,False,,Ranch,,,Osseo #279,,Osseo #279,,Osseo #279,,,False,Brooklyn Park,,,[],55444,1908 Yellowstone Trl,Brooklyn Park,MN,45.099499,-93.306421,253500.0,SOLD,1,55444_500,"Recently sold: $253,500. "
3,2,0,0,0,0,,,,,,['Forced air'],True,['Central'],True,,,,,,False,,,1600.0,,,,['Attached Garage'],,,False,,,False,,False,,,,,,,,,,['Composition'],,,,,,,,,,,,False,0.2 acres,,,,False,2311921140047,False,False,,,,Single Family,,,,Asphalt,,,False,,,False,,,,,,,,,,,,,,,True,False,,,,,Osseo 279,,Osseo 279,,Osseo 279,,,False,Brooklyn Park,,,[],55444,1616 82nd Ave N,Brooklyn Park,MN,45.104316,-93.303324,230000.0,SOLD,15,55444_501,"Recently sold: $230,000. WOW! Awesome open floorplan with tons of natural light. Freshly painted. New driveway, new siding, newer windows, furnace, A/C, water heater, and more! HUGE deck! Fenced yard. Tons of storage. This is it! HURRY!"
4,2,,,,,,,,,,,,,,,,,,True,False,,,1086.0,,,,"['Carport', 'Attached Garage']",,,False,,,False,,False,,,,,,,,,,['Composition'],,,,,,,,,,,,False,0.15 acres,,,,False,2311921410082,False,False,,,,Single Family,,,,,,,False,,,False,,,,,,,,,,,,,,,True,False,,,,,,,,,,,,False,Brooklyn Park,,,[],55444,8024 James Ave N,Brooklyn Park,MN,45.100437,-93.302334,248500.0,SOLD,0,55444_502,"Recently sold: $248,500. 8024 James Ave N, Brooklyn Park, MN is a single family home that contains 1,086 sq ft and was built in 1984. It contains 4 bedrooms and 2 bathrooms. This home last sold for $248,500 in May 2018. 
 
The Zestimate for this house is $271,910, which has increased by $2,193 in the last 30 days. The Rent Zestimate for this home is $1,850/mo, which has increased by $112/mo in the last 30 days. "
5,2,1,1,0,0,,,[],,['Carpet'],['Forced air'],True,,,"['Cooktop', 'Wall Oven']",,,,False,False,,,1876.0,,,,['Attached Garage'],2,,False,True,,False,,False,,,,1,,,False,False,,['Wood'],,,,,False,,,,,,,False,0.33 acres,,,,False,2411921440015,False,False,,Residential-Single,,Single Family,,,,Asphalt,,,False,,,False,,,,['City Sewer/Connected'],,,,,,,,,,,True,False,,Other,,,,,,,,,,False,Brooklyn Park,,,"[{'name': 'AmenitiesUnit', 'value': 'Natural Woodwork, Kitchen Window, Washer/Dryer Hookup'}, {'name': 'Fuel', 'value': 'Natural Gas'}, {'name': 'GarageDescription', 'value': 'Driveway - Asphalt'}, {'name': 'SpecialSearch', 'value': '3 BR on One Level'}, {'name': 'BathDesc', 'value': 'Main Floor Full Bath, Upper Level 3/4 Bath'}, {'name': 'PresentUse', 'value': 'Yearly'}, {'name': 'Roof', 'value': 'Age 8 Years or Less'}, {'name': 'Style', 'value': '(SF) One 1/2 Stories'}, {'name': 'Exterior', 'value': 'Shakes'}, {'name': 'FrontageFeet', 'value': 'City'}, {'name': 'Water', 'value': 'City Water/Connected'}]",55444,108 Brookdale Dr,Brooklyn Park,MN,45.094583,-93.283006,245000.0,SOLD,0,55444_503,"Recently sold: $245,000. Exceptional 5 bedroom home. Enjoy the spacious kitchen, living room and family room. Original hardwood floors in all bedrooms and upper level hallway. New Pella double-hung windows 2014, furnace 2017, water heater 2016, roof 2013. House was painted in 2015 and cedar shakes were added to the gables and band board trim added around windows. Another 1,000 square feet available to be finished in basement. Convenient access to major roadways, shopping, parks and trails (Mississippi River Trail)."
3,2,1,0,1,0,,,[],Finished (Livable),,['Forced air'],True,,,"['Dishwasher', 'Dryer', 'Microwave', 'Range / Oven', 'Refrigerator']",,,,False,False,,,1893.0,,,,['Detached Garage'],2,,False,True,,False,,False,,,,1,,,False,False,,['Vinyl'],,,,,False,,,,,,,False,0.23 acres,,,,False,2311921430094,False,False,,Residential-Single Family,,Single Family,,,,Asphalt,,,False,,,False,,,,['City Sewer/Connected'],,,,,,,,,,,True,False,,Other,,,279 - Osseo,,279 - Osseo,,279 - Osseo,,,False,Brooklyn Park,5552868,,"[{'name': 'Fuel', 'value': 'Natural Gas'}, {'name': 'Exterior', 'value': 'Vinyl'}, {'name': 'GarageDescription', 'value': 'Detached Garage'}, {'name': 'HeatingDescription', 'value': 'Forced Air'}, {'name': 'PresentUse', 'value': 'Yearly'}, {'name': 'Water', 'value': 'City Water/Connected'}, {'name': 'TaxYear', 'value': '2019.00'}, {'name': 'CONSTRUCTIONSTATUS', 'value': 'Previously Owned'}, {'name': 'Status', 'value': 'Active'}]",55444,1916 Teton Trl,Brooklyn Park,MN,45.097022,-93.306171,260000.0,FOR_SALE,15,55444_504,"For sale: $260,000. Nicely taken care of home with bright light, open floor plan with lots of natural light and gleaming hardwood floors. Updated Kitchen with lots of space for eat in Kitchen and enjoy the formal dining room.  Finished lower level includes family room, large 3rd bedroom and bath with finished Laundry room. Two car garage for your convenience."
3,2,2,0,0,0,,,[],,['Hardwood'],['Forced air'],True,,,"['Exhaust Fan/Hood', 'Disposal', 'Water Softener - Owned', 'Central Vacuum']",,,,,False,,,1866.0,,,,['Attached Garage'],,,False,,,False,,False,,,,,,,,,,['Vinyl'],,,,,,,,,,,,False,0.25 acres,,,,False,2311921120010,False,False,,Residential-Single,,Single Family,,,,Asphalt,,,False,,,False,,,,['City Sewer/Connected'],,,,,,,,,,,True,False,,,,,,,,,,,,False,Brooklyn Park,,,"[{'name': 'AmenitiesUnit', 'value': 'Kitchen Window, Washer/Dryer Hookup'}, {'name': 'BathDesc', 'value': 'Private Master, Full Master, Main Floor Full Bath, Separate Tub & Shower, Walk-In Shower Stall'}, {'name': 'Fuel', 'value': 'Natural Gas'}, {'name': 'GarageDescription', 'value': 'Insulated Garage, Garage Door Opener, Driveway - Asphalt'}, {'name': 'Fence', 'value': 'Wood'}, {'name': 'PresentUse', 'value': 'Yearly'}, {'name': 'SpecialSearch', 'value': 'Main Floor Bedroom'}, {'name': 'FrontageFeet', 'value': 'City'}, {'name': 'Water', 'value': 'City Water/Connected'}]",55444,2400 84th Ave N,Brooklyn Park,MN,45.107671,-93.310086,257000.0,SOLD,0,55444_505,"Recently sold: $257,000. "
3,3,2,0,1,0,,,,,,['Forced air'],True,['Central'],True,,,,,,False,,,1192.0,,,,"['Carport', 'Attached Garage']",,,False,,,False,,False,,,,,,,,,,['Metal'],,,,,,,,,,,,False,0.31 acres,,,,False,2411921410058,False,False,,,,Single Family,,,,,,,False,,,False,,,,,,,,,,,,,,,True,False,,Other,,,11 - Anoka-Hennepin,,11 - Anoka-Hennepin,,11 - Anoka-Hennepin,,,False,Brooklyn Park,,,[],55444,8040 Sunkist Blvd,Brooklyn Park,MN,45.100794,-93.283134,210000.0,SOLD,24,55444_506,"Recently sold: $210,000. Gleaming hardwood, large windows, beadboard accents, &amp; claw foot tub  - this completely renovated 1920s farmhouse blends original charm w/modern updates! Enter to an open living &amp; dining room leading to kitchen which features updated lighting, granite counters, breakfast bar seating &amp; apron front sink. Back yard deck for quiet mornings &amp; front porch for watching the sun set. 3 beds &amp; full bath w/separate tub &amp; shower upstairs. Enjoy the 0.31 acre lot and convenient location near parks &amp; trails!"
4,2,1,1,0,0,,,[],,['Hardwood'],['Forced air'],True,,,"['Exhaust Fan/Hood', 'Disposal', 'Water Softener - Owned']",,,,True,False,,,2066.0,,,,['Attached Garage'],,,False,,,False,,False,,,,,,,,,,"['Brick', 'Stone']",,,,,,,,,,,,False,0.28 acres,,,,False,2311921410027,False,False,,Residential-Single,,Single Family,,,,,,,False,,,False,,,,['City Sewer/Connected'],,,,,,,,,,,True,False,,Other,,,279 - Osseo,,279 - Osseo,,279 - Osseo,,,False,Brooklyn Park,,,"[{'name': 'Fuel', 'value': 'Natural Gas'}, {'name': 'SpecialSearch', 'value': '3 BR on One Level, Main Floor Bedroom'}, {'name': 'BathDesc', 'value': 'Main Floor Full Bath, 3/4 Master'}, {'name': 'PresentUse', 'value': 'Yearly'}, {'name': 'Roof', 'value': 'Age 8 Years or Less'}, {'name': 'Style', 'value': '(SF) One Story'}, {'name': 'Water', 'value': 'City Water/Connected'}, {'name': 'Fence', 'value': 'Full'}]",55444,7940 Sierra Pkwy,Brooklyn Park,MN,45.099557,-93.303483,220000.0,SOLD,0,55444_507,"Recently sold: $220,000. "
3,2,1,1,0,0,,,[],,"['Laminate', 'Linoleum / Vinyl']",['Forced air'],True,['Central'],True,['Cooktop'],,,,True,False,,,1828.0,,,,['Attached Garage'],,,False,,,False,,False,,,,,,,False,False,,"['Brick', 'Stone']",,,,,False,,,,,,,False,0.26 acres,,,,False,1311921320029,False,False,,Residential-Single,,Single Family,,,,Asphalt,,,False,,,False,,,,['City Sewer/Connected'],,,,,,,,,,,True,False,,Other,,,,,,,,,,False,Brooklyn Park,,,"[{'name': 'AmenitiesUnit', 'value': 'Kitchen Window, Washer/Dryer Hookup'}, {'name': 'Exterior', 'value': 'Fiber Board'}, {'name': 'Fuel', 'value': 'Natural Gas'}, {'name': 'GarageDescription', 'value': 'Driveway - Asphalt'}, {'name': 'Fence', 'value': 'Wood'}, {'name': 'PresentUse', 'value': 'Yearly'}, {'name': 'Roof', 'value': 'Age 8 Years or Less'}, {'name': 'BathDesc', 'value': 'Upper Level Full Bath'}, {'name': 'FrontageFeet', 'value': 'City'}, {'name': 'Water', 'value': 'City Water/Connected'}]",55444,1316 88th Ave N,Brooklyn Park,MN,45.113858,-93.298745,250500.0,SOLD,0,55444_508,"Recently sold: $250,500. "
3,2,1,1,0,0,,,[],,"['Hardwood', 'Tile']",['Forced air'],True,,,"['Cooktop', 'Disposal']",,,,,False,,,1394.0,,,,['Attached Garage'],,,False,,,False,,False,,,,,,,,,,['Vinyl'],,,,,,,,,,,,False,0.19 acres,,,,False,2311921410099,False,False,,Residential-Single,,Single Family,,,,Asphalt,,,False,,,False,,,,['City Sewer/Connected'],,,,,,,,,,,True,False,,,,,279,,279,,279,,,False,Brooklyn Park,,,"[{'name': 'AmenitiesUnit', 'value': 'Kitchen Window, Washer/Dryer Hookup'}, {'name': 'Fuel', 'value': 'Natural Gas, Electric'}, {'name': 'GarageDescription', 'value': 'Garage Door Opener, Driveway - Concrete'}, {'name': 'Fence', 'value': 'Wood'}, {'name': 'BathDesc', 'value': 'Main Floor Full Bath, Rough In'}, {'name': 'FrontageFeet', 'value': 'Paved Streets, City'}, {'name': 'PresentUse', 'value': 'Yearly'}, {'name': 'Roof', 'value': 'Pitched, Age 8 Years or Less'}, {'name': 'Water', 'value': 'City Water/Connected'}]",55444,8024 Irving Ave N,Brooklyn Park,MN,45.100226,-93.301195,225000.0,SOLD,0,55444_509,"Recently sold: $225,000. "
3,1,1,0,0,0,,,[],,,['Forced air'],True,,,"['Dishwasher', 'Dryer', 'Freezer', 'Range / Oven', 'Refrigerator']",,,,,False,,,1428.0,,,,['Attached Garage'],,,False,,,False,,False,,,,1,,,,,,['Composition'],,,,,,,,,,,,False,0.29 acres,,,,False,2211921410119,False,False,,,,Single Family,,,,Asphalt,,,False,,,False,,,,,,,,,,,,,,,True,False,,,,,,,,,,,,False,Brooklyn Park,,,"[{'name': 'central_air_desc', 'value': 'Central A/C'}, {'name': 'architectural_style', 'value': 'Other'}, {'name': 'has_ceiling_fan_fl', 'value': 'Y'}, {'name': 'taxes_annual', 'value': '2517'}]",55444,7885 Xerxes Ct N,Brooklyn Park,MN,45.098979,-93.321666,216000.0,SOLD,24,55444_510,"Recently sold: $216,000. Highest and best due Apr 8th 3pm. From your updated kitchen (including granite countertops) step out the newer patio door onto the deck which overlooks a large fenced and treed yard-Which features a nice shed. Enameled cupboards, fridge, w/h, asphalt drive, front doors, decking and rails ALL WITHIN THE  past 5 years!! Add to this a master W/I closet, Garage work bench, w/s in 2012, mostly newer windows in 2007, R/O drinking water system. Conveniently located."
3,2,,,,,,,,,,,,,,,,,,,False,,,1810.0,,,,"['Carport', 'Attached Garage']",,,False,,,False,,False,,,,,,,,,,['Shingle'],,,,,,,,,,,,False,0.29 acres,,,,False,2511921230057,False,False,,,,Single Family,,,,,,,False,,,False,,,,,,,,,,,,,,,True,False,,,,,11 - Anoka-Hennepin,,11 - Anoka-Hennepin,,11 - Anoka-Hennepin,,,False,Brooklyn Park,,,[],55444,7372 Fremont Ct N,Brooklyn Park,MN,45.089137,-93.296745,255500.0,SOLD,0,55444_511,"Recently sold: $255,500. Super clean, well-maintained home on peaceful cul-de-sac. Fenced yard feels like a park, cared for like a country club. Comfortable, practical home; fully utilized space; meticulously maintained and beautifully cared for property. 3 bed + den, 1 3/4 bath."
6,3,,,,,,,,,,,,,,,,,,True,False,,,1988.0,,,,"['Carport', 'Attached Garage']",,,False,,,False,,False,,,,,,,True,,,,,,,,,,,,,,,False,0.59 acres,,,,False,2411921440020,False,False,,,,Single Family,,,,,,,False,,,False,,,,,,,,,,,,,,,True,False,,Other,,,,,,,,,,False,Brooklyn Park,,,[],55444,7749 Mississippi Ln,Brooklyn Park,MN,45.096123,-93.282745,336941.0,SOLD,0,55444_512,"Recently sold: $336,941. 7749 Mississippi Ln, Brooklyn Park, MN is a single family home that contains 1,988 sq ft and was built in 1966. It contains 6 bedrooms and 3 bathrooms. This home last sold for $336,941 in May 2018. 
 
The Zestimate for this house is $318,162, which has increased by $3,302 in the last 30 days. The Rent Zestimate for this home is $1,700/mo, which has decreased by $135/mo in the last 30 days. "
4,3,3,0,0,0,,,,,['Hardwood'],['Forced air'],True,,,"['Dishwasher', 'Dryer', 'Microwave', 'Refrigerator', 'Washer']",,,,,False,,,2282.0,,,,['Attached Garage'],,,False,,,False,,False,,,,,,,,,,"['Metal', 'Vinyl']",,,,,,,,,,,,False,0.34 acres,,,,False,1111921410012,False,False,,,,Single Family,,,,Asphalt,,,False,,,False,,,,,,,,,,,,,,,True,False,,Other,,,11 - Anoka-Hennepin,,11 - Anoka-Hennepin,,11 - Anoka-Hennepin,,,False,Brooklyn Park,,,[],55444,9532 Knox Ave N,Brooklyn Park,MN,45.127425,-93.304523,285000.0,SOLD,38,55444_513,"Recently sold: $285,000. Beautiful Updated House! 4 Full Ceramic Baths, Kitchen with SS appliances and Alder Cabinets, Hickory Floors. Master has a Full Bath, Walk-In Closet. Bedroom downstairs is large also with a Full Bath. So much to see. Walking distance to park.  Large Fenced In Yard."
5,3,0,0,0,0,,,[],Finished,['Carpet'],['Forced air'],True,['Central'],True,"['Exhaust Fan/Hood', 'Indoor Grill']",,,,False,False,,,2579.0,,,,['Attached Garage'],2,,False,True,,False,,False,,,,,,,False,False,,"['Brick', 'Stone', 'Vinyl']",,,,,False,,,,,,,False,0.24 acres,,,,False,2311921120104,False,False,,Residential-Single,,Single Family,,,,Asphalt,,,False,,,False,,,,['City Sewer/Connected'],,,,,,,,,,,True,False,,Other,,,Osseo #279,,Osseo #279,,Osseo #279,,,False,Brooklyn Park,,,"[{'name': 'AmenitiesUnit', 'value': 'Natural Woodwork, Kitchen Window'}, {'name': 'BathDesc', 'value': 'Full Master, Main Floor Full Bath'}, {'name': 'Fuel', 'value': 'Natural Gas'}, {'name': 'GarageDescription', 'value': 'Driveway - Asphalt'}, {'name': 'Fence', 'value': 'Wood, Partial'}, {'name': 'SpecialSearch', 'value': '3 BR on One Level'}, {'name': 'FrontageFeet', 'value': 'Paved Streets, City'}, {'name': 'PresentUse', 'value': 'Yearly'}, {'name': 'Roof', 'value': 'Age 8 Years or Less'}, {'name': 'Water', 'value': 'City Water/Connected'}]",55444,2308 84th Ave N,Brooklyn Park,MN,45.108468,-93.309395,301000.0,SOLD,0,55444_514,"Recently sold: $301,000. PRICED REDUCED to $324900. Seller open to all offers. Home Warranty. 5BR/3BA/3 Car w/Hot/cold water &amp; drain 1 owner custom built home on a cul de sac. Beautiful Immaculate move in ready Spacious. New roof  some siding. Kit. Ctr Is. w/ Jenn Air Grill. L/O kit. window, eat in Kit/DR area walks out to a 15x20 Deck wide stairs to huge yard for entertaining. Abundance of recessed lighting w/ dimmers thru-out. Vaulted ceilings in spacious LR. Huge lower lvl has 2 addl' BR &amp; 3/4 BA. Pool table stays."
