4,2,2,0,0,0,,,,Finished,"['Carpet', 'Hardwood']",['Forced air'],True,['Central'],True,"['Dishwasher', 'Dryer', 'Microwave', 'Range / Oven', 'Refrigerator']",,,,,False,,,1944.0,,,,['Attached Garage'],,,False,,,False,,False,,,,0,,,,,,['Metal'],,,,,,,,,,,,False,0.29 acres,,,,False,155088001020,False,False,,,,Single Family,,,['Concrete Block'],Asphalt,,,False,,,False,,,,,,,,,,,,,,,True,False,,,,,,,,,,,,False,Monticello,,,[],55362,9434 Oriole Ln,Monticello,MN,45.284799,-93.774027,206000.0,RECENTLY_SOLD,7,55563_70,1,"Recently sold: $206,000. "
4,2,1,1,0,0,,,[],"Full, Finished (Livable), Sump Pump, Egress Windows","['Hardwood', 'Tile']",['Forced air'],True,['Central'],True,"['Range', 'Microwave', 'Exhaust Fan/Hood', 'Dishwasher', 'Refrigerator', 'Washer', 'Dryer', 'Cooktop']",,,,,False,,,1835.0,,,,['Attached Garage'],,,False,,,False,,False,,,,0,,,,,,"['Metal', 'Vinyl']",,,,,,,,,,,,False,0.98 acres,,,,False,155132004060,False,False,,Residential-Single Family,,Single Family,,,['Concrete Block'],Asphalt,,,False,,,False,,,,['City Sewer/Connected'],,,,,,,,,,,True,False,,,,,,,,,,,,False,Monticello,,,"[{'name': 'AmenitiesUnit', 'value': 'Deck, Natural Woodwork, Kitchen Window, Vaulted Ceiling(s), Hardwood Floors, Tiled Floors, Washer/Dryer Hookup, Ceiling Fan(s), Kitchen Center Island, Master Bedroom Walk-In Closet'}, {'name': 'DiningRoomDescription', 'value': 'Informal Dining Room, Kitchen/Dining Room'}, {'name': 'Fuel', 'value': 'Natural Gas'}, {'name': 'Exterior', 'value': 'Vinyl, Metal'}, {'name': 'GarageDescription', 'value': 'Attached Garage, Insulated Garage, Heated Garage, Driveway - Asphalt'}, {'name': 'HeatingDescription', 'value': 'Forced Air'}, {'name': 'FrontageFeet', 'value': 'Paved Streets, City'}, {'name': 'PresentUse', 'value': 'Yearly'}, {'name': 'Roof', 'value': 'Asphalt Shingles, Age 8 Years or Less'}, {'name': 'BathDesc', 'value': '3/4 Basement, Upper Level Full Bath'}, {'name': 'Water', 'value': 'City Water/Connected'}, {'name': 'TaxYear', 'value': '2019.00'}, {'name': 'CONSTRUCTIONSTATUS', 'value': 'Previously Owned'}, {'name': 'Status', 'value': 'Active'}]",55362,10069 Prescott Dr,Monticello,MN,45.296906,-93.81629,250000.0,RECENTLY_SOLD,27,55563_71,1,"Recently sold: $250,000. "
4,3,2,1,0,0,,,[],"Full, Finished (Livable), Drain Tiled, Sump Pump, Walkout, Egress Windows, Poured Concrete, Drainage System","['Hardwood', 'Tile']",['Forced air'],True,['Central'],True,"['Range', 'Microwave', 'Exhaust Fan/Hood', 'Dishwasher', 'Refrigerator', 'Washer', 'Dryer', 'Disposal', 'Water Softener - Owned', 'Furnace Humidifier', 'Air-To-Air Exchanger', 'Electronic Air Filter', 'Water Filtration System']",,,,True,False,,,2681.0,,,,['Attached Garage'],,,False,,,False,,False,,,,0,,,,,,"['Brick', 'Stone', 'Vinyl']",,,,,,,,,,,,False,0.15 acres,,,,False,118190009040,False,False,,Residential-Single Family,,Townhouse,,,['Concrete'],Asphalt,,,False,,,False,,,,['City Sewer/Connected'],,,,,,,,,,,True,False,,Ranch,,,,,,,,,,False,Otsego,,,"[{'name': 'AmenitiesUnit', 'value': 'Deck, Natural Woodwork, Vaulted Ceiling(s), Hardwood Floors, Tiled Floors, Sun Room, Washer/Dryer Hookup, Patio, Walk-In Closet, Ceiling Fan(s), In-Ground Sprinkler, Local Area Network, Indoor Sprinklers, Kitchen Center Island, Master Bedroom Walk-In Closet, Main Floor Master Bedroom, Paneled Doors, Wet Bar, Panoramic View'}, {'name': 'BathDesc', 'value': 'Private Master, Full Master, Main Floor Full Bath, 3/4 Basement, Separate Tub & Shower, Walk-In Shower Stall, Bathroom Ensuite, Jetted Tub'}, {'name': 'Exterior', 'value': 'Brick/Stone, Vinyl'}, {'name': 'DiningRoomDescription', 'value': 'Informal Dining Room, Kitchen/Dining Room, Breakfast Area, Living/Dining Room, Eat In Kitchen'}, {'name': 'Fuel', 'value': 'Natural Gas'}, {'name': 'GarageDescription', 'value': 'Attached Garage, Garage Door Opener, Underground Garage, Tuckunder Garage'}, {'name': 'FireplaceLoc', 'value': 'Family Room, Gas Burning'}, {'name': 'HeatingDescription', 'value': 'Forced Air, Fireplace'}, {'name': 'PresentUse', 'value': 'Yearly'}, {'name': 'Roof', 'value': 'Asphalt Shingles'}, {'name': 'SpecialSearch', 'value': 'Main Floor Laundry, Main Floor Bedroom, All Living Facilities on One Level'}, {'name': 'FrontageFeet', 'value': 'Private'}, {'name': 'Water', 'value': 'City Water/Connected'}, {'name': 'AmenitiesShared', 'value': 'Lawn Sprinkler'}, {'name': 'TaxYear', 'value': '2018.00'}, {'name': 'CONSTRUCTIONSTATUS', 'value': 'Previously Owned'}, {'name': 'Status', 'value': 'Active'}, {'name': 'AssocFeeIncludes', 'value': 'Other, Sanitation, Snow/Lawn Care, Snow Removal'}]",55362,9163 Kahl Ct NE,Otsego,MN,45.283994,-93.677482,372500.0,RECENTLY_SOLD,0,55563_72,0,"Recently sold: $372,500. "
2,2,1,1,0,0,,,[],"Full, Finished (Livable), Drain Tiled, Walkout, Egress Windows, Daylight/Lookout Windows","['Carpet', 'Hardwood', 'Linoleum / Vinyl', 'Tile']",['Forced air'],True,['Central'],True,"['Range', 'Microwave', 'Dishwasher', 'Refrigerator', 'Washer', 'Dryer', 'Water Softener - Owned']",,,,True,False,,,1775.0,,,,['Attached Garage'],,,False,,,False,,False,,,,1,,,False,False,,"['Brick', 'Vinyl']",,,['Water'],True,False,,,,,,,False,0.23 acres,,,,False,216120000310,False,False,,Residential-Single Family,,Single Family,,,['Concrete Block'],Asphalt,,,False,,,False,,,,"['Tank with Drainage Field', 'Private']",,,,,,,,,,,True,False,,Ranch,,,,,,,,,,False,Monticello,,,"[{'name': 'AmenitiesUnit', 'value': 'Deck, Kitchen Window, Vaulted Ceiling(s), Hardwood Floors, Tiled Floors, Patio, Ceiling Fan(s), Dock, Security System, Main Floor Master Bedroom, Broadband Available, Panoramic View'}, {'name': 'Exterior', 'value': 'Brick/Stone, Vinyl'}, {'name': 'DiningRoomDescription', 'value': 'Kitchen/Dining Room, Breakfast Area, Living/Dining Room, Eat In Kitchen'}, {'name': 'Fuel', 'value': 'Natural Gas'}, {'name': 'FireplaceLoc', 'value': 'Living Room, Gas Burning'}, {'name': 'WaterfrontView', 'value': 'South, Lake, Panoramic'}, {'name': 'GarageDescription', 'value': 'Detached Garage'}, {'name': 'BathDesc', 'value': 'Main Floor Full Bath, 3/4 Basement, Master Walk-Thru'}, {'name': 'HeatingDescription', 'value': 'Forced Air'}, {'name': 'FrontageFeet', 'value': 'Paved Streets'}, {'name': 'LakeWaterfront', 'value': 'Lake Front, Dock'}, {'name': 'PresentUse', 'value': 'Yearly'}, {'name': 'Roof', 'value': 'Asphalt Shingles, Pitched, Age Over 8 Years'}, {'name': 'SpecialSearch', 'value': 'Main Floor Laundry, Main Floor Bedroom, All Living Facilities on One Level'}, {'name': 'Water', 'value': 'Well'}, {'name': 'WaterfrontElevation', 'value': '0-4'}, {'name': 'WaterfrontSlope', 'value': 'Gradual'}, {'name': 'TaxYear', 'value': '2018.00'}, {'name': 'CONSTRUCTIONSTATUS', 'value': 'Previously Owned'}, {'name': 'Status', 'value': 'Active'}]",55362,3453 144th St NW,Monticello,MN,45.361204,-93.962129,343000.0,RECENTLY_SOLD,66,55563_73,1,"Recently sold: $343,000. COMING SOON! Get a sneak peak at this fabulous walkout Rambler on Locke Lake with 65' of lake shore! You will not be disappointed! Upgrades galore from top to bottom. Enjoy a maintenance free deck with beautiful panoramic views of the lake, a spacious open main level accented by a gas fireplace, 2 BR's, 2 BA's, granite tops, SS appliances, tons of storage, extensive landscaping, double attached garage with adjoining 12 x 8 storage room, newer mechanicals PLUS maintenance free dock included! Be sure to watch for the upcoming listing so you do not miss out on this excellent opportunity! Call Jon D. Jondahl/Re/Max Results 763-286-7573 or jond@jondahl.com."
4,2,2,0,0,0,,,[],Finished,['Hardwood'],['Forced air'],True,['Central'],True,"['Dishwasher', 'Dryer', 'Microwave', 'Range / Oven', 'Refrigerator', 'Washer']",,,,,False,,,1732.0,,,,['Attached Garage'],2,,False,True,,False,,False,,,,1,,,,,,"['Brick', 'Metal', 'Stone', 'Vinyl']",,,,,,,,,,,,False,0.28 acres,,,,False,155090003040,False,False,,,,Single Family,,,,Asphalt,,,False,,,False,,,,,,,,,,,,,,,True,False,,Other,,,882 - Monticello,,882 - Monticello,,882 - Monticello,,,False,Monticello,,,"[{'name': 'PRESENTUSE', 'value': 'Yearly'}, {'name': 'STATUS', 'value': 'Pending'}, {'name': 'TAXYEAR', 'value': '2018.00'}, {'name': 'ZONING', 'value': 'Residential-Single Family'}, {'name': 'FRONTAGEFEET', 'value': 'Paved Streets, City'}, {'name': 'BASEMENT', 'value': 'Full, Finished (Livable), Sump Pump, Daylight/Lookout Windows, Concrete Block, Drain Tiled'}, {'name': 'CONSTRUCTIONSTATUS', 'value': 'Previously Owned'}, {'name': 'EXTERIOR', 'value': 'Metal, Vinyl, Brick/Stone'}, {'name': 'GARAGEDESCRIPTION', 'value': 'Attached Garage, Driveway - Asphalt'}, {'name': 'HEATINGDESCRIPTION', 'value': 'Forced Air'}, {'name': 'APPLIANCES', 'value': 'Range, Refrigerator, Washer, Dryer, Microwave, Dishwasher, Water Softener - Owned'}, {'name': 'FIREPLACELOC', 'value': 'Living Room, Gas Burning'}, {'name': 'AMENITIESUNIT', 'value': 'Deck, Kitchen Window, Ceiling Fan(s), Hardwood Floors, Porch, Vaulted Ceiling(s), Master Bedroom Walk-In Closet, Kitchen Center Island'}, {'name': 'ROOMFLOOR1', 'value': 'Main'}, {'name': 'ROOF', 'value': 'Asphalt Shingles, Pitched, Age 8 Years or Less'}, {'name': 'FUEL', 'value': 'Natural Gas'}, {'name': 'SEWER', 'value': 'City Sewer/Connected'}, {'name': 'WATER', 'value': 'City Water/Connected'}, {'name': 'BATHDESC', 'value': 'Main Floor Full Bath, Full Basement'}, {'name': 'DININGROOMDESCRIPTION', 'value': 'Informal Dining Room'}, {'name': 'FENCE', 'value': 'Chain Link'}, {'name': 'DAYSONMARKETCUMULATIVE', 'value': '22'}, {'name': 'DAYSONMARKET', 'value': '22'}, {'name': 'OFFMARKETDATE', 'value': '2019-07-12T07:50:46'}]",55362,4865 Stoneridge Dr,Monticello,MN,45.286812,-93.789404,242200.0,RECENTLY_SOLD,0,55563_74,0,"Recently sold: $242,200. "
3,3,,,,,,,,Finished,['Hardwood'],['Forced air'],True,['Central'],True,"['Dishwasher', 'Microwave', 'Range / Oven']",,,,True,False,,,1572.0,,,,['Attached Garage'],3,,False,True,,False,,False,,,,2,,,,,,"['Metal', 'Vinyl']",,,,,,,,,,,,False,0.4 acres,,,,False,155155004010,False,False,,,,Single Family,,,,Asphalt,,,False,,,False,,,,,,,,,,,,,,,True,False,,,,,882 - Monticello,,882 - Monticello,,882 - Monticello,,,False,Monticello,,,[],55362,4456 Eakern Cir NE,Monticello,MN,45.279714,-93.796793,240000.0,RECENTLY_SOLD,15,55563_75,1,"Recently sold: $240,000. New Appliances, fresh paint and new carpet. Almost like a new home. Family room offers a corner fireplace on the main level. Nice corner lot. Close to shopping. Appliances are on the way."
3,2,0,0,0,0,,,,Finished,['Hardwood'],['Forced air'],True,['Central'],True,,,,,,False,,,1914.0,,,,['Attached Garage'],,,False,,,False,,False,,,,0,,,,,,['Vinyl'],,,,,,,,,,,,False,0.29 acres,,,,False,155132002080,False,False,,,,Single Family,,,['Concrete Block'],Asphalt,,,False,,,False,,,,,,,,,,,,,,,True,False,,,,,Monticello #882,,Monticello #882,,Monticello #882,,,False,Monticello,,,[],55362,9971 Weston Dr,Monticello,MN,45.295043,-93.814543,263000.0,RECENTLY_SOLD,0,55563_76,0,"Recently sold: $263,000. "
4,2,2,0,0,0,,,[],Finished (Livable),['Tile'],['Forced air'],True,['Central'],True,"['Range', 'Microwave', 'Exhaust Fan/Hood', 'Dishwasher', 'Refrigerator', 'Washer', 'Dryer', 'Water Softener - Owned']",,,,,False,,,1881.0,,,,['Attached Garage'],,,False,,,False,,False,,,,0,,,,,,"['Brick', 'Metal', 'Stone', 'Vinyl']",,,,,,,,,,,,False,0.28 acres,,,,False,155125003030,False,False,,Residential-Single Family,,Single Family,,,['Concrete Block'],Asphalt,,,False,,,False,,,,['City Sewer/Connected'],,,,,,,,,,,True,False,,,,,,,,,,,,False,Monticello,,,"[{'name': 'AmenitiesUnit', 'value': 'Deck, Kitchen Window, Vaulted Ceiling(s), Tiled Floors, Skylight, Ceiling Fan(s), Kitchen Center Island, Cable'}, {'name': 'Exterior', 'value': 'Brick/Stone, Vinyl, Metal'}, {'name': 'Fuel', 'value': 'Natural Gas'}, {'name': 'Fence', 'value': 'Wood'}, {'name': 'HeatingDescription', 'value': 'Forced Air'}, {'name': 'PresentUse', 'value': 'Yearly'}, {'name': 'Roof', 'value': 'Asphalt Shingles'}, {'name': 'DiningRoomDescription', 'value': 'Eat In Kitchen'}, {'name': 'BathDesc', 'value': 'Full Basement, Upper Level Full Bath, Master Walk-Thru'}, {'name': 'Water', 'value': 'City Water/Connected'}, {'name': 'GarageDescription', 'value': 'Other'}, {'name': 'AmenitiesShared', 'value': 'Deck'}, {'name': 'TaxYear', 'value': '2018.00'}, {'name': 'CONSTRUCTIONSTATUS', 'value': 'Previously Owned'}, {'name': 'Status', 'value': 'Active'}]",55362,10069 Park Place Dr,Monticello,MN,45.29644,-93.810631,237500.0,RECENTLY_SOLD,0,55563_77,0,"Recently sold: $237,500. "
4,2,2,0,0,0,,,[],Finished,"['Carpet', 'Hardwood']",['Forced air'],True,['Central'],True,"['Dishwasher', 'Dryer', 'Freezer', 'Microwave', 'Range / Oven', 'Refrigerator', 'Washer']",,,,,False,,,2452.0,,,,['Attached Garage'],3,,False,True,,False,,False,,,,0,,,,,,['Vinyl'],,,,,,,,,,,,False,0.26 acres,,,,False,155044002030,False,False,,,,Single Family,,,,Asphalt,,,False,,,False,,,,,,,,,,,,,,,True,False,,Split level,,,Monticello,,Monticello,,Monticello,,,False,Monticello,,,"[{'name': 'PRESENTUSE', 'value': 'Yearly'}, {'name': 'STATUS', 'value': 'Pending'}, {'name': 'TAXYEAR', 'value': '2018.00'}, {'name': 'ZONING', 'value': 'Residential-Single Family'}, {'name': 'CONSTRUCTIONSTATUS', 'value': 'Previously Owned'}, {'name': 'GARAGEDESCRIPTION', 'value': 'Attached Garage'}, {'name': 'HEATINGDESCRIPTION', 'value': 'Forced Air'}, {'name': 'FRONTAGEFEET', 'value': 'City'}, {'name': 'APPLIANCES', 'value': 'Range, Refrigerator, Washer, Dryer, Microwave, Dishwasher, Water Softener - Owned, Air-To-Air Exchanger'}, {'name': 'AMENITIESUNIT', 'value': 'Deck, Kitchen Window, Natural Woodwork'}, {'name': 'ROOMFLOOR1', 'value': 'Main'}, {'name': 'ROOF', 'value': 'Asphalt Shingles'}, {'name': 'EXTERIOR', 'value': 'Vinyl, Brick/Stone'}, {'name': 'FUEL', 'value': 'Natural Gas'}, {'name': 'SEWER', 'value': 'City Sewer/Connected'}, {'name': 'WATER', 'value': 'City Water/Connected'}, {'name': 'BASEMENT', 'value': 'Daylight/Lookout Windows'}, {'name': 'DININGROOMDESCRIPTION', 'value': 'Kitchen/Dining Room'}, {'name': 'SPECIALSEARCH', 'value': '3 BR on One Level'}, {'name': 'BATHDESC', 'value': 'Upper Level Full Bath, Full Basement'}, {'name': 'FENCE', 'value': 'Other'}, {'name': 'DAYSONMARKET', 'value': '25'}, {'name': 'DAYSONMARKETCUMULATIVE', 'value': '25'}, {'name': 'OFFMARKETDATE', 'value': '2019-07-15T07:45:39'}]",55362,2404 Meadow Oak Ave,Monticello,MN,45.287649,-93.763917,247000.0,RECENTLY_SOLD,57,55563_78,1,"Recently sold: $247,000. Contact co-listing agent, Jill Erlandson, from Kris Lindahl Real Estate at (612) 250-6671 or Jill@KrisLindahl.com for questions and inquiries."
5,2,1,1,0,0,,,,Finished,"['Carpet', 'Other']",['Forced air'],True,['Central'],True,,,,,,False,,,3696.0,,,,['Attached Garage'],2,,False,True,,False,,False,,,,0,,,,,,"['Brick', 'Other']",,,,,,,,,,,,False,1 acres,,,,False,213119003060,False,False,,,,Single Family,,,['Concrete Block'],,,,False,,,False,,,,,,,,,,,,,,,True,False,,Ranch,,,,,,,,,,False,Monticello,,,[],55362,8692 Darlington Ave NE,Monticello,MN,45.276798,-93.8226,385000.0,RECENTLY_SOLD,0,55563_79,0,"Recently sold: $385,000. A Must See! This little rambler has it all. Spacious kitchen with large center island, enter closet and heated floor, large main floor living room with bay window, two large bedrooms  one with large walk-in closet plus large master bedroom with large walk-in closet with area ready to add master bathroom and main floor laundry . Large bedrooms in lower level with large walk-in closets, lower level    entertainment center, with full bar, double glass doors to game/exercise room plus tons of storage in lower level ! More storage and work space 30x40 finished shop with heat,air and office, additional 20x30 cold storage pole building all on a large corner lot.  Plus this property is located a few miles from down town Monticello and State Hwy. 94. West to St. Cloud or East to Minneapolis. Easy commute !"
3,2,1,1,0,0,,,[],"Full, Finished (Livable), Daylight/Lookout Windows",['Tile'],['Forced air'],True,['Central'],True,"['Range', 'Microwave', 'Dishwasher', 'Refrigerator', 'Washer', 'Dryer', 'Freezer']",,,,,False,,,1540.0,,,,['Attached Garage'],,,False,,,False,,False,,,,0,,,,,,"['Brick', 'Stone', 'Wood']",,,['Water'],True,,,,,,,,False,0.32 acres,,,,False,155014003080,False,False,,Residential-Single Family,,Single Family,,,['Concrete Block'],Asphalt,,,False,,,False,,,,['City Sewer/Connected'],,,,,,,,,,,True,False,,,,,,,,,,,,False,Monticello,,,"[{'name': 'AmenitiesUnit', 'value': 'Deck, Kitchen Window, Tiled Floors, Washer/Dryer Hookup, Patio, Kitchen Center Island, Cable'}, {'name': 'Exterior', 'value': 'Brick/Stone, Wood'}, {'name': 'Fuel', 'value': 'Natural Gas'}, {'name': 'GarageDescription', 'value': 'Attached Garage, Garage Door Opener, Driveway - Asphalt, Tuckunder Garage'}, {'name': 'BathDesc', 'value': 'Main Floor Full Bath, 3/4 Basement'}, {'name': 'HeatingDescription', 'value': 'Forced Air'}, {'name': 'PresentUse', 'value': 'Yearly'}, {'name': 'Roof', 'value': 'Asphalt Shingles, Age Over 8 Years'}, {'name': 'SpecialSearch', 'value': 'Main Floor Bedroom'}, {'name': 'DiningRoomDescription', 'value': 'Eat In Kitchen'}, {'name': 'FrontageFeet', 'value': 'City'}, {'name': 'Water', 'value': 'City Water/Connected'}, {'name': 'Fence', 'value': 'Chain Link, Full'}, {'name': 'LakeWaterfront', 'value': 'River View'}, {'name': 'TaxYear', 'value': '2019.00'}, {'name': 'CONSTRUCTIONSTATUS', 'value': 'Previously Owned'}, {'name': 'Status', 'value': 'Active'}]",55362,216 Mississippi Dr,Monticello,MN,45.296162,-93.769233,200000.0,RECENTLY_SOLD,19,55563_80,1,"Recently sold: $200,000. Beautiful home, very well maintained. Across the street from the mighty Mississippi with views of the river. Close to shopping and highway access 1/2 block from famous Swan Park - 1000's of swans visit each year. Home features 3 BR, 2 BA, 2 car, finished lower level, private fenced in back yard, walk out deck off kitchen, newer HVAC system, refrigerator, washer, water softener, remodeled lower bathroom, and much more. This is a must see!"
4,2,2,0,0,0,,,,Finished,"['Carpet', 'Hardwood']",['Forced air'],True,['Central'],True,"['Dishwasher', 'Dryer', 'Freezer', 'Microwave', 'Range / Oven']",,,,True,False,,,2391.0,,,,['Attached Garage'],,,False,,,False,,False,,,,0,,,,,,"['Brick', 'Stone', 'Vinyl']",,,,,,,,,,,,False,0.35 acres,,,,False,155151006030,False,False,,,,Single Family,,,['Concrete Block'],Asphalt,,,False,,,False,,,,,,,,,,,,,,,True,False,,,,,,,,,,,,False,Monticello,,,[],55362,9611 Park Place Dr,Monticello,MN,45.28977,-93.809949,260000.0,RECENTLY_SOLD,25,55563_81,1,"Recently sold: $260,000. Spacious and well cared for Split Foyer Home with 3 main floor bedrooms in complete turnkey condition!  Large master bedroom with walk-through master bath, stainless steel appliances, an abundance of countertops and kitchen cabinets - great for entertaining!  Laminate flooring throughout and the lower level is finished with large family room &amp; side rec room - ideal for Gamer.  Recently finished 16 x 12 deck overlooks the oversized backyard with large garden, plus a 22 x 12 patio at the walkout."
2,1,0,0,0,0,,,,,['Hardwood'],['Forced air'],True,['Central'],True,,,,,,False,,,1068.0,,,,['Attached Garage'],,,False,,,False,,False,,,,0,,,,,,['Vinyl'],,,,,,,,,,,,False,0.25 acres,,,,False,155010038030,False,False,,,,Single Family,,,['Concrete Block'],Asphalt,,,False,,,False,,,,,,,,,,,,,,,True,False,,,,,Monticello #882,,Monticello #882,,Monticello #882,,,False,Monticello,,,[],55362,413 W 3rd St,Monticello,MN,45.30667,-93.799736,115000.0,RECENTLY_SOLD,0,55563_82,0,"Recently sold: $115,000. "
4,2,,,,,,,,Finished,,['Forced air'],True,['Central'],True,,,,,,False,,,1150.0,,,,['Attached Garage'],,,False,,,False,,False,,,,0,,,,,,['Stone'],,,,,,,,,,,,False,,,,,False,155028001010,False,False,,,,Single Family,,,,,,,False,,,False,,,,,,,,,,,,,,,True,False,,,,,,,,,,,,False,Monticello,,,[],55362,1 Riverside Cir,Monticello,MN,45.314703,-93.811275,252000.0,RECENTLY_SOLD,0,55563_83,0,"Recently sold: $252,000. "
2,2,0,0,0,0,,,,Finished,,['Forced air'],True,['Central'],True,,,,,,False,,,1588.0,,,,['Attached Garage'],,,False,,,False,,False,,,,0,,,,,,"['Brick', 'Other']",,,,,,,,,,,,False,,,,,False,155154007030,False,False,,,,Townhouse,,,['Concrete Block'],Asphalt,,,False,,,False,,,,,,,,,,,,,,,True,False,,,,,Monticello #882,,Monticello #882,,Monticello #882,,,False,Monticello,,,[],55362,9106 Orchard Cir,Monticello,MN,45.282596,-93.798087,185000.0,RECENTLY_SOLD,0,55563_84,0,"Recently sold: $185,000. "
3,2,2,0,0,0,,,[],Finished,"['Carpet', 'Linoleum / Vinyl']",['Forced air'],True,['Central'],True,"['Refrigerator', 'Washer']",,,,False,False,,,1640.0,,,,['Attached Garage'],,,False,,,False,,False,,,,2,,,False,False,,"['Brick', 'Stone', 'Vinyl']",,,,,False,,,,,,,False,0.18 acres,,,,False,155173003170,False,False,,,,Single Family,,,['Concrete Block'],Asphalt,,,False,,,False,,,,,,,,,,,,,,,True,False,,,,,,,,,,,,False,Monticello,,,"[{'name': 'PRESENTUSE', 'value': 'Yearly'}, {'name': 'STATUS', 'value': 'Pending'}, {'name': 'ZONING', 'value': 'Residential-Single Family'}, {'name': 'FRONTAGEFEET', 'value': 'Paved Streets, Curbs, City, Sidewalks'}, {'name': 'CONSTRUCTIONSTATUS', 'value': 'Previously Owned'}, {'name': 'GARAGEDESCRIPTION', 'value': 'Attached Garage, Driveway - Concrete'}, {'name': 'HEATINGDESCRIPTION', 'value': 'Forced Air'}, {'name': 'APPLIANCES', 'value': 'Range, Refrigerator, Washer, Dryer, Microwave, Dishwasher'}, {'name': 'BASEMENT', 'value': 'Finished (Livable), Crawl Space, Sump Pump, Daylight/Lookout Windows, Concrete Block, Drain Tiled'}, {'name': 'ROOF', 'value': 'Asphalt Shingles, Pitched, Age 8 Years or Less'}, {'name': 'EXTERIOR', 'value': 'Vinyl, Brick/Stone'}, {'name': 'FUEL', 'value': 'Natural Gas'}, {'name': 'SEWER', 'value': 'City Sewer/Connected'}, {'name': 'WATER', 'value': 'City Water/Connected'}, {'name': 'AMENITIESUNIT', 'value': 'Kitchen Window, Washer/Dryer Hookup, In-Ground Sprinkler'}, {'name': 'DININGROOMDESCRIPTION', 'value': 'Informal Dining Room'}, {'name': 'SPECIALSEARCH', 'value': '3 BR on One Level'}, {'name': 'BATHDESC', 'value': 'Private Master, Upper Level Full Bath, Full Master'}, {'name': 'FENCE', 'value': 'Privacy, Wood'}, {'name': 'ROOMFLOOR1', 'value': 'Upper'}, {'name': 'TAXYEAR', 'value': '2019.00'}, {'name': 'DAYSONMARKET', 'value': '5'}, {'name': 'DAYSONMARKETCUMULATIVE', 'value': '5'}, {'name': 'OFFMARKETDATE', 'value': '2019-05-06T20:36:39'}]",55362,9328 Golden Pond Ln N,Monticello,MN,45.286092,-93.745659,242000.0,RECENTLY_SOLD,0,55563_85,0,"Recently sold: $242,000. "
2,2,,,,,,,,,,['Forced air'],True,['Central'],True,,,,,,False,,,1225.0,,,,['Attached Garage'],,,False,,,False,,False,,,,0,,,,,,['Metal'],,,,,,,,,,,,False,,,,,False,155058001050,False,False,,,,Single Family,,,,,,,False,,,False,,,,,,,,,,,,,,,True,False,,,,,,,,,,,,False,Monticello,,,[],55362,138 Jerry Liefert Dr,Monticello,MN,45.314224,-93.823444,180000.0,RECENTLY_SOLD,0,55563_86,0,"Recently sold: $180,000. "
3,2,0,0,0,0,,,,Finished,['Hardwood'],['Forced air'],True,['Central'],True,,,,,,False,,,3641.0,,,,['Attached Garage'],,,False,,,False,,False,,,,0,,,,,,['Wood'],,,,,,,,,,,,False,0.31 acres,,,,False,155046001050,False,False,,,,Single Family,,,,,,,False,,,False,,,,,,,,,,,,,,,True,False,,,,,Monticello #882,,Monticello #882,,Monticello #882,,,False,Monticello,,,[],55362,1111 Clubview Dr,Monticello,MN,45.306944,-93.814819,325000.0,RECENTLY_SOLD,0,55563_87,0,"Recently sold: $325,000. "
5,5,0,0,0,0,,,,Finished,['Hardwood'],['Other'],True,['Central'],True,,,,,True,False,,,4438.0,,,,['Attached Garage'],,,False,,,False,,False,,,,0,,,True,,,"['Brick', 'Other']",,,,,,,,,,,,False,2.5 acres,,,,False,213100183402,False,False,,,,Single Family,,,['Concrete Block'],,,,False,,,False,,,,,,,,,,,,,,,True,False,,,,,Monticello #882,,Monticello #882,,Monticello #882,,,False,Monticello,,,[],55362,382 90th St NE,Monticello,MN,45.284666,-93.87986,600000.0,RECENTLY_SOLD,0,55563_88,0,"Recently sold: $600,000. "
1,2,1,1,0,0,,,[],Finished,"['Carpet', 'Hardwood']",['Forced air'],True,['Central'],True,"['Dishwasher', 'Dryer', 'Microwave', 'Range / Oven', 'Refrigerator', 'Washer']",,,,,False,,,1540.0,,,,['Attached Garage'],,,False,,,False,,False,,,,0,,,,,,['Stucco'],,,,,,,,,,,,False,0.03 acres,,,,False,155037010010,False,False,,,,Single Family,,,['Concrete Block'],Asphalt,,,False,,,False,,,,,,,,,,,,,,,True,False,,Ranch,,,,,,,,,,False,Monticello,,,"[{'name': 'PRESENTUSE', 'value': 'Yearly'}, {'name': 'STATUS', 'value': 'Pending'}, {'name': 'TAXYEAR', 'value': '2018.00'}, {'name': 'ZONING', 'value': 'Residential-Multi-Family'}, {'name': 'BASEMENT', 'value': 'Full, Finished (Livable), Daylight/Lookout Windows, Concrete Block, Walkout'}, {'name': 'CONSTRUCTIONSTATUS', 'value': 'Previously Owned'}, {'name': 'GARAGEDESCRIPTION', 'value': 'Attached Garage'}, {'name': 'HEATINGDESCRIPTION', 'value': 'Forced Air'}, {'name': 'FRONTAGEFEET', 'value': 'City'}, {'name': 'APPLIANCES', 'value': 'Range, Refrigerator, Washer, Dryer, Microwave, Dishwasher'}, {'name': 'ROOMFLOOR1', 'value': 'Main'}, {'name': 'ROOF', 'value': 'Asphalt Shingles'}, {'name': 'FUEL', 'value': 'Natural Gas'}, {'name': 'SEWER', 'value': 'City Sewer/Connected'}, {'name': 'WATER', 'value': 'City Water/Connected'}, {'name': 'BATHDESC', 'value': 'Main Floor Full Bath, 3/4 Basement'}, {'name': 'ASSOCFEEINCLUDES', 'value': 'Sanitation, Snow/Lawn Care, Outside Maintenance, Hazard Insurance, Water/Sewer, Building Exterior, Professional Mgmt'}, {'name': 'EXTERIOR', 'value': 'Stucco'}, {'name': 'STYLE', 'value': '(TH) Side x Side'}, {'name': 'MULTIPIDYN', 'value': 'Yes'}, {'name': 'DAYSONMARKET', 'value': '25'}, {'name': 'DAYSONMARKETCUMULATIVE', 'value': '25'}, {'name': 'OFFMARKETDATE', 'value': '2019-06-19T09:08:27'}]",55362,149 Riverview Dr APT 7,Monticello,MN,45.296263,-93.771183,175000.0,RECENTLY_SOLD,0,55563_89,0,"Recently sold: $175,000. "
