3,2,2,0,0,0,,,[],"Crawl Space, Finished (Livable), Partial",['Hardwood'],['Forced air'],True,['Central'],True,"['Range', 'Microwave', 'Dishwasher', 'Refrigerator', 'Washer', 'Dryer', 'Water Softener - Owned']",,,,True,False,,,1688.0,,,,['Attached Garage'],,,False,,,False,,False,,,,0,,,,,,"['Brick', 'Stone', 'Vinyl']",,,,,,,,,,,,False,0.37 acres,,,,False,155086002050,False,False,,Residential-Single Family,,Single Family,,,,Asphalt,,,False,,,False,,,,['City Sewer/Connected'],,,,,,,,,,,True,False,,,,,882 - Monticello,,882 - Monticello,,882 - Monticello,,,False,Monticello,,,"[{'name': 'AmenitiesUnit', 'value': 'Kitchen Window, Vaulted Ceiling(s), Hardwood Floors, Patio, In-Ground Sprinkler, Master Bedroom Walk-In Closet'}, {'name': 'Exterior', 'value': 'Brick/Stone, Vinyl'}, {'name': 'DiningRoomDescription', 'value': 'Informal Dining Room, Kitchen/Dining Room'}, {'name': 'Fuel', 'value': 'Natural Gas'}, {'name': 'GarageDescription', 'value': 'Attached Garage, Insulated Garage, Driveway - Asphalt'}, {'name': 'Fence', 'value': 'Wood, Chain Link, Full'}, {'name': 'HeatingDescription', 'value': 'Forced Air'}, {'name': 'FrontageFeet', 'value': 'Paved Streets, City, Cul De Sac'}, {'name': 'PresentUse', 'value': 'Yearly'}, {'name': 'Roof', 'value': 'Asphalt Shingles, Pitched'}, {'name': 'BathDesc', 'value': '3/4 Basement, Upper Level Full Bath, Master Walk-Thru'}, {'name': 'Water', 'value': 'City Water/Connected'}, {'name': 'TaxYear', 'value': '2019.00'}, {'name': 'CONSTRUCTIONSTATUS', 'value': 'Previously Owned'}, {'name': 'Status', 'value': 'Active'}]",55362,9830 Mill Ct,Monticello,MN,45.293205,-93.762158,244900.0,RECENTLY_SOLD,16,55584_127,1,"Recently sold: $244,900. Welcome home! Charming 3 level split, 3 bed, 2, bath w/ a 3 car insulated garage in Monticello, located on a quiet cul-de-sac! Vaulted main level features one of a kind pine flooring throughout, kitchen w/ stainless steel appliances &amp; granite countertops, informal dining that walks out to the 16x16 patio, and a spacious living area. 2 bedrooms up including a large master walk in closet and &amp; walk-thru full bath. Lower level offers third bedroom, 3/4 bath and abundant storage in the 25x20 crawlspace! Don't forget to check out the gorgeous &amp; private, fenced-in backyard w/ storage shed and mature trees, perfect for entertaining guests! Hurry today!"
4,2,,,,,,,,Finished,,['Forced air'],True,['Central'],True,,,,,,False,,,1185.0,,,,['Attached Garage'],,,False,,,False,,False,,,,0,,,,,,"['Brick', 'Other']",,,,,,,,,,,,False,,,,,False,155090002180,False,False,,,,Single Family,,,,,,,False,,,False,,,,,,,,,,,,,,,True,False,,,,,,,,,,,,False,Monticello,,,[],55362,4895 Stoneridge Cir,Monticello,MN,45.286892,-93.787792,150000.0,RECENTLY_SOLD,0,55584_128,0,"Recently sold: $150,000. "
4,2,0,0,0,0,,,,Finished,['Hardwood'],['Forced air'],True,['Central'],True,,,,,,False,,,2101.0,,,,['Attached Garage'],,,False,,,False,,False,,,,0,,,,,,"['Brick', 'Other']",,,,,,,,,,,,False,0.28 acres,,,,False,155125006040,False,False,,,,Single Family,,,['Concrete Block'],,,,False,,,False,,,,,,,,,,,,,,,True,False,,,,,Monticello #882,,Monticello #882,,Monticello #882,,,False,Monticello,,,[],55362,9953 Park Place Dr,Monticello,MN,45.294843,-93.808886,260000.0,RECENTLY_SOLD,0,55584_129,0,"Recently sold: $260,000. "
3,2,,,,,,,,,,['Forced air'],True,['Central'],True,,,,,,False,,,1326.0,,,,['Attached Garage'],,,False,,,False,,False,,,,0,,,,,,"['Brick', 'Other']",,,,,,,,,,,,False,,,,,False,155173001010,False,False,,,,Single Family,,,['Concrete Block'],,,,False,,,False,,,,,,,,,,,,,,,True,False,,,,,,,,,,,,False,Monticello,,,[],55362,9423 Golden Pond Ln N,Monticello,MN,45.287033,-93.747694,249000.0,RECENTLY_SOLD,0,55584_130,0,"Recently sold: $249,000. "
4,2,2,0,0,0,,,,Finished,,['Forced air'],True,['Central'],True,"['Dishwasher', 'Dryer', 'Freezer', 'Garbage disposal', 'Microwave', 'Range / Oven', 'Refrigerator', 'Washer']",,,,,False,,,1681.0,,,,['Attached Garage'],2,,False,True,,False,,False,,,,1,,,,,,['Wood'],,,,,,,,,,,,False,0.35 acres,,,,False,155033002130,False,False,,,,Single Family,,,,Asphalt,,,False,,,False,,,,,,,,,,,,,,,True,False,,Other,,,882 - Monticello,,882 - Monticello,,882 - Monticello,,,False,Monticello,,,[],55362,12 Eagle Cir,Monticello,MN,45.305427,-93.812517,230000.0,RECENTLY_SOLD,0,55584_131,0,"Recently sold: $230,000. Welcome home to a quiet cul-de-sac with Country Club Park adjacent to backyard. Showcasing 4 bedrooms 2 full bathrooms with solid 6 panel doors throughout and matching two tone kitchen. Convenient with garage access from lower level. Plus recessed lighting in living room and family room. Fresh paint and lower level carpet. Backyard storage shed. Lots of mature trees, large fertile gardens, bonus water well,  and a chicken-coop to house up to 6 hens with proper permit from the city."
4,2,2,0,0,0,,,,Finished,"['Hardwood', 'Laminate', 'Tile']",['Forced air'],True,['Central'],True,"['Dishwasher', 'Dryer', 'Freezer', 'Microwave', 'Range / Oven', 'Refrigerator', 'Washer']",,,,False,False,,,2050.0,,,,['Attached Garage'],2,,False,True,,False,,False,,,,1,,,False,False,,['Vinyl'],,,,,False,,,,,,,False,1.43 acres,,,,False,155500032404,False,False,,,,Single Family,,,,Asphalt,,,False,,,False,,,,,,,,,,,,,,,True,False,,Other,,,Monticello #882,,Monticello #882,,Monticello #882,,,False,Monticello,,,[],55362,1509 Hilltop Dr,Monticello,MN,45.318253,-93.821768,270000.0,RECENTLY_SOLD,0,55584_132,0,"Recently sold: $270,000. Charming one-story home w/ large wooded private backyard &amp; access to small creek on quiet cul-de-sac road. Features include maintenance-free exterior, spacious LL family rm for entertaining, hardwood floors, ceramic tile in kitchen, newer roof &amp; more!"
4,2,,,,,,,[],Finished,,['Forced air'],True,['Central'],True,,,,,False,False,,,1800.0,,,,['Attached Garage'],3,,False,True,,False,,False,,,,2,,,False,False,,"['Brick', 'Vinyl']",,,"['City', 'Park']",True,False,,,,,,,False,0.4 acres,,,,False,155080003010,False,False,,,,Single Family,,,,Asphalt,,,False,,,False,,,,,,,,,,,,,,,True,False,,,,,882 - Monticello,,882 - Monticello,,882 - Monticello,,,False,Monticello,,,"[{'name': None, 'value': 'Deck'}, {'name': None, 'value': 'porch/patio'}, {'name': None, 'value': 'large storage shed'}, {'name': None, 'value': 'privacy fence'}, {'name': None, 'value': 'deck'}, {'name': None, 'value': 'attached garage'}, {'name': None, 'value': 'fireplace.'}]",55362,1115 Meadow Oak Dr,Monticello,MN,45.28217,-93.756707,212463.0,RECENTLY_SOLD,14,55584_133,1,"Recently sold: $212,463. The property at 1115 Meadow Oak Dr, Monticello, MN is a Residential Single Family property with 4 bedroom(s) and 2.0 bathroom(s), built in 1995 and is 1050 square feet.Submit your offer today!"
3,2,1,1,0,0,,,,Finished,,['Forced air'],True,['Central'],True,,,,,,False,,,2008.0,,,,['Attached Garage'],2,,False,True,,False,,False,,,,0,,,,,,"['Brick', 'Other']",,,,,,,,,,,,False,,,,,False,155182002040,False,False,,,,Townhouse,,,,,,,False,,,False,,,,,,,,,,,,,,,True,False,,Ranch,,,,,,,,,,False,Monticello,,,[],55362,11571 Spruce Dr,Monticello,MN,45.31862,-93.836513,225000.0,RECENTLY_SOLD,0,55584_134,0,"Recently sold: $225,000. Main level living at it's best! Located in highly desirable Timber Ridge Community. Main level has been completely renovated down to the studs. Purchase a newly remodeled townhome without paying new construction pricing. This unit offers beautiful new flooring throughout, natural wood flooring in the kitchen, carpet in living area and master bedroom, trim around windows and flooring. New window treatments and blinds, new electrical on main level, fresh paint, all new appliances in kitchen, new light fixtures. New kitchen cabinets and island including new countertops. New deck door windows 2018. Maintenance free deck railing. Also has new furnace, water heater and water softener. Low monthly association fees. Call for private showing. Welcome home!"
3,1,1,0,0,0,,,[],Finished,,['Forced air'],True,['Central'],True,"['Dryer', 'Washer']",,,,,False,,,1570.0,,,,"['Attached Garage', 'Off street']",2,,False,True,,False,,False,,,,0,,,,,,"['Brick', 'Metal']",,,,,,,,,,,,False,0.25 acres,,,,False,155010046021,False,False,,,,Single Family,,,,Asphalt,,,False,,,False,,,,,,,,,,,,,,,True,False,,Ranch,,,,,,,,,,False,Monticello,,,"[{'name': None, 'value': 'Balcony'}, {'name': None, 'value': 'Cooling System: Air Conditioning'}, {'name': None, 'value': 'Laundry: In Unit'}, {'name': None, 'value': 'No Utilities included in rent'}, {'name': None, 'value': 'Parking Type: Garage'}]",55362,739 W Broadway St,Monticello,MN,45.309301,-93.803634,211500.0,RECENTLY_SOLD,0,55584_135,0,"Recently sold: $211,500. Nice rambler,  Needs a little TLC- close to school, parks, golf course, walking and bike paths, open floor plan, nice backyard with plenty of room. Updated bedroom Potential  bathroom in the basement just finish it for instant equity. This one won't last long!!"
3,2,1,1,0,0,,,[],Finished,['Hardwood'],['Forced air'],True,['Central'],True,"['Dishwasher', 'Microwave', 'Range / Oven', 'Refrigerator']",,,,False,False,,,1200.0,,,,['Attached Garage'],,,False,,,False,,False,,,,0,,,False,False,,['Other'],,,,,False,,,,,,,False,0.06 acres,,,,False,155112001020,False,False,,Residential-Single Family,,Townhouse,,,['Concrete Block'],Asphalt,,,False,,,False,,,,['City Sewer/Connected'],,,,,,,,,,,True,False,,Ranch,,,,,,,,,,False,Monticello,,,"[{'name': 'AmenitiesUnit', 'value': 'Natural Woodwork, Washer/Dryer Hookup, Exercise Room, Kitchen Center Island, Master Bedroom Walk-In Closet, Main Floor Master Bedroom, Paneled Doors'}, {'name': 'Fuel', 'value': 'Natural Gas'}, {'name': 'GarageDescription', 'value': 'Garage Door Opener, Driveway - Asphalt'}, {'name': 'BathDesc', 'value': 'Main Floor Full Bath, Jetted Tub'}, {'name': 'PresentUse', 'value': 'Yearly'}, {'name': 'Roof', 'value': 'Pitched'}, {'name': 'SpecialSearch', 'value': 'Main Floor Laundry, Main Floor Bedroom, All Living Facilities on One Level'}, {'name': 'Water', 'value': 'City Water/Connected'}, {'name': 'HandicapAccess', 'value': 'Reduced Height Counters, Doors 36&rdquo;&#43;, Grab Bars In Bathroom, No Stairs Internal, Door Lever Handles, Hallways 42&rdquo;&#43;, Fully Wheelchair'}, {'name': 'TaxYear', 'value': '2019.00'}, {'name': 'CONSTRUCTIONSTATUS', 'value': 'Previously Owned'}, {'name': 'Status', 'value': 'Active'}, {'name': 'AssocFeeIncludes', 'value': 'Sanitation, Snow/Lawn Care, Outside Maintenance, Building Exterior, Hazard Insurance'}]",55362,722 W 5th St,Monticello,MN,45.305692,-93.806279,237651.0,RECENTLY_SOLD,0,55584_136,0,"Recently sold: $237,651. "
3,3,2,0,1,0,,,,,"['Carpet', 'Hardwood']",['Forced air'],True,['Central'],True,"['Dishwasher', 'Dryer', 'Garbage disposal', 'Microwave', 'Range / Oven']",,,,False,False,,,1800.0,,,,['Attached Garage'],3,,False,True,,False,,False,,,,0,,,False,False,,"['Brick', 'Other']",,,['Park'],True,False,,,,,,,False,1.18 acres,,,,False,155155002020,False,False,,,,Single Family,,,,Shake/Shingle,,,False,,,False,,,,,,,,,,,,,,,True,False,,,,,,,,,,,,False,Monticello,,,[],55362,4365 89th St NE,Monticello,MN,45.280524,-93.799889,295000.0,RECENTLY_SOLD,30,55584_137,1,"Recently sold: $295,000. Great 2-Story home on over an acre! Open main floor walks out to the large deck overlooking the spacious backyard.  3 bedrooms on one level with a master suite.  Office and laundry on main level.   Unfinished basement walks out to the stunning pavered patio with stone counter/bar.  This one is a must see!"
3,2,2,0,0,0,,,,,,['Baseboard'],True,,,"['Dishwasher', 'Dryer', 'Microwave', 'Range / Oven', 'Refrigerator']",,,,True,False,,,2200.0,,,,['Attached Garage'],,,False,,,False,,False,,,,0,,,,,,,,,['Water'],True,True,,,,,,,False,0.33 acres,,,,False,,False,False,,,,Single Family,,,,Asphalt,,,False,,,False,,,,,,,,,,,,,,,True,False,,,,,,,,,,,,False,Monticello,,,[],55362,14536 Devitt Ave NW,Monticello,MN,45.362653,-93.961052,354000.0,RECENTLY_SOLD,23,55584_138,1,"Recently sold: $354,000. This wonderful lakefront home is located just west of the Twin Cities with easy access to 94.  This year-round three bedrooms, two bath home is located on the Western shores of Locke Lake.  The gradual slope lot invites yard games and outdoor lake activities.  The paver patio landscaped firepit is wonderful for nights at the lake and taking in the stars.  This is a great getaway home within 45 minutes of the Twin Cities."
4,2,2,0,0,0,,,,Finished,,['Forced air'],True,['Central'],True,,,,,False,False,,,1350.0,,,,['Attached Garage'],,,False,,,False,,False,,,,2,,,False,False,,['Vinyl'],,,,,False,,,,,,,False,0.3 acres,,,,False,155109002030,False,False,,,,Single Family,,,,Asphalt,,,False,,,False,,,,,,,,,,,,,,,True,False,,Split level,,,Monticello #882,,Monticello #882,,Monticello #882,,,False,Monticello,,,[],55362,6417 River Ridge Ln,Monticello,MN,45.292168,-93.75717,224000.0,RECENTLY_SOLD,0,55584_139,0,"Recently sold: $224,000. Move-in ready 4 BR split level home in the River Mill Development of Monticello. Just 2 blocks from River Mill Park.  Quick access to shopping, schools, CR 39 and I-94."
4,2,,,,,,,[],Finished,['Mixed'],['Forced air'],True,['Central'],True,,,,,,False,,,2240.0,,,,['Attached Garage'],,,False,,,False,,False,,,,0,,,,,,"['Other', 'Vinyl']",,,,,,,,,,,,False,,,,,False,213024002030,False,False,,,,Single Family,,,['Concrete'],,,,False,,,False,,,,['Septic'],,,,,,,,,,,True,False,,,,,,,,,,,,False,Monticello,,,"[{'name': 'Age', 'value': '31-40 Years Old'}, {'name': 'Water', 'value': 'Well'}, {'name': 'Lot Size', 'value': '2 - 1 Acre'}]",55362,9747 Hall Ave NE,Monticello,MN,45.291614,-93.739826,315000.0,RECENTLY_SOLD,0,55584_140,0,"Recently sold: $315,000. Stately trees offer privacy, cool fun and natural shelter. Convenient kitchen island featuring Jenn-air cooktop &amp; updated lighting will be the entertaining focus. Abundance of storage in extra garage for toys &amp; hobbies. On cul-de-sac"
2,2,,,,,,,,,,,,['Central'],True,,,,,,False,,,1612.0,,,,['Attached Garage'],,,False,,,False,,False,,,,0,,,,,,"['Brick', 'Other']",,,,,,,,,,,,False,,,,,False,118190004160,False,False,,,,Single Family,,,['Slab'],,,,False,,,False,,,,,,,,,,,,,,,True,False,,,,,,,,,,,,False,Otsego,,,[],55362,9213 Kaiser Cir NE,Otsego,MN,45.285329,-93.676701,279900.0,RECENTLY_SOLD,0,55584_141,0,"Recently sold: $279,900. "
3,2,1,0,0,1,,,[],Finished,,['Forced air'],True,['Central'],True,"['Dishwasher', 'Dryer', 'Microwave', 'Range / Oven', 'Refrigerator']",,,,,False,,,1409.0,,,,['Attached Garage'],,,False,,,False,,False,,,,0,,,,,,"['Brick', 'Other']",,,,,,,,,,,,False,,,,,False,155159009010,False,False,,,,Single Family,,,,Asphalt,,,False,,,False,,,,,,,,,,,,,,,True,False,,,,,,,,,,,,False,Monticello,,,"[{'name': 'PRESENTUSE', 'value': 'Yearly'}, {'name': 'STATUS', 'value': 'Pending'}, {'name': 'TAXYEAR', 'value': '2018.00'}, {'name': 'ZONING', 'value': 'Residential-Multi-Family'}, {'name': 'CONSTRUCTIONSTATUS', 'value': 'Previously Owned'}, {'name': 'GARAGEDESCRIPTION', 'value': 'Attached Garage, Driveway - Asphalt'}, {'name': 'HEATINGDESCRIPTION', 'value': 'Forced Air'}, {'name': 'FRONTAGEFEET', 'value': 'City'}, {'name': 'APPLIANCES', 'value': 'Range, Refrigerator, Washer, Dryer, Microwave, Dishwasher'}, {'name': 'FIREPLACELOC', 'value': 'Living Room, Gas Burning'}, {'name': 'ROOF', 'value': 'Asphalt Shingles, Age 8 Years or Less'}, {'name': 'SPECIALSEARCH', 'value': 'Main Floor Laundry'}, {'name': 'FUEL', 'value': 'Natural Gas'}, {'name': 'SEWER', 'value': 'City Sewer/Connected'}, {'name': 'WATER', 'value': 'City Water/Connected'}, {'name': 'AMENITIESUNIT', 'value': 'Patio, Washer/Dryer Hookup, Vaulted Ceiling(s)'}, {'name': 'BASEMENT', 'value': 'Crawl Space, Sump Pump'}, {'name': 'BATHDESC', 'value': 'Main Floor Full Bath, Upper Level Full Bath'}, {'name': 'DININGROOMDESCRIPTION', 'value': 'Kitchen/Dining Room, Eat In Kitchen'}, {'name': 'ASSOCFEEINCLUDES', 'value': 'Outside Maintenance, Hazard Insurance, Professional Mgmt, Snow Removal, Lawn Care'}, {'name': 'STYLE', 'value': '(TH) Side x Side'}, {'name': 'DAYSONMARKET', 'value': '12'}, {'name': 'DAYSONMARKETCUMULATIVE', 'value': '12'}, {'name': 'OFFMARKETDATE', 'value': '2019-05-15T09:24:43'}]",55362,6905 92nd St NE,Monticello,MN,45.284982,-93.747219,188100.0,RECENTLY_SOLD,25,55584_142,1,"Recently sold: $188,100. Perfect opportunity to own a beautiful end unit townhome! Nicely kept, new floors, with an awesome view of the pond! Don't forget the wonderfully cozy sitting area by the fireplace. This place is a 10! Multiple offers received! Highest and best due by Sunday, May 5 at 4pm."
4,3,2,0,1,0,,,,,"['Carpet', 'Hardwood']",['Forced air'],True,['Central'],True,,,,,True,False,,,3100.0,,,,['Attached Garage'],3,,False,True,,False,,False,,,,2,,,,,,"['Brick', 'Metal', 'Stone', 'Vinyl']",,,,,,,,,,,,False,0.37 acres,,,,False,155183002160,False,False,,,,Single Family,,,,Asphalt,,,False,,,False,,,,,,,,,,,,,,,True,False,,,,,Monticello,,Monticello,,Monticello,,,False,Monticello,,,[],55362,6393 82nd St NE,Monticello,MN,45.271334,-93.757739,453000.0,RECENTLY_SOLD,18,55584_143,1,"Recently sold: $453,000. Spacious open home with lots of upgrades &amp; quality materials through out. Huge kitchen w granite, extensive Maple cabinetry, hardwood floors, &amp; high end appliance package. Large dining area open to the family rm and kitchen. Huge master suite, be impressed!"
3,2,2,0,0,0,,,,,,['Forced air'],True,['Central'],True,"['Dishwasher', 'Dryer', 'Microwave', 'Range / Oven', 'Refrigerator']",,,,False,False,,,2000.0,,,,['Attached Garage'],,,False,,,False,,False,,,,0,,,False,False,,"['Brick', 'Other']",,,,,False,,,,,,,False,1 acres,,,,False,155105007010,False,False,,,,Single Family,,,,Asphalt,,,False,2013,,False,,,,,,,,,,,,,,,True,False,,,,,Monticello,,Monticello,,Monticello,,,False,Monticello,,,[],55362,9218 Farmstead Ave,Monticello,MN,45.284831,-93.789227,264400.0,RECENTLY_SOLD,21,55584_144,1,"Recently sold: $264,400. Home is conveniently located within walking distance to schools, park, shopping! Large corner lot. Basement partially finished. Add your touches to lower level bedroom and large family room."
4,6,3,3,0,0,,,,Finished,"['Hardwood', 'Tile']",['Forced air'],True,['Central'],True,"['Dishwasher', 'Dryer', 'Microwave', 'Range / Oven', 'Refrigerator', 'Washer']",,,,True,False,,,2836.0,,,,['Attached Garage'],,,False,,,False,,False,,,,0,,,,,,"['Brick', 'Stucco', 'Wood']",,,,,,,,,,,,False,0.58 acres,,,,False,155020002010,False,False,,,,Single Family,,,,Asphalt,,,False,,,False,,,,,,,,,,,,,,,True,False,,Ranch,,,,,,,,,,False,Monticello,,,[],55362,1101 W River St,Monticello,MN,45.31292,-93.808011,320000.0,RECENTLY_SOLD,0,55584_145,0,"Recently sold: $320,000. This gorgeous Mississippi riverfront home has 4 bedrooms and 3 baths. The main floor living room has large windows overlooking the river. This spacious rambler also has a formal dining room, breakfast nook, and kitchen with large center island, 2 sinks, a cooktop, and wall oven. Enjoy summer evenings relaxing in the 3-season porch enjoying scenic river views. Great location too - just on the outskirts of town. Close to Pinewood elementary school, parks and shopping. 1 year HMS home warranty included in the sale."
4,4,2,0,1,1,,,,Partially finished,"['Carpet', 'Hardwood', 'Tile']",['Forced air'],True,['Central'],True,"['Dishwasher', 'Dryer', 'Freezer', 'Microwave', 'Range / Oven', 'Refrigerator', 'Washer']",,,,True,False,,,2411.0,,,,['Attached Garage'],3,,False,True,,False,,False,,,,0,,,,,,['Metal'],,,['Water'],True,True,,,,,,,False,0.95 acres,,,,False,118121001050,False,False,,,,Single Family,,,['Concrete Block'],Asphalt,,,False,,,False,,,,,,,,,,,,,,,True,False,,,,,,,,,,,,False,Otsego,,,[],55362,10340 Kahler Ave NE,Otsego,MN,45.296449,-93.676241,332850.0,RECENTLY_SOLD,3,55584_146,1,"Recently sold: $332,850. "
4,2,2,0,0,0,,,[],Crawl Space,['Hardwood'],['Forced air'],True,['Central'],True,"['Microwave', 'Refrigerator']",,,,,False,,,2069.0,,,,['Attached Garage'],,,False,,,False,,False,,,,0,,,,,,['Wood'],,,,,,,,,,,,False,0.29 acres,,,,False,155199001030,False,False,,Residential-Single Family,,Single Family,,,['Concrete Block'],Asphalt,,,False,,,False,,,,['City Sewer/Connected'],,,,,,,,,,,True,False,,,,,,,,,,,,False,Monticello,,,"[{'name': 'AmenitiesUnit', 'value': 'Kitchen Center Island, Master Bedroom Walk-In Closet, Main Floor Master Bedroom'}, {'name': 'BathDesc', 'value': 'Private Master, Full Master, Main Floor Full Bath'}, {'name': 'Fuel', 'value': 'Natural Gas'}, {'name': 'GarageDescription', 'value': 'Insulated Garage'}, {'name': 'SpecialSearch', 'value': '3 BR on One Level, Main Floor Laundry, Main Floor Bedroom, All Living Facilities on One Level, 4 BR on One Level'}, {'name': 'PresentUse', 'value': 'Yearly'}, {'name': 'Roof', 'value': 'Pitched, Age 8 Years or Less'}, {'name': 'FrontageFeet', 'value': 'City'}, {'name': 'Water', 'value': 'City Water/Connected'}, {'name': 'HandicapAccess', 'value': 'Doors 36&rdquo;&#43;, No Stairs Internal'}, {'name': 'TaxYear', 'value': '2018.00'}, {'name': 'Status', 'value': 'Active'}, {'name': 'CONSTRUCTIONSTATUS', 'value': 'Completed New Construction'}]",55362,5953 Deer St,Monticello,MN,45.277635,-93.766615,359900.0,RECENTLY_SOLD,20,55584_147,1,"Recently sold: $359,900. "
4,2,0,0,0,0,,,,Finished,"['Hardwood', 'Softwood']",['Forced air'],True,['Central'],True,"['Dishwasher', 'Dryer', 'Garbage disposal', 'Microwave', 'Range / Oven', 'Refrigerator', 'Washer']",,,,False,False,,,1741.0,,,,"['Attached Garage', 'Off street']",,,False,,,False,,False,,,,3,,,True,False,,"['Brick', 'Vinyl']",,,,,False,,,,,,,False,0.5 acres,,,,False,155090005050,False,False,,,,Single Family,,,,Asphalt,,,False,,,False,,,,,,,,,,,,,,,True,False,,Other,,,Monticello #882,,Monticello #882,,Monticello #882,,,False,Monticello,,,[],55362,4704 Farmstead Dr,Monticello,MN,45.287262,-93.792006,245000.0,RECENTLY_SOLD,0,55584_148,0,"Recently sold: $245,000. "
4,2,2,0,0,0,,,[],Crawl Space,,['Forced air'],True,['Central'],True,"['Exhaust Fan/Hood', 'Water Softener - Owned']",,,,,False,,,1896.0,,,,['Attached Garage'],,,False,,,False,,False,,,,0,,,,,,"['Other', 'Stone']",,,,,,,,,,,,False,0.28 acres,,,,False,155033003030,False,False,,Residential-Single Family,,Single Family,,,,Asphalt,,,False,,,False,,,,['City Sewer/Connected'],,,,,,,,,,,True,False,,,,,,,,,,,,False,Monticello,,,"[{'name': 'Fuel', 'value': 'Natural Gas'}, {'name': 'GarageDescription', 'value': 'Insulated Garage, Driveway - Concrete'}, {'name': 'Fence', 'value': 'Wood'}, {'name': 'Exterior', 'value': 'Fiber Board'}, {'name': 'PresentUse', 'value': 'Yearly'}, {'name': 'Roof', 'value': 'Pitched, Age Over 8 Years'}, {'name': 'OutBuildings', 'value': 'Storage Shed'}, {'name': 'BathDesc', 'value': 'Upper Level Full Bath'}, {'name': 'Water', 'value': 'City Water/Connected'}, {'name': 'FrontageFeet', 'value': 'Cul De Sac'}, {'name': 'TaxYear', 'value': '2019.00'}, {'name': 'CONSTRUCTIONSTATUS', 'value': 'Previously Owned'}, {'name': 'Status', 'value': 'Active'}]",55362,14 Eagle Cir,Monticello,MN,45.305764,-93.812537,224900.0,RECENTLY_SOLD,0,55584_149,0,"Recently sold: $224,900. "
4,4,2,1,1,0,,,[],Daylight/Lookout Windows,['Tile'],['Forced air'],True,['Central'],True,"['Exhaust Fan/Hood', 'Water Softener - Owned', 'Furnace Humidifier', 'Air-To-Air Exchanger']",,,,False,False,,,3111.0,,,,['Attached Garage'],3,,False,True,,False,,False,,,,2,,,False,False,,"['Metal', 'Vinyl']",,,['Park'],True,False,,,,,,,False,1.01 acres,,,,False,118164009040,False,False,,Residential-Single Family,,Single Family,,,['Concrete'],Asphalt,,,False,,,False,,,,['Private'],,,,,,,,,,,True,False,,Other,,,,,,,,,,False,Otsego,,,"[{'name': 'AmenitiesUnit', 'value': 'Natural Woodwork, Kitchen Window, Washer/Dryer Hookup, In-Ground Sprinkler, Kitchen Center Island, French Doors, Master Bedroom Walk-In Closet, Panoramic View, Cable'}, {'name': 'BathDesc', 'value': 'Private Master, Full Master, Main Floor 1/2 Bath, Upper Level Full Bath, Separate Tub & Shower, Walk-In Shower Stall, Bathroom Ensuite'}, {'name': 'Fuel', 'value': 'Natural Gas'}, {'name': 'GarageDescription', 'value': 'Garage Door Opener, Driveway - Concrete'}, {'name': 'SpecialSearch', 'value': '3 BR on One Level, Main Floor Laundry'}, {'name': 'PresentUse', 'value': 'Yearly'}, {'name': 'Roof', 'value': 'Pitched, Age Over 8 Years'}, {'name': 'Water', 'value': 'Well, 4-Inch Submersible, Drilled'}, {'name': 'FrontageFeet', 'value': 'City'}, {'name': 'TaxYear', 'value': '2018.00'}, {'name': 'CONSTRUCTIONSTATUS', 'value': 'Previously Owned'}, {'name': 'Status', 'value': 'Active'}, {'name': 'AssocFeeIncludes', 'value': 'Shared Amenities'}]",55362,10134 Jandel Ave NE,Otsego,MN,45.297382,-93.688412,390000.0,RECENTLY_SOLD,0,55584_150,0,"Recently sold: $390,000. "
