3,2,2,0,0,0,,,[],,,,,['Central'],True,,,,,,False,,,1620.0,,,,,,,False,,,False,,False,,,,2,,,,,,['Metal'],,,,,,,,,,,,False,0.59 acres,,,,False,010318900050,False,False,,,,Townhouse,,,,,,,False,,,False,,,,['City'],,,,,,,,,,,True,False,,,,,Duluth #709,,Duluth #709,,Duluth #709,,,False,Duluth,,,"[{'name': 'Sale/Rent', 'value': 'For Sale'}, {'name': 'Classification', 'value': 'NonHomestead'}, {'name': 'Fireplace Type', 'value': 'Gas'}, {'name': 'Association Fee', 'value': 'Yes'}, {'name': 'Construction Status', 'value': 'Under Construction'}, {'name': 'Association Fee Frequency', 'value': 'Monthly'}, {'name': 'Assessments', 'value': 'Unknown'}, {'name': 'New Development', 'value': 'Yes'}, {'name': 'School District', 'value': 'Duluth #709'}, {'name': 'BWCAW Access', 'value': 'Main'}, {'name': 'Lot Description', 'value': 'Landscaped, Corner Lot'}, {'name': 'Fireplace', 'value': 'Yes'}, {'name': 'Fireplaces', 'value': '1'}, {'name': 'Main Floor Bedroom', 'value': '1'}, {'name': 'Style', 'value': 'Condo/Townhouse'}, {'name': 'Garage Dimensions', 'value': '25x25'}, {'name': 'Amenities-Exterior', 'value': 'Deck'}, {'name': 'Association Fee Includes', 'value': 'Exterior Maintenance, Landscaping, Snow Removal, Trash, Building Insurance, Lawn Care'}, {'name': 'Bath Description', 'value': 'Private Master, Full Master'}, {'name': 'Construction Type', 'value': 'Frame/Wood'}, {'name': 'Dining', 'value': 'Formal Dining Room, Eat-In Kitchen'}, {'name': 'Terms', 'value': 'Cash, Conventional, VA DVA, FHA'}, {'name': 'Basement Features', 'value': 'Bedrooms, Den/Office, Family/Rec Room, Fireplace'}, {'name': 'Basement Material', 'value': 'Poured Concrete'}, {'name': 'Basement Style', 'value': 'Full'}, {'name': 'Extra Rooms', 'value': 'Master Bd Bath'}, {'name': 'Heat', 'value': 'Electric, City Gas, Hot Water'}, {'name': 'Roof', 'value': 'Asphalt Shingles'}, {'name': 'Amenities', 'value': 'Eat-In Kitchen, Garage Door Opener, Foyer Entry'}, {'name': 'Road Maintenance', 'value': 'Public'}, {'name': 'Water', 'value': 'City'}, {'name': 'Exterior', 'value': 'Stone, Metal'}]",55811,1114 Butternut Ave,Duluth,MN,46.809482,-92.122049,370600.0,RECENTLY_SOLD,0,55701_40,0,"Recently sold: $370,600. Spectacular town home in the Maple Ridge Development. This design features 3 bedrooms, 2 bathrooms and a large two car garage. Open concept living with vaulted ceilings in the living room which features a gas fireplace and walk out to a potential deck over looking the back yard. The kitchen boasts beautiful cabinetry, quartz counter tops and an island. The master bedroom has a 3 quarter bath and a large 8 x 7 walk in closet. In addition to two more bedroom's and bath on this floor you also have main floor laundry. Home to be completed August 2019. (Pictures shown are of similar unit). Set up a showing today."
2,2,,,,,,,,,,['Other'],True,['Central'],True,,,,,True,False,,,1509.0,,,,['Attached Garage'],1,,False,True,,False,,False,,,,1,,,True,True,,['Other'],,,,,,,,,,,,False,,,,,False,010326700020,False,False,,,,Single Family,,,,,,,False,,,False,,,,,,,,,,,,,,,True,False,,,,,,,,,,,,False,Duluth,,,[],55811,2115 Miller Creek Dr,Duluth,MN,46.819034,-92.17036,295000.0,RECENTLY_SOLD,0,55701_41,0,"Recently sold: $295,000. "
4,2,2,0,0,0,,,[],Finished,,['Other'],True,['Central'],True,,,,,,False,,,1688.0,,,,"['Attached Garage', 'Detached Garage']",,,False,,,False,,False,,,,2,,,,,,"['Other', 'Wood']",,,,,,,,,,,,False,1.11 acres,,,,False,395001004477,False,False,,,,Single Family,,,,Asphalt,,,False,,,False,,,,['City'],,,,,,,,,,,True,False,,,,,Hermantown #700,,Hermantown #700,,Hermantown #700,,,False,Hermantown,,,"[{'name': 'Sale/Rent', 'value': 'For Sale'}, {'name': 'Construction Status', 'value': 'Previously Owned'}, {'name': 'Assessments', 'value': 'Yes'}, {'name': 'Classification', 'value': 'Homestead'}, {'name': 'Occupied By', 'value': 'Owner'}, {'name': 'BWCAW Access', 'value': 'upper'}, {'name': 'School District', 'value': 'Hermantown #700'}, {'name': 'Lot Description', 'value': 'Tree Coverage - Light, Level'}, {'name': 'Main Floor Bedroom', 'value': '1'}, {'name': 'Style', 'value': 'Traditional'}, {'name': 'Garage Dimensions', 'value': '24x24'}, {'name': 'Amenities-Exterior', 'value': 'Deck, Gutter/Downspout'}, {'name': 'Bath Description', 'value': 'Main Floor Full Bath, Full Master'}, {'name': 'Construction Type', 'value': 'Frame/Wood'}, {'name': 'Terms', 'value': 'Cash, Conventional, VA DVA, FHA'}, {'name': 'Amenities', 'value': 'Walk-In Closet, Ceiling Fans, Eat-In Kitchen, Tiled Floors, Hardwood Floors'}, {'name': 'Basement Style', 'value': 'Full'}, {'name': 'Extra Rooms', 'value': 'Den/Office, Master Bd Bath, Sitting/Parlor, Mud Room'}, {'name': 'Heat', 'value': 'Electric'}, {'name': 'Outbuildings', 'value': 'Storage Shed'}, {'name': 'Roof', 'value': 'Asphalt Shingles'}, {'name': 'Road Frontage', 'value': 'City'}, {'name': 'Water', 'value': 'City'}, {'name': 'Exterior', 'value': 'Vinyl'}, {'name': 'Windows', 'value': 'Vinyl Frame'}, {'name': 'Dining', 'value': 'Eat-In Kitchen'}, {'name': 'Basement Features', 'value': 'Washer Hook-Ups, Dryer Hook-Ups'}, {'name': 'Basement Material', 'value': 'Stone'}]",55811,4286 Lindahl Rd,Hermantown,MN,46.821131,-92.258805,204900.0,RECENTLY_SOLD,32,55701_42,1,"Recently sold: $204,900. Come take a look today at this affordable Hermantown home with 4 bedrooms, 2 full bathrooms, and 24x24 garage on a little over an acre! It has a very convenient and quiet location only about a mile to the schools and new Wellness Center!  Plenty of room to spread out with 2 full floors of living space and on city utilities.  You are going to love your large eat in kitchen with new wood flooring, new lighting and updated stainless steel appliances.   On the main floor you have a master suite with updated bathroom, with luxurious tiling and separate vanity area.  In the mornings enjoy sipping your coffee while relaxing in your living room and bathe in the sunshine in the bay window area.  Upstairs you will find 3 more bedrooms, two with walk in closets and a nice common area at the top of the stairs. Full Bathroom on the second level has been nicely updated with subway tiling in the shower, updated vanity, toilet and vinyl window.  Outside you will enjoy being on a quieter road in Hermantown, but still very close to everything you will need.  Other outdoor features include a level yard, deck, shed, and 2 stall garage for all your outdoor toys.  Updates to the home include: new roof on home and garage 2018, maintenance free vinyl siding 2010, stainless steel appliances, 80 gallon water heater 2012, wood flooring 2011, some pex plumbing, both full bathrooms updated, and all windows 2009. Come take a look today before this home is gone!"
3,1,1,0,0,0,,,[],Finished,,['Forced air'],True,['Central'],True,"['Dishwasher', 'Dryer', 'Microwave', 'Range/Stove', 'Refrigerator', 'Washer']",,,,,False,,,1196.0,,,,['Attached Garage'],2,,False,True,,False,,False,,,,1,,,True,True,,['Metal'],,,['Lake Superior'],,,,,,,,,False,0.22 acres,,,,False,010428001430,False,False,,,,Single Family,,,,Metal,,,False,1950,,False,,,,['City'],,,,,,,,,,,True,False,,Bungalow,,,Duluth #709,,Duluth #709,,Duluth #709,,,False,Duluth,,,"[{'name': 'Sale/Rent', 'value': 'For Sale'}, {'name': 'Construction Status', 'value': 'Previously Owned'}, {'name': 'Assessments', 'value': 'Yes'}, {'name': 'Classification', 'value': 'Homestead'}, {'name': 'School District', 'value': 'Duluth #709'}, {'name': 'Parking/Driveway', 'value': 'Off Street, Driveway - Concrete'}, {'name': 'Main Floor Bedroom', 'value': '1'}, {'name': 'Style', 'value': 'Bungalow'}, {'name': 'Lot Description', 'value': 'High'}, {'name': 'Garage Dimensions', 'value': '24x22'}, {'name': 'Amenities-Exterior', 'value': 'Deck, Fenced Yard - Partial'}, {'name': 'Bath Description', 'value': 'Main Floor Full Bath'}, {'name': 'Construction Type', 'value': 'Frame/Wood'}, {'name': 'Dining', 'value': 'Combine with Living Room'}, {'name': 'Heat', 'value': 'Forced Air, City Gas'}, {'name': 'Terms', 'value': 'Cash, Conventional, FHA'}, {'name': 'Amenities', 'value': 'Patio Door, Garage Door Opener, Drywalls, Foyer Entry, Hardwood Floors, Washer Hook-Ups, Dryer Hook-Ups, Panelled Walls, Plaster Walls'}, {'name': 'Basement Features', 'value': 'Family/Rec Room'}, {'name': 'Basement Style', 'value': 'Full'}, {'name': 'Extra Rooms', 'value': 'Family/Rec'}, {'name': 'Outbuildings', 'value': 'Storage Shed, Screenhouse'}, {'name': 'Windows', 'value': 'Wood Frame'}, {'name': 'Road Frontage', 'value': 'City'}, {'name': 'Road Maintenance', 'value': 'Public'}, {'name': 'Basement Material', 'value': 'Concrete Block'}, {'name': 'Water', 'value': 'City'}, {'name': 'Exterior', 'value': 'Steel'}, {'name': 'Roof', 'value': 'Metal'}]",55811,1120 Missouri Ave,Duluth,MN,46.817491,-92.094096,189000.0,RECENTLY_SOLD,1,55701_43,1,"Recently sold: $189,000. "
3,2,0,0,0,0,,,[],,,['Other'],True,['Central'],True,,,,,True,False,,,1829.0,,,,['Attached Garage'],1,,False,True,,False,,False,,,,1,,,True,True,,['Vinyl'],,,,,,,,,,,,False,0.06 acres,,,,False,010318800120,False,False,,,,Single Family,,,,,,,False,,,False,,,,['City'],,,,,,,,,,,True,False,,Other,,,Duluth #709,,Duluth #709,,Duluth #709,,,False,Duluth,,,"[{'name': 'Sale/Rent', 'value': 'For Sale'}, {'name': 'Construction Status', 'value': 'Previously Owned'}, {'name': 'Assessments', 'value': 'Yes'}, {'name': 'Fireplace Type', 'value': 'Gas'}, {'name': 'Association Fee', 'value': 'Yes'}, {'name': 'Classification', 'value': 'Homestead'}, {'name': 'Association Fee Frequency', 'value': 'Monthly'}, {'name': 'School District', 'value': 'Duluth #709'}, {'name': 'Fireplace', 'value': 'Yes'}, {'name': 'Fireplaces', 'value': '1'}, {'name': 'Main Floor Bedroom', 'value': '1'}, {'name': 'Style', 'value': 'Condo/Townhouse'}, {'name': 'Parking/Driveway', 'value': 'Driveway - Shared'}, {'name': 'Air Conditioning', 'value': 'Central'}, {'name': 'Amenities', 'value': 'Main Floor Laundry, Eat-In Kitchen, Garage Door Opener, Vaulted Ceilings, Washer Hook-Ups, Dryer Hook-Ups'}, {'name': 'Amenities-Exterior', 'value': 'Deck'}, {'name': 'Association Fee Includes', 'value': 'Snow Removal, Trash, Building Insurance, Lawn Care'}, {'name': 'Bath Description', 'value': 'Main Floor Full Bath, Private Master, Main Floor 3/4 Bath, 3/4 Master'}, {'name': 'Construction Type', 'value': 'Frame/Wood'}, {'name': 'Dining', 'value': 'Breakfast Bar, Informal Dining Room, Eat-In Kitchen'}, {'name': 'Heat', 'value': 'Forced Air, Fireplace'}, {'name': 'Terms', 'value': 'Cash, Conventional, VA DVA, FHA'}, {'name': 'Basement Material', 'value': 'Poured Concrete'}, {'name': 'Extra Rooms', 'value': 'Utility Room, Sunrm/Solarium'}, {'name': 'Roof', 'value': 'Asphalt Shingles'}, {'name': 'Road Maintenance', 'value': 'Association'}, {'name': 'Water', 'value': 'City'}, {'name': 'Exterior', 'value': 'Vinyl'}, {'name': 'Restrictions/Covenants', 'value': 'Seniors - 55+'}]",55811,1133 Como Ave,Duluth,MN,46.810068,-92.124549,306000.0,RECENTLY_SOLD,1,55701_44,1,"Recently sold: $306,000. "
4,2,1,1,0,0,,,[],Finished,,"['Forced air', 'Radiant']",True,['Central'],True,"['Dishwasher', 'Dryer', 'Range / Oven', 'Refrigerator', 'Washer']",,,,True,False,,,1810.0,,,,['Attached Garage'],1,,False,True,,False,,False,,,,1,,,True,True,,['Vinyl'],,,,,,,,,,,,False,0.18 acres,,,,False,010156002240,False,False,,,,Single Family,,,,Asphalt,,,False,,,False,,,,['City'],,,,,,,,,,,True,False,,Ranch,,,Duluth #709,,Duluth #709,,Duluth #709,,,False,Duluth,,,"[{'name': 'Sale/Rent', 'value': 'For Sale'}, {'name': 'Construction Status', 'value': 'Previously Owned'}, {'name': 'Assessments', 'value': 'Yes'}, {'name': 'Fireplace Type', 'value': 'Wood Burning'}, {'name': 'Classification', 'value': 'Homestead'}, {'name': 'Remodeled/Addition', 'value': 'Yes'}, {'name': 'School District', 'value': 'Duluth #709'}, {'name': 'BWCAW Access', 'value': 'Lower Level'}, {'name': 'Fireplace', 'value': 'Yes'}, {'name': 'Fireplaces', 'value': '1'}, {'name': 'Style', 'value': 'Ranch/Rambler'}, {'name': 'Lot Description', 'value': 'Level'}, {'name': 'Main Floor Bedroom', 'value': '1'}, {'name': 'Amenities-Exterior', 'value': 'Deck, Gutter/Downspout'}, {'name': 'Construction Type', 'value': 'Frame/Wood'}, {'name': 'Dining', 'value': 'Combine with Kitchen, Informal Dining Room'}, {'name': 'Heat', 'value': 'Forced Air'}, {'name': 'Terms', 'value': 'Cash, Conventional'}, {'name': 'Amenities', 'value': 'Patio Door, Eat-In Kitchen, Tiled Floors, Hardwood Floors, Washer Hook-Ups, Dryer Hook-Ups'}, {'name': 'Basement Features', 'value': 'Walkout, Bath, Bedrooms, Family/Rec Room, Utility Room, Partially Finished, Fireplace, Washer Hook-Ups, Dryer Hook-Ups'}, {'name': 'Basement Style', 'value': 'Full'}, {'name': 'Outbuildings', 'value': 'Storage Shed'}, {'name': 'Roof', 'value': 'Asphalt Shingles'}, {'name': 'Road Frontage', 'value': 'Paved, City'}, {'name': 'Basement Material', 'value': 'Concrete Block'}, {'name': 'Water', 'value': 'City'}, {'name': 'Exterior', 'value': 'Vinyl, Brick'}, {'name': 'Windows', 'value': 'Vinyl Frame'}, {'name': 'Disclosures/Docs', 'value': 'Disc./Condition Report'}]",55811,1615 Dodge Ave,Duluth,MN,46.822684,-92.098092,186000.0,RECENTLY_SOLD,1,55701_45,1,"Recently sold: $186,000. "
2,2,1,1,0,0,,,[],Finished,,['Forced air'],True,['Central'],True,,,,,False,False,,,1768.0,,,,"['Attached Garage', 'Detached Garage']",1,,False,True,,False,,False,,,,1,,,False,False,,['Vinyl'],,,,,False,,,,,,,False,0.83 acres,,,,False,010318000415,False,False,,,,Single Family,,,,Asphalt,,,False,,,False,,,,['City'],,,,,,,,,,,True,False,,Bungalow,,,Duluth #709,,Duluth #709,,Duluth #709,,,False,Duluth,,,"[{'name': 'Sale/Rent', 'value': 'For Sale'}, {'name': 'Construction Status', 'value': 'Previously Owned'}, {'name': 'Assessments', 'value': 'Yes'}, {'name': 'Classification', 'value': 'Homestead'}, {'name': 'School District', 'value': 'Duluth #709'}, {'name': 'BWCAW Access', 'value': 'lower'}, {'name': 'Style', 'value': 'Ranch/Rambler'}, {'name': 'Main Floor Bedroom', 'value': '1'}, {'name': 'Air Conditioning', 'value': 'Central'}, {'name': 'Amenities-Exterior', 'value': 'Patio, Porch, Fenced Yard - Partial'}, {'name': 'Construction Type', 'value': 'Frame/Wood'}, {'name': 'Exterior', 'value': 'Wood'}, {'name': 'Heat', 'value': 'Forced Air, City Gas'}, {'name': 'Basement Style', 'value': 'Full'}, {'name': 'Roof', 'value': 'Asphalt Shingles'}, {'name': 'Basement Material', 'value': 'Concrete Block'}, {'name': 'Water', 'value': 'City'}]",55811,727 N Robin Ave,Duluth,MN,46.805645,-92.143355,225000.0,RECENTLY_SOLD,25,55701_46,1,"Recently sold: $225,000. Here it is! A gem of a home in town with close to an acre of incredible, luscious outdoor space all of your own! 2 plus bedroom, 2 bath home in Duluth Heights, centrally located so buzzing downtown or roaming around on top the hill is super convenient.  Modern, crisp colors throughout the home with hardwood floors and tiled flooring.  Classic white kitchen design with large pantry, subway tile backsplash, tiled floors and even space for an eat in area. Right off the kitchen wander into the calming living room with large windows and gorgeous dark stained hardwood floors.  This is definitely the place for a quiet evening cuddled up with a book!  Main floor bathroom is tastefully designed with a tiled shower, neutral colors, and contemporary elements.  As beautiful as the main floor is the lower level boasts more living space including a large family room perfect for movie nights with friends or a play room for the kiddos!  Need an office?  It's here in lower level, away from the hustle and bustle of life upstairs.  How about a craft room, brewing room, or art room? Spend hours in this well thought out area with tile floor, chalk board walls and long counter made just for tinkering on your favorite hobby.  This yard is spectacular! Perennials all around with strategically placed gardens making this backyard an oasis for play or relaxation, it even has a back patio for those who love grilling or just hanging out and enjoying a fairy tale setting right in the back yard!  On top of all this there is a newer furnace, central air, newer windows, newer vinyl siding, a shed and a 1+ stall garage!  Wow!  So much to offer here and won't last long!!"
3,2,1,1,0,0,,,[],Finished,,['Forced air'],True,['Central'],True,,,,,,False,,,1525.0,,,,"['Attached Garage', 'Detached Garage']",,,False,,,False,,False,,,,1,,,,,,"['Other', 'Wood']",,,,,,,,,,,,False,0.6 acres,,,,False,395011000140,False,False,,,,Single Family,,,,Asphalt,,,False,,,False,,,,['City'],,,,,,,,,,,True,False,,Bungalow,,,Hermantown #700,,Hermantown #700,,Hermantown #700,,,False,Hermantown,,,"[{'name': 'Sale/Rent', 'value': 'For Sale'}, {'name': 'Construction Status', 'value': 'Previously Owned'}, {'name': 'Assessments', 'value': 'Yes'}, {'name': 'Classification', 'value': 'Homestead'}, {'name': 'Occupied By', 'value': 'Owner'}, {'name': 'BWCAW Access', 'value': 'Main'}, {'name': 'School District', 'value': 'Hermantown #700'}, {'name': 'Main Floor Bedroom', 'value': '1'}, {'name': 'Style', 'value': 'Bungalow'}, {'name': 'Bath Description', 'value': 'Main Floor Full Bath, Main Floor 3/4 Bath'}, {'name': 'Construction Type', 'value': 'Frame/Wood'}, {'name': 'Dining', 'value': 'Formal Dining Room'}, {'name': 'Heat', 'value': 'Forced Air, City Gas'}, {'name': 'Basement Features', 'value': 'Family/Rec Room'}, {'name': 'Basement Style', 'value': 'Full'}, {'name': 'Roof', 'value': 'Asphalt Shingles'}, {'name': 'Road Maintenance', 'value': 'Public'}, {'name': 'Basement Material', 'value': 'Concrete Block'}, {'name': 'Water', 'value': 'City'}, {'name': 'Exterior', 'value': 'Vinyl'}]",55811,3733 Haines Rd,Hermantown,MN,46.78085,-92.175459,162000.0,RECENTLY_SOLD,21,55701_47,1,"Recently sold: $162,000. This home has a lot of opportunity for a new family looking to buy a home in Hermantown, which offers 3 bedrooms, living room, kitchen and bathroom on the main level of the home. Lower level of the home can have an additional living quarters for more formal gatherings. This home is located near shopping centers, Keenes Creek, bus lines and within minutes for any commute to Duluth or Hermantown, Home is situated on a deep lot for a place for kids to play or host backyard gatherings ."
3,1,1,0,0,0,,,[],,,,,,,,,,,,False,,,993.0,,,,['Detached Garage'],,,False,,,False,,False,,,,1,,,,,,,,,,,,,,,,,,False,3.93 acres,,,,False,010271004080,False,False,,,,Single Family,,,,,,,False,,,False,,,,['Private'],,,,,,,,,,,True,False,,Bungalow,,,Duluth #709,,Duluth #709,,Duluth #709,,,False,Duluth,,,"[{'name': 'Sale/Rent', 'value': 'For Sale'}, {'name': 'Construction Status', 'value': 'Previously Owned'}, {'name': 'Lender Owned', 'value': 'Yes'}, {'name': 'Classification', 'value': 'Homestead'}, {'name': 'School District', 'value': 'Duluth #709'}, {'name': 'Main Floor Bedroom', 'value': '1'}, {'name': 'Style', 'value': 'Bungalow'}, {'name': 'Bath Description', 'value': 'Main Floor Full Bath'}, {'name': 'Construction Type', 'value': 'Frame/Wood'}, {'name': 'Heat', 'value': 'Forced Air, City Gas'}, {'name': 'Basement Style', 'value': 'Full'}, {'name': 'Roof', 'value': 'Asphalt Shingles'}, {'name': 'Basement Material', 'value': 'Concrete Block'}, {'name': 'Water', 'value': 'City'}, {'name': 'Basement Features', 'value': 'Unfinished'}, {'name': 'Exterior', 'value': 'Metal'}]",55811,1214 N Arlington Ave,Duluth,MN,46.809659,-92.130769,125500.0,RECENTLY_SOLD,9,55701_48,1,"Recently sold: $125,500. "
3,2,1,1,0,0,,,[],Finished,,['Other'],True,['Central'],True,,,,,,False,,,1771.0,,,,"['Attached Garage', 'Detached Garage']",1,,False,True,,False,,False,,,,2,,,True,True,,['Other'],,,,,,,,,,,,False,0.38 acres,,,,False,010082500100,False,False,,,,Single Family,,,,,,,False,,,False,,,,['City'],,,,,,,,,,,True,False,,Other,,,Duluth #709,,Duluth #709,,Duluth #709,,,False,Duluth,,,"[{'name': 'Sale/Rent', 'value': 'For Sale'}, {'name': 'Construction Status', 'value': 'Previously Owned'}, {'name': 'Classification', 'value': 'Homestead'}, {'name': 'Assessments', 'value': 'Pending'}, {'name': 'School District', 'value': 'Duluth #709'}, {'name': 'BWCAW Access', 'value': 'upper'}, {'name': 'Main Floor Bedroom', 'value': '0'}, {'name': 'Style', 'value': 'Traditional'}, {'name': 'Parking/Driveway', 'value': 'RV Parking'}, {'name': 'Construction Type', 'value': 'Frame/Wood'}, {'name': 'Heat', 'value': 'Forced Air, Oil'}, {'name': 'Mechanicals', 'value': 'Fuel Tank-Owned'}, {'name': 'Terms', 'value': 'Cash, Conventional'}, {'name': 'Basement Style', 'value': 'Full'}, {'name': 'Roof', 'value': 'Asphalt Shingles'}, {'name': 'Bath Description', 'value': 'Upper Level Bath'}, {'name': 'Dining', 'value': 'Informal Dining Room'}, {'name': 'Road Frontage', 'value': 'City'}, {'name': 'Road Maintenance', 'value': 'Public'}, {'name': 'Basement Material', 'value': 'Concrete Block, Stone'}, {'name': 'Water', 'value': 'City'}, {'name': 'Basement Features', 'value': 'Unfinished'}, {'name': 'Exterior', 'value': 'Vinyl'}, {'name': 'Garage Dimensions', 'value': '32 x 32'}]",55811,3810 Decker Rd,Duluth,MN,46.793646,-92.163471,123000.0,RECENTLY_SOLD,1,55701_49,1,"Recently sold: $123,000. "
3,3,1,0,2,0,,,[],Finished,"['Carpet', 'Hardwood']",,,,,"['Dishwasher', 'Freezer', 'Range / Oven', 'Refrigerator']",,,,True,False,,,1809.0,,,,['Detached Garage'],,,False,,,False,,False,,,,2,,,,,,,,,['Typical'],,,,,,,,,False,0.29 acres,,,,False,010089007390,False,False,,,,Single Family,,,,,,,False,,,False,,,,['City'],,,,,,,,,,,True,False,,Colonial,,,Duluth #709,,Duluth #709,,Duluth #709,,,False,Duluth,,,"[{'name': 'Sale/Rent', 'value': 'For Sale'}, {'name': 'Construction Status', 'value': 'Previously Owned'}, {'name': 'Assessments', 'value': 'Yes'}, {'name': 'Fireplace Type', 'value': 'Gas'}, {'name': 'Classification', 'value': 'Homestead'}, {'name': 'School District', 'value': 'Duluth #709'}, {'name': 'BWCAW Access', 'value': 'upper'}, {'name': 'Main Floor Bedroom', 'value': '0'}, {'name': 'Fireplace', 'value': 'Yes'}, {'name': 'Fireplaces', 'value': '1'}, {'name': 'Parking/Driveway', 'value': 'Off Street, Driveway - Gravel'}, {'name': 'Style', 'value': 'Colonial/Tudor'}, {'name': 'Bath 3 Level', 'value': 'Lower'}, {'name': 'Amenities-Exterior', 'value': 'Deck, Patio'}, {'name': 'Construction Type', 'value': 'Frame/Wood'}, {'name': 'Dining', 'value': 'Combine with Living Room, Informal Dining Room'}, {'name': 'Terms', 'value': 'Cash, Conventional, VA DVA, FHA'}, {'name': 'Basement Features', 'value': 'Bath, Family/Rec Room, Utility Room, Partially Finished'}, {'name': 'Basement Material', 'value': 'Poured Concrete'}, {'name': 'Basement Style', 'value': 'Full'}, {'name': 'Extra Rooms', 'value': 'Den/Office, Family/Rec'}, {'name': 'Outbuildings', 'value': 'Storage Shed'}, {'name': 'Heat', 'value': 'City Gas, Fireplace, Boiler'}, {'name': 'Roof', 'value': 'Asphalt Shingles'}, {'name': 'Bath Description', 'value': 'Upper Level Bath, Main Floor 1/2 Bath, 1/2 Basement'}, {'name': 'Water', 'value': 'City'}, {'name': 'Exterior', 'value': 'Vinyl'}]",55811,11 W Myrtle St,Duluth,MN,46.801457,-92.132666,200000.0,RECENTLY_SOLD,1,55701_50,1,"Recently sold: $200,000. "
3,2,1,1,0,0,,,[],Finished,,['Forced air'],True,['Central'],True,"['Dishwasher', 'Dryer', 'Range/Stove', 'Refrigerator', 'Washer', 'Exhaust Fan/Hood']",,,,,False,,,1443.0,,,,"['Attached Garage', 'Detached Garage']",1,,False,True,,False,,False,,,,1,,,True,True,,['Wood'],,,,,,,,,,,,False,0.22 acres,,,,False,010318300270,False,False,,,,Single Family,,,,Asphalt,,,False,,,False,,,,['City'],,,,,,,,,,,True,False,,Ranch,,,Duluth #709,,Duluth #709,,Duluth #709,,,False,Duluth,,,"[{'name': 'Sale/Rent', 'value': 'For Sale'}, {'name': 'Construction Status', 'value': 'Previously Owned'}, {'name': 'Classification', 'value': 'Homestead'}, {'name': 'Occupied By', 'value': 'Owner'}, {'name': 'Assessments', 'value': 'Unknown'}, {'name': 'School District', 'value': 'Duluth #709'}, {'name': 'BWCAW Access', 'value': 'Main'}, {'name': 'Parking/Driveway', 'value': 'Driveway - Asphalt'}, {'name': 'Style', 'value': 'Ranch/Rambler'}, {'name': 'Lot Description', 'value': 'Level'}, {'name': 'Main Floor Bedroom', 'value': '1'}, {'name': 'Amenities-Exterior', 'value': 'Deck, Porch'}, {'name': 'Bath Description', 'value': 'Main Floor Full Bath, 3/4 Master'}, {'name': 'Construction Type', 'value': 'Frame/Wood'}, {'name': 'Dining', 'value': 'Combine with Kitchen, Informal Dining Room, Eat-In Kitchen'}, {'name': 'Exterior', 'value': 'Wood'}, {'name': 'Heat', 'value': 'Forced Air, City Gas'}, {'name': 'Terms', 'value': 'Cash, Conventional, VA DVA, FHA'}, {'name': 'Amenities', 'value': 'Patio Door, Ceiling Fans, Eat-In Kitchen, Tiled Floors, Hardwood Floors, Washer Hook-Ups, Dryer Hook-Ups'}, {'name': 'Basement Features', 'value': 'Bath, Bedrooms, Utility Room, Partially Finished, Egress Windows, Kitchen, Washer Hook-Ups, Dryer Hook-Ups, Apartment'}, {'name': 'Basement Style', 'value': 'Full'}, {'name': 'Extra Rooms', 'value': 'Second Kitchen, Utility Room, Storage Room'}, {'name': 'Outbuildings', 'value': 'Storage Shed'}, {'name': 'Roof', 'value': 'Asphalt Shingles'}, {'name': 'Road Frontage', 'value': 'Paved, City, Storm Sewer'}, {'name': 'Windows', 'value': 'Energy Windows, Vinyl Frame'}, {'name': 'Road Maintenance', 'value': 'Public'}, {'name': 'Basement Material', 'value': 'Concrete Block'}, {'name': 'Water', 'value': 'City'}]",55811,718 Ebony Ave,Duluth,MN,46.805509,-92.138953,190000.0,RECENTLY_SOLD,16,55701_51,1,"Recently sold: $190,000. Can you say LOCATION,LOCATION LOCATION??.. Come see this great 3 bed, 2 bath home near all the local restaurants and shopping centers but yet nestled in a quiet neighborhood.  Updated bathroom and windows and a one and a half car garage!! Beautiful hardwood floor in dining area.  The home also has a second kitchen in the lower level for a convenient way to have a renter.  Rental license is valid through August of 2020."
