bedrooms,bathrooms,bathroomsFull,bathroomsThreeQuarter,bathroomsHalf,bathroomsOneQuarter,bathroomsPartial,mainLevelBathrooms,rooms,basement,flooring,heating,hasHeating,cooling,hasCooling,appliances,laundryFeatures,fireplaces,fireplaceFeatures,hasFireplace,furnished,commonWalls,buildingArea,livingArea,aboveGradeFinishedArea,belowGradeFinishedArea,parking,parkingFeatures,garageSpaces,coveredSpaces,hasAttachedGarage,hasGarage,openParkingSpaces,hasOpenParking,carportSpaces,hasCarport,otherParking,accessibilityFeatures,levels,stories,entryLevel,entryLocation,hasPrivatePool,hasSpa,spaFeatures,exteriorFeatures,patioAndPorchFeatures,fencing,view,hasView,hasWaterfrontView,waterfrontFeatures,frontageType,frontageLength,topography,woodedArea,vegetation,canRaiseHorses,lotSize,lotSizeDimensions,otherStructures,additionalParcelsDescription,hasAdditionalParcels,parcelNumber,hasAttachedProperty,hasLandLease,landLeaseAmount,zoning,zoningDescription,homeType,architecturalStyle,constructionMaterials,foundationDetails,roofType,windowFeatures,propertyCondition,isNewConstruction,yearBuiltEffective,builderModel,hasHomeWarranty,electric,hasElectricOnProperty,gas,sewer,waterSources,utilities,greenBuildingVerificationType,greenEnergyEfficient,greenIndoorAirQuality,greenSustainability,greenWaterConservation,numberOfUnitsInCommunity,numberOfUnitsVacant,storiesTotal,hasPetsAllowed,hasRentControl,buildingFeatures,structureType,buildingName,elementarySchool,elementarySchoolDistrict,middleOrJuniorSchool,middleOrJuniorSchoolDistrict,highSchool,highSchoolDistrict,securityFeatures,communityFeatures,isSeniorCommunity,cityRegion,listingId,buildingAreaSource,otherFacts,zipcode,streetAddress,city,state,latitude,longitude,price,homeStatus,photoCount,imageId,imageIdCount,description
4,3,2,1,0,0,,,[],Finished,"['Hardwood', 'Tile']","['Forced air', 'Other']",True,['Central'],True,"['Dishwasher', 'Dryer', 'Microwave', 'Range / Oven', 'Refrigerator', 'Washer']",,,,True,False,,,3130.0,,,,"['Attached Garage', 'Detached Garage']",4,,False,True,,False,,False,,,,2,,,,,,['Other'],,,,,,,,,,,,False,0.77 acres,,,,False,395007000962,False,False,,,,Single Family,,,,Asphalt,,,False,,,False,,,,['City'],,,,,,,,,,,True,False,,Bungalow,,,Hermantown #700,,Hermantown #700,,Hermantown #700,,,False,Hermantown,6088919,,"[{'name': 'Sale/Rent', 'value': 'For Sale'}, {'name': 'Construction Status', 'value': 'Previously Owned'}, {'name': 'Fireplace Type', 'value': 'Gas'}, {'name': 'Classification', 'value': 'Homestead'}, {'name': 'School District', 'value': 'Hermantown #700'}, {'name': 'Fireplace', 'value': 'Yes'}, {'name': 'Main Floor Bedroom', 'value': '1'}, {'name': 'Style', 'value': 'Bungalow'}, {'name': 'Fireplaces', 'value': '2'}, {'name': 'Air Conditioning', 'value': 'Central'}, {'name': 'Bath Description', 'value': 'Private Master, Whirlpool, Full Upper, Separate Tub &amp; Shower'}, {'name': 'Construction Type', 'value': 'Frame/Wood'}, {'name': 'Dining', 'value': 'Breakfast Bar, Formal Dining Room, Eat-In Kitchen'}, {'name': 'Heat', 'value': 'Forced Air, In Floor, City Gas, Boiler'}, {'name': 'Basement Features', 'value': 'Finished, Bath, Bedrooms, Family/Rec Room, Utility Room, Egress Windows, Washer Hook-Ups, Dryer Hook-Ups, Drainage System'}, {'name': 'Basement Material', 'value': 'Poured Concrete'}, {'name': 'Basement Style', 'value': 'Full'}, {'name': 'Extra Rooms', 'value': 'Family/Rec'}, {'name': 'Outbuildings', 'value': 'Storage Shed'}, {'name': 'Roof', 'value': 'Asphalt Shingles'}, {'name': 'Amenities', 'value': 'Hardwood Floors'}, {'name': 'Water', 'value': 'City'}, {'name': 'Amenities-Exterior', 'value': 'Gutter/Downspout'}, {'name': 'Mechanicals', 'value': 'Air to Air Exchange'}, {'name': 'Exterior', 'value': 'Other'}]",55811,4173 Ugstad Rd,Hermantown,MN,46.813129,-92.238921,515000.0,FOR_SALE,40,55701_0,7,"For sale: $515,000. You will fall in love with this Amazing 4 bedroom, 3 bathroom home! Enjoy over 3000 sq ft of finished living space on all 3 levels. You're going to love every detail of this home. This adorable cottage style home comes complete with wide planked Douglas Fir flooring and an open floor concept with plenty of storage. The kitchen has all the necessities you need, along with plenty of space, in addition to the stainless steel appliances and butcher block counter tops.  The master suite makes up the entire 2nd level of the home, which includes a gas fireplace, plenty of space to relax, a large master closet for everything you could need, and a spacious master bathroom with a jacuzzi tub and a walk in tiled shower.  The lower level features a large rec room with tongue and groove ceilings, a guest bedroom and 3/4 bath. This home is perfectly located within a mile from Hermantown Community Schools and only 1/2 mile from the new Essentia Wellness Center. Tour this home virtually https://my.matterport.com/show/?m=amZGbjk6TUz&amp;mls=1"
5,4,2,1,1,0,,,[],Finished,"['Carpet', 'Hardwood', 'Tile']","['Forced air', 'Other', 'Geothermal']",True,"['Central', 'Geothermal']",True,"['Dishwasher', 'Dryer', 'Microwave', 'Range/Stove', 'Refrigerator', 'Washer']",,,,True,False,,,3818.0,,,,['Attached Garage'],4,,False,True,,False,,False,,,,2,,,,,,"['Brick', 'Other']",,,,,,,,,,,,False,1.1 acres,,,,False,395005500080,False,False,,,,Single Family,,,,Asphalt,,,False,,,False,,,,['City'],,,,,,,,,,,True,False,,Contemporary,,,Hermantown #700,,Hermantown #700,,Hermantown #700,,,False,Hermantown,6088728,,"[{'name': 'Sale/Rent', 'value': 'For Sale'}, {'name': 'Construction Status', 'value': 'Previously Owned'}, {'name': 'Fireplace Type', 'value': 'Gas'}, {'name': 'Classification', 'value': 'Homestead'}, {'name': 'School District', 'value': 'Hermantown #700'}, {'name': 'Lot Description', 'value': 'Tree Coverage - Medium, High'}, {'name': 'Main Floor Bedroom', 'value': '0'}, {'name': 'Fireplace', 'value': 'Yes'}, {'name': 'Fireplaces', 'value': '1'}, {'name': 'Parking/Driveway', 'value': 'Off Street, Driveway - Concrete'}, {'name': 'Style', 'value': 'Contemporary'}, {'name': 'Air Conditioning', 'value': 'Central'}, {'name': 'Amenities-Exterior', 'value': 'Deck, Gutter/Downspout'}, {'name': 'Bath Description', 'value': 'Private Master, Master Walk-Thru, Whirlpool, Separate Tub &amp; Shower'}, {'name': 'Construction Type', 'value': 'Frame/Wood'}, {'name': 'Dining', 'value': 'Combine with Kitchen, Eat-In Kitchen'}, {'name': 'Heat', 'value': 'Forced Air, In Floor, Electric, City Gas, Hot Water, Boiler, Geothermal'}, {'name': 'Terms', 'value': 'Cash, Conventional, VA DVA'}, {'name': 'Amenities', 'value': 'Walk-In Closet, Eat-In Kitchen, Garage Door Opener, Tiled Floors, Hardwood Floors, Kitchen Center Island, 2nd Floor Laundry'}, {'name': 'Basement Features', 'value': 'Finished, Bath, Bedrooms, Den/Office, Family/Rec Room, Utility Room, Egress Windows, Drainage System'}, {'name': 'Basement Material', 'value': 'Poured Concrete'}, {'name': 'Extra Rooms', 'value': 'Den/Office, Family/Rec, Great Room'}, {'name': 'Roof', 'value': 'Asphalt Shingles'}, {'name': 'Road Frontage', 'value': 'Paved'}, {'name': 'Road Maintenance', 'value': 'Public'}, {'name': 'Water', 'value': 'City'}, {'name': 'Mechanicals', 'value': 'Air to Air Exchange'}, {'name': 'Exterior', 'value': 'Other, Stone'}, {'name': 'Basement Style', 'value': 'Partial'}]",55811,5134 Cedar Ridge Dr,Hermantown,MN,46.826514,-92.221325,579900.0,FOR_SALE,43,55701_1,7,"For sale: $579,900. You will be awed! This 5 bedroom, 4 bathroom contemporary home with huge garage is in the heart of Hermantown! From the moment you step out of the car, the covered front porch is so welcoming. When you step inside, you will notice the open floor living.  Main level features living room with gas fireplace, kitchen with cherry cabinets, granite countertops, tile backsplash, hardwood floors, and center island breakfast bar. There is also a dining area with patio door that leads to a back deck that overlooks the private wooded backyard. Main level also has powder room and walk-in closet in mud room with built in lockers. Upper level has unique staircases which takes you to one of 2 ways.  There are 3 bedrooms in their own separate wing with a full bath, a master suite with 2 walk-in closets, laundry and gorgeous walk-in shower and spa tub and a 25'x14' bonus room. Lower level has family room with amazing cherry built-in wall-to-wall cabinets, 5th bedroom with walk-in closet, storage room, office and a &frac34; bathroom w/travertine tile shower. The heated garage is 4+ car with extra space for plenty of storage. This home is conveniently located only a 1/2 mile away from the Hermantown Schools and the new Essentia Wellness Center. Tour this home virtually https://my.matterport.com/show/?m=uN6ZTcjX7Su&amp;mls=1"
3,2,1,1,0,0,,,[],Finished,,['Other'],True,['Central'],True,"['Dishwasher', 'Dryer', 'Range/Stove', 'Refrigerator', 'Washer']",,,,True,False,,,1524.0,,,,"['Attached Garage', 'Detached Garage']",2,,False,True,,False,,False,,,,1,,,,,,"['Brick', 'Metal', 'Wood']",,,['Typical'],,,,,,,,,False,1.03 acres,,,,False,395007000170,False,False,,,,Single Family,,,,,,,False,,,False,,,,['City'],,,,,,,,,,,True,False,,,,,Hermantown #700,,Hermantown #700,,Hermantown #700,,,False,Hermantown,6088297,,"[{'name': 'Sale/Rent', 'value': 'For Sale'}, {'name': 'Construction Status', 'value': 'Previously Owned'}, {'name': 'Classification', 'value': 'Homestead'}, {'name': 'Occupied By', 'value': 'Vacant'}, {'name': 'Remodeled/Addition', 'value': 'Yes'}, {'name': 'School District', 'value': 'Hermantown #700'}, {'name': 'Lot Description', 'value': 'Tree Coverage - Light, High'}, {'name': 'Main Floor Bedroom', 'value': '1'}, {'name': 'Style', 'value': 'Traditional'}, {'name': 'Parking/Driveway', 'value': 'Driveway - Concrete'}, {'name': 'Amenities-Exterior', 'value': 'Deck'}, {'name': 'Construction Type', 'value': 'Frame/Wood, Brick'}, {'name': 'Heat', 'value': 'Forced Air, Electric, Baseboard, Dual Fuel/Off Peak, Oil'}, {'name': 'Mechanicals', 'value': 'Fuel Tank-Owned, Water Heater-Electric, Sump Pump'}, {'name': 'Terms', 'value': 'Cash, Conventional, VA DVA, FHA'}, {'name': 'Water', 'value': 'Private, City'}, {'name': 'Amenities', 'value': 'Walk-In Closet, Garage Door Opener, Drywalls, Foyer Entry, Washer Hook-Ups, Dryer Hook-Ups, Plaster Walls'}, {'name': 'Basement Material', 'value': 'Poured Concrete, Concrete Block'}, {'name': 'Basement Style', 'value': 'Full'}, {'name': 'Outbuildings', 'value': 'Storage Shed, Gazebo'}, {'name': 'Roof', 'value': 'Asphalt Shingles'}, {'name': 'Dining', 'value': 'Informal Dining Room'}, {'name': 'Road Frontage', 'value': 'Paved, Sidewalk, Storm Sewer'}, {'name': 'Windows', 'value': 'Energy Windows, Vinyl Frame'}, {'name': 'Road Maintenance', 'value': 'Public'}, {'name': 'Basement Features', 'value': 'Unfinished, Washer Hook-Ups, Dryer Hook-Ups'}, {'name': 'Exterior', 'value': 'Brick, Steel'}, {'name': 'Disclosures/Docs', 'value': 'Disc./Condition Report'}, {'name': 'Bath Description', 'value': '3/4 Main Floor, Full Upper'}]",55811,5251 W Arrowhead Rd,Hermantown,MN,46.822303,-92.233246,269900.0,FOR_SALE,24,55701_2,7,"For sale: $269,900. Great beginnings in this treasured Jackson Project home in the heart of Hermantown. Remodeled and tastefully added onto in the 1980's, this 3 bedroom, 1.75 bath home feels like home. Remove the living room carpet to reveal the hardwood floors beneath. Main floor bedroom with a 3/4 bath. Bright and sunny entryway with large closet. Upstairs you'll find two more bedrooms, a full bath, and storage galore. 24x30 + 20x14 heated detached garage has extra large workshop space. Beautiful high lot with mature trees. Deck with gazebo. Concrete driveway. New roof in 2017. Seamless steel siding on the addition and Marvin windows in 2008. Located just a block or two from Hermantown school and the new Essentia Wellness Center.   Electric: $154/mo average Water/sewer: $60/mo average Fuel oil: 1,100 gallons from June 2018 to May 2019"
4,3,2,0,1,0,,,[],,,['Other'],True,['Central'],True,"['Dishwasher', 'Range/Stove', 'Refrigerator', 'Exhaust Fan/Hood']",,,,True,False,,,3092.0,,,,['Attached Garage'],2,,False,True,,False,,False,,,,2,,,,,,['Wood'],,,['Typical'],,,,,,,,,False,0.62 acres,,,,False,395013400220,False,False,,,,Single Family,,,,,,,False,,,False,,,,['City'],,,,,,,,,,,True,False,,,,,Hermantown #700,,Hermantown #700,,Hermantown #700,,,False,Hermantown,6088258,,"[{'name': 'Sale/Rent', 'value': 'For Sale'}, {'name': 'Construction Status', 'value': 'Previously Owned'}, {'name': 'Assessments', 'value': 'Yes'}, {'name': 'Association Fee', 'value': 'Yes'}, {'name': 'Fireplace Type', 'value': 'Wood Burning'}, {'name': 'Classification', 'value': 'Homestead'}, {'name': 'Association Fee Frequency', 'value': 'Yearly'}, {'name': 'Occupied By', 'value': 'Owner'}, {'name': 'School District', 'value': 'Hermantown #700'}, {'name': 'Lot Description', 'value': 'Landscaped, Level, Irregular Lot, Cul De Sac'}, {'name': 'Fireplace', 'value': 'Yes'}, {'name': 'Fireplaces', 'value': '1'}, {'name': 'Parking/Driveway', 'value': 'Off Street, Driveway - Concrete'}, {'name': 'Main Floor Bedroom', 'value': '1'}, {'name': 'Style', 'value': 'Traditional'}, {'name': 'Disclosures/Docs', 'value': 'Convnt/Restrict, Disc./Condition Report'}, {'name': 'Amenities', 'value': 'Main Floor Laundry, Walk-In Closet, Patio Door, Ceiling Fans, Eat-In Kitchen, Garage Door Opener, Tiled Floors, Vaulted Ceilings, Drywalls, Foyer Entry, Hardwood Floors, Kitchen Center Island, Washer Hook-Ups, Dryer Hook-Ups'}, {'name': 'Amenities-Exterior', 'value': 'Patio, Porch, Gutter/Downspout'}, {'name': 'Basement Style', 'value': 'Slab'}, {'name': 'Bath Description', 'value': 'Private Master, 1/2 Main Floor, Full Main Floor, Full Upper'}, {'name': 'Construction Type', 'value': 'Frame/Wood'}, {'name': 'Dining', 'value': 'Breakfast Bar, Combine with Kitchen, Informal Dining Room, Eat-In Kitchen'}, {'name': 'Heat', 'value': 'In Floor, Wood, City Gas, Boiler'}, {'name': 'Terms', 'value': 'Cash, Conventional'}, {'name': 'Basement Material', 'value': 'Poured Concrete'}, {'name': 'Windows', 'value': 'Double Glazed, Wood Frame, Energy Windows, Vinyl Frame, Bay Window'}, {'name': 'Mechanicals', 'value': 'Water Heater-Gas, Air to Air Exchange'}, {'name': 'Road Frontage', 'value': 'Paved, City, Street Lights, Dead End/No Outlet, Storm Sewer'}, {'name': 'Road Maintenance', 'value': 'Public'}, {'name': 'Restrictions/Covenants', 'value': 'Other Covenants'}, {'name': 'Internet Options', 'value': 'Cable'}, {'name': 'Water', 'value': 'City'}, {'name': 'Exterior', 'value': 'Vinyl, Stone'}, {'name': 'Roof', 'value': 'Composite'}, {'name': 'Garage Dimensions', 'value': ""21'.8'' x 26'""}]",55811,4310 Sugar Maple Dr,Hermantown,MN,46.825887,-92.209311,550000.0,FOR_SALE,37,55701_3,7,"For sale: $550,000. Quality abounds in this 4+ bedroom Craftsman farmhouse style home built in 2015. Living features floor to ceiling stone wood fireplace, expansive Marvin Integrity windows allowing southern and western exposure looking out to the private side &amp; back yard. Open to the 2nd floor loft area. Kitchen has wood Dura cabinets, classic engineered wood flooring and a two tiered counter top, stainless steel appliances stay Quaint dining area has views of the back yard and access to patio area. These two rooms are great for entertaining family and friends with access to a concrete back patio with overhang to stay cool in the summertime. Main floor master suite has vaulted ceilings, french doors to back yard, barn door to full bath &amp; walk in closet. Main floor 1/2 bath, nicely designed laundry room. Surprise second floor has open loft sitting area great for play area, craft or reading area. 3 large bedrooms w/walk in closet plus a 4th room currently used as a family room and a 2 car attached garage. All situated on a well manicured lot in a cul de sac. Beautifully decorated, quality throughout &amp; ready to move into to make it your home!"
4,3,2,0,1,0,,,[],None,"['Hardwood', 'Tile']",['Forced air'],True,['Central'],True,"['Dishwasher', 'Dryer', 'Microwave', 'Range / Oven', 'Refrigerator', 'Washer']",,,,True,False,,,3565.0,,,,['Attached Garage'],2,,False,True,,False,,False,,,,1,,,False,True,,['Vinyl'],,,,,False,,,,,,,False,0.71 acres,,,,False,395008800270,False,False,,,,Single Family,,,,Asphalt,,,False,,,False,,,,['City'],,,,,,,,,,,True,False,,Contemporary,,,Hermantown #700,,Hermantown #700,,Hermantown #700,,,False,Hermantown,6088252,,"[{'name': 'Sale/Rent', 'value': 'For Sale'}, {'name': 'Construction Status', 'value': 'Previously Owned'}, {'name': 'Assessments', 'value': 'Yes'}, {'name': 'Fireplace Type', 'value': 'Gas'}, {'name': 'Classification', 'value': 'Homestead'}, {'name': 'Occupied By', 'value': 'Owner'}, {'name': 'School District', 'value': 'Hermantown #700'}, {'name': 'Parking/Driveway', 'value': 'Driveway - Asphalt, Off Street'}, {'name': 'Fireplace', 'value': 'Yes'}, {'name': 'Fireplaces', 'value': '1'}, {'name': 'Main Floor Bedroom', 'value': '1'}, {'name': 'Style', 'value': 'Contemporary'}, {'name': 'Amenities', 'value': 'Main Floor Laundry, Foyer Entry'}, {'name': 'Amenities-Exterior', 'value': 'Patio, Fenced Yard - Partial'}, {'name': 'Bath Description', 'value': 'Private Master, Full Master, Whirlpool, Full Main Floor, Full Upper'}, {'name': 'Construction Type', 'value': 'Frame/Wood'}, {'name': 'Dining', 'value': 'Breakfast Bar, Combine with Kitchen, Informal Dining Room'}, {'name': 'Heat', 'value': 'Forced Air, Fireplace'}, {'name': 'Terms', 'value': 'Cash, Conventional, VA DVA, FHA'}, {'name': 'Outbuildings', 'value': 'Storage Shed'}, {'name': 'Roof', 'value': 'Asphalt Shingles'}, {'name': 'Water', 'value': 'City'}, {'name': 'Exterior', 'value': 'Vinyl'}]",55811,4223 Washington Dr,Hermantown,MN,46.816323,-92.244037,444900.0,FOR_SALE,31,55701_4,7,"For sale: $444,900. Beautiful home with quality updates in the Jackson Estates located in the heart of Hermantown.  Newest improvements include granite countertops, kitchen cabinets, a fireplace with custom cabinets and stone work. This home boasts 4 bedrooms, 3 baths, including a master bath (featuring a soaking tub and walk-in closet) full bath, a kitchen that opens to the dining room, breakfast bar, living room and sunroom that has endless opportunities. The upstairs of this home features 3 generous sized bedrooms, a full bath and an extra living room. The backyard has great space for greens and concrete patio slab surrounded by a fence for privacy for enjoyable evenings. Location is within minutes of the schools, fields, arena and new wellness center. Avg monthly electric $114, Water/Sewer $178."
4,5,0,0,0,0,,,[],Finished,['Hardwood'],['Other'],True,['Central'],True,"['Dishwasher', 'Dryer', 'Microwave', 'Refrigerator', 'Washer', 'Exhaust Fan/Hood', 'Wall Oven', 'Disposal', 'Cooktop', 'Dehumidifier']",,,,True,False,,,6350.0,,,,"['Attached Garage', 'Detached Garage']",,,False,,,False,,False,,,,1,,,True,True,,['Wood'],,,['Typical'],,,,,,,,,False,1.4 acres,,,,False,395022500040,False,False,,,,Single Family,,,,,,,False,,,False,,,,['City'],,,,,,,,,,,True,False,,Contemporary,,,Hermantown #700,,Hermantown #700,,Hermantown #700,,,False,Hermantown,6087192,,"[{'name': 'Sale/Rent', 'value': 'For Sale'}, {'name': 'Construction Status', 'value': 'Previously Owned'}, {'name': 'Assessments', 'value': 'Yes'}, {'name': 'Fireplace Type', 'value': 'Gas'}, {'name': 'Classification', 'value': 'Homestead'}, {'name': 'BWCAW Access', 'value': '2'}, {'name': 'School District', 'value': 'Hermantown #700'}, {'name': 'Lot Description', 'value': 'Landscaped, Telephone, Underground Utilities, Tree Coverage - Heavy, Additional Land Available, Cul De Sac'}, {'name': 'Main Floor Bedroom', 'value': '0'}, {'name': 'Fireplace', 'value': 'Yes'}, {'name': 'Bath 3 Level', 'value': '1'}, {'name': 'Style', 'value': 'Contemporary'}, {'name': 'Parking/Driveway', 'value': 'Other'}, {'name': 'Fireplaces', 'value': '2'}, {'name': 'Air Conditioning', 'value': 'Central'}, {'name': 'Amenities', 'value': 'Natural Woodwork, Wet Bar, Walk-In Closet, Cable TV, Patio Door, Ceiling Fans, Garage Door Opener, Security System, Tiled Floors, Vaulted Ceilings, Drywalls, Foyer Entry, Hardwood Floors, Kitchen Center Island, Washer Hook-Ups, Sauna, Dryer Hook-Ups, Skylight, Hot Tub'}, {'name': 'Amenities-Exterior', 'value': 'Deck, Patio, Gutter/Downspout, Hot Tub, Balcony, Permanent Outdoor Grill'}, {'name': 'Bath Description', 'value': 'Private Master, 3/4 Basement, 3/4 Master, 1/2 Main Floor'}, {'name': 'Construction Type', 'value': 'Frame/Wood'}, {'name': 'Dining', 'value': 'Combine with Kitchen'}, {'name': 'Exterior', 'value': 'Wood'}, {'name': 'Heat', 'value': 'Forced Air, In Floor, Propane, City Gas'}, {'name': 'Outbuildings', 'value': 'Hot Tub'}, {'name': 'Terms', 'value': 'Cash, Conventional'}, {'name': 'Basement Features', 'value': 'Finished, Walkout, Bath, Bedrooms, Family/Rec Room, Utility Room, Partially Finished, Fireplace, Unfinished, Washer Hook-Ups, Dryer Hook-Ups'}, {'name': 'Basement Style', 'value': 'Full, Partial, Posts'}, {'name': 'Extra Rooms', 'value': 'Family/Rec, Library, Utility Room, Workshop, Sunrm/Solarium, Spa/Sauna'}, {'name': 'Roof', 'value': 'Asphalt Shingles'}, {'name': 'Windows', 'value': 'Double Glazed, Wood Frame'}, {'name': 'Mechanicals', 'value': 'Water Heater-Gas, Air to Air Exchange, Central Vacuum, Electronic Air Filter'}, {'name': 'Road Frontage', 'value': 'City, Dead End/No Outlet'}, {'name': 'Road Maintenance', 'value': 'Public'}, {'name': 'Basement Material', 'value': 'Concrete Block'}, {'name': 'Internet Options', 'value': 'Cable, DSL'}, {'name': 'Water', 'value': 'City'}]",55811,5030 Jonan Dr,Hermantown,MN,46.817382,-92.208217,639900.0,FOR_SALE,23,55701_5,7,"For sale: $639,900. Beautiful home in the heart of Hermantown with an abundance of wildlife and privacy. This come is located in a cul-de-sac and sits 1.4 acres. It has beautiful cedar siding and a newer roof. Inside you will find four bedrooms in this 4 level split with 5 bathrooms. It also boasts a beautiful library, sitting room sun area, craft room, large family room that walk out, 2 fireplaces, a sauna, and excellent storage in the basement.  You will have plenty of garage space with room to hold 5 cars. The garage also has a great workshop area and a dog grooming tub. Outside you will enjoy the nature on a very private deck and patio. You will love the newest addition to the property a large Enclosed Sport Court. This seller also has an additional 20 acres off the back of the home for sale too."
