6,5,3,1,1,0,,,[],Finished,"['Carpet', 'Hardwood', 'Tile']",['Forced air'],True,['Central'],True,"['Dishwasher', 'Dryer', 'Microwave', 'Refrigerator', 'Washer', 'Exhaust Fan/Hood', 'Wall Oven', 'Disposal', 'Cooktop']",,,,True,False,,,5363.0,,,,"['Attached Garage', 'Off street']",,,False,,,False,,False,,,,2,,,True,False,,"['Stone', 'Vinyl']",,,,,,,,,,,,False,0.69 acres,,,,False,395008800140,False,False,,,,Single Family,,,,Asphalt,,,False,2004,,False,,,,['City'],,,,,,,,,,,True,False,,Contemporary,,,Hermantown #700,,Hermantown #700,,Hermantown #700,,,False,Hermantown,6079346,,"[{'name': 'Sale/Rent', 'value': 'For Sale'}, {'name': 'Construction Status', 'value': 'Previously Owned'}, {'name': 'Fireplace Type', 'value': 'Gas'}, {'name': 'Classification', 'value': 'Homestead'}, {'name': 'Occupied By', 'value': 'Owner'}, {'name': 'BWCAW Access', 'value': 'U'}, {'name': 'School District', 'value': 'Hermantown #700'}, {'name': 'Lot Description', 'value': 'Landscaped, Tree Coverage - Medium, Cul De Sac'}, {'name': 'Parking/Driveway', 'value': 'Driveway - Asphalt'}, {'name': 'Fireplace', 'value': 'Yes'}, {'name': 'Fireplaces', 'value': '1'}, {'name': 'Main Floor Bedroom', 'value': '1'}, {'name': 'Bath 3 Level', 'value': 'U'}, {'name': 'Style', 'value': 'Contemporary'}, {'name': 'Disclosures/Docs', 'value': 'Convnt/Restrict, Disc./Condition Report'}, {'name': 'Air Conditioning', 'value': 'Central'}, {'name': 'Amenities', 'value': 'Natural Woodwork, Walk-In Closet, Patio Door, Ceiling Fans, Eat-In Kitchen, Garage Door Opener, Security System, Tiled Floors, Drywalls, Foyer Entry, Hardwood Floors, 2nd Floor Laundry'}, {'name': 'Amenities-Exterior', 'value': 'Deck, Gutter/Downspout, Invisible Fencing'}, {'name': 'Bath Description', 'value': 'Private Master, 3/4 Basement, Full Master, Separate Tub & Shower, Two Master Baths, 1/2 Main Floor'}, {'name': 'Construction Type', 'value': 'Frame/Wood'}, {'name': 'Dining', 'value': 'Breakfast Bar, Formal Dining Room, Eat-In Kitchen, Breakfast Nook'}, {'name': 'Heat', 'value': 'Forced Air, Electric, City Gas'}, {'name': 'Terms', 'value': 'Cash, Conventional, VA DVA, FHA'}, {'name': 'Basement Features', 'value': 'Finished, Bath, Bedrooms, Family/Rec Room, Utility Room, Egress Windows'}, {'name': 'Basement Material', 'value': 'Poured Concrete'}, {'name': 'Basement Style', 'value': 'Full'}, {'name': 'Extra Rooms', 'value': 'Den/Office, Family/Rec, Utility Room, Storage Room, Mud Room'}, {'name': 'Outbuildings', 'value': 'Storage Shed'}, {'name': 'Roof', 'value': 'Asphalt Shingles'}, {'name': 'Windows', 'value': 'Wood Frame, Energy Windows, Bay Window'}, {'name': 'Road Frontage', 'value': 'City'}, {'name': 'Restrictions/Covenants', 'value': 'Other Covenants'}, {'name': 'Internet Options', 'value': 'Cable, Satellite'}, {'name': 'Water', 'value': 'City'}, {'name': 'Exterior', 'value': 'Vinyl, Stone'}, {'name': 'Mechanicals', 'value': 'Air to Air Exchange, Sump Pump'}]",55811,5382 Roosevelt Dr,Hermantown,MN,46.81777,-92.247163,625000.0,FOR_SALE,31,55701_6,7,"For sale: $625,000. This home has everything you could ever want and then some! Tucked on a cul de sac in Jackson Estates you will find this fabulous home which provides spacious country living right in the heart of Hermantown. Cathedral entry welcomes you into great living space perfect for family and entertaining. Main level has office/den, formal dining room, 1/2 bath, living room w/ cathedral ceiling and gas fireplace, gourmet kitchen w/ granite countertops, double oven, gas cooktop, bfast bar and eat in nook. Great back entry mud room w/ tiled floor and good storage. Upper level has 4 large bedrooms (one w/ its own bath) and master bedroom has huge walk in closet, walk in tiled shower and soaking tub, and dual sinks. This level also has laundry room with 2 dryer hookups! Lower level has 2 more bedrooms, family room, 3/4 bath and storage. 3 car att heated garage, amazing deck off back of home, shed, and nicely landscaped complete this package! Walking distance to schools and the Wellness Center."
3,3,1,1,1,0,,,[],Finished,"['Carpet', 'Hardwood', 'Tile']","['Baseboard', 'Forced air', 'Heat pump']",True,['Other'],True,"['Dishwasher', 'Dryer', 'Microwave', 'Range/Stove', 'Refrigerator', 'Washer']",,,,True,False,,,3380.0,,,,['Attached Garage'],5,,False,True,,False,,False,,,,1,,,False,False,,"['Vinyl', 'Wood']",,,['Territorial'],True,False,,,,,,,False,1.14 acres,,,,False,395009700080,False,False,,,,Single Family,,,,Asphalt,,,False,1991,,False,,,,['Drain Field'],,,,,,,,,,,True,False,,Ranch,,,Hermantown #700,,Hermantown #700,,Hermantown #700,,,False,Hermantown,,,"[{'name': 'Sale/Rent', 'value': 'For Sale'}, {'name': 'Construction Status', 'value': 'Previously Owned'}, {'name': 'Assessments', 'value': 'Yes'}, {'name': 'Fireplace Type', 'value': 'Wood Burning'}, {'name': 'Classification', 'value': 'Homestead'}, {'name': 'Occupied By', 'value': 'Owner'}, {'name': 'BWCAW Access', 'value': 'Main'}, {'name': 'School District', 'value': 'Hermantown #700'}, {'name': 'Parking/Driveway', 'value': 'Driveway - Asphalt'}, {'name': 'Fireplace', 'value': 'Yes'}, {'name': 'Fireplaces', 'value': '1'}, {'name': 'Style', 'value': 'Ranch/Rambler'}, {'name': 'Lot Description', 'value': 'Tree Coverage - Light'}, {'name': 'Main Floor Bedroom', 'value': '1'}, {'name': 'Bath 3 Level', 'value': 'Main'}, {'name': 'Amenities', 'value': 'Main Floor Laundry, Garage Door Opener, Drywalls, Washer Hook-Ups, Dryer Hook-Ups'}, {'name': 'Amenities-Exterior', 'value': 'Deck'}, {'name': 'Construction Type', 'value': 'Frame/Wood'}, {'name': 'Dining', 'value': 'Combine with Kitchen, Formal Dining Room'}, {'name': 'Terms', 'value': 'Cash, Conventional, VA DVA, FHA'}, {'name': 'Basement Features', 'value': 'Finished, Walkout, Bath, Den/Office, Family/Rec Room, Fireplace'}, {'name': 'Basement Style', 'value': 'Full'}, {'name': 'Extra Rooms', 'value': 'Den/Office, Family/Rec, Mud Room'}, {'name': 'Heat', 'value': 'Wood, City Gas, Baseboard, Dual Fuel/Off Peak, Hot Water, Fireplace, Ductless/Mini Split, Boiler'}, {'name': 'Roof', 'value': 'Asphalt Shingles'}, {'name': 'Windows', 'value': 'Wood Frame'}, {'name': 'Mechanicals', 'value': 'Water Heater-Gas, Water Heater-Tankless'}, {'name': 'Road Frontage', 'value': 'Paved, City'}, {'name': 'Basement Material', 'value': 'Wood'}, {'name': 'Water', 'value': 'City'}, {'name': 'Exterior', 'value': 'Vinyl, Brick'}, {'name': 'Air Conditioning', 'value': 'Ductless Mini Split'}, {'name': 'Bath Description', 'value': '3/4 Master, 1/2 Main Floor, Full Main Floor'}, {'name': 'Disclosures/Docs', 'value': 'Septic Disclosure, Disc./Condition Report'}]",55811,4915 Whitetail Dr,Hermantown,MN,46.806193,-92.198376,305000.0,RECENTLY_SOLD,1,55701_7,1,"Recently sold: $305,000. 3-5 bedroom rambler with roughed in spa (toilet, jetted bath, shower and sauna).  23 x 33 great room with fireplace in walkout basement.  Updated appliances, roof (2017) and HVAC (2018)."
3,4,1,2,1,0,,,[],Finished,"['Carpet', 'Laminate', 'Tile']",['Radiant'],True,['Central'],True,"['Dishwasher', 'Dryer', 'Freezer', 'Refrigerator', 'Washer']",,,,True,False,,,1652.0,,,,"['Detached Garage', 'Off street']",4,,False,True,,False,,False,,,,2,,,True,True,,['Wood'],,,,,False,,,,,,,False,6 acres,,,,False,280003100330,False,False,,,,Single Family,,,,Asphalt,,,False,,,False,,,,['Private'],,,,,,,,,,,True,False,,Split level,,,Hermantown #700,,Hermantown #700,,Hermantown #700,,,False,Duluth,,,"[{'name': 'Sale/Rent', 'value': 'For Sale'}, {'name': 'Construction Status', 'value': 'Previously Owned'}, {'name': 'Assessments', 'value': 'Yes'}, {'name': 'Fireplace Type', 'value': 'Wood Burning'}, {'name': 'Classification', 'value': 'Homestead'}, {'name': 'Occupied By', 'value': 'Owner'}, {'name': 'School District', 'value': 'Hermantown #700'}, {'name': 'Style', 'value': 'Split Entry/Foyer'}, {'name': 'Main Floor Bedroom', 'value': '0'}, {'name': 'Fireplace', 'value': 'Yes'}, {'name': 'Lot Description', 'value': 'Irregular Lot'}, {'name': 'Parking/Driveway', 'value': 'Driveway - Gravel'}, {'name': 'Fireplaces', 'value': '2'}, {'name': 'Garage Dimensions', 'value': '32x36'}, {'name': 'Construction Type', 'value': 'Frame/Wood'}, {'name': 'Dining', 'value': 'Combine with Kitchen'}, {'name': 'Exterior', 'value': 'Wood'}, {'name': 'Terms', 'value': 'Cash, Conventional'}, {'name': 'Water', 'value': 'Private'}, {'name': 'Basement Features', 'value': 'Finished'}, {'name': 'Extra Rooms', 'value': 'Den/Office'}, {'name': 'Heat', 'value': 'Wood, Electric'}, {'name': 'Outbuildings', 'value': 'Other Buildings, Chicken Coop'}, {'name': 'Roof', 'value': 'Asphalt Shingles'}, {'name': 'Amenities', 'value': 'Garage Door Opener, Security System, Foyer Entry'}, {'name': 'Road Frontage', 'value': 'County'}, {'name': 'Road Maintenance', 'value': 'Public'}, {'name': 'Basement Material', 'value': 'Concrete Block'}, {'name': 'Bath Description', 'value': '3/4 Master, 1/2 Basement'}, {'name': 'Amenities-Exterior', 'value': 'Hot Tub'}, {'name': 'Pool', 'value': 'Above Ground'}, {'name': 'Disclosures/Docs', 'value': 'Disc./Condition Report'}]",55803,5038 Martin Rd,Duluth,MN,46.864904,-92.210552,310000.0,RECENTLY_SOLD,13,55701_8,1,"Recently sold: $310,000. Come check out this 3 bedroom, 4 bath home nestled back on 6 private acres in the Hermantown School district. Enjoy relaxing off your private deck from your master bedroom watching the wildlife run through the yard. Or perhaps watch the kids while they swim in the above ground pool. Better yet join them in the hot tub. Outdoors also comes with a detached 6 car heated garage with an extra 633 sq. ft. heated finished bonus room about the garage. Great extra space for those guest. (So great they may never want to leave). The garage comes with a half bath and running water. This home has many updates: Updated bathrooms, New flooring, newer carpet, newer roof , 5 years old and more. All this just minutes from schools, shopping and lakes. Set up your private showing today."
4,2,2,0,0,0,,,[],Finished,,['Forced air'],True,['Central'],True,"['Dishwasher', 'Dryer', 'Range/Stove', 'Refrigerator', 'Washer', 'Exhaust Fan/Hood']",,,,,False,,,1984.0,,,,"['Attached Garage', 'Detached Garage']",2,,False,True,,False,,False,,,,1,,,True,True,,['Wood'],,,['Typical'],,,,,,,,,False,5 acres,,,,False,280001500235,False,False,,,,Single Family,,,,Asphalt,,,False,,,False,,,,['Mound'],,,,,,,,,,,True,False,,Other,,,Proctor #704,,Proctor #704,,Proctor #704,,,False,Duluth,,,"[{'name': 'Sale/Rent', 'value': 'For Sale'}, {'name': 'Construction Status', 'value': 'Previously Owned'}, {'name': 'Assessments', 'value': 'Yes'}, {'name': 'Classification', 'value': 'Homestead'}, {'name': 'School District', 'value': 'Proctor #704'}, {'name': 'Style', 'value': 'Split Entry/Foyer'}, {'name': 'Lot Description', 'value': 'Tree Coverage - Medium, Corner Lot'}, {'name': 'Parking/Driveway', 'value': 'Driveway - Asphalt, Off Street, RV Parking'}, {'name': 'Main Floor Bedroom', 'value': '1'}, {'name': 'Garage Dimensions', 'value': '24x28'}, {'name': 'Air Conditioning', 'value': 'Central'}, {'name': 'Construction Type', 'value': 'Frame/Wood'}, {'name': 'Heat', 'value': 'Forced Air, Propane'}, {'name': 'Terms', 'value': 'Cash, Conventional, VA DVA, FHA'}, {'name': 'Basement Features', 'value': 'Walkout, Bath, Bedrooms, Den/Office, Family/Rec Room, Utility Room, Partially Finished, Washer Hook-Ups, Dryer Hook-Ups'}, {'name': 'Basement Style', 'value': 'Full'}, {'name': 'Extra Rooms', 'value': 'Den/Office, Family/Rec, Utility Room'}, {'name': 'Roof', 'value': 'Asphalt Shingles'}, {'name': 'Amenities', 'value': 'Ceiling Fans, Garage Door Opener, Tiled Floors, Hardwood Floors, Washer Hook-Ups, Dryer Hook-Ups'}, {'name': 'Dining', 'value': 'Informal Dining Room'}, {'name': 'Road Frontage', 'value': 'County, Paved'}, {'name': 'Bath Description', 'value': 'Full Basement, Full Main Floor'}, {'name': 'Mechanicals', 'value': 'Water Heater-Electric, Air to Air Exchange'}, {'name': 'Basement Material', 'value': 'Concrete Block'}, {'name': 'Exterior', 'value': 'Vinyl'}, {'name': 'Windows', 'value': 'Vinyl Frame'}, {'name': 'Water', 'value': 'Dug'}]",55811,5307 Martin Rd,Duluth,MN,46.865927,-92.239002,230000.0,RECENTLY_SOLD,27,55701_9,1,"Recently sold: $230,000. Well maintained, energy efficient 4 bedroom 2 bath split entry on 5 wooded acres with a 2 car detached garage and a black top driveway that goes right to the front door. This bright, clean home is move-in ready, the stove and refrigerator are 3 months old, the front steps were installed in 3 years ago, the central air was replaced in 2014, there are newer windows, in the large walkout utility room there is a newer propane forced air furnace. The ceilings were spray foamed and your average monthly heating bill for the last 4 years has been $76 and the seller like to keep it warm. There many flowers and trees on this beautiful corner lot. You are also just down the road from the Pike Lake Public Access."
3,2,0,0,0,0,,,,,,['Other'],True,['Central'],True,,,,,,False,,,2600.0,,,,['Attached Garage'],,,False,,,False,,False,,,,,,,,,,['Other'],,,,,,,,,,,,False,0.62 acres,,,,False,395001006708,False,False,,,,Single Family,,,,,,,False,,,False,,,,,,,,,,,,,,,True,False,,,,,,,,,,,,False,Hermantown,,,[],55811,4070 Stebner Rd,Hermantown,MN,46.805317,-92.195285,388000.0,RECENTLY_SOLD,15,55701_10,1,"Recently sold: $388,000. Updated single level duplex unit in Hermantown. This large unit has an open floor plan including kitchen, living room, 3 bedrooms, 2 baths and utility/laundry room(w/laundry hookups.) Attached 2 car garage with off street parking. Rent is $1795.00/month with tenant paying all utilities. Lawn-care and snow plowing included. Application fee required."
3,2,1,1,0,0,,,[],,,,,['Central'],True,,,,,True,False,,,3073.0,,,,,4,,False,True,,False,,False,,,,1,,,,,,['Metal'],,,['Typical'],,,,,,,,,False,10 acres,,,,False,280001400724,False,False,,,,Single Family,,,,Asphalt,,,False,,,False,,,,['Private'],,,,,,,,,,,True,False,,Contemporary,,,Hermantown #700,,Hermantown #700,,Hermantown #700,,,False,Duluth,,,"[{'name': 'Sale/Rent', 'value': 'For Sale'}, {'name': 'Construction Status', 'value': 'Previously Owned'}, {'name': 'Assessments', 'value': 'Yes'}, {'name': 'Fireplace Type', 'value': 'Gas'}, {'name': 'Classification', 'value': 'Homestead'}, {'name': 'BWCAW Access', 'value': 'upper'}, {'name': 'School District', 'value': 'Hermantown #700'}, {'name': 'Parking/Driveway', 'value': 'Driveway - Asphalt, Off Street'}, {'name': 'Fireplace', 'value': 'Yes'}, {'name': 'Main Floor Bedroom', 'value': '1'}, {'name': 'Style', 'value': 'Contemporary'}, {'name': 'Fireplaces', 'value': '2'}, {'name': 'Amenities-Exterior', 'value': 'Deck, Balcony'}, {'name': 'Basement Style', 'value': 'Slab'}, {'name': 'Bath Description', 'value': 'Main Floor Full Bath, Upper Level Bath'}, {'name': 'Construction Type', 'value': 'Frame/Wood'}, {'name': 'Dining', 'value': 'Breakfast Bar, Combine with Living Room, Informal Dining Room'}, {'name': 'Heat', 'value': 'In Floor, Propane, Electric, Fireplace'}, {'name': 'Terms', 'value': 'Cash, Conventional'}, {'name': 'Water', 'value': 'Private'}, {'name': 'Amenities', 'value': 'Walk-In Closet, Patio Door, Ceiling Fans, Eat-In Kitchen, Vaulted Ceilings, Foyer Entry, Kitchen Center Island'}, {'name': 'Extra Rooms', 'value': 'Family/Rec, Mud Room, Pantry'}, {'name': 'Roof', 'value': 'Asphalt Shingles'}, {'name': 'Outbuildings', 'value': 'Pole Building'}, {'name': 'Exterior', 'value': 'Metal'}]",55803,4885 Martin Rd,Duluth,MN,46.866566,-92.192863,495000.0,RECENTLY_SOLD,1,55701_11,1,"Recently sold: $495,000. "
4,2,2,0,0,0,,,[],Finished,,"['Baseboard', 'Forced air']",True,['Central'],True,,,,,True,False,,,2266.0,,,,"['Attached Garage', 'Detached Garage']",2,,False,True,,False,,False,,,,2,,,False,False,,"['Vinyl', 'Wood']",,,,,False,,,,,,,False,5 acres,,,,False,395001003940,False,False,,,,Single Family,,,,Asphalt,,,False,,,False,,,,,,,,,,,,,,,True,False,,Other,,,Hermantown #700,,Hermantown #700,,Hermantown #700,,,False,Hermantown,,,"[{'name': 'Sale', 'value': 'For Sale'}, {'name': 'CONSTRUCTION TYPE', 'value': 'Wood'}, {'name': 'GARAGE TYPE', 'value': 'Detached'}, {'name': 'ROOF', 'value': 'Asphalt Shingles'}, {'name': 'AMENITIES-EXTERIOR', 'value': 'Porch'}, {'name': 'APPLIANCES', 'value': 'Microwave'}, {'name': 'APPLIANCES', 'value': 'Stove'}, {'name': 'Construction Status', 'value': 'Previously Owned'}, {'name': 'APPLIANCES', 'value': 'Refrigerator'}, {'name': 'Style', 'value': 'SF Single Family'}, {'name': 'BASEMENT MATERIAL', 'value': 'Concrete Block'}, {'name': 'EXTERIOR', 'value': 'Vinyl'}, {'name': 'APPLIANCES', 'value': 'Dishwasher'}, {'name': 'Assessments', 'value': 'Yes'}, {'name': 'Fireplace Type', 'value': 'Gas'}, {'name': 'BASEMENT STYLE', 'value': 'Full'}, {'name': 'HEAT', 'value': 'Forced Air'}, {'name': 'AMENITIES', 'value': 'Garage Door Opener'}, {'name': 'AMENITIES', 'value': 'Hardwood Floors'}, {'name': 'SEWER', 'value': 'City'}, {'name': 'WATER', 'value': 'City'}, {'name': 'APPLIANCES', 'value': 'Dryer'}, {'name': 'FUEL', 'value': 'Natural Gas'}, {'name': 'APPLIANCES', 'value': 'Washer'}, {'name': 'DINING', 'value': 'Formal Dining Room'}, {'name': 'ROAD FRONTAGE', 'value': 'City'}, {'name': 'Classification', 'value': 'Homestead'}, {'name': 'Occupied By', 'value': 'Owner'}, {'name': 'BASEMENT FEATURES', 'value': 'A'}, {'name': 'Open House Type', 'value': 'Public'}, {'name': 'LA1Agent Phone1 CountryId', 'value': 'United States (+1)'}, {'name': 'School District', 'value': 'Hermantown #700'}, {'name': 'BWCAW Access', 'value': 'second'}, {'name': 'House Style', 'value': '38x23++'}]",55811,5028 W Arrowhead Rd,Hermantown,MN,46.821342,-92.209514,365000.0,RECENTLY_SOLD,1,55701_12,1,"Recently sold: $365,000. Don't miss this chance to own this 4 Br, 2 Bath home on 5 acres in Hermantown! Enjoy the private immense back yard and fire pit area. Completely remodeled home with new kitchen, new stainless steel appliances. Large dining room and main floor laundry. 2 bedrooms and a bath on the main level with 2 bedrooms and a bath upstairs. A HUGE rec room with a fireplace overlooks the back yard. 2 car garage with extra parking. Basement has space that could be finished as well."
3,2,,,,,,,,,,['Other'],True,['Central'],True,,,,,True,False,,,1192.0,,,,,,,False,,,False,,False,,,,1,,,,,,"['Other', 'Wood']",,,,,,,,,,,,False,5 acres,,,,False,395001003945,False,False,,,,Single Family,,,,,,,False,,,False,,,,,,,,,,,,,,,True,False,,Ranch,,,,,,,,,,False,Hermantown,,,[],55811,5034 W Arrowhead Rd,Hermantown,MN,46.821473,-92.210069,185000.0,RECENTLY_SOLD,0,55701_13,0,"Recently sold: $185,000. "
3,1,1,0,0,0,,,[],Finished,,['Forced air'],True,['Central'],True,"['Dryer', 'Range / Oven', 'Refrigerator', 'Washer']",,,,,False,,,864.0,,,,['Detached Garage'],1,,False,True,,False,,False,,,,1,,,True,True,,['Other'],,,,,,,,,,,,False,0.29 acres,,,,False,010434500050,False,False,,,,Single Family,,,,Asphalt,,,False,,,False,,,,,,,,,,,,,,,True,False,,Bungalow,,,,,,,,,,False,Duluth,,,"[{'name': 'PRESENTUSE', 'value': 'Yearly'}, {'name': 'STATUS', 'value': 'Pending'}, {'name': 'TAXYEAR', 'value': '2018.00'}, {'name': 'ZONING', 'value': 'Residential-Single Family'}, {'name': 'FRONTAGEFEET', 'value': 'Paved Streets, City'}, {'name': 'CONSTRUCTIONSTATUS', 'value': 'Previously Owned'}, {'name': 'GARAGEDESCRIPTION', 'value': 'Detached Garage, Driveway - Asphalt'}, {'name': 'HEATINGDESCRIPTION', 'value': 'Forced Air'}, {'name': 'APPLIANCES', 'value': 'Range, Refrigerator, Washer, Dryer'}, {'name': 'DININGROOMDESCRIPTION', 'value': 'Living/Dining Room'}, {'name': 'ROOMFLOOR1', 'value': 'Main'}, {'name': 'ROOF', 'value': 'Asphalt Shingles, Age Over 8 Years'}, {'name': 'SPECIALSEARCH', 'value': 'Main Floor Laundry, Main Floor Bedroom, 3 BR on One Level, All Living Facilities on One Level'}, {'name': 'FUEL', 'value': 'Natural Gas'}, {'name': 'SEWER', 'value': 'City Sewer/Connected'}, {'name': 'WATER', 'value': 'City Water/Connected'}, {'name': 'AMENITIESUNIT', 'value': 'Patio, Kitchen Window, Washer/Dryer Hookup, Main Floor Master Bedroom'}, {'name': 'BATHDESC', 'value': 'Main Floor Full Bath'}, {'name': 'EXTERIOR', 'value': 'Other'}, {'name': 'DAYSONMARKET', 'value': '116'}, {'name': 'DAYSONMARKETCUMULATIVE', 'value': '116'}, {'name': 'OFFMARKETDATE', 'value': '2020-01-22T11:30:18'}]",55811,1101 W Arrowhead Rd,Duluth,MN,46.823895,-92.094081,152000.0,RECENTLY_SOLD,9,55701_14,1,"Recently sold: $152,000. "
3,3,3,0,0,0,,,[],Finished,,['Forced air'],True,['Central'],True,,,,,False,False,,,2853.0,,,,['Attached Garage'],2,,False,True,,False,,False,,,,1,,,False,False,,['Stone'],,,,,False,,,,,,,False,0.36 acres,,,,False,010389500060,False,False,,,,Single Family,,,,Asphalt,,,False,,,False,,,,['City'],,,,,,,,,,,True,False,,Other,,,Duluth #709,,Duluth #709,,Duluth #709,,,False,Duluth,,,"[{'name': 'Sale/Rent', 'value': 'For Sale'}, {'name': 'Construction Status', 'value': 'Previously Owned'}, {'name': 'Fireplace Type', 'value': 'Gas'}, {'name': 'Classification', 'value': 'Homestead'}, {'name': 'Assessments', 'value': 'Unknown'}, {'name': 'School District', 'value': 'Duluth #709'}, {'name': 'Lot Description', 'value': 'Tree Coverage - Medium'}, {'name': 'Fireplace', 'value': 'Yes'}, {'name': 'Fireplaces', 'value': '1'}, {'name': 'Style', 'value': 'Ranch/Rambler'}, {'name': 'Main Floor Bedroom', 'value': '1'}, {'name': 'Air Conditioning', 'value': 'Central'}, {'name': 'Amenities-Exterior', 'value': 'Deck, Fenced Yard - Full'}, {'name': 'Bath Description', 'value': 'Private Master, Full Basement, Full Master, Full Main Floor'}, {'name': 'Construction Type', 'value': 'Frame/Wood'}, {'name': 'Dining', 'value': 'Combine with Kitchen, Informal Dining Room, Eat-In Kitchen'}, {'name': 'Heat', 'value': 'Forced Air, Electric, City Gas, Fireplace'}, {'name': 'Basement Features', 'value': 'Finished, Walkout, Bath, Den/Office, Family/Rec Room, Utility Room, Fireplace'}, {'name': 'Basement Style', 'value': 'Full'}, {'name': 'Outbuildings', 'value': 'Storage Shed'}, {'name': 'Extra Rooms', 'value': 'Storage Room, Mud Room, 3 Season Porch'}, {'name': 'Basement Material', 'value': 'Concrete Block'}, {'name': 'Water', 'value': 'City'}, {'name': 'Exterior', 'value': 'Aluminum'}]",55811,2520 Peace Dr,Duluth,MN,46.787528,-92.16168,313000.0,RECENTLY_SOLD,4,55701_15,1,"Recently sold: $313,000. "
2,2,1,1,0,0,,,[],,,,,,,,,,,True,False,,,1271.0,,,,['Attached Garage'],,,False,,,False,,False,,,,3,,,,,,['Brick'],,,['Typical'],,,,,,,,,False,0.01 acres,,,,False,010392300700,False,False,,,,Townhouse,,,,,,,False,,,False,,,,['City'],,,,,,,,,,,True,False,,,,,Duluth #709,,Duluth #709,,Duluth #709,,,False,Duluth,,,"[{'name': 'Sale/Rent', 'value': 'For Sale'}, {'name': 'Construction Status', 'value': 'Previously Owned'}, {'name': 'Assessments', 'value': 'Yes'}, {'name': 'Fireplace Type', 'value': 'Gas'}, {'name': 'Association Fee', 'value': 'Yes'}, {'name': 'Classification', 'value': 'Homestead'}, {'name': 'Association Fee Frequency', 'value': 'Monthly'}, {'name': 'Occupied By', 'value': 'Owner'}, {'name': 'School District', 'value': 'Duluth #709'}, {'name': 'Lot Description', 'value': 'Landscaped'}, {'name': 'Fireplace', 'value': 'Yes'}, {'name': 'Fireplaces', 'value': '1'}, {'name': 'Parking/Driveway', 'value': 'Off Street'}, {'name': 'Main Floor Bedroom', 'value': '1'}, {'name': 'Style', 'value': 'Condo/Townhouse'}, {'name': 'Air Conditioning', 'value': 'Central'}, {'name': 'Amenities', 'value': 'Natural Woodwork, Main Floor Laundry, Walk-In Closet, Cable TV, Security System'}, {'name': 'Amenities-Exterior', 'value': 'Deck, Patio'}, {'name': 'Association Fee Includes', 'value': 'Snow Removal, Trash, Water, Shared Amenities, Building Insurance, Cable/Satellite, Lawn Care'}, {'name': 'Basement Style', 'value': 'Slab'}, {'name': 'Bath Description', 'value': 'Private Master, Full Main Floor'}, {'name': 'Construction Type', 'value': 'Frame/Wood'}, {'name': 'Dining', 'value': 'Combine with Living Room, Formal Dining Room'}, {'name': 'Heat', 'value': 'Forced Air, Electric, City Gas'}, {'name': 'Terms', 'value': 'Cash, Conventional'}, {'name': 'Roof', 'value': 'Asphalt Shingles'}, {'name': 'Road Frontage', 'value': 'City, Sidewalk, Street Lights, Curb/Gutters'}, {'name': 'Water', 'value': 'City'}, {'name': 'Exterior', 'value': 'Vinyl, Other, Stone'}, {'name': 'Amenities-Shared', 'value': 'Elevator(s), Exercise Room, Community Room, Security Building, Car Wash'}, {'name': 'ADA Features', 'value': 'Fully Wheelchair'}, {'name': 'Disclosures/Docs', 'value': 'Disc./Condition Report'}]",55811,4042 Haines Rd UNIT 111,Duluth,MN,46.803756,-92.173476,245000.0,RECENTLY_SOLD,1,55701_16,1,"Recently sold: $245,000. "
