2,1,1,0,0,0,,,[],Finished,['Concrete'],['Forced air'],True,['Central'],True,"['Microwave', 'Range / Oven', 'Refrigerator']",,,,True,False,,,1017.0,,,,['Detached Garage'],,,False,,,False,,False,,,,1,,,,,,"['Metal', 'Wood']",,,,,,,,,,,,False,14 acres,,,,False,275001000050,False,False,,,,Single Family,,,,Asphalt,,,False,1960,,False,,,,,,,,,,,,,,,True,False,,Ranch,,,St. Louis County #2142,,St. Louis County #2142,,St. Louis County #2142,,,False,Saginaw,,,"[{'name': 'Features', 'value': 'Area Description/Country Living, Basement/Slab Foundation, General/Ceiling Fan(s), Water/Well, Age/Over 50 Years Old, Kitchen Features/Eat-in Kitchen, Sewer/Private, Lot Size/10-20 Acres, Exterior/Out Building, Property Description/Acreage, Road Type/County Street, Garage Count/3 Car Garage, General/Workshop, Exterior Description/Steel Frame'}]",55779,7161 Highway 2,Saginaw,MN,46.845154,-92.434439,135000.0,SOLD,0,55779_69,0,"Recently sold: $135,000. Enjoy country living in this honey of a home located on 14+ acres. This 2 bedroom home has a full bath, updated spacious kitchen with oak cabinetry and wall oven, informal dining area, and a living room with electric fireplace, bay window and a door to the deck. From the deck you will see the cool trout stream! Lower level in unfinished with a walk out. Exterior has 3 car detached garage with a bonus room above, pole building and 14 rolling acres! Septic is assumed failed and well is currently in the basement. Buyer to address well and septic replacement at buyer expense."
3,2,,,,,,,,,,['Other'],True,['Central'],True,,,,,True,False,,,1444.0,,,,,,,False,,,False,,False,,,,,,,,,,['Wood'],,,,,,,,,,,,False,3.76 acres,,,,False,400001002171,False,False,,,,Single Family,,,,,,,False,,,False,,,,,,,,,,,,,,,True,False,,,,,,,,,,,,False,Saginaw,,,[],55779,7249 Industrial Rd,Saginaw,MN,46.895791,-92.444559,175000.0,SOLD,0,55779_70,0,"Recently sold: $175,000. "
2,1,,,,,,,,,,['Other'],True,['Central'],True,,,,,,False,,,1344.0,,,,"['Attached Garage', 'Detached Garage']",,,False,,,False,,False,,,,2,,,,,,"['Other', 'Wood']",,,,,,,,,,,,False,10 acres,,,,False,380001001860,False,False,,,,Single Family,,,,,,,False,,,False,,,,,,,,,,,,,,,True,False,,Other,,,704 (Proctor),,704 (Proctor),,704 (Proctor),,,False,Saginaw,,,[],55779,6625 Halseth Rd,Saginaw,MN,46.917956,-92.377454,205000.0,SOLD,15,55779_71,1,"Recently sold: $205,000. If privacy is what you are looking for look no further, this property is on 10 beautiful acres and only 2.5 miles away from HWY 53. This newer (1992) two bedroom home offers an open floor plan with a updated kitchen, beautiful rock fireplace, family room and living room PLUS a patio door leading to a very private back yard. Convinently located main floor laundry and bath. Updates include a Jenn Air fridge, Frigidaire cooktop,cabinets and a movable center island, and that's only the kitchen! Newer Paine furnace, renovated bath, flooring, Marvin windows and roof. Don't forget to check out the 34X38 garage!! Septic is for one bedroom, but is an over sized system."
3,2,2,0,0,0,,,[],,"['Hardwood', 'Tile']",['Baseboard'],True,['None'],True,"['Dishwasher', 'Dryer', 'Microwave', 'Range / Oven', 'Refrigerator', 'Washer']",,,,True,False,,,1919.0,,,,"['Attached Garage', 'Detached Garage']",4,,False,True,,False,,False,,,,2,,,,,,['Wood'],,,['Inland Lake'],,True,,,,,,,False,1.6 acres,,,,False,380009600070,False,False,,,,Single Family,,,,Asphalt,,,False,,,False,,,,['Private'],,,,,,,,,,,True,False,,Contemporary,,,Duluth #709,,Duluth #709,,Duluth #709,,,False,Saginaw,,,"[{'name': 'Sale/Rent', 'value': 'For Sale'}, {'name': 'Construction Status', 'value': 'Previously Owned'}, {'name': 'Classification', 'value': 'Homestead'}, {'name': 'Assessments', 'value': 'Unknown'}, {'name': 'School District', 'value': 'Duluth #709'}, {'name': 'BWCAW Access', 'value': 'upper'}, {'name': 'Waterfront Name', 'value': 'Baby Grand'}, {'name': 'Main Floor Bedroom', 'value': '1'}, {'name': 'Amenities-Exterior', 'value': 'Deck, Patio, Dock'}, {'name': 'Construction Type', 'value': 'Frame/Wood'}, {'name': 'Exterior', 'value': 'Wood'}, {'name': 'Heat', 'value': 'Forced Air, Propane, Electric, Baseboard, Dual Fuel/Off Peak'}, {'name': 'Water', 'value': 'Private'}, {'name': 'Roof', 'value': 'Asphalt Shingles'}, {'name': 'Basement Material', 'value': 'Concrete Block'}, {'name': 'Basement Features', 'value': 'Unfinished'}, {'name': 'Basement Style', 'value': 'Crawl Space'}]",55779,4712 Dow Rd,Saginaw,MN,46.852143,-92.410124,299900.0,SOLD,18,55779_72,1,"Recently sold: $299,900. "
3,2,1,0,1,0,,,[],Finished,,['Forced air'],True,['Central'],True,"['Dishwasher', 'Dryer', 'Microwave', 'Range/Stove', 'Washer']",,,,False,False,,,960.0,,,,"['Detached Garage', 'Off street']",,,False,,,False,,False,,,,1,,,False,False,,['Metal'],,,,,False,,,,,,,False,2.5 acres,,,,False,380001003424,False,False,,,,Single Family,,,,Shake/Shingle,,,False,2007,,False,,,,['Mound'],,,,,,,,,,,True,False,,Other,,,Proctor #704,,Proctor #704,,Proctor #704,,,False,Saginaw,,,"[{'name': 'Sale/Rent', 'value': 'For Sale'}, {'name': 'Construction Status', 'value': 'Previously Owned'}, {'name': 'Classification', 'value': 'Homestead'}, {'name': 'Occupied By', 'value': 'Owner'}, {'name': 'BWCAW Access', 'value': 'Main'}, {'name': 'School District', 'value': 'Proctor #704'}, {'name': 'Township', 'value': 'Grand Lake township (St. Louis County)'}, {'name': 'Style', 'value': 'Ranch/Rambler'}, {'name': 'Main Floor Bedroom', 'value': '1'}, {'name': 'Parking/Driveway', 'value': 'Driveway - Gravel'}, {'name': 'Air Conditioning', 'value': 'Central'}, {'name': 'Bath Description', 'value': 'Main Floor Full Bath, 1/2 Master'}, {'name': 'Construction Type', 'value': 'Frame/Wood'}, {'name': 'Heat', 'value': 'Forced Air, Propane'}, {'name': 'Mechanicals', 'value': 'Fuel Tank-Rented, Water Heater-Electric'}, {'name': 'Terms', 'value': 'Cash, Conventional, VA DVA, FHA'}, {'name': 'Basement Style', 'value': 'Full'}, {'name': 'Extra Rooms', 'value': 'Master Bd Bath'}, {'name': 'Water', 'value': 'Drilled'}, {'name': 'Roof', 'value': 'Asphalt Shingles'}, {'name': 'Amenities', 'value': 'Drywalls, Washer Hook-Ups'}, {'name': 'Road Frontage', 'value': 'County'}, {'name': 'Road Maintenance', 'value': 'Public'}, {'name': 'Basement Material', 'value': 'Concrete Block'}, {'name': 'Basement Features', 'value': 'Unfinished'}, {'name': 'Dining', 'value': 'Eat-In Kitchen'}, {'name': 'Outbuildings', 'value': 'Lean-To'}, {'name': 'Exterior', 'value': 'Aluminum'}]",55779,6689 Industrial Rd,Saginaw,MN,46.895632,-92.384934,184000.0,SOLD,1,55779_73,1,"Recently sold: $184,000. "
3,2,1,1,0,0,,,[],,,,,,,"['Dishwasher', 'Dryer', 'Range/Stove', 'Refrigerator', 'Washer', 'Exhaust Fan/Hood']",,,,,False,,,1932.0,,,,"['Attached Garage', 'Detached Garage']",,,False,,,False,,False,,,,1,,,,,,"['Metal', 'Other']",,,,,,,,,,,,False,7.41 acres,,,,False,530001000993,False,False,,,,Single Family,,,,,,,False,,,False,,,,['Private'],,,,,,,,,,,True,False,,Contemporary,,,Proctor #704,,Proctor #704,,Proctor #704,,,False,Saginaw,,,"[{'name': 'Sale/Rent', 'value': 'For Sale'}, {'name': 'Construction Status', 'value': 'Previously Owned'}, {'name': 'Assessments', 'value': 'Yes'}, {'name': 'Classification', 'value': 'Homestead'}, {'name': 'School District', 'value': 'Proctor #704'}, {'name': 'BWCAW Access', 'value': 'upper'}, {'name': 'Lot Description', 'value': 'Landscaped, Tree Coverage - Heavy, High'}, {'name': 'Parking/Driveway', 'value': 'Driveway - Asphalt, Driveway - Concrete'}, {'name': 'Main Floor Bedroom', 'value': '1'}, {'name': 'Amenities', 'value': 'Main Floor Laundry, Patio Door, Ceiling Fans, Eat-In Kitchen, Garage Door Opener, Tiled Floors, Vaulted Ceilings, Drywalls, Kitchen Center Island, Skylight'}, {'name': 'Amenities-Exterior', 'value': 'Deck, Hot Tub'}, {'name': 'Basement Style', 'value': 'Slab'}, {'name': 'Bath Description', 'value': 'Main Floor Full Bath, Upper Level Bath'}, {'name': 'Construction Type', 'value': 'Frame/Wood'}, {'name': 'Heat', 'value': 'In Floor, Electric, Baseboard, Pellet'}, {'name': 'Water', 'value': 'Private'}, {'name': 'Outbuildings', 'value': 'Storage Shed, Other Buildings'}, {'name': 'Roof', 'value': 'Asphalt Shingles'}, {'name': 'Road Frontage', 'value': 'County'}, {'name': 'Mechanicals', 'value': 'Water Heater-Electric, Water Softener-Owned'}, {'name': 'ADA Features', 'value': 'Partially Wheelchair'}, {'name': 'Exterior', 'value': 'Vinyl'}, {'name': 'Windows', 'value': 'Vinyl Frame'}, {'name': 'Dining', 'value': 'Eat-In Kitchen'}]",55779,6959 Seville Rd,Saginaw,MN,46.849638,-92.413952,299900.0,SOLD,0,55779_74,0,"Recently sold: $299,900. Private 3 bedroom 2 bath home tucked back in the woods on 7.41 acres.  Landscaped yard, wildlife galore, Paved driveway, 28 x 40 garage with heated workshop, storage shed and quonset hut, hot tub and sauna.  Main floor of home features 1 bedroom, full bath, laundry room, office, eat in kitchen, living room with patio doors that lead to a nice deck.  Enclosed porch.  Upper level features 2 bedrooms and a 3/4 bath.  Several lakes near by.  12 mins to Cloquet and approx 15-20 mins to Duluth."
2,2,1,1,0,0,,,[],Finished,"['Carpet', 'Laminate', 'Linoleum / Vinyl']","['Forced air', 'Stove']",True,['Other'],True,"['Dishwasher', 'Dryer', 'Range/Stove', 'Refrigerator', 'Washer']",,,,True,False,,,1612.0,,,,"['Carport', 'Off street']",,,False,,,False,,False,,,,1,,,False,False,,"['Brick', 'Vinyl']",,,,,False,,,,,,,False,1 acres,,,,False,530001000472,False,False,,,,Single Family,,,,Asphalt,,,False,,,False,,,,"['Private', 'Mound']",,,,,,,,,,,True,False,,Ranch,,,Proctor #704,,Proctor #704,,Proctor #704,,,False,Culver,,,"[{'name': 'Sale/Rent', 'value': 'For Sale'}, {'name': 'Construction Status', 'value': 'Previously Owned'}, {'name': 'Classification', 'value': 'Homestead'}, {'name': 'School District', 'value': 'Proctor #704'}, {'name': 'Style', 'value': 'Ranch/Rambler'}, {'name': 'Main Floor Bedroom', 'value': '1'}, {'name': 'Construction Type', 'value': 'Frame/Wood'}, {'name': 'Dining', 'value': 'Combine with Kitchen'}, {'name': 'Heat', 'value': 'Forced Air, Oil, Pellet'}, {'name': 'Terms', 'value': 'Cash, Conventional, VA DVA, FHA, USDA'}, {'name': 'Water', 'value': 'Private, Drilled'}, {'name': 'Basement Style', 'value': 'Full'}, {'name': 'Roof', 'value': 'Asphalt Shingles'}, {'name': 'Windows', 'value': 'Wood Frame, Vinyl Frame'}, {'name': 'Mechanicals', 'value': 'Water Heater-Electric'}, {'name': 'Basement Material', 'value': 'Concrete Block'}, {'name': 'Exterior', 'value': 'Vinyl'}]",55779,6391 Highway 194,Culver,MN,46.84414,-92.352056,170000.0,SOLD,1,55779_75,1,"Recently sold: $170,000. 2+ bedroom ranch, 1 3/4 baths, with a freshly remodeled bathroom along with a recently  finished basement. New roof, gutters, decks, capert, doors and much more. Compliant mound system."
3,1,,,,,,,,Finished,,['Other'],True,['Central'],True,,,,,,False,,,832.0,,,,"['Attached Garage', 'Detached Garage']",,,False,,,False,,False,,,,,,,,,,"['Other', 'Wood']",,,,,,,,,,,,False,10 acres,,,,False,475001002672,False,False,,,,Single Family,,,,,,,False,,,False,,,,,,,,,,,,,,,True,False,,,,,,,,,,,,False,Culver,,,[],55779,8006 Shipley Rd,Culver,MN,46.995241,-92.52659,120000.0,SOLD,0,55779_76,0,"Recently sold: $120,000. "
3,3,3,0,0,0,,,[],Finished,['Hardwood'],['Other'],True,"['Central', 'Solar']",True,"['Dishwasher', 'Dryer', 'Microwave', 'Range / Oven', 'Refrigerator']",,,,True,False,,,4204.0,,,,"['Attached Garage', 'Detached Garage']",,,False,,,False,,False,,,,2,,,,,,"['Metal', 'Vinyl', 'Wood']",,,,,,,,,,,,False,5.46 acres,,,,False,380011200060,False,False,,,,Single Family,,,,Asphalt,,,False,,,False,,,,,,,,,,,,,,,True,False,,Ranch,,,Proctor #704,,Proctor #704,,Proctor #704,,,False,Saginaw,,,"[{'name': 'central_air_desc', 'value': 'Central A/C'}, {'name': 'architectural_style', 'value': 'Other'}, {'name': 'has_ceiling_fan_fl', 'value': 'Y'}, {'name': 'taxes_annual', 'value': '5128'}]",55779,6244 Boulderbelle Dr,Saginaw,MN,46.855708,-92.337744,467500.0,SOLD,24,55779_77,1,"Recently sold: $467,500. Stunning fortress just a few miles out of Hermantown, N off Hwy 53; This magnificent custom home has catered touches from top to bottom w/ a Northwoods atmosphere including tongue &amp; groove throughout, rock fireplaces, hardwood floors &amp; custom tile work. Huge bedrooms and ample closets on every floor; a mother-in-law suite in the lower level-all nestled on a wooded 5 acre parcel at the end of a dead end road filled with stunning hardwoods. Don't miss the additional 2 stall garage &amp; pole bldg."
3,1,0,0,0,0,,,[],,,['Other'],True,['None'],True,,,,,,False,,,1528.0,,,,,,,False,,,False,,False,,,,1,,,,,,"['Other', 'Wood']",,,,,True,,,,,,,False,1.8 acres,,,,False,380005500090,False,False,,,,Single Family,,,,,,,False,,,False,,,,,,,,,,,,,,,True,False,,Ranch,,,Proctor #704,,Proctor #704,,Proctor #704,,,False,Saginaw,,,"[{'name': 'Sale/Rent', 'value': 'For Sale'}, {'name': 'CONSTRUCTION TYPE', 'value': 'Frame/Wood'}, {'name': 'DINING', 'value': 'Breakfast Bar, Combine with Living Room'}, {'name': 'EXTERIOR', 'value': 'Wood, Steel'}, {'name': 'FUEL', 'value': 'Propane'}, {'name': 'GARAGE TYPE', 'value': 'Detached'}, {'name': 'ROOF', 'value': 'Asphalt Shingles'}, {'name': 'AMENITIES', 'value': 'Ceiling Fans, Natural Woodwork, Patio Door, Main Floor Laundry'}, {'name': 'Waterfront', 'value': 'Yes'}, {'name': 'APPLIANCES', 'value': 'Range/Stove, Refrigerator, Dishwasher, Dryer, Washer'}, {'name': 'Construction Status', 'value': 'Previously Owned'}, {'name': 'Style', 'value': 'SF Single Family'}, {'name': 'ROAD FRONTAGE', 'value': 'County'}, {'name': 'Classification', 'value': 'NonHomestead'}, {'name': 'AMENITIES-EXTERIOR', 'value': 'Dock, Boat Slip, Patio, Water Feature'}, {'name': 'Assessments', 'value': 'Yes'}, {'name': 'HEAT', 'value': 'Forced Air, Fireplace, Wood, Propane'}, {'name': 'OUTBUILDINGS', 'value': 'Storage Shed, Lean-To'}, {'name': 'Fireplace Type', 'value': 'Wood Burning'}, {'name': 'ADA FEATURES', 'value': 'Partially Wheelchair, No Stairs Internal'}, {'name': 'MECHANICALS', 'value': 'Sump Pump, Water Heater-Tankless'}, {'name': 'School District', 'value': 'Proctor #704'}, {'name': 'House Style', 'value': '24x44'}, {'name': 'Waterfront Description', 'value': 'Inland Lake'}, {'name': 'Waterfront Name', 'value': 'Grand Lake'}, {'name': 'WATER', 'value': 'Drilled'}, {'name': 'SEWER', 'value': 'Mound'}]",55779,6874 Birch Grove Rd,Saginaw,MN,46.889139,-92.40343,257000.0,SOLD,1,55779_78,1,"Recently sold: $257,000. "
3,2,2,0,0,0,,,[],Finished,,['Other'],True,['Central'],True,,,,,True,False,,,2400.0,,,,"['Attached Garage', 'Detached Garage']",,,False,,,False,,False,,,,0,,,,,,['Wood'],,,,,,,,,,,,False,9.08 acres,,,,False,380001002996,False,False,,,,Single Family,,,,,,,False,,,False,,,,,,,,,,,,,,,True,False,,,,,Proctor #704,,Proctor #704,,Proctor #704,,,False,Saginaw,,,[],55779,6367 Hotop Ln,Saginaw,MN,46.90308,-92.34722,335000.0,SOLD,0,55779_79,0,"Recently sold: $335,000. Rare opportunity! Beautiful Long Lake near Caribou and Pike Lake. This custom log home is private and secluded and includes guest house, extra garage,and more! One level living at its finest. Enjoy snowmobile trails and all lake activities and just seconds off highway 53. A few of the features include, granitecounters, new maple flooring, Jenn-aire cook top, pantry, stunning stone fireplace in great room and a beautiful owners suite. This custom lake home will not disappoint you!"
2,2,1,1,0,0,,,[],,,['Other'],True,['Central'],True,,,,,,False,,,1216.0,,,,"['Attached Garage', 'Detached Garage']",,,False,,,False,,False,,,,1,,,,,,"['Other', 'Wood']",,,,,,,,,,,,False,12.14 acres,,,,False,400001002572,False,False,,,,Single Family,,,,,,,False,,,False,,,,,,,,,,,,,,,True,False,,,,,St. Louis County #2142,,St. Louis County #2142,,St. Louis County #2142,,,False,Saginaw,,,"[{'name': 'Sale/Rent', 'value': 'For Sale'}, {'name': 'DINING', 'value': 'Combine with Kitchen'}, {'name': 'FUEL', 'value': 'Propane'}, {'name': 'BASEMENT STYLE', 'value': 'Crawl Space'}, {'name': 'BATH DESCRIPTION', 'value': 'Main Floor Full Bath, 3/4 Master'}, {'name': 'GARAGE TYPE', 'value': 'Detached'}, {'name': 'SEWER', 'value': 'Private'}, {'name': 'WATER', 'value': 'Private'}, {'name': 'Construction Status', 'value': 'Previously Owned'}, {'name': 'Style', 'value': 'SF Single Family'}, {'name': 'AMENITIES', 'value': 'Eat-In Kitchen, Vaulted Ceilings, Walk-In Closet'}, {'name': 'Assessments', 'value': 'Yes'}, {'name': 'AMENITIES-EXTERIOR', 'value': 'Driveway - Gravel'}, {'name': 'HEAT', 'value': 'Forced Air'}, {'name': 'School District', 'value': 'St. Louis County #2142'}, {'name': 'OUTBUILDINGS', 'value': 'Storage Shed'}, {'name': 'Fireplace Type', 'value': 'Wood Burning'}, {'name': 'Classification', 'value': 'Homestead'}, {'name': 'CONSTRUCTION TYPE', 'value': 'Manufactured'}, {'name': 'EXTERIOR', 'value': 'Other'}, {'name': 'House Style', 'value': '16 x 76'}]",55779,7569 Industrial Rd,Saginaw,MN,46.896638,-92.480195,95000.0,SOLD,0,55779_80,0,"Recently sold: $95,000. Septic to be tested in spring. There is a driveway easement across the neighbors property at the very beginning of the driveway."
3,2,2,0,0,0,,,[],Finished,"['Carpet', 'Laminate', 'Linoleum / Vinyl']",['Heat pump'],True,['Central'],True,"['Dryer', 'Freezer', 'Microwave', 'Refrigerator', 'Washer']",,,,True,False,,,1920.0,,,,"['Detached Garage', 'Off street']",6,,False,True,,False,,False,,,,2,,,False,False,,['Metal'],,,['Park'],True,False,,,,,,,False,2.51 acres,,,,False,380001004873,False,False,,,,Single Family,,,,Metal,,,False,,,False,,,,,,,,,,,,,,,True,False,,Split level,,,Proctor #704,,Proctor #704,,Proctor #704,,,False,Saginaw,,,"[{'name': 'Sale/Rent', 'value': 'For Sale'}, {'name': 'AMENITIES-EXTERIOR', 'value': 'Deck, Invisible Fencing, Driveway - Asphalt'}, {'name': 'CONSTRUCTION TYPE', 'value': 'Frame/Wood'}, {'name': 'FUEL', 'value': 'Propane, Electric'}, {'name': 'GARAGE TYPE', 'value': 'Detached'}, {'name': 'SEWER', 'value': 'Private'}, {'name': 'AMENITIES', 'value': 'Ceiling Fans, Garage Door Opener, Hardwood Floors, Natural Woodwork, Walk-In Closet, Washer/Dryer Hookups, Broadband Available'}, {'name': 'WATER', 'value': 'Private'}, {'name': 'APPLIANCES', 'value': 'Microwave, Range/Stove, Refrigerator, Dishwasher, Dryer, Washer, Exhaust Fan/Hood, Freezer'}, {'name': 'Construction Status', 'value': 'Previously Owned'}, {'name': 'Style', 'value': 'SF Single Family'}, {'name': 'BASEMENT MATERIAL', 'value': 'Concrete Block'}, {'name': 'Assessments', 'value': 'Yes'}, {'name': 'Fireplace Type', 'value': 'Gas'}, {'name': 'BASEMENT FEATURES', 'value': 'Family/Rec Room, Finished, Bath, Bedrooms, Egress Windows, Washer Hook-Ups, Dryer Hook-Ups'}, {'name': 'BASEMENT STYLE', 'value': 'Full'}, {'name': 'AIR CONDITIONING', 'value': 'Central'}, {'name': 'EXTERIOR', 'value': 'Steel'}, {'name': 'Classification', 'value': 'Homestead'}, {'name': 'ROOF', 'value': 'Metal'}, {'name': 'Occupied By', 'value': 'Owner'}, {'name': 'HEAT', 'value': 'Heat Pump, Electric'}, {'name': 'School District', 'value': 'Proctor #704'}, {'name': 'BWCAW Access', 'value': 'Lower Level'}, {'name': 'House Style', 'value': '40x24'}]",55779,6046 Charles Rd,Saginaw,MN,46.891794,-92.318029,239900.0,SOLD,24,55779_81,1,"Recently sold: $239,900. null Brokered And Advertised By: Edina Realty, Inc - Duluth Listing Agent: Mary Townsend"
3,2,2,0,0,0,,,[],Finished,"['Concrete', 'Hardwood', 'Linoleum / Vinyl', 'Tile']","['Baseboard', 'Forced air', 'Stove']",True,['Central'],True,"['Dishwasher', 'Dryer', 'Microwave', 'Range / Oven', 'Washer']",,,,False,False,,,1446.0,,,,"['Detached Garage', 'Off street']",10,,False,True,,False,,False,,,,1,,,False,False,,['Wood'],,,['Territorial'],True,False,,,,,,,False,19.9 acres,,,,False,475001004380,False,False,,,,Single Family,,,,Asphalt,,,False,2000,,False,,,,,,,,,,,,,,,True,False,,Contemporary,,,Proctor #704,,Proctor #704,,Proctor #704,,,False,Culver,,,"[{'name': 'Sale/Rent', 'value': 'For Sale'}, {'name': 'CONSTRUCTION TYPE', 'value': 'Frame/Wood'}, {'name': 'DINING', 'value': 'Combine with Kitchen, Eat-In Kitchen'}, {'name': 'EXTERIOR', 'value': 'Wood, Vinyl'}, {'name': 'BASEMENT MATERIAL', 'value': 'Poured Concrete'}, {'name': 'BATH DESCRIPTION', 'value': 'Main Floor Full Bath, Full Basement'}, {'name': 'GARAGE TYPE', 'value': 'Detached, Multiple'}, {'name': 'ROOF', 'value': 'Asphalt Shingles'}, {'name': 'SEWER', 'value': 'Private'}, {'name': 'WATER', 'value': 'Private, Drilled'}, {'name': 'Construction Status', 'value': 'Previously Owned'}, {'name': 'Style', 'value': 'SF Single Family'}, {'name': 'BASEMENT STYLE', 'value': 'Full'}, {'name': 'BASEMENT FEATURES', 'value': 'Finished'}, {'name': 'FUEL', 'value': 'Oil'}, {'name': 'HEAT', 'value': 'Forced Air'}, {'name': 'OUTBUILDINGS', 'value': 'Storage Shed'}, {'name': 'Classification', 'value': 'Homestead'}, {'name': 'School District', 'value': 'Proctor #704'}, {'name': 'House Style', 'value': '24 x 40'}, {'name': 'BWCAW Access', 'value': 'LL'}]",55779,7629 Swan Lake Rd,Culver,MN,46.962208,-92.483846,224800.0,SOLD,24,55779_82,1,"Recently sold: $224,800. Solid Ranch style house. Multiple out buildings.  Very clean and well cared for.  New septic.  Full basement."
2,1,,,,,,,,Finished,,['Other'],True,['Central'],True,,,,,True,False,,,924.0,,,,,,,False,,,False,,False,,,,1,,,,,,"['Metal', 'Wood']",,,,,,,,,,,,False,10 acres,,,,False,380001002192,False,False,,,,Single Family,,,,,,,False,,,False,,,,,,,,,,,,,,,True,False,,Ranch,,,,,,,,,,False,Saginaw,,,[],55779,5591 Munger Shaw Rd,Saginaw,MN,46.914323,-92.344768,101000.0,SOLD,0,55779_83,0,"Recently sold: $101,000. "
3,2,1,1,0,0,,,[],,['Tile'],['Baseboard'],True,['Wall'],True,"['Dishwasher', 'Dryer', 'Microwave', 'Range / Oven', 'Refrigerator', 'Washer']",,,,,False,,,2808.0,,,,"['Attached Garage', 'Detached Garage']",3,,False,True,,False,,False,,,,2,,,,,,['Vinyl'],,,,,,,,,,,,False,15.04 acres,,,,False,275001001100,False,False,,,,Single Family,,,,Metal,,,False,2000,,False,,,,,,,,,,,,,,,True,False,,Other,,,#2142,,#2142,,#2142,,,False,Saginaw,,,"[{'name': 'Sale', 'value': 'For Sale'}, {'name': 'AMENITIES-EXTERIOR', 'value': 'Deck'}, {'name': 'BASEMENT MATERIAL', 'value': 'A'}, {'name': 'CONSTRUCTION TYPE', 'value': 'Wood'}, {'name': 'FUEL', 'value': 'Propane'}, {'name': 'HEAT', 'value': 'Baseboard'}, {'name': 'HEAT', 'value': 'In Floor'}, {'name': 'GARAGE TYPE', 'value': 'Detached'}, {'name': 'SEWER', 'value': 'Private'}, {'name': 'AMENITIES', 'value': 'Ceiling Fans'}, {'name': 'WATER', 'value': 'Private'}, {'name': 'Construction Status', 'value': 'Previously Owned'}, {'name': 'Style', 'value': 'SF Single Family'}, {'name': 'EXTERIOR', 'value': 'Vinyl'}, {'name': 'ROAD FRONTAGE', 'value': 'County'}, {'name': 'FUEL', 'value': 'Electric'}, {'name': 'Assessments', 'value': 'Yes'}, {'name': 'AMENITIES', 'value': 'Vaulted Ceilings'}, {'name': 'AMENITIES-EXTERIOR', 'value': 'Driveway - Gravel'}, {'name': 'AMENITIES', 'value': 'Garage Door Opener'}, {'name': 'AMENITIES', 'value': 'Walk-In Closet'}, {'name': 'AMENITIES', 'value': 'Dryer Hookups'}, {'name': 'BATH DESCRIPTION', 'value': '4 Bath'}, {'name': 'BATH DESCRIPTION', 'value': 'Upper Level Bath'}, {'name': 'School District', 'value': 'St. Louis County #2142'}, {'name': 'Classification', 'value': 'Homestead'}, {'name': 'AMENITIES', 'value': 'Tiled Floors'}, {'name': 'AMENITIES-EXTERIOR', 'value': 'Patio'}, {'name': 'BATH DESCRIPTION', 'value': 'Full Master'}, {'name': 'ROOF', 'value': 'Metal'}, {'name': 'BASEMENT STYLE', 'value': 'Slab'}, {'name': 'HEAT', 'value': 'Fireplace'}, {'name': 'DINING', 'value': 'Informal Dining Room'}, {'name': 'ROAD FRONTAGE', 'value': 'Gravel'}, {'name': 'BASEMENT FEATURES', 'value': 'A'}, {'name': 'AMENITIES-EXTERIOR', 'value': 'RV Parking'}, {'name': 'Fireplace Type', 'value': 'Electric'}, {'name': 'LA1Agent Phone1 CountryId', 'value': 'United States (+1)'}, {'name': 'LA2Agent Phone1 CountryId', 'value': 'United States (+1)'}, {'name': 'LA2Agent Phone2 CountryId', 'value': 'United States (+1)'}, {'name': 'BWCAW Access', 'value': '2'}, {'name': 'House Style', 'value': '48x36+12x8'}]",55779,4667 Shadow Ln W,Saginaw,MN,46.85043,-92.540819,225000.0,SOLD,23,55779_84,1,"Recently sold: $225,000. Gorgeous Setting!Step into this beautiful newer home and see endless features including and open floor plan with newly updated kitchen, large L-shaped great room with balcony overlooking it, wonderful natural lighting, and In-floor heat! The upper level offers a HUGE 15x31 master suite with full bath, walk-in closet, separate seating area, and beautiful views of the surrounding valleys and wooded property. There are also two more large bedrooms on the upper level with nice vaulted ceilings.  Outside, you have a newer, fully insulated &amp; finished, 3 stall garage including a workshop! There are also multiple wildlife ponds, natural landscaping, and beautiful views of the surrounding property. This property is centrally located to Cloquet, Duluth, and Grand Rapids and offers a Park-Like setting! Don't let this one get away!"
