4,3,2,0,1,0,,,[],Finished,,['Other'],True,['Central'],True,"['Dishwasher', 'Dryer', 'Microwave', 'Range/Stove', 'Refrigerator', 'Washer']",,,,,False,,,2688.0,,,,,,,False,,,False,,False,,,,2,,,,,,"['Other', 'Wood']",,,,,,,,,,,,False,10 acres,,,,False,380001005310,False,False,,,,Single Family,,,,,,,False,,,False,,,,['Private'],,,,,,,,,,,True,False,,,,,Proctor #704,,Proctor #704,,Proctor #704,,,False,Saginaw,,,"[{'name': 'Sale/Rent', 'value': 'For Sale'}, {'name': 'Construction Status', 'value': 'Previously Owned'}, {'name': 'Classification', 'value': 'Homestead'}, {'name': 'Occupied By', 'value': 'Owner'}, {'name': 'School District', 'value': 'Proctor #704'}, {'name': 'BWCAW Access', 'value': 'U'}, {'name': 'Disclosures/Docs', 'value': 'Assoc Document, Well Disc, Septic Disclosure'}, {'name': 'Lot Description', 'value': 'Tree Coverage - Medium, Irregular Lot, High'}, {'name': 'Main Floor Bedroom', 'value': '1'}, {'name': 'Parking/Driveway', 'value': 'Driveway - Gravel, RV Parking, Driveway - Shared'}, {'name': 'Style', 'value': 'Multi-level'}, {'name': 'Bath 3 Level', 'value': 'M'}, {'name': 'Amenities', 'value': 'Natural Woodwork, Walk-In Closet, Patio Door, Ceiling Fans, Tiled Floors, Drywalls, Foyer Entry, Washer Hook-Ups, Dryer Hook-Ups, 2nd Floor Laundry'}, {'name': 'Bath Description', 'value': 'Private Master, Upper Level Bath, Main Floor 1/2 Bath, Full Master'}, {'name': 'Construction Type', 'value': 'Frame/Wood'}, {'name': 'Dining', 'value': 'Breakfast Bar, Combine with Kitchen'}, {'name': 'Heat', 'value': 'Forced Air, Propane'}, {'name': 'Mechanicals', 'value': 'Fuel Tank-Rented, Air to Air Exchange, Sump Pump, Central Vacuum, Water Softener-Rented'}, {'name': 'Terms', 'value': 'Cash, Conventional, VA DVA, FHA, USDA'}, {'name': 'Water', 'value': 'Private, Drilled'}, {'name': 'Basement Features', 'value': 'Finished, Family/Rec Room, Utility Room'}, {'name': 'Basement Style', 'value': 'Full'}, {'name': 'Extra Rooms', 'value': 'Master Bd Bath, Mud Room'}, {'name': 'Outbuildings', 'value': 'Storage Shed'}, {'name': 'Roof', 'value': 'Asphalt Shingles'}, {'name': 'Road Frontage', 'value': 'County, Township'}, {'name': 'Road Maintenance', 'value': 'Public'}, {'name': 'Basement Material', 'value': 'Concrete Block'}, {'name': 'Exterior', 'value': 'Vinyl'}, {'name': 'Amenities-Exterior', 'value': 'Gutter/Downspout'}, {'name': 'Windows', 'value': 'Vinyl Frame'}, {'name': 'Internet Options', 'value': 'DSL'}]",55779,6263 Old Miller Trunk Hwy,Saginaw,MN,46.876492,-92.335797,270000.0,RECENTLY_SOLD,0,55779_25,0,"Recently sold: $270,000. Be prepared to be excited about this multi level home. It is such a functional layout and adorable place! Main floor bedroom and new half bath with room for a stack-able. New flooring thru out the whole house. Side door mud room and laundry. Brand new stove, updated kitchen, sliding patio doors to the back yard.  3rd floor Master bedroom, full bath and walk in closet. Two additional bedrooms and another full bath. In the basement you have a rec. room, bar area and projector for all your family nights! 10 acres of seclusion and compliant septic. 5 minutes from Pike Lake Super One, Dairy Queen and a bait shop. You'll love it!"
3,2,1,1,0,0,,,[],,,['Other'],True,['Central'],True,,,,,True,False,,,2710.0,,,,['Attached Garage'],,,False,,,False,,False,,,,1,,,,,,"['Other', 'Wood']",,,['Typical'],,,,,,,,,False,9.38 acres,,,,False,400001004420,False,False,,,,Single Family,,,['Slab'],,,,False,,,False,,,,['Private'],,,,,,,,,,,True,False,,,,,St. Louis County #2142,,St. Louis County #2142,,St. Louis County #2142,,,False,Saginaw,,,"[{'name': 'Sale/Rent', 'value': 'For Sale'}, {'name': 'Construction Status', 'value': 'Previously Owned'}, {'name': 'Fireplace Type', 'value': 'Gas'}, {'name': 'School District', 'value': 'St. Louis County #2142'}, {'name': 'Classification', 'value': 'Homestead'}, {'name': 'BWCAW Access', 'value': 'Main'}, {'name': 'Fireplace', 'value': 'Yes'}, {'name': 'Fireplaces', 'value': '1'}, {'name': 'Style', 'value': 'Ranch/Rambler'}, {'name': 'Lot Description', 'value': 'Level'}, {'name': 'Main Floor Bedroom', 'value': '1'}, {'name': 'Air Conditioning', 'value': 'Central'}, {'name': 'Amenities', 'value': 'Natural Woodwork, Main Floor Laundry, Ceiling Fans, Vaulted Ceilings, Foyer Entry, Kitchen Center Island'}, {'name': 'Amenities-Exterior', 'value': 'Patio, Gutter/Downspout, Fenced Yard - Partial, Hot Tub'}, {'name': 'Basement Style', 'value': 'Slab'}, {'name': 'Bath Description', 'value': 'Main Floor Full Bath, 3/4 Master'}, {'name': 'Construction Type', 'value': 'Frame/Wood'}, {'name': 'Dining', 'value': 'Breakfast Bar, Combine with Kitchen, Informal Dining Room'}, {'name': 'Heat', 'value': 'Forced Air, In Floor, Propane, Electric, Dual Fuel/Off Peak, Boiler'}, {'name': 'Outbuildings', 'value': 'Hot Tub, Gazebo'}, {'name': 'Terms', 'value': 'Cash, Conventional, VA DVA, FHA'}, {'name': 'Water', 'value': 'Private'}, {'name': 'Road Frontage', 'value': 'County, Paved'}, {'name': 'ADA Features', 'value': 'Partially Wheelchair, Doors 36?+'}, {'name': 'Exterior', 'value': 'Vinyl'}, {'name': 'Mechanicals', 'value': 'Air to Air Exchange, Water Softener-Owned'}, {'name': 'Garage Dimensions', 'value': '34x30'}]",55779,5048 Independence Rd,Saginaw,MN,46.877777,-92.468975,365000.0,RECENTLY_SOLD,1,55779_26,1,"Recently sold: $365,000. "
4,4,3,0,1,0,,,[],Finished,"['Hardwood', 'Tile']","['Forced air', 'Other', 'Radiant']",True,['Central'],True,"['Dishwasher', 'Dryer', 'Microwave', 'Refrigerator', 'Washer']",,,,True,False,,,3046.0,,,,"['Attached Garage', 'Detached Garage']",,,False,,,False,,False,,,,1,,,,,,"['Stone', 'Vinyl']",,,['Panoramic'],,,,,,,,,False,12.28 acres,,,,False,380001003820,False,False,,,,Single Family,,,,,,,False,,,False,,,,['Private'],,,,,,,,,,,True,False,,Ranch,,,Proctor #704,,Proctor #704,,Proctor #704,,,False,Saginaw,,,"[{'name': 'Sale/Rent', 'value': 'For Sale'}, {'name': 'Construction Status', 'value': 'Previously Owned'}, {'name': 'Classification', 'value': 'Homestead'}, {'name': 'BWCAW Access', 'value': 'Main'}, {'name': 'School District', 'value': 'Proctor #704'}, {'name': 'Parking/Driveway', 'value': 'Driveway - Asphalt'}, {'name': 'Style', 'value': 'Ranch/Rambler'}, {'name': 'Lot Description', 'value': 'Level, Rolling, High'}, {'name': 'Main Floor Bedroom', 'value': '1'}, {'name': 'Bath 3 Level', 'value': 'Lower'}, {'name': 'Air Conditioning', 'value': 'Central'}, {'name': 'Amenities', 'value': 'Natural Woodwork, Walk-In Closet, Ceiling Fans, Garage Door Opener, Security System, Tiled Floors, Vaulted Ceilings, Hardwood Floors, Skylight'}, {'name': 'Amenities-Exterior', 'value': 'Deck, Patio, Porch, Water Feature, Gutter/Downspout, Hot Tub'}, {'name': 'Basement Style', 'value': 'Slab, Full'}, {'name': 'Bath Description', 'value': 'Main Floor Full Bath, Private Master, Full Basement, Full Master, 1/2 Basement, Whirlpool, Separate Tub & Shower'}, {'name': 'Construction Type', 'value': 'Frame/Wood, Insulating Concrete Forms'}, {'name': 'Dining', 'value': 'Breakfast Bar, Formal Dining Room'}, {'name': 'Heat', 'value': 'Forced Air, In Floor, Propane, Electric, Dual Fuel/Off Peak, Boiler'}, {'name': 'Water', 'value': 'Private'}, {'name': 'Basement Features', 'value': 'Finished, Walkout, Bath, Bedrooms, Family/Rec Room, Utility Room, Washer Hook-Ups, Dryer Hook-Ups'}, {'name': 'Basement Material', 'value': 'Poured Concrete'}, {'name': 'Outbuildings', 'value': 'Pole Building'}, {'name': 'Road Frontage', 'value': 'County, Paved'}, {'name': 'Windows', 'value': 'Energy Windows, Triple Glazed'}, {'name': 'Exterior', 'value': 'Vinyl, Stone'}, {'name': 'Mechanicals', 'value': 'Air to Air Exchange, Central Vacuum, Water Softener-Owned'}]",55779,6933 Industrial Rd,Saginaw,MN,46.89715,-92.410033,508500.0,RECENTLY_SOLD,1,55779_27,1,"Recently sold: $508,500. "
3,2,,,,,,,,Finished,,['Other'],True,['Central'],True,,,,,,False,,,923.0,,,,"['Attached Garage', 'Detached Garage']",,,False,,,False,,False,,,,,,,,,,"['Other', 'Wood']",,,,,,,,,,,,False,33.61 acres,,,,False,400001002350,False,False,,,,Single Family,,,,,,,False,,,False,,,,,,,,,,,,,,,True,False,,,,,,,,,,,,False,Saginaw,,,[],55779,5364 Highway 33,Saginaw,MN,46.899564,-92.469228,186000.0,RECENTLY_SOLD,0,55779_28,0,"Recently sold: $186,000. "
2,2,0,0,0,0,,,,,,['Other'],True,['Central'],True,,,,,True,False,,,1008.0,,,,"['Attached Garage', 'Detached Garage']",,,False,,,False,,False,,,,1,,,,,,"['Other', 'Wood']",,,,,,,,,,,,False,,,,,False,380016000180,False,False,,,,Single Family,,,,,,,False,,,False,,,,,,,,,,,,,,,True,False,,Ranch,,,,,,,,,,False,Saginaw,,,[],55779,4977 Westlund Rd,Saginaw,MN,46.871434,-92.392579,300000.0,RECENTLY_SOLD,0,55779_29,0,"Recently sold: $300,000. Spacious newer 2 bedroom stick built home on Grand Lake.  Amenities:  Hardwood floors, ceramic tile in both baths, spa tub in bath, master bedroom with bathroom, Huge garage with 36x48 garage with office and bathroom.  Garage and house are air conditioned.  Exterior amenities include a wrap around deck, dock, and 2 sheds!"
4,3,1,1,1,0,,,[],Finished,['Tile'],"['Baseboard', 'Other']",True,['None'],True,"['Dryer', 'Microwave', 'Range/Stove', 'Refrigerator', 'Washer', 'Exhaust Fan/Hood']",,,,True,False,,,2960.0,,,,"['Attached Garage', 'Detached Garage']",5,,False,True,,False,,False,,,,1,,,,,,['Wood'],,,,,,,,,,,,False,9.02 acres,,,,False,380001007051,False,False,,,,Single Family,,,,Asphalt,,,False,,,False,,,,['Private'],,,,,,,,,,,True,False,,Other,,,Proctor #704,,Proctor #704,,Proctor #704,,,False,Saginaw,,,"[{'name': 'Sale/Rent', 'value': 'For Sale'}, {'name': 'Construction Status', 'value': 'Previously Owned'}, {'name': 'Fireplace Type', 'value': 'Gas'}, {'name': 'Classification', 'value': 'Homestead'}, {'name': 'Occupied By', 'value': 'Owner'}, {'name': 'BWCAW Access', 'value': 'M'}, {'name': 'School District', 'value': 'Proctor #704'}, {'name': 'Lot Description', 'value': 'Underground Utilities, Tree Coverage - Heavy, Additional Land Available, High'}, {'name': 'Fireplace', 'value': 'Yes'}, {'name': 'Fireplaces', 'value': '1'}, {'name': 'Style', 'value': 'Ranch/Rambler'}, {'name': 'Main Floor Bedroom', 'value': '1'}, {'name': 'Bath 3 Level', 'value': 'L'}, {'name': 'Amenities', 'value': 'Natural Woodwork, Main Floor Laundry, Patio Door, Ceiling Fans, Eat-In Kitchen, Drywalls, Foyer Entry, Washer Hook-Ups, Dryer Hook-Ups'}, {'name': 'Amenities-Exterior', 'value': 'Patio, Dog Run, Gutter/Downspout'}, {'name': 'Construction Type', 'value': 'Frame/Wood'}, {'name': 'Dining', 'value': 'Breakfast Bar, Informal Dining Room, Eat-In Kitchen'}, {'name': 'Exterior', 'value': 'Wood'}, {'name': 'Mechanicals', 'value': 'Fuel Tank-Owned, Water Heater-Electric, Air to Air Exchange, Sump Pump'}, {'name': 'Terms', 'value': 'Cash, Conventional'}, {'name': 'Water', 'value': 'Private, Drilled'}, {'name': 'Basement Features', 'value': 'Finished, Bath, Bedrooms, Family/Rec Room, Egress Windows, Fireplace'}, {'name': 'Basement Style', 'value': 'Full'}, {'name': 'Extra Rooms', 'value': 'Family/Rec, Storage Room'}, {'name': 'Heat', 'value': 'Electric, Baseboard, Dual Fuel/Off Peak, Hot Water, Fireplace'}, {'name': 'Outbuildings', 'value': 'Other Buildings, Kennel'}, {'name': 'Roof', 'value': 'Asphalt Shingles'}, {'name': 'Windows', 'value': 'Wood Frame, Energy Windows, Aluminum'}, {'name': 'Bath Description', 'value': 'Main Floor 3/4 Bath, Full Basement, Main Floor 1/2 Bath'}, {'name': 'Road Frontage', 'value': 'County'}, {'name': 'Road Maintenance', 'value': 'Public'}, {'name': 'Basement Material', 'value': 'Concrete Block'}, {'name': 'Internet Options', 'value': 'DSL'}, {'name': 'Disclosures/Docs', 'value': 'Disc./Condition Report'}, {'name': 'Garage Dimensions', 'value': '28x26'}]",55779,4741 Munger Shaw Rd,Saginaw,MN,46.854283,-92.345948,365900.0,RECENTLY_SOLD,0,55779_30,0,"Recently sold: $365,900. Here is the home you have been looking for that has everything you will ever need! Private drive welcomes you to this private setting country home just 15 minutes from the mall area. Step inside to the tiled front entry, spacious sunny living room w/ new carpet, dining room also with new carpet and a french door to the sprawling deck. Spacious eat in kitchen w/breakfast bar, pantry, desk area, stainless appliances and another door to the deck which is perfect for summer entertaining! Powder bath, laundry room and 2 nice sized bedrooms w/new carpet, and a cool bath with w/jetted tub. The lower level has family room with walk out &amp; gas fireplace, rec room, 2 more bedrooms (all with new new carpet) and a full bath. There is also a great storage room! Exterior has attached 30 x 30 heated garage, gardens, pond, detached 28 x 60 heated garage with workshop and dual fuel AND 10 ft tall doors!!! Yard is a park like setting that is sooo nice! So much space to have all your toys and enjoy them on this 9+ acre setting.  This one owner home has a lot of love and pride of ownership and it shows! Put this one on your must see list!"
3,3,2,0,1,0,,,[],Finished,"['Carpet', 'Laminate', 'Linoleum / Vinyl', 'Tile']",['Other'],True,['Central'],True,"['Dishwasher', 'Dryer', 'Microwave', 'Range/Stove', 'Refrigerator', 'Washer']",,,,True,False,,,2314.0,,,,"['Detached Garage', 'Off street']",,,False,,,False,,False,,,,2,,,,,,"['Vinyl', 'Wood']",,,['Typical'],,,,,,,,,False,7.17 acres,,,,False,380001004700,False,False,,,,Single Family,,,,Asphalt,,,False,2011,,False,,,,"['Private', 'Mound']",,,,,,,,,,,True,False,,Other,,,Proctor #704,,Proctor #704,,Proctor #704,,,False,Saginaw,,,"[{'name': 'Sale/Rent', 'value': 'For Sale'}, {'name': 'Construction Status', 'value': 'Previously Owned'}, {'name': 'Assessments', 'value': 'Yes'}, {'name': 'Fireplace Type', 'value': 'Gas'}, {'name': 'Classification', 'value': 'Homestead'}, {'name': 'Remodeled/Addition', 'value': 'Yes'}, {'name': 'BWCAW Access', 'value': '2nd'}, {'name': 'School District', 'value': 'Proctor #704'}, {'name': 'Township', 'value': 'Grand Lake'}, {'name': 'Main Floor Bedroom', 'value': '0'}, {'name': 'Fireplace', 'value': 'Yes'}, {'name': 'Lot Description', 'value': 'Tree Coverage - Light'}, {'name': 'Style', 'value': 'Traditional'}, {'name': 'Parking/Driveway', 'value': 'Driveway - Gravel'}, {'name': 'Disclosures/Docs', 'value': 'Well Disc, LBP Disclosure, Disc./Condition Report'}, {'name': 'Fireplaces', 'value': '2'}, {'name': 'Bath 3 Level', 'value': '2nd'}, {'name': 'Air Conditioning', 'value': 'Central'}, {'name': 'Amenities', 'value': 'Main Floor Laundry, Patio Door, Ceiling Fans, Garage Door Opener, Vaulted Ceilings'}, {'name': 'Amenities-Exterior', 'value': 'Deck'}, {'name': 'Bath Description', 'value': 'Private Master, Upper Level Bath, Main Floor 1/2 Bath, Full Master'}, {'name': 'Construction Type', 'value': 'Frame/Wood'}, {'name': 'Dining', 'value': 'Breakfast Bar, Formal Dining Room'}, {'name': 'Heat', 'value': 'Forced Air, Propane, Electric'}, {'name': 'Mechanicals', 'value': 'Fuel Tank-Rented, Water Softener-Owned'}, {'name': 'Terms', 'value': 'Cash, Conventional, VA DVA, FHA'}, {'name': 'Water', 'value': 'Private, Drilled'}, {'name': 'Basement Features', 'value': 'Utility Room, Partially Finished'}, {'name': 'Extra Rooms', 'value': 'Family/Rec, Master Bd Bath'}, {'name': 'Outbuildings', 'value': 'Storage Shed'}, {'name': 'Roof', 'value': 'Asphalt Shingles'}, {'name': 'Road Frontage', 'value': 'County, Paved'}, {'name': 'Road Maintenance', 'value': 'Public'}, {'name': 'Exterior', 'value': 'Vinyl'}, {'name': 'Basement Style', 'value': 'Partial'}, {'name': 'Basement Material', 'value': 'Rock'}, {'name': 'Garage Dimensions', 'value': '22 x 24'}]",55779,5286 Munger Shaw Rd,Saginaw,MN,46.893154,-92.34348,339900.0,RECENTLY_SOLD,1,55779_31,1,"Recently sold: $339,900. "
3,3,1,1,1,0,,,[],Finished,,['Other'],True,['Central'],True,"['Dishwasher', 'Dryer', 'Range/Stove', 'Refrigerator', 'Washer']",,,,,False,,,925.0,,,,['Attached Garage'],,,False,,,False,,False,,,,1,,,,,,['Metal'],,,,,,,,,,,,False,5.69 acres,,,,False,400001003735,False,False,,,,Single Family,,,,,,,False,,,False,,,,['Private'],,,,,,,,,,,True,False,,,,,South Ridge,,South Ridge,,South Ridge,,,False,Saginaw,,,"[{'name': 'Sale/Rent', 'value': 'For Sale'}, {'name': 'Construction Status', 'value': 'Previously Owned'}, {'name': 'Assessments', 'value': 'Yes'}, {'name': 'Classification', 'value': 'Homestead'}, {'name': 'School District', 'value': 'South Ridge'}, {'name': 'Lot Description', 'value': 'Tree Coverage - Medium'}, {'name': 'Parking/Driveway', 'value': 'Driveway - Asphalt'}, {'name': 'Style', 'value': 'Ranch/Rambler'}, {'name': 'Main Floor Bedroom', 'value': '1'}, {'name': 'Construction Type', 'value': 'Frame/Wood'}, {'name': 'Terms', 'value': 'Cash, Conventional'}, {'name': 'Water', 'value': 'Private'}, {'name': 'Amenities', 'value': 'Cable TV, Ceiling Fans, Garage Door Opener, Washer Hook-Ups, Dryer Hook-Ups'}, {'name': 'Basement Style', 'value': 'Full'}, {'name': 'Roof', 'value': 'Asphalt Shingles'}, {'name': 'Windows', 'value': 'Wood Frame'}, {'name': 'Mechanicals', 'value': 'Water Heater-Gas, Water Softener-Owned'}, {'name': 'Road Frontage', 'value': 'County'}, {'name': 'Basement Material', 'value': 'Concrete Block'}, {'name': 'Basement Features', 'value': 'Unfinished'}, {'name': 'Exterior', 'value': 'Brick'}, {'name': 'Heat', 'value': 'Boiler'}, {'name': 'Air Conditioning', 'value': 'Wall'}]",55779,7616 Industrial Rd,Saginaw,MN,46.89394,-92.483045,188000.0,RECENTLY_SOLD,8,55779_32,1,"Recently sold: $188,000. One owner- 3 bedroom 3 bath on 5.69 acres- 2 car attached garage includes a brand new septic to be installed . walk out basement and much, much more! Must see today!!"
3,1,,,,,,,,Finished,,['Other'],True,['Central'],True,,,,,,False,,,572.0,,,,"['Attached Garage', 'Detached Garage']",,,False,,,False,,False,,,,,,,,,,['Wood'],,,,,,,,,,,,False,4.68 acres,,,,False,380001005766,False,False,,,,Single Family,,,,,,,False,,,False,,,,,,,,,,,,,,,True,False,,,,,,,,,,,,False,Culver,,,[],55779,5015 Canosia Rd,Culver,MN,46.874132,-92.368697,177500.0,RECENTLY_SOLD,0,55779_33,0,"Recently sold: $177,500. "
5,3,3,0,0,0,,,[],Finished,"['Carpet', 'Concrete', 'Laminate', 'Tile']","['Forced air', 'Heat pump', 'Other']",True,['Central'],True,"['Dishwasher', 'Dryer', 'Range/Stove', 'Refrigerator', 'Washer']",,,,True,False,,,3400.0,,,,"['Attached Garage', 'Off street']",10,,False,True,,False,,False,,,,1,,,,,,"['Other', 'Shingle', 'Stone', 'Vinyl', 'Wood']",,,['Typical'],True,,,,,,,,False,17.79 acres,,,,False,380001003792,False,False,,,,Single Family,,,,Asphalt,,,False,,,False,,,,['Private'],,,,,,,,,,,True,False,,Ranch,,,Proctor #704,,Proctor #704,,Proctor #704,,,False,Saginaw,,,"[{'name': 'Sale/Rent', 'value': 'For Sale'}, {'name': 'Construction Status', 'value': 'Previously Owned'}, {'name': 'Assessments', 'value': 'Yes'}, {'name': 'Classification', 'value': 'Homestead'}, {'name': 'Occupied By', 'value': 'Owner'}, {'name': 'BWCAW Access', 'value': '1'}, {'name': 'School District', 'value': 'Proctor #704'}, {'name': 'Lot Description', 'value': 'Tree Coverage - Medium'}, {'name': 'Style', 'value': 'Ranch/Rambler'}, {'name': 'Parking/Driveway', 'value': 'Off Street'}, {'name': 'Main Floor Bedroom', 'value': '1'}, {'name': 'Air Conditioning', 'value': 'Central'}, {'name': 'Amenities', 'value': 'Main Floor Laundry, Eat-In Kitchen, Garage Door Opener, Drywalls, Kitchen Center Island'}, {'name': 'Amenities-Exterior', 'value': 'Deck'}, {'name': 'Bath Description', 'value': 'Main Floor Full Bath, Private Master, Full Master, Rough In'}, {'name': 'Dining', 'value': 'Breakfast Bar'}, {'name': 'Heat', 'value': 'In Floor, Propane, Electric, Baseboard'}, {'name': 'Terms', 'value': 'Cash, Conventional, VA DVA, FHA'}, {'name': 'Water', 'value': 'Private'}, {'name': 'Basement Features', 'value': 'Bedrooms, Family/Rec Room, Utility Room, Partially Finished, Egress Windows, Washer Hook-Ups, Dryer Hook-Ups'}, {'name': 'Basement Material', 'value': 'Poured Concrete'}, {'name': 'Basement Style', 'value': 'Full'}, {'name': 'Outbuildings', 'value': 'Storage Shed'}, {'name': 'Roof', 'value': 'Asphalt Shingles'}, {'name': 'Road Frontage', 'value': 'County'}, {'name': 'Road Maintenance', 'value': 'Public'}, {'name': 'Exterior', 'value': 'Vinyl'}, {'name': 'Mechanicals', 'value': 'Air to Air Exchange, Sump Pump'}, {'name': 'Construction Type', 'value': 'Modular'}, {'name': 'Garage Dimensions', 'value': '24X32+2X12'}]",55779,5359 Dickerman Rd,Saginaw,MN,46.899052,-92.409503,400000.0,RECENTLY_SOLD,1,55779_34,1,"Recently sold: $400,000. "
3,1,,,,,,,,,,['Other'],True,['Central'],True,,,,,,False,,,1248.0,,,,"['Attached Garage', 'Detached Garage']",,,False,,,False,,False,,,,1,,,,,,['Wood'],,,,,,,,,,,,False,,,,,False,380005000490,False,False,,,,Single Family,,,,,,,False,,,False,,,,,,,,,,,,,,,True,False,,,,,,,,,,,,False,Culver,,,[],55779,5998 Birch Point Rd,Culver,MN,46.899932,-92.313228,245000.0,RECENTLY_SOLD,0,55779_35,0,"Recently sold: $245,000. "
3,3,2,1,0,0,,,[],,,['Forced air'],True,['Central'],True,"['Dishwasher', 'Dryer', 'Microwave', 'Range/Stove', 'Refrigerator', 'Washer']",,,,True,False,,,2178.0,,,,['Attached Garage'],,,False,,,False,,False,,,,1,,,,,,['Metal'],,,,,,,,,,,,False,3.37 acres,,,,False,380016200040,False,False,,,,Single Family,,,['Slab'],Asphalt,,,False,,,False,,,,['Private'],,,,,,,,,,,True,False,,Other,,,Proctor #704,,Proctor #704,,Proctor #704,,,False,Saginaw,,,"[{'name': 'Sale/Rent', 'value': 'For Sale'}, {'name': 'Construction Status', 'value': 'Previously Owned'}, {'name': 'Assessments', 'value': 'Yes'}, {'name': 'Association Fee', 'value': 'Yes'}, {'name': 'Classification', 'value': 'Homestead'}, {'name': 'Association Fee Frequency', 'value': 'Yearly'}, {'name': 'Occupied By', 'value': 'Owner'}, {'name': 'BWCAW Access', 'value': 'Main'}, {'name': 'School District', 'value': 'Proctor #704'}, {'name': 'Lot Description', 'value': 'Underground Utilities, Rolling, High'}, {'name': 'Style', 'value': 'Ranch/Rambler'}, {'name': 'Main Floor Bedroom', 'value': '1'}, {'name': 'Parking/Driveway', 'value': 'Driveway - Gravel'}, {'name': 'Bath 3 Level', 'value': 'Main'}, {'name': 'Amenities', 'value': 'Main Floor Laundry, Walk-In Closet, Patio Door, Ceiling Fans, Eat-In Kitchen, Garage Door Opener, Tiled Floors, Vaulted Ceilings, Drywalls, Foyer Entry'}, {'name': 'Amenities-Exterior', 'value': 'Patio'}, {'name': 'Association Fee Includes', 'value': 'Snow Removal'}, {'name': 'Basement Style', 'value': 'Slab'}, {'name': 'Bath Description', 'value': 'Main Floor Full Bath, Main Floor 3/4 Bath, Full Master'}, {'name': 'Construction Type', 'value': 'Frame/Wood'}, {'name': 'Dining', 'value': 'Combine with Kitchen, Formal Dining Room'}, {'name': 'Heat', 'value': 'Forced Air, In Floor, Hot Water, Fireplace, Boiler'}, {'name': 'Mechanicals', 'value': 'Fuel Tank-Rented, Water Softener-Rented'}, {'name': 'Terms', 'value': 'Cash, Conventional, VA DVA, FHA'}, {'name': 'Water', 'value': 'Private'}, {'name': 'Extra Rooms', 'value': 'Family/Rec, Master Bd Bath'}, {'name': 'Roof', 'value': 'Asphalt Shingles'}, {'name': 'Road Frontage', 'value': 'Private'}, {'name': 'Air Conditioning', 'value': 'Wall'}, {'name': 'Road Maintenance', 'value': 'Private'}, {'name': 'Exterior', 'value': 'Metal'}]",55779,6127 Wilderness Rdg,Saginaw,MN,46.881139,-92.325999,310000.0,RECENTLY_SOLD,24,55779_36,1,"Recently sold: $310,000. Built in 2004, this roomy one level home offers easy living in the country. Home sits on 3.37 acres.  A nice Master suite and 2 more bedrooms, all generous in size, plus 3 baths all featuring tiled floors.  Amenities include in floor heat, corner fireplace in living room, patio doors, eat-in kitchen, kitchen center island with breakfast bar, covered patio, private well and septic, steel siding and convenient attached garage.  This one won't last long so schedule your showing! Average propane usage is 1,000 gallons per year.  Avg Electric is $161 per month."
4,2,1,0,1,0,,,[],Finished,,"['Baseboard', 'Forced air']",True,['Central'],True,"['Dishwasher', 'Dryer', 'Range / Oven', 'Refrigerator', 'Washer']",,,,,False,,,1992.0,,,,['Detached Garage'],2,,False,True,,False,,False,,,,1,,,,,,['Wood'],,,,,,,,,,,,False,6.62 acres,,,,False,380001007052,False,False,,,,Single Family,,,,Asphalt,,,False,,,False,,,,['Private'],,,,,,,,,,,True,False,,Other,,,Proctor #704,,Proctor #704,,Proctor #704,,,False,Saginaw,,,"[{'name': 'Sale/Rent', 'value': 'For Sale'}, {'name': 'Construction Status', 'value': 'Previously Owned'}, {'name': 'Assessments', 'value': 'Yes'}, {'name': 'Classification', 'value': 'Homestead'}, {'name': 'School District', 'value': 'Proctor #704'}, {'name': 'BWCAW Access', 'value': 'lower'}, {'name': 'Main Floor Bedroom', 'value': '1'}, {'name': 'Style', 'value': 'Traditional'}, {'name': 'Lot Description', 'value': 'Irregular Lot'}, {'name': 'Garage Dimensions', 'value': '24x24'}, {'name': 'Air Conditioning', 'value': 'Central'}, {'name': 'Bath Description', 'value': 'Main Floor Full Bath, 1/2 Master'}, {'name': 'Construction Type', 'value': 'Frame/Wood'}, {'name': 'Exterior', 'value': 'Wood'}, {'name': 'Heat', 'value': 'Forced Air, Baseboard, Dual Fuel/Off Peak, Hot Water, Boiler'}, {'name': 'Terms', 'value': 'Cash, Conventional, VA DVA, FHA'}, {'name': 'Water', 'value': 'Private'}, {'name': 'Basement Features', 'value': 'Bath'}, {'name': 'Basement Style', 'value': 'Full'}, {'name': 'Basement Material', 'value': 'Concrete Block'}, {'name': 'Road Frontage', 'value': 'Township'}]",55779,6345 Seville Rd,Saginaw,MN,46.851225,-92.347966,232000.0,RECENTLY_SOLD,1,55779_37,1,"Recently sold: $232,000. "
